Date,Tweet,Ticker,Score
2020-06-09,analysts ratings changes xpvgnzaiqa,CVX,0.0371250435709953
2020-06-09,analysts ratings changes,CVX,0.0371250435709953
2020-06-09,analysts expect announce earnings,CVX,-0.9575766324996948
2020-06-09,analysts expect announce earnings,CVX,-0.8901915550231934
2020-06-09,analysts expect announce earnings,CVX,-0.8901915550231934
2020-06-09,zacks analysts anticipate earnings,CVX,-0.539557695388794
2020-06-09,analysts expect announce earnings,CVX,-0.8901915550231934
2020-06-09,first press into smaller names drop stop losses,CVX,-1.0824697017669678
2020-06-09,directional bias report click details,CVX,-0.309488981962204
2020-06-09,report click sell,CVX,0.3291448950767517
2020-06-09,pullback downtrend longerterm combo chart,CVX,-1.057314157485962
2020-06-09,bank america lowers neutral,CVX,-0.3808580636978149
2020-06-09,bank america lowers neutral zuudnlrxwy,CVX,-0.3808580636978149
2020-06-09,bank america lowers neutral ggiawngisd,CVX,-0.3808580636978149
2020-06-09,bank america lowers neutral,CVX,-0.3808580636978149
2020-06-09,exclusive weighs blacklisting dozens tankers venezuela officials nvdijallyd,CVX,-0.1388896405696869
2020-06-09,uptrend rising consecutive days june view odds indicators kamggquyyp stockmarket technicalanalysis money daytrading news wcbgdngfyz,CVX,0.9801677465438844
2020-06-09,exclusive considers blacklisting tankers venezuela official says abnfronbpj,CVX,-0.5361529588699341
2020-06-09,update cargo tangled sanctions venezuela,CVX,-0.0686619728803634
2020-06-09,valuation looks good change recently,CVX,0.9546326398849488
2020-06-09,timing forecast view neutral bullish search timing forecast upper lower,CVX,0.9023178815841676
2020-06-09,nice healthy pullback testing wedge,CVX,0.9720999002456664
2020-06-09,acquisition,CVX,-0.0395904704928398
2020-06-10,consolid uptrend intraweek combo chart,CVX,0.9476643800735474
2020-06-10,bank america downgrades neutral,CVX,-1.0213382244110107
2020-06-10,pullback downtrend longerterm combo chart,CVX,-1.057314157485962
2020-06-10,deitaone downgraded underperform sector perform capital,CVX,-1.0376603603363037
2020-06-10,lowered neutral,CVX,-0.790764331817627
2020-06-10,monster signal earlier hindsight alert didn until,CVX,0.0910096541047096
2020-06-10,manual exit closing position opened gain,CVX,0.9072285890579224
2020-06-10,expiration maxpain high open interest high call open interest,CVX,0.9334111213684082
2020-06-10,long looking close days,CVX,0.1096833795309066
2020-06-10,sell equivalent valuation capital downgrades underperform sector perform target saying company premium valuation leaves little room gains,CVX,-0.6946754455566406
2020-06-10,recent underperformance greater earnings downgrades than peers substantial premium sector macro backdrop improving room catch says downgrade underperform oott,CVX,0.1515946239233017
2020-06-10,royal bank canada downgrades underperform,CVX,-1.038949728012085
2020-06-10,capital downgrades underperform target,CVX,-1.0430068969726562
2020-06-10,downgraded royal bank canada,CVX,-0.9743016958236694
2020-06-10,downgraded royal bank canada,CVX,-0.9743016958236694
2020-06-10,downgraded royal bank canada,CVX,-0.9743016958236694
2020-06-10,uptrend moving average convergence divergence macd histogram crosses above signal line view odds indicators balkxwbuza stockmarket technicalanalysis money daytrading news,CVX,0.9536726474761964
2020-06-10,downgraded underperform sector perform capital,CVX,-1.04517662525177
2020-06-10,downgraded underperform sector perform capital,CVX,-1.04517662525177
2020-06-10,raised chase,CVX,0.8113895654678345
2020-06-10,raised chase,CVX,0.8113895654678345
2020-06-10,target raised chase,CVX,0.8609936237335205
2020-06-10,gets grade tuesday session score,CVX,0.8617751598358154
2020-06-10,dividend june pays cash dividend common record,CVX,0.4225914180278778
2020-06-10,target increased analysts chase,CVX,0.8916792869567871
2020-06-10,timing forecast view neutral bullish search timing forecast upper lower,CVX,0.9012914896011353
2020-06-11,resume downtrend pullback longerterm combo chart,CVX,-1.0771408081054688
2020-06-11,lower higher volume pattern appearances since performance close days later worst best days later worst best days later worst best,CVX,-0.7251399755477905
2020-06-11,downgraded,CVX,-1.0319138765335083
2020-06-11,reaction back change recently,CVX,0.4872117340564728
2020-06-11,favorite headline plummets only recent lows,CVX,0.955458402633667
2020-06-11,starting position small begin,CVX,0.5427103042602539
2020-06-11,bank america downgrades neutral,CVX,-1.0213382244110107
2020-06-11,bank america downgrades neutral,CVX,-1.0213382244110107
2020-06-11,olbfkjwdzk,CVX,-1.024405598640442
2020-06-11,expiration maxpain high open interest high call open interest,CVX,0.9342935085296632
2020-06-11,petroleum marketing listed nigeria stockprice below moving average,CVX,-1.0340238809585571
2020-06-11,enters uptrend because momentum indicator exceeded level view odds indicators stockmarket technicalanalysis money daytrading news,CVX,0.9015400409698486
2020-06-11,billion sales expected quarter,CVX,0.4252308309078216
2020-06-11,billion sales expected quarter,CVX,0.227963387966156
2020-06-11,billion sales expected quarter,CVX,0.227963387966156
2020-06-11,pullback downtrend longerterm combo chart rebrjsdkcq,CVX,-1.057314157485962
2020-06-13,venezuela production plunges lowest level since,CVX,-1.0141165256500244
2020-06-13,rating reiterated morgan stanley lqtlicakby,CVX,0.4866515696048736
2020-06-13,rating lowered bank america,CVX,-0.9345823526382446
2020-06-13,rating lowered bank america,CVX,-0.9345823526382446
2020-06-13,rating lowered bank america hwbmwltilb,CVX,-0.9345823526382446
2020-06-13,rating lowered bank america,CVX,-0.9345823526382446
2020-06-13,rating lowered royal bank canada,CVX,-0.8854678869247437
2020-06-13,which based ramon calif refineries state synthetic fuel,CVX,-0.0154143348336219
2020-06-14,options flow grid update optionstrading optionsflow optiontrading stockmarket invest energy oilandgas oilprices oilprice,CVX,0.911696434020996
2020-06-14,rating reaffirmed morgan stanley,CVX,0.9001644849777222
2020-06-14,rating reaffirmed morgan stanley,CVX,0.2607783079147339
2020-06-14,peak profit expired option alerts,CVX,0.6195367574691772
2020-06-14,months option alerts peaked above after were triggered algo zizubknlhk,CVX,0.9230468273162842
2020-06-14,view historical options performance,CVX,0.1102021858096122
2020-06-15,enters uptrend because momentum indicator exceeded level june view odds indicators buyyksgxck stockmarket technicalanalysis money daytrading news,CVX,0.9013315439224244
2020-06-15,rating reiterated morgan stanley,CVX,0.9103132486343384
2020-06-15,given rating morgan stanley,CVX,0.8547942638397217
2020-06-15,rating reiterated morgan stanley,CVX,0.9103132486343384
2020-06-15,intermed downtrend intraweek combo chart,CVX,-1.077000617980957
2020-06-16,pullback downtrend intraweek combo chart,CVX,-1.060970664024353
2020-06-16,seekingalpha better than mobil finance stockmarket,CVX,0.959740400314331
2020-06-16,better than mobil finance stockmarket,CVX,0.9642339944839478
2020-06-16,sold gain green good missed bounce,CVX,0.9677523374557496
2020-06-16,downtrend stochastic indicator staying oversold zone view odds indicators azyiwrztki stockmarket technicalanalysis money daytrading news wyccbwacgy,CVX,-1.0757750272750854
2020-06-16,shell industry resilience woodmac says,CVX,0.8022964000701904
2020-06-16,good thing about being zealot owning days,CVX,0.985993504524231
2020-06-16,rating reiterated morgan stanley mtuyprudid,CVX,0.9103132486343384
2020-06-16,rating reiterated morgan stanley yellahqtux,CVX,0.9103132486343384
2020-06-16,timing forecast view neutral bearish search timing forecast upper lower,CVX,-1.0645040273666382
2020-06-17,happen need dollars sure exact math something,CVX,0.2794274091720581
2020-06-17,star appearances since close days later worst best days later worst best days later worst best,CVX,-0.7397103309631348
2020-06-17,opec outlook demand hasn improved,CVX,0.6511543989181519
2020-06-17,downtrend indicator exits overbought zone view odds indicators stockmarket technicalanalysis money daytrading news,CVX,-1.0598050355911257
2020-06-17,blockbuster change recently,CVX,0.5090454816818237
2020-06-17,better than mobil,CVX,0.9401766061782836
2020-06-17,high coming change recently,CVX,0.9841430187225342
2020-06-17,arlenhansen goldstocktrades cematrix,CVX,-0.0469407178461551
2020-06-17,goldstocktrades cematrix,CVX,-0.0192624814808368
2020-06-18,ginsecurities energy giant looking sell cent stake australia largest longest running liquefied natura,CVX,-1.0007189512252808
2020-06-18,options flow grid update optionstrading optionsflow optionstrade optiontrading stockmarket invest energy oilandgas oilprices oilprice,CVX,0.8271442651748657
2020-06-18,downtrend drop because broke higher bollinger band june view odds indicators stockmarket technicalanalysis money daytrading news mavvgasfaa,CVX,-1.069397211074829
2020-06-18,expiration maxpain high open interest high call open interest,CVX,0.926044464111328
2020-06-18,energy giant looking sell cent stake australia largest longest running liquefied natural project billion north west shelf joint venture lifetime great timing,CVX,0.694852352142334
2020-06-18,developing news space oilandgas puts north west shelf stake block,CVX,0.0130208581686019
2020-06-18,instinct telling,CVX,-1.0503990650177002
2020-06-18,update puts stake australia north west shelf block href,CVX,-0.0428441651165485
2020-06-18,update puts stake australia north west shelf block,CVX,-0.0184288769960403
2020-06-18,update puts stake australia north west shelf sale href,CVX,-0.031253520399332
2020-06-18,start sale process north west shelf stake href lglvhgmnnp lglvhgmnnp,CVX,0.0874988734722137
2020-06-18,start sale process north west shelf stake jtqbqvouuq,CVX,0.1055312603712081
2020-06-18,never bought change recently,CVX,-0.9000108242034912
2020-06-18,need dollars,CVX,0.4115603566169739
2020-06-19,ncla asks reverse panel failure precedent bump case alykonpwih,CVX,-0.4810903072357178
2020-06-19,bearish engulfing appearances since close days later worst best days later worst best days later worst best,CVX,-1.057766079902649
2020-06-19,intermed downtrend intraweek combo chart,CVX,-1.077000617980957
2020-06-19,headed crickets wonder funds always laggers fink same tobacco question shallow beneath,CVX,-1.0554921627044678
2020-06-19,jimcramer headed crickets wonder funds always laggers fink same tobacco question shallow beneath,CVX,-1.0598105192184448
2020-06-19,resume downtrend pullback longerterm combo chart,CVX,-1.0771408081054688
2020-06-19,short interest update xxcjmzzdjf,CVX,0.7276277542114258
2020-06-19,downtrend decline result having broken higher bollinger band june view odds indicators stockmarket technicalanalysis money daytrading news,CVX,-1.0718532800674438
2020-06-19,timing forecast view neutral bearish search timing forecast upper lower,CVX,-1.0625572204589844
2020-06-19,puts north west shelf stake block,CVX,0.0065994188189506
2020-06-19,diamondhill capital corp,CVX,0.1167840510606765
2020-06-19,directional bias report click details,CVX,-0.309488981962204
2020-06-19,report stzogyhadh click sell,CVX,0.3291448950767517
2020-06-20,venezuela fortune looms maduro regime,CVX,-0.4211505353450775
2020-06-20,downtrend moving average convergence divergence macd histogram crosses below signal line view odds indicators stockmarket technicalanalysis money daytrading news hcszmxeixg,CVX,-1.0746057033538818
2020-06-20,technical alerts fell below resistance,CVX,-1.0285087823867798
2020-06-21,laziestofdans agree profitable option winner huge take,CVX,0.977631688117981
2020-06-21,laziestofdans agree profitable option winner huge take,CVX,0.9803344011306764
2020-06-21,optionsmike best breed holding want play sector best name imho plus divey,CVX,0.9706640243530272
2020-06-21,best breed holding want play sector best name imho plus divey,CVX,0.9727935791015624
2020-06-21,downtrend moving average convergence divergence macd histogram crosses below signal line view odds indicators stockmarket technicalanalysis money daytrading news,CVX,-1.0746057033538818
2020-06-21,energy seems footing seems wants come these tired eyes saturdayeveningcharting,CVX,-1.0854345560073853
2020-06-22,theflynews report saudi kuwait venture resume exports july,CVX,0.0796569809317588
2020-06-22,report saudi kuwait venture resume exports july,CVX,0.0434630140662193
2020-06-22,saudi kuwait venture resume exports july says,CVX,0.1776402592658996
2020-06-22,saudi kuwait venture restart exports july nmbppapoze,CVX,0.0191505141556262
2020-06-22,saudi kuwait resume shipments despite opec curbs deal saudi kuwait pump sources saudi kuwait restart exports july sources,CVX,0.2848814725875854
2020-06-22,option alert puts earnings before open,CVX,0.0824437662959098
2020-06-22,downtrend moving average convergence divergence macd histogram turned negative view odds indicators stockmarket technicalanalysis money daytrading news,CVX,-1.0836290121078491
2020-06-22,short interest declines,CVX,-1.0408506393432615
2020-06-23,options maxpain chart open interest chart update optionstrading optionsflow optionstrade optiontrading stockmarket invest,CVX,0.5479003190994263
2020-06-23,tickeron downtrend moving average convergence divergence macd histogram crosses below signal line view odds,CVX,-1.0787283182144165
2020-06-23,downtrend moving average convergence divergence macd histogram crosses below signal line view odds indicators stockmarket technicalanalysis money daytrading news,CVX,-1.0746057033538818
2020-06-23,saudi kuwait venture restart exports july iqzvjjojzs,CVX,0.0087572671473026
2020-06-23,wait return well buying cematrixcorporation gold high know concrete supporting technology grow short term cities broke think about time look chart,CVX,0.9500569105148317
2020-06-24,first time majority push giant align paris climate pact,CVX,0.1923338770866394
2020-06-24,interest volume diff purchase,CVX,0.0272661857306957
2020-06-24,volatility chart crude pulls back qypmgxbixm,CVX,-0.0587792880833148
2020-06-24,interest volume diff purchase,CVX,0.0374389179050922
2020-06-24,started small position,CVX,-0.8908445835113525
2020-06-24,downtrend moving average convergence divergence macd histogram crosses below signal line view odds indicators stockmarket technicalanalysis money daytrading news,CVX,-1.0746057033538818
2020-06-24,minteractapp options maxpain chart open interest chart update optionstrading optionsflow optionstrade optiontradi,CVX,0.557680606842041
2020-06-24,what about ebitda yield perform years,CVX,0.1155244335532188
2020-06-25,needs rebound point change recently,CVX,0.7419052124023438
2020-06-25,poor technical analysis score score breakdown categories candle score poor moving average score neutral momentum score poor stockmarket disettzaiu,CVX,-1.0517282485961914
2020-06-25,interesting agree abide environmental standards first time call order,CVX,0.9811019897460938
2020-06-25,downtrend moving average convergence divergence macd histogram crosses below signal line view odds indicators stockmarket technicalanalysis money daytrading news qlfvvxepeo,CVX,-1.0746057033538818
2020-06-26,point become value needs make clear leap hydrogen straight away,CVX,0.9455482959747314
2020-06-26,poor technical rating quality setup perfect moment,CVX,-1.0151119232177734
2020-06-26,downtrend moving average convergence divergence macd histogram turned negative view odds indicators stockmarket technicalanalysis money daytrading news,CVX,-1.0836290121078491
2020-06-26,analysts ratings updates,CVX,0.0714523941278457
2020-06-26,resume downtrend pullback longerterm combo chart yzrgwvibvk,CVX,-1.0771408081054688
2020-06-26,good fundamental analysis score score check various indicators value score chart roic gross margin ebitda stockmarket nbbcqoezaa,CVX,0.9705421924591064
2020-06-26,intermed downtrend intraweek combo chart,CVX,-1.077000617980957
2020-06-26,,CVX,-0.0762669891119003
2020-06-27,puts alerted peak after alert progress,CVX,0.8833887577056885
2020-06-27,calls alerted peak after alert progress,CVX,0.9079887866973876
2020-06-27,peak profit expired option alerts rfaxqdavjh,CVX,0.7186757326126099
2020-06-27,performance algo based option alerts,CVX,0.3143753111362457
2020-06-27,months option alerts peaked above after were triggered algo,CVX,0.9258599281311036
2020-06-27,view historical options performance,CVX,0.1102021858096122
2020-06-27,traderkarthik absolutely needs break above area upside below curling loss leads,CVX,0.7343860864639282
2020-06-27,absolutely needs break above area upside below curling loss leads tests lfcvgumgnw,CVX,0.5379024744033813
2020-06-27,reversal rather wait good uptrend dips moving forward though look timeframe reversal technique dips uptrend,CVX,0.9701882600784302
2020-06-27,considerable movement change recently,CVX,-0.1327825933694839
2020-06-27,tickeron moving average crossed below moving average june view odds indicator,CVX,-0.9981685876846312
2020-06-27,moving average crossed below moving average june view odds indicators hedvvrifxo stockmarket technicalanalysis money daytrading news fbbmfxgaxl,CVX,-0.9589564800262452
2020-06-28,looking worse than change recently,CVX,-1.0709264278411863
2020-06-28,puts stake billion north west shelf venture sale analysts estimated stake worth billion australia,CVX,0.330660879611969
2020-06-28,hardwoodtile good write thoughts them,CVX,0.8480018377304077
2020-06-28,directional bias report twoqhytjcs click details,CVX,-0.309488981962204
2020-06-28,report click sell,CVX,0.3291448950767517
2020-06-28,moving average broke below moving average june view odds indicators stockmarket technicalanalysis money daytrading news,CVX,-0.951102614402771
2020-06-28,never bought change recently,CVX,-0.9167647361755372
2020-06-29,closed call position collected option income,CVX,0.5219721794128418
2020-06-29,moving average broke below moving average june view odds indicators stockmarket technicalanalysis money daytrading news rcklcmxqaj,CVX,-0.951102614402771
2020-06-29,receives average target brokerages,CVX,0.0667750686407089
2020-06-29,receives average target brokerages,CVX,0.0667750686407089
2020-06-29,receives average target brokerages,CVX,0.0667750686407089
2020-06-30,opened robinhood distracted bought,CVX,0.1638147234916687
2020-06-30,completes acquisition puma energy australia holdings,CVX,0.1983844637870788
2020-06-30,cematrix huge potential hlbelfisbk,CVX,1.005131721496582
2020-06-30,awesome setup backtest strong support filled lets highs inmwpbzpnn,CVX,0.9741047620773317
2020-06-30,belt well,CVX,0.3384796679019928
2020-06-30,moving average broke below moving average june view odds indicators stockmarket technicalanalysis money daytrading news,CVX,-0.951102614402771
2020-06-30,timing forecast view bullish search timing forecast upper lower,CVX,0.9535986185073853
2020-07-01,optionsmike change change target anlbfiaats,CVX,-0.5160268545150757
2020-07-01,receives average rating analysts,CVX,0.7636797428131104
2020-07-01,looks attractive long continue recover nice divvy thing really technicals chart looks ready crumble wait enter position,CVX,0.9666930437088012
2020-07-01,resume downtrend pullback longerterm combo chart hogzhfiwzl,CVX,-1.0771408081054688
2020-07-01,stop after triggered basically break because dropped below,CVX,0.6664258241653442
2020-07-01,adding another,CVX,0.3892664909362793
2020-07-01,brokerages expect announce,CVX,-0.8324066400527954
2020-07-01,expected quarter htwikbcjdr,CVX,-0.6690225601196289
2020-07-01,moving average moved below moving average june view odds indicators stockmarket technicalanalysis money daytrading news truyawrwuk,CVX,-1.0101367235183716
2020-07-02,bearish while remains below declining moving average,CVX,-1.075650691986084
2020-07-02,good fundamental analysis score score check various indicators value score chart roic gross margin ebitda stockmarket,CVX,0.9740511178970336
2020-07-02,malibuprivate giffy represents whole than itslit,CVX,0.9304656982421876
2020-07-02,optimus maximus shorted opened corp corp chance loss hold stats,CVX,0.8471448421478271
2020-07-02,bloomberg saudi unit resumed output wafra field kingdom kuwait output site suspended june than months after restarted shutdown because dispute oott,CVX,-1.020694375038147
2020-07-02,downtrend moving average convergence divergence macd histogram turned negative view odds indicators stockmarket technicalanalysis money daytrading news,CVX,-1.0836290121078491
2020-07-02,resume downtrend pullback longerterm combo chart,CVX,-1.0771408081054688
2020-07-02,company profile fundamental analysis score update score stockmarket invest,CVX,0.0494599565863609
2020-07-03,closed higher rejected broke support kyboolwjsf,CVX,0.5006346702575684
2020-07-03,those tweezer looking candles knocked wind inside probably stay away until summer those tweezers aren worth messing maybe rally highs awhile come back sooner later,CVX,-0.9620252847671508
2020-07-03,tickeron downtrend moving average convergence divergence macd histogram turned negative view odds othe,CVX,-1.0879569053649902
2020-07-03,downtrend moving average convergence divergence macd histogram turned negative view odds indicators klenhmomwu stockmarket technicalanalysis money daytrading news,CVX,-1.0836290121078491
2020-07-03,optionsmaxpain options maxpain chart open interest chart update optionstrading optionsflow optionstrade optiontra,CVX,0.5599662065505981
2020-07-03,options maxpain chart open interest chart update optionstrading optionsflow optionstrade optiontrading stockmarket invest,CVX,0.5479003190994263
2020-07-04,optiontradiniq bearish while remains below declining moving average,CVX,-1.0817755460739136
2020-07-05,downtrend moving average convergence divergence macd histogram turned negative view odds indicators stockmarket technicalanalysis money daytrading news,CVX,-1.0836290121078491
2020-07-06,optimus maximus closed covered previously shorted profit corp corp stats,CVX,0.8355964422225952
2020-07-06,little,CVX,-0.977178692817688
2020-07-06,rating update corp,CVX,0.1301178187131881
2020-07-06,downtrend moving average convergence divergence macd histogram crosses below signal line view odds indicators stockmarket technicalanalysis money daytrading news,CVX,-1.0746057033538818
2020-07-07,looking heavy break below interesting,CVX,0.7964160442352295
2020-07-07,cematrix huge double potential love forming pipe line,CVX,1.0016969442367554
2020-07-07,energyintel president americas products andy walz virtually energy intelligence discuss,CVX,-0.0523881241679191
2020-07-07,directional bias report click details trfdazfyfo,CVX,-0.309488981962204
2020-07-07,dividend remains safe finance,CVX,0.9437958002090454
2020-07-07,report click sell,CVX,0.3291448950767517
2020-07-07,president americas products andy walz virtually energy intelligence discuss integrated giant maneuvered historic downturn steps what mind beyond read free interview,CVX,-0.1822426468133926
2020-07-07,need weak,CVX,-1.081400752067566
2020-07-07,bought back after selling wednesday,CVX,-0.5484651327133179
2020-07-07,downtrend moving average convergence divergence macd histogram turned negative view odds indicators stockmarket technicalanalysis money daytrading news,CVX,-1.0836290121078491
2020-07-07,timing forecast view sell bearish search timing forecast upper lower,CVX,-1.0575547218322754
2020-07-08,march what steal,CVX,1.0059267282485962
2020-07-08,williams companies hess corporation continue gains long,CVX,0.9508388042449952
2020-07-08,turned negative green move thnprtvcgx,CVX,-0.7980185747146606
2020-07-08,recent technical alerts stochastic reached oversold plus alerts,CVX,0.3607518374919891
2020-07-08,guessing,CVX,-0.0383916199207305
2020-07-08,advisory corporation earnings conference call webcast,CVX,0.0167085416615009
2020-07-08,bloomberg pasadena refinery houston ship channel finishing multi unit turnaround involved refinery preparing units restart people familiar operations oott,CVX,0.4553965926170349
2020-07-08,ellenychang companies laid thousands employees money racist conventions,CVX,-0.4822652339935303
2020-07-08,companies laid thousands employees money racist conventions,CVX,-0.6743640899658203
2020-07-08,make exit change recently,CVX,-0.1953535676002502
2020-07-08,flyin,CVX,0.7409844398498535
2020-07-08,optimus maximus shorted opened corp corp chance loss hold stats,CVX,0.8578659296035767
2020-07-08,optimus bought opened corp corp chance loss hold stats,CVX,0.856777548789978
2020-07-08,calls alerted peak after alert progress nmvmgfmmff,CVX,0.9084981679916382
2020-07-08,puts alerted peak after alert progress,CVX,0.8767577409744263
2020-07-08,peak profit expired option alerts,CVX,0.7061347961425781
2020-07-08,petroleum marketing listed nigeria priceearnings yield amgcjhigkm,CVX,0.3476904034614563
2020-07-08,calls option volume volume,CVX,0.891447901725769
2020-07-08,months option alerts peaked above after were triggered algo,CVX,0.9261802434921264
2020-07-08,view historical options performance,CVX,0.1102021858096122
2020-07-08,aroon indicator drops into downtrend july view odds indicators stockmarket technicalanalysis money daytrading news,CVX,-1.0778683423995972
2020-07-09,reaction back change recently,CVX,0.4872246384620666
2020-07-09,pain maturity maxpain options ydokxyznvg,CVX,0.0061651840806007
2020-07-09,cematrix partnersresearch advisory house loading interesting nice,CVX,0.989476203918457
2020-07-09,picking surfing wave needs higher meters,CVX,0.9848012924194336
2020-07-09,resume downtrend pullback longerterm combo chart,CVX,-1.0771408081054688
2020-07-09,short interest june,CVX,-0.9869815111160278
2020-07-09,short interest june,CVX,-0.9623245000839232
2020-07-09,optimus maximus closed covered previously shorted profit corp corp stats,CVX,0.6267727613449097
