Date,Tweet,Ticker,Score
2020-04-27,altman score better than industry average,CVX,0.964902400970459
2020-04-27,offfrac fail shitty succeed,CVX,-0.9901036024093628
2020-04-28,carleygarner into near come winners mention almost,CVX,0.580883264541626
2020-04-28,retirementright targeting them agree survive zero dollar only government intervention high especially insane,CVX,0.3271429538726806
2020-04-28,jimcramer wait dividend cuts,CVX,-0.1121010929346084
2020-04-28,jimcramer wait dividend cuts,CVX,-0.0649771988391876
2020-04-28,reports friday upside stop xjynhcamsr,CVX,0.8810842037200928
2020-04-28,jimcramer always bcuz love ahhhhh,CVX,0.8456640243530273
2020-04-28,jimcramer bought trashing,CVX,-0.2917955815792084
2020-04-28,enters uptrend momentum indicator exceeded level march view odds indicators stockmarket technicalanalysis money daytrading news bjzcwbfmyj,CVX,0.905327558517456
2020-04-28,jimcramer already sell rallies,CVX,-0.8289498090744019
2020-04-28,nice short open range open above wait,CVX,0.9868643283843994
2020-04-28,these measures indicate using debt reasonably well simply wall news,CVX,0.789618730545044
2020-04-28,these measures indicate using debt reasonably well simply wall news,CVX,0.7753264904022217
2020-04-29,announces dividend payable june,CVX,0.1175995767116546
2020-04-29,garethsoloway hits major fill short setup,CVX,0.1587634980678558
2020-04-29,announced dividend,CVX,0.0430631786584854
2020-04-29,time reward,CVX,0.4924896359443664
2020-04-29,announced dividend,CVX,0.0316350907087326
2020-04-29,brandonvanzee good hear announced dividend payment though increase months,CVX,0.9811515808105468
2020-04-29,paying dividend nyse declares dividend line previous,CVX,0.5959631204605103
2020-04-29,sandiegosam incidentally cover short news regarding energy support back short,CVX,-1.0556029081344604
2020-04-29,incidentally cover short news regarding energy support back short,CVX,-1.08220636844635
2020-04-29,hits major fill short chchxtgtbo,CVX,-0.0012804344296455
2020-04-29,hits major fill short setup,CVX,0.0489650815725326
2020-04-29,hits major fill short puurpeahwi,CVX,0.0005624070763587
2020-04-29,days held,CVX,0.6656168699264526
2020-04-29,negative demand people fall pump dump drops choice stay long long term these make sick,CVX,-1.0838333368301392
2020-04-29,overrated drops time,CVX,-1.0535069704055786
2020-04-29,suspect someone inside knows something about though meaning earnings probably beat,CVX,0.8205626010894775
2020-04-29,cons were respectively cons insert impressive resiliency come side stronger believe missed back lows take,CVX,0.9623744487762452
2020-04-29,olbfkjwdzk,CVX,0.9034290313720704
2020-04-29,want action climate change themotleyfool read ytrhcciram adaptation antarctica arctic carbondioxide climateaction climatechange climatescience climatology companies environment,CVX,0.1398807764053344
2020-04-29,absolute monster wants area longer time frame take,CVX,0.2363942712545395
2020-04-29,currently,CVX,0.7790164947509766
2020-04-29,enters uptrend momentum indicator exceeded level march view odds indicators stockmarket technicalanalysis money daytrading news,CVX,0.905327558517456
2020-04-29,release earnings friday,CVX,0.0844326540827751
2020-04-29,short interest expands,CVX,0.9328713417053224
2020-04-29,biggest think benefit balance sheet basis cole smead portfolio manager smead capital management smeadcap because benefit zero demand negative pricing,CVX,0.9781339168548584
2020-05-03,sentiment total scores positive negative sentiment,CVX,0.0568027272820472
2020-05-03,couple days holding above showing distribution holds,CVX,-1.0834895372390747
2020-05-03,announces earnings results,CVX,0.1590589731931686
2020-05-03,another anecdote about coronavirus reducing industry ability mitigate declines slowing tengiz covid cases camps matter point,CVX,-0.948128342628479
2020-05-03,unlikely shell lead finance,CVX,-0.740492582321167
2020-05-03,israel delek fourth quarter loss widens auditors place concern warning coronavirus,CVX,-1.0621148347854614
2020-05-03,benzinga talks dividend venezuela,CVX,0.0017594471573829
2020-05-03,aroon indicator drops into downtrend view odds indicators vrkcnjftnn stockmarket technicalanalysis money daytrading news,CVX,-1.078466296195984
2020-05-04,venezuela crude output keeps sliding fields shut fire damage,CVX,-1.05479633808136
2020-05-04,janney montgomery scott increases stake nyse ghktilympv ratingsnetwork,CVX,0.4762750267982483
2020-05-04,chase boosts target,CVX,0.2510031163692474
2020-05-04,raised chase,CVX,0.8136676549911499
2020-05-04,craig hallum increases target bcsvvvrwyt,CVX,0.8532540798187256
2020-05-04,were hedge funds about corporation,CVX,0.3088304698467254
2020-05-04,credit suisse group increases target onepmllmvd,CVX,0.8902337551116943
2020-05-04,downgraded goldman sachs group,CVX,-0.4120961129665375
2020-05-04,petenajarian holding,CVX,-0.0742385312914848
2020-05-04,corp yoing between euphoria despair rckonzerde business finance,CVX,-0.7587199211120605
2020-05-04,deitaone downgraded conviction goldman sachs,CVX,0.8026955127716064
2020-05-04,target raised,CVX,0.9349859952926636
2020-05-04,target raised wells fargo npuuvqrsgm,CVX,0.9264791011810304
2020-05-04,wells fargo raises target,CVX,0.2210078090429306
2020-05-04,target raised,CVX,0.9188892841339112
2020-05-04,craig hallum boosts target,CVX,0.2971658408641815
2020-05-04,craig hallum boosts target,CVX,0.2971658408641815
2020-05-04,target raised bycraig hallum,CVX,0.930484414100647
2020-05-04,capex cuts,CVX,-1.0035667419433594
2020-05-04,opex cuts,CVX,-0.9638779163360596
2020-05-04,stress case brent says repo seems base upside nowadays,CVX,0.3287929594516754
2020-05-04,limited debt maturities ratings yymhptazwd,CVX,0.8978792428970337
2020-05-04,changing production guidance excludes curtailment impact expect curtailment doesn guidance matter anymore,CVX,0.0822703465819358
2020-05-04,understand cutting capex audio capex happened nearly analysts,CVX,-0.9146312475204468
2020-05-04,dividend safe krilnrlbfy,CVX,0.9498015642166138
2020-05-04,insight into curtailment outlook lmgedcqwgi,CVX,0.0692420452833175
2020-05-04,industry operators strategies diverging cutting winning formula,CVX,0.9429354667663574
2020-05-04,expect mega consolidation type anytime soon,CVX,-0.3769596517086029
2020-05-04,asia though regional specific starting bottom demand decline,CVX,-1.081544041633606
2020-05-04,highlights transcript multinational energy company,CVX,0.0840169191360473
2020-05-04,goldman sachs group,CVX,0.241519421339035
2020-05-04,goldman sachs group fsrmjqafzj,CVX,0.241519421339035
2020-05-04,goldman sachs group,CVX,0.241519421339035
2020-05-04,digging shade gdyppuezvc,CVX,0.0281865000724792
2020-05-04,earnings results beats estimates,CVX,0.1780530363321304
2020-05-04,earnings results beats estimates,CVX,0.1780530363321304
2020-05-04,earnings results beats estimates,CVX,0.1780530363321304
2020-05-04,downgraded conviction goldman sachs,CVX,0.6324707269668579
2020-05-04,aroon indicator drops into downtrend view odds indicators stockmarket technicalanalysis money daytrading news,CVX,-1.078466296195984
2020-05-04,downgraded conviction goldman sachs,CVX,0.8740437030792236
2020-05-04,raised citi,CVX,0.8743609189987183
2020-05-04,invest maybe invest dump anchor company happy take,CVX,0.9277509450912476
2020-05-05,settled made black candle which leans bearish support,CVX,-1.0549098253250122
2020-05-05,savannahkhan squawkcnbc jimcramer near yearly highs pass,CVX,0.9068605899810792
2020-05-05,settled made black candle which leans bearish support petenajarian,CVX,-1.0690938234329224
2020-05-05,petenajarian prefer,CVX,0.4953943490982055
2020-05-05,petenajarian best balance sheet growth,CVX,0.9831933975219728
2020-05-05,prefer,CVX,0.6084449291229248
2020-05-05,back same,CVX,0.4754669368267059
2020-05-05,petenajarian giddy,CVX,0.9654743671417236
2020-05-05,petenajarian giddy,CVX,0.9635581970214844
2020-05-05,aroon indicator drops into downtrend view odds indicators stockmarket technicalanalysis money daytrading news wdwjgwtwvj,CVX,-1.0784709453582764
2020-05-05,committed capital return plans years mean zpjfswsnbf,CVX,0.9221574068069458
2020-05-05,implied volatility index decreasing,CVX,-1.014983892440796
2020-05-05,need back,CVX,0.4516575932502746
2020-05-06,falto,CVX,0.0147456973791122
2020-05-06,signalbased listenin help,CVX,0.1325459629297256
2020-05-06,shale producers reported friday along exxonmobil jump earnings inclusion gain associated sale upstream assets philippines however line fell economic shutdown oott hlgfrwjnjm,CVX,0.9665628671646118
2020-05-06,given stronger short medium term rankings while declining long term xwnkrylmqf,CVX,0.8177882432937622
2020-05-06,centralchartsen basic bullish trend slowed lacking power short term does,CVX,0.3580309748649597
2020-05-06,basic bullish trend slowed lacking power short term does offer,CVX,0.3523141741752624
2020-05-06,tradermtb handle,CVX,0.6639190912246704
2020-05-06,tradermtb added puts,CVX,0.6641920804977417
2020-05-06,basic bullish trend slowed lacking power short term does offer information allow anticipate recovery bullish movement correction sellers generally,CVX,0.774802565574646
2020-05-06,grrr,CVX,-0.1053618341684341
2020-05-06,basic bullish trend slowed lacking power short term does offer information allow anticipate,CVX,0.2162053883075714
2020-05-06,signalbased listenin help,CVX,0.2513267695903778
2020-05-06,handle,CVX,0.7045116424560547
2020-05-06,added puts,CVX,0.7383203506469727
2020-05-06,high range option expiration putcallratio maxpain options qgayopiqqt,CVX,0.976948380470276
2020-05-06,chase increases target,CVX,0.494565337896347
2020-05-06,given target chase,CVX,0.1489035636186599
2020-05-06,randalllsimpson neostockhacker jbdridgebacks bought,CVX,0.9650567770004272
2020-05-06,sjosephburns none above choose energy only producing,CVX,0.3436311483383178
2020-05-06,matlitalien options mind owning underlying valero options refineries being built nimby biggest input dramatically,CVX,0.3375292718410492
2020-05-06,target raised chase nlyilpuxbr,CVX,0.8609730005264282
2020-05-06,moving average broke above moving average april view odds indicators stockmarket technicalanalysis money daytrading news,CVX,0.8922590017318726
2020-05-06,texas regulator rejects production cuts knbyrfnurr,CVX,-0.7519056797027588
2020-05-06,neostockhacker jbdridgebacks bought,CVX,0.9760421514511108
2020-05-06,sjosephburns none above choose energy only producing,CVX,0.5154106616973877
2020-05-07,stockmarket issued preceding quarter turn positive sales deteriorated billions,CVX,0.6839115619659424
2020-05-07,aroon indicator drops into downtrend view odds indicators stockmarket technicalanalysis money daytrading news,CVX,-1.0785681009292605
2020-05-07,goldman sachs group,CVX,0.2727531492710113
2020-05-07,goldman sachs group,CVX,0.2727531492710113
2020-05-07,anchored near after rally ends lingering glut concern,CVX,0.7662338018417358
2020-05-08,issuing billion bonds majors banks build cash needed weather dramatic volatility read free story,CVX,0.5948609113693237
2020-05-08,updated,CVX,0.1513086706399917
2020-05-08,energycynic closing only consolidator mess them wirth watch,CVX,-1.0718631744384766
2020-05-08,target raised craig hallum gyoaszqwzw,CVX,0.8956958055496216
2020-05-08,downgraded goldman sachs group xayssalzqp,CVX,-0.998108983039856
2020-05-08,target raised craig hallum,CVX,0.8956958055496216
2020-05-08,target raised craig hallum,CVX,0.8956958055496216
2020-05-08,target raised craig hallum,CVX,0.8956958055496216
2020-05-08,downgraded goldman sachs group scrkwjmmhr,CVX,-0.998108983039856
2020-05-08,moving average moved above moving average april view odds indicators stockmarket technicalanalysis money daytrading news,CVX,0.9120385646820068
2020-05-08,open interest maturity high high call putcallratio maxpain options qgayopiqqt,CVX,0.953315258026123
2020-05-08,watchlistn target raised chase,CVX,0.8468722105026245
2020-05-08,target raised chase,CVX,0.8609730005264282
2020-05-08,target raised chase,CVX,0.8609730005264282
2020-05-08,gona keep buying until hits dollars change,CVX,0.9890832901000975
2020-05-08,given average rating brokerages slcbozomcb,CVX,0.8811266422271729
2020-05-08,given average rating brokerages,CVX,0.8051877021789551
2020-05-08,given average rating brokerages,CVX,0.8051877021789551
2020-05-08,receives consensus recommendation analysts thzzcclxmj,CVX,0.8655130863189697
2020-05-09,moving average crossed above moving average april view odds indicators stockmarket technicalanalysis money daytrading news drdklmkjdu,CVX,0.8966785669326782
2020-05-09,technical alerts narrow range stochastic reached overbought,CVX,-0.6413968801498413
2020-05-09,peak profit expired option alerts,CVX,0.6987336874008179
2020-05-09,puts option volume volume,CVX,0.7748011350631714
2020-05-09,months option alerts peaked above after were triggered algo,CVX,0.9266557693481444
2020-05-09,view historical options performance,CVX,0.1102021858096122
2020-05-28,options flow grid update optionstrading optionsflow stockmarket energy oilandgas oilprices oilprice,CVX,0.2315211594104766
2020-05-28,sierraclub companies soon heading arctic refuge spend millions destroying pristine sacred land,CVX,-0.8533837795257568
2020-05-28,calls close,CVX,0.1058147102594375
2020-05-28,nestorkim bought calls,CVX,0.8098069429397583
2020-05-28,bought calls,CVX,0.702872633934021
2020-05-28,winner space which better,CVX,0.9911901950836182
2020-05-28,leveraged robinhood related tickers,CVX,0.0109160728752613
2020-05-28,started position probably later,CVX,0.8789821863174438
2020-05-28,discusses business operations stockholders meeting,CVX,0.0195459686219692
2020-05-28,enronchairman update proposal voting proposal calling split chairman roles voted,CVX,-0.0431529283523559
2020-05-28,update proposal voting proposal calling split chairman roles voted were defeated advisory vote executive compensation votes oott mike wirth commented,CVX,-0.4749851524829864
2020-05-28,majority supported proposal asking report climate lobbying corpgov,CVX,0.1814276278018951
2020-05-28,moving average crossed above moving average april view odds indicators stockmarket technicalanalysis money daytrading news,CVX,0.8966785669326782
2020-05-28,sentiment total scores positive negative sentiment,CVX,-0.0255533531308174
2020-05-28,pullback downtrend longerterm combo chart,CVX,-1.057314157485962
2020-05-28,poor technical analysis score score breakdown categories candle score weak moving average score neutral momentum score poor stockmarket,CVX,-1.032084345817566
2020-05-28,ginsecurities huge layoffs viacom firing people make huge single announcement boyd gaming perma,CVX,-0.9482321739196776
2020-05-29,insider filing corp director debra reed vlfoopqxrg,CVX,0.059998795390129
2020-05-29,insider filing corp director john frank,CVX,0.0566215515136718
2020-05-29,upgraded zacks research,CVX,0.775428295135498
2020-05-29,insider filing corp director wanda austin,CVX,0.0591630563139915
2020-05-29,insider filing corp director alice gast,CVX,0.0609610937535762
2020-05-29,voted climatelobbying proposal bnpparibas institutional trillion wrote lobbyingdisclosure same fully respond resign corpgov climatecrisis hqussrjsuj,CVX,-0.0240522250533103
2020-05-29,files form submission matters vote security holders yiwqxbwypy,CVX,-0.0005262233316898
2020-05-29,intermed downtrend intraweek combo chart isxadrugfr,CVX,-1.077000617980957
2020-05-29,optimus maximus closed covered previously shorted profit corp corp stats,CVX,0.8243290185928345
2020-05-29,bought dividend,CVX,0.8967272043228149
2020-05-29,trump china fight shows covid hasn changed world coronavirus,CVX,-0.2130155116319656
2020-05-29,moving average moved above moving average april view odds indicators cwaqhnvtlo stockmarket technicalanalysis money daytrading news,CVX,0.9120385646820068
2020-05-29,probably need research,CVX,0.953194260597229
2020-05-29,demobilises workers tengiz field kazakhstan,CVX,-0.1352816224098205
2020-05-29,looking worse than change recently,CVX,-1.0703586339950562
2020-05-29,pullback downtrend longerterm combo chart,CVX,-1.057314157485962
2020-05-30,upgraded zacks research rhnupuhqxg,CVX,0.775428295135498
2020-05-30,enters uptrend because momentum indicator exceeded level view odds indicators rdcmzdixdg stockmarket technicalanalysis money daytrading news,CVX,0.9015400409698486
2020-05-30,voted climatelobbying proposal bnpparibas institutional trillion wrote lobbyingdisclosure same fully respond resign,CVX,0.0584628731012344
2020-05-30,insider filing corp director donald umpleby,CVX,0.059323251247406
2020-05-30,insider filing corp director ronald sugar,CVX,0.0547616556286811
2020-05-30,good fundamental analysis score score check various indicators value score chart roic gross margin ebitda stockmarket,CVX,0.9710310697555542
2020-05-30,options maxpain chart free options,CVX,0.1587696969509124
2020-05-31,technical rating does show decent setup pattern,CVX,0.6866244077682495
2020-05-31,remains favorite paying huge divey sideways needs clear,CVX,0.9809800386428832
2020-05-31,options maxpain chart free options,CVX,0.1587696969509124
2020-05-31,enters uptrend because momentum indicator exceeded level view odds indicators stockmarket technicalanalysis money daytrading news,CVX,0.9015400409698486
2020-05-31,directional bias report click details,CVX,-0.309488981962204
2020-05-31,report click sell,CVX,0.3291448950767517
2020-06-01,stay afloat output falls lowest level since crude crudeoil benzinga,CVX,-0.9997673034667968
2020-06-01,took look,CVX,-0.0277379415929317
2020-06-01,options maxpain chart open interest chart update optionstrading optionsflow stockmarket,CVX,0.4155454933643341
2020-06-01,tickeron enters uptrend because momentum indicator exceeded level view odds indicato,CVX,0.9089882373809814
2020-06-01,enters uptrend because momentum indicator exceeded level view odds indicators stockmarket technicalanalysis money daytrading news,CVX,0.9015400409698486
2020-06-01,make sweeping cuts demand plummets,CVX,-0.9525541067123412
2020-06-01,needs trigger before kjnwfbdzly,CVX,0.8855147361755371
2020-06-01,intermed downtrend intraweek combo chart,CVX,-1.077000617980957
2020-06-02,biggest regret buying during selloffs both size number long term plus side winners time across different sectors latest make move weeks,CVX,0.789164662361145
2020-06-02,direct target failed close above target couple days ready target dmgdrbvyez,CVX,-0.967095136642456
2020-06-02,debt equity ratio better performing companies industry,CVX,0.9668548107147216
2020-06-02,koyfincharts lightcharts funny actually full write march average return lows hindsight,CVX,0.8690602779388428
2020-06-02,taking,CVX,0.7316720485687256
2020-06-02,moving,CVX,0.8866392374038696
2020-06-02,atlasalphatrade lightcharts average energy consistent cash generator paid double,CVX,0.9234520196914672
2020-06-02,lightcharts average energy consistent cash generator paid double digit dividend yield traded high quality,CVX,0.9743103981018066
2020-06-02,uptrend rising consecutive days june view odds indicators stockmarket technicalanalysis money daytrading news,CVX,0.979865312576294
2020-06-02,helped,CVX,0.94725239276886
2020-06-02,benaltitude tightttttt looking after area clears,CVX,0.7588212490081787
2020-06-02,tightttttt looking after area clears,CVX,0.7575613260269165
2020-06-03,closed calls cash,CVX,0.8499240875244141
2020-06-03,rising volume pattern appearances since performance close days later worst best days later worst best days later worst best,CVX,0.2117577642202377
2020-06-03,major breakout pattern appearances since performance close days later worst best days later worst best days later worst best,CVX,-0.8009045124053955
2020-06-03,minor breakout pattern appearances since performance close days later worst best days later worst best days later worst best,CVX,-0.7920898199081421
2020-06-03,closed calls cash,CVX,0.9282602071762084
2020-06-03,joaquinkam another,CVX,0.9238381385803224
2020-06-03,blue,CVX,0.0818547010421752
2020-06-03,blue,CVX,-0.0885303914546966
2020-06-03,neutral technical analysis score score breakdown categories candle score good moving average score neutral momentum score weak stockmarket anfklafbdb,CVX,0.5290322303771973
2020-06-03,waver opec production cuts questioned,CVX,-1.0019463300704956
2020-06-03,bull break above short term resistance around level,CVX,0.2228821814060211
2020-06-03,enters uptrend because momentum indicator exceeded level view odds indicators stockmarket technicalanalysis money daytrading news,CVX,0.9015400409698486
2020-06-03,insider filing corp general counsel hewitt pate,CVX,0.0522657558321952
2020-06-03,insider filing corp director debra reed,CVX,0.059998795390129
2020-06-04,optiontradiniq couple days holding above showing distribution,CVX,-1.0848395824432373
2020-06-04,neutral technical analysis score score breakdown categories candle score good moving average score neutral momentum score weak stockmarket,CVX,0.438651829957962
2020-06-04,hanging pattern appearances since performance close days later worst best days later worst best days later worst best,CVX,-0.7787978649139404
2020-06-04,trailed pull back gain,CVX,0.9913601875305176
2020-06-04,reasonable changes change recently,CVX,0.9345623254776
2020-06-04,buytoopen atthemoney,CVX,0.923999547958374
2020-06-04,enters uptrend momentum indicator exceeded level view odds indicators stockmarket technicalanalysis money daytrading news qzscssjodn,CVX,0.9058277606964112
2020-06-05,capitalism change recently,CVX,0.3450773656368255
2020-06-05,major breakout pattern appearances since performance close days later worst best days later worst best days later worst best,CVX,-0.8025116920471191
2020-06-05,minor breakout pattern appearances since performance close days later worst best days later worst best days later worst best,CVX,-0.7936750650405884
2020-06-05,redlerallaccess,CVX,-0.1290384083986282
2020-06-05,announced plans global workforce totaling around workers growing concern least these workers employees houston layoffs,CVX,-1.005717396736145
2020-06-05,capped performance long short calls,CVX,-0.9646315574645996
2020-06-05,above fixed,CVX,0.920644760131836
2020-06-05,human human posessions freetip,CVX,0.1400521993637085
2020-06-05,above,CVX,0.9055750370025636
2020-06-05,,CVX,0.8932886123657227
2020-06-05,realtingreese play sent months crazy,CVX,-1.0880099534988403
2020-06-05,quickdcapital feeling trim bigley riding since riding since agree sentiment change coming,CVX,0.4758520722389221
2020-06-05,enters uptrend because momentum indicator exceeded level view odds indicators stockmarket technicalanalysis money daytrading news ahxsfnahmc,CVX,0.9015400409698486
2020-06-05,options flow grid update optionstrading optionsflow stockmarket energy oilandgas oilprices oilprice,CVX,0.1770771145820617
2020-06-06,enjoy weekend everyone cheers change recently,CVX,0.9996920824050904
2020-06-06,click view sustainability page ewfwlrzkvq,CVX,0.1361558735370636
2020-06-06,theinvestinguru answer bearish,CVX,-1.0399504899978638
2020-06-06,printing money change recently,CVX,0.3903223574161529
2020-06-06,enters uptrend momentum indicator exceeded level view odds indicators cedrleprwi stockmarket technicalanalysis money daytrading news,CVX,0.9058277606964112
2020-06-06,technical alerts high closing high iazgyuzego,CVX,0.8100857734680176
2020-06-06,high range option expiration putcallratio maxpain options,CVX,0.9737277030944824
2020-06-07,target against close below,CVX,-0.9475024938583374
2020-06-07,pullback downtrend longerterm combo chart,CVX,-1.057314157485962
2020-06-07,options maxpain chart free options,CVX,0.1587696969509124
2020-06-07,what company change recently,CVX,0.1786419004201889
2020-06-07,options flow grid update optionstrading optionsflow stockmarket energy oilandgas oilprices oilprice ivgtkhyzqe oksgmhjxkr,CVX,0.9292830228805542
2020-06-07,change change target anlbfiaats,CVX,-0.4578322470188141
2020-06-07,another massive squeeze fired mentioned weeks back plenty rooms upside long holds level targets coming weeks,CVX,0.9626542329788208
2020-06-07,investingwbrady moon,CVX,-0.0454660356044769
2020-06-07,bipolar change recently,CVX,0.7147699594497681
2020-06-07,enters uptrend momentum indicator exceeded level view odds indicators stockmarket technicalanalysis money daytrading news,CVX,0.9058277606964112
2020-06-07,change recently,CVX,0.6610863208770752
2020-06-07,considerable movement change recently,CVX,0.5966067314147949
2020-06-08,major breakout pattern appearances since performance close days later worst best days later worst best days later worst best,CVX,-0.8019744157791138
2020-06-08,minor breakout pattern appearances since performance close days later worst best days later worst best days later worst best,CVX,-0.7965514659881592
2020-06-08,iampatelrp target back support,CVX,0.9185177087783812
2020-06-08,chitraders raised morgan,CVX,0.9417978525161744
2020-06-08,target back support,CVX,0.9160127639770508
2020-06-08,closed bull spreads each total profit contract,CVX,0.9410983324050904
2020-06-08,raised morgan,CVX,0.937358260154724
2020-06-08,looking engineer finance person recently worked help consulting work someone,CVX,0.0270605161786079
2020-06-08,enters uptrend because momentum indicator exceeded level view odds indicators cvjurrqblz stockmarket technicalanalysis money daytrading news,CVX,0.9015400409698486
2020-06-08,looking engineer finance person recently worked help consulting work someone recently laid familiar onshore best,CVX,0.9196587800979614
2020-06-08,long strong,CVX,0.9452545642852784
2020-06-09,concho after recent,CVX,-0.8141342401504517
2020-06-09,reasonable changes change recently,CVX,0.9311543703079224
2020-06-09,downgraded bank america neutral,CVX,-1.0434976816177368
2020-06-09,analysts ratings changes ivcjnglvqo,CVX,0.0371250435709953
2020-06-09,analysts ratings changes,CVX,0.0371250435709953
2020-06-09,analysts ratings changes,CVX,0.0508802309632301
