Date,Tweet,Ticker,Score
2018-09-07,farmers satellite imagery weather data watson help monitor soil moisture levels smart work,IBM,0.0
2018-09-07,visual recognition taught watson what usopen highlight looks fist pump facial expression,IBM,0.0
2018-09-07,holgermu sounds plausible theory holger services grow grow roles shift,IBM,0.625
2018-09-08,workshop callforcode psnacet association gdgmadurai register,IBM,0.0
2018-09-08,natepitruzzello blockchain being adopted steadily businesses ahead game trying adopt compani,IBM,0.1666666666666666
2018-09-08,prassackadvsrs agtech news researchers brazil built prototype agropad paper testing strip combined,IBM,0.0
2018-09-08,xblockofficial wanted know what quantum computer looks robert knows thanks tcdisrupt techcrunchdisrupt,IBM,0.0
2018-09-11,valaafshar woman wiring accounting machine introduced advanced piece technology time,IBM,0.4
2018-09-11,same technology means doctors watson better detect melanoma color asymmetry level borde,IBM,0.25
2018-09-12,outstanding days dublin reimagining thinking doing thank digital business grou orrdhywbgq,IBM,0.5
2018-09-12,interested hear lisaseacat distinguished engineer inventor patents started career stem check,IBM,0.25
2018-09-13,womenwhocode miss reactivesummit taking place montreal october hear facebook salesforce grubhu,IBM,0.0
2018-09-13,insurance platforms accelerate digital ecosystems fgraillot insurance insurtech fintech bloc,IBM,0.0681818181818181
2018-09-13,internationalprogrammersday learn developers working solve pressing disaster relief problems,IBM,0.5
2018-09-14,thirds companies looking deploy blockchain juniperresearch survey shows want,IBM,0.0
2018-09-14,wrap thank action packed robdthomas ibmanalytics ibmwatson ibmcloud winwithai,IBM,0.0
2018-09-14,siderabc great realities together sidera change rules game blockchain part incubation,IBM,0.8
2018-09-16,ibcshow media businesses retain access media assets while cutting costs using komprise stop,IBM,-0.6
2018-09-16,siderabc great realities together sidera change rules game blockchain part incubation,IBM,0.8
2018-09-17,siderabc great realities together sidera change rules game blockchain part incubation,IBM,0.8
2018-09-18,msdeskillindia skill india partnership india facilitate provision skills academy badges career pathways,IBM,0.0
2018-09-18,businesses transform digital ongoing development employee skills never critical,IBM,0.1666666666666666
2018-09-18,siderabc great realities together sidera change rules game blockchain part incubation,IBM,0.8
2018-09-18,meet makana chan powered chatbot japan airlines learn using provide highly personalize,IBM,0.0
2018-09-18,citizenibm read responding hurricaneflorence help redcross goodtechibm,IBM,0.0
2018-09-19,launches tool aimed detecting bias artificialintelligence analytics bigdataanalytics bigdata,IBM,0.0
2018-09-20,themuse tech computer science degree techjobs sponsored nutt,IBM,0.0
2018-09-30,century built systems enabled nazi catalog kill estimated million jews rrpkpxjofz,IBM,0.0
2018-09-30,ibmwatson prove seen scant evidence initial tests show intelligence,IBM,0.0
2018-09-22,harriet green chairman ibmasiapacific karan bajwa managing director india south asia launching ibmyou,IBM,-0.2
2018-09-24,talks about importance opensource changing world around technology,IBM,0.0
2018-09-24,siderabc great realities together sidera change rules game blockchain part incubation,IBM,0.8
2018-09-25,ibmwatson constantly working improve watson transform industries farms factories offices introducin,IBM,0.0
2018-09-27,siderabc sidera success continues decenturionof foxbusiness bloombergtv iontv date,IBM,0.375
2018-09-27,idcuki lots prize draws thank partners axwayuknd puppetize,IBM,0.0
2018-09-27,grow person leader need comfortable being uncomfortable ginni rometty shar,IBM,-0.0499999999999999
2018-09-28,grow person leader need comfortable being uncomfortable ginni rometty shar,IBM,-0.0499999999999999
2018-09-29,grow person leader need comfortable being uncomfortable ginni rometty shar,IBM,-0.0499999999999999
2018-09-29,great realities together siderabc change rules game sidera blockchain part,IBM,0.2
2018-10-01,marsh blockchain proof insurance collaboration expanded through salesforce,IBM,0.0
2018-10-01,foreignpolicy security brief mattis cancels china trip amid rising tensions scores major payday trump says fell love,IBM,0.0
2018-10-01,awiresham dear tatasky without prior intimation discontinued subscription sony,IBM,0.0
2018-10-01,sony playstation move motion camera microphone zoom lens gaming item specifics,IBM,0.0
2018-10-01,cccrowl thank reaching regarding concerns prides itself offering fresh high quality,IBM,0.5
2018-10-01,eyes tesco half results,IBM,0.0
2018-10-01,commission,IBM,0.0
2018-10-01,tune cnbc around world weekend watch chairman chuckrobbins talk strategy leadership djpsxtnmee,IBM,0.0
2018-10-01,want work hiring brookfield click details labor jobs careerarc,IBM,0.0
2018-10-01,ronniedelcarmen mary blair concept alice talking doorknob voiced joseph kearns wilson dennis,IBM,0.0
2018-10-01,security solutions engineer firepower work home area tier gold partner,IBM,0.0
2018-10-01,giveaway samsung note teclado gaming mouse gamer,IBM,0.0
2018-10-02,haetbitmark adidas offline online store buyers emoticons,IBM,0.0
2018-10-18,examdump download cloud computing infrastructure architect oyovymotwp please,IBM,0.0
2018-10-18,insights saas based expense management software leading players involved ariba,IBM,0.25
2018-10-18,insights saas based expense management software leading players involved ariba zkanmlelai,IBM,0.25
2018-10-18,check latest openings danieatupsjobs waste management allwmjobs parking management,IBM,0.0
2018-10-18,watch wall street blockchain coming exec cryptocoinsnews refindcom,IBM,0.0
2018-10-18,samsung galaxy launched india inch display support,IBM,0.0
2018-10-18,onstage shawna hoffman watson legal team talking about convergence datascience,IBM,0.2
2018-10-18,missed analysts revenue estimates ending short lived streak sales gains,IBM,0.0
2018-10-18,honda officially launched indonesia india hondaindia hondalife,IBM,0.6000000000000001
2018-10-18,imrankhanpti condemnable terrorist attack targeting kandahar governor police chief chief condolences prayers,IBM,0.2
2018-10-18,stellar lumens technical analysis demo blockchain world wire sibo conference soon golden crossove ztdnyvemth,IBM,0.1833333333333332
2018-10-18,ebay movies deals jurassic park collection disc incl,IBM,0.0833333333333333
2018-10-18,knausc recap thales military contractor asked suppress parts auditor general report critical,IBM,0.3
2018-10-19,cash only repeat cash only sugardaddy sugarbabyneeded,IBM,0.7708333333333333
2018-10-19,funding early stage startups plug play changing game great read,IBM,0.3
2018-10-19,network management softwares industry booming worldwide players netscout systems xtfrxxyver,IBM,0.0
2018-10-19,siliconundergro juggernaut until made fateful decision create based fear eating,IBM,0.0
2018-10-19,ibmwatsonmedia finalists streaming media readers choice awards announced competition diff,IBM,0.0
2018-10-19,candid whysoserious simransharmaaaa office,IBM,0.0
2018-10-20,story gift apps xbox live avatar items through store,IBM,0.8
2018-10-20,live rugbyonthebox heineken champions racing ulster sport,IBM,0.1363636363636363
2018-10-20,premiumtimesng reuters economist baffled question atiku buhari corruption mohammed,IBM,0.4
2018-10-20,weekend which involves cycling good,IBM,0.0
2018-10-20,texastribune president donald trump rally monday houston moved arena bigger venue toyota center,IBM,0.1363636363636363
2018-10-20,americafruitco trials blockchain store blockchain projects worldwide,IBM,0.0
2018-10-20,using logo second,IBM,0.05
2018-10-20,racist white refused elderly black woman ryanair flight called ugly black bast,IBM,0.0
2018-10-20,trials blockchain store blockchain projects worldwide dlgyyrskzu,IBM,0.0
2018-10-21,comicbooknow years grandtheftauto first crashed onto screens debuted windows,IBM,0.0
2018-10-21,nytimes years opened what basically escape room cybersecurity nerds taking idea road,IBM,0.0
2018-10-21,lemondahyun need fuck jennies case happy instead bashing bias,IBM,-0.4
2018-10-21,cloud helps airlines create easier check improve time departures avoid turbulence smart work,IBM,0.0
2018-10-22,byndogehk wrap major motoko kusanagi ghost shell polaroids prints full sets patrons,IBM,0.1363636363636363
2018-10-22,hailyoongissi fucking love shitting mumbai didn knew were savior bighitent thank,IBM,-0.0499999999999999
2018-10-22,adidas performance women element race running shoe black carbon aero pink,IBM,0.0
2018-10-22,chairmidrand south africa operating systems search engines anti virus softwares gmail,IBM,0.0
2018-10-22,fredcantu live houston something huge happen stadium toyota center born bred,IBM,0.1
2018-10-22,elevate mainframe server performance refurbished packs speed intelligence security,IBM,0.0
2018-10-22,xhakaed ryanair apparently dming people take instead moving racist moved lady,IBM,0.1
2018-10-22,monday inspo brought ginni rometty founder reminder step outside comfort,IBM,0.0
2018-10-22,jobs requirement broadway long term contract,IBM,0.0431818181818181
2018-10-22,tainemclean drivers lord moves mysterious ways please indicator,IBM,0.0
2018-10-22,black horse coming breakout remember about conference october,IBM,-0.4
2018-10-23,sophaskins always loved didn windows thinkpads because windows killed great throw shade,IBM,0.1666666666666666
2018-10-23,ebay retired seymour mann jointed plush female bear coat teddy bear,IBM,0.0
2018-10-23,automeme forbes wants make artificial intelligence fair transparent openscale rulcigxqxk auto,IBM,0.1
2018-10-23,tonight media digest trump talks usatoday speculation move,IBM,0.0
2018-10-23,sony products available stores visit nearest outlet attractive offers sony,IBM,0.0
2018-10-23,xhakaed ryanair apparently dming people take instead moving racist moved lady,IBM,0.4333333333333333
2018-10-23,empty good change kikmenow goddeshazel rtpid rtfaggot pigg findom paypig finsub,IBM,0.0
2018-10-23,sirishchandran legend back introduced hyundai brings back well nameplate launched hyundai,IBM,0.0
2018-10-23,enterprise data storage swot analysis business strategies players dell fujitsu netapp,IBM,0.0
2018-10-23,looking wheels star ditchs wheel call thank,IBM,0.2121212121212121
2018-10-23,johanna koester insights help diversity inclusion tech aware timezones diversity,IBM,0.25
2018-10-23,comming time join powerai live rome systems tech university,IBM,0.0
2018-10-23,stop booth ground floor ibminfluencer sibos ibmfintech ibmfintech ibmblockchai,IBM,0.0
2018-10-23,ruialmazan previous record notch iphone arrive samsung,IBM,0.0
2018-10-23,itvnews widow victim racist tirade ryanair flight told news incident,IBM,0.0
2018-10-23,jvdwesterlo partners includes macdonald star bucks hyundai airlines aston martin uber,IBM,0.5625
2018-10-23,security breach yahoo million security breach after email addresses personal inform,IBM,0.1363636363636363
2018-10-23,brand xbox bundle free shipping dsgjnhvhsa,IBM,0.1363636363636363
2018-10-24,proposed ring completely happy about size costs,IBM,0.1875
2018-10-24,surface pack attend basketball games showcase series,IBM,0.0
2018-10-24,davelackie love burberry giving away burberry velvet crush oxblood honey nude hudson enter,IBM,0.0
2018-10-24,hotnews evolution technology paying without cash ethereum tech block sbgsrjuyng,IBM,0.1363636363636363
2018-10-24,travelport build future travel planning blockchain,IBM,0.0
2018-10-24,xhakaed ryanair apparently dming people take instead moving racist moved lady,IBM,0.1363636363636363
2018-10-24,acloudguru serverlessconf session cloud functions production about developing debugging monitoring,IBM,0.0
2018-10-24,proved quantum computers things impossible classical ones quantumcomputing quantumadvantage,IBM,-0.3333333333333333
2018-10-24,continuumpharma head watson health leaving after company stumbles growing criticism esante hcsmeufr digitalhealth,IBM,0.0
2018-10-24,making biggest move premarket siri,IBM,0.0
2018-10-24,mikehudema think makers colgate toothpaste dove doritos stop buying palm companies,IBM,0.0
2018-10-24,meet force command cyber tactical operations center industry first security operations center wheels find,IBM,0.0166666666666666
2018-10-24,nezvsuniverse nutmegradio reuters probably biggest media agency world credible,IBM,0.0
2018-10-24,palewire braintree branch intelligence community pydatala recruiting usual,IBM,-0.25
2018-10-24,bensilverm news global cloud management openstack future trend software vmware,IBM,0.0
2018-10-24,opening ibmcloudgarage europe including munich back april total cloud,IBM,0.0
2018-10-24,sony warns gamers lose saves progress access after changing name,IBM,0.0
2018-10-24,jordipuignero destrueix dades foreign companies seem worried about situation siemens amaz,IBM,0.125
2018-10-24,originpc giveaway launched giveaway samsungbizusa celebrate samsung game,IBM,0.5
2018-10-24,appleinsider seeing great returns macs devices issued employees,IBM,0.8
2018-10-24,michaeljfoody tylercowen questions bayer based socialist eyeroll germany come,IBM,0.4603174603174602
2018-10-25,cbsnews gold digging pretends stray hamburgers mcdonald owner says,IBM,0.0
2018-10-25,historyinmoment console,IBM,0.0
2018-10-25,steph curry buries triples route warriors victory arena dubnation,IBM,0.0
2018-10-27,dayvales dave great hear travelling first class,IBM,0.3
2018-10-27,power supply unit ready ship,IBM,0.0
2018-10-27,emfarl word sensitive thing move something half inch pictures move pages inserte,IBM,0.0
2018-10-27,historylvrsclub hard drive,IBM,-0.2916666666666667
2018-10-28,defends jedi cloud project qwgfktsfjf,IBM,0.35
2018-10-28,techrepublic cris thomas space rogue global strategy lead force discusses myths realities,IBM,0.0
2018-10-28,rivals reject blockchain solution maersk need joint industry standard says hapag lloyd,IBM,0.0
2018-10-28,xbox looking brighter future custom radiation king samsung qled custom xbox,IBM,0.0
2018-10-28,phillip lindsay finds zone broncos broncoscountry,IBM,0.2
2018-10-28,adamhjk happens news strategic asset bunch reasons nears deal acquire software maker,IBM,0.0
2018-10-28,pretty news buying redhat predatory hostile patent practice including suing groupon,IBM,-0.2249999999999999
2018-10-28,soleindividual adidas yeezy boost zebra available purchase free shipping options,IBM,0.0
2018-10-28,seizethedey,IBM,0.0
2018-10-28,bobbybigwheel manning toyota customer real champion visit ridge sayreville baldwin,IBM,0.0
2018-10-28,announces acquire personally think great thing enterprise linux,IBM,0.0
2018-10-28,filmsfoundintinsjarsandbottles feet,IBM,0.0
2018-10-28,cnbcnow breaking advanced talks acquire which value about deal announced soon,IBM,0.2
2018-10-28,somebody sega helped yahoo boys advocacy,IBM,0.0
2018-10-28,lazejanev well billions acquisition acquire completely changing cloud landscape becoming,IBM,0.0
2018-10-28,baby ready ebygzhrewh,IBM,0.0
2018-10-28,official gobble enterprise linux theregister,IBM,0.0
2018-10-28,read about companies acquired worse looks doesn look good anyone redhat,IBM,0.0499999999999999
2018-10-28,drawpile close screams,IBM,-0.1
2018-10-28,rakyll never imagined world acquired microsystems acquired github acquired,IBM,0.0
2018-10-28,wfiknzlwns mobicam multi purpose video baby monitor baby monitoring system camera,IBM,0.0
2018-10-28,theregister dear staff congrats home memo useful interact ginni,IBM,0.0
2018-10-28,peaks around corner points canonical doesn swoop first,IBM,0.125
2018-10-28,trying read rhel gives access lots customers otherwise shutting,IBM,0.0
2018-10-28,acquire redhat world leading provider open source technology becoming hybrid cloud provider,IBM,0.225
2018-10-28,acquire redhat world leading provider open source technology becoming hybrid cloud provider,IBM,-0.1
2018-10-28,segrediego acquire completely changing cloud landscape becoming world hybrid cloud provider,IBM,0.0
2018-10-28,ibmnews acquire completely changing cloud landscape becoming world hybrid cloud provider,IBM,0.1833333333333332
2018-10-28,vertaholic radar protocol tackling supply chain mcap only winning award,IBM,0.0
2018-10-28,theregister official gobble enterprise linux riiyrfaxsr,IBM,0.0
2018-10-28,ibmnews ginni rometty james whitehurst announced acquire acquisition brings,IBM,0.0
2018-10-28,davidfaber cash roughly deal announced shortly sources,IBM,0.0
2018-10-28,eddyelfenbein buying well chart every,IBM,0.0
2018-10-28,wait acquires redhat didn move coming,IBM,0.0
2018-10-28,dberkholz official acquires building monopoly open,IBM,0.0
2018-10-28,ibmnews acquire completely changing cloud landscape becoming world hybrid cloud provider,IBM,0.0
2018-10-28,luxury chic ebay designerclothing wrapdress dianevonfurstenberg fashion chic silk jilda ebay,IBM,0.0
2018-10-28,sure called doyle rules jack doyle colts touchdown funny ksfnvovzox,IBM,0.0
2018-10-29,baby ready ebygzhrewh,IBM,0.0
2018-10-29,seen obvious novel takes acquisition redhat them focused,IBM,0.1
2018-10-29,morgan dollar anacs legends comstock lode brilliant uncirculated listed ebay another affor,IBM,0.2333333333333333
2018-10-29,posimann martens something asos find,IBM,0.0
2018-10-29,nascaronnbc probably seems toyota rolls,IBM,0.0
2018-10-29,landolakesinc time join thing until continue avoid products,IBM,0.0
2018-10-29,forget watson acquisition thing saves techcrunch googlenews,IBM,0.0
2018-10-29,nosiphozmtshali colgate yourself prove another penis small hayi niyazistressa,IBM,0.0
2018-10-29,kicks black friday leaks season ipad pair laptops ubfgaabrzl,IBM,0.0
2018-10-29,coreos,IBM,0.0
2018-10-29,paulkrugman forget attempted mass killing african americans shooter tried,IBM,0.0
2018-10-29,ibmnews acquire completely changing cloud landscape becoming world hybrid cloud provider,IBM,-0.1
2018-10-29,business lion crash lost contact traffic control around local time indonesia search,IBM,0.0
2018-10-29,cash debt taking bigger leap into hybrid cloud jzcudqccvo,IBM,0.0
2018-10-29,acquire redhat world leading provider open source technology becoming hybrid cloud provider,IBM,0.225
2018-10-29,lion crashes coast indonesia passengers board debris found,IBM,-0.6999999999999998
2018-10-29,huffpost news conference held later edward sirait chief executive lion group told reuters,IBM,0.0
2018-10-29,acquire completely changing cloud landscape becoming world hybrid cloud provider,IBM,0.0
2018-10-29,acquisition refocuses core strengths rather than watson push alwa,IBM,0.0
2018-10-29,ibmnews acquire completely changing cloud landscape becoming world hybrid cloud provider,IBM,0.1833333333333332
2018-10-29,techcrunch cash debt taking bigger leap into hybrid cloud,IBM,0.0
2018-10-29,forget watson acquisition thing saves,IBM,0.0
2018-10-29,lionair plane crashes jakarta indonesia people board,IBM,0.0
2018-10-29,buys open source software company billion,IBM,0.0
2018-10-29,acquire redhat world leading provider open source technology becoming hybrid cloud,IBM,0.225
2018-10-29,thehackersnews acquire open source software company billion largest tech,IBM,0.0
2018-10-29,mikereiss patriots downgraded sony michel knee marcus cannon concussion geneo grissom ankle barring,IBM,0.0
2018-10-29,official acquiring software company billion official,IBM,0.0
2018-10-29,amiliibrahim please lost adidas picture ikea cheras section lighting tengok cctv,IBM,0.0
2018-10-29,official gobble enterprise linux theregister,IBM,0.0
2018-10-29,leaders praise acquisition employees worried zdnet googlenews,IBM,0.0
2018-10-29,mitchellcocaine shut conservatives make competitor getongab makes competitor,IBM,0.0
2018-10-29,buys rrjqgzotwt,IBM,0.0
2018-10-29,investingcom wall street points tentative rebound acquires dollar holds near high,IBM,0.05
2018-10-29,topstory buys open source software company billion,IBM,0.0
2018-10-29,hatena blog support yahoo email call blog texjwsrpzo,IBM,0.0
2018-10-29,tell about roots animus,IBM,0.8
2018-10-29,heshmatalavi breaking south korea hyundai cancels deal build petrochemicals complex iran citing upcoming,IBM,0.0
2018-10-29,xbox looking brighter future custom radiation king samsung qled custom xbox,IBM,0.0
2018-10-29,making biggest move premarket hsbc blmn,IBM,0.5
2018-10-29,desperation move buys billion largest acquisition,IBM,0.0
2018-10-29,linux distributor billion technology,IBM,0.25
2018-10-29,comicbooknow reportedly making xbox controllers phones tablets alvhfkqyqw,IBM,-0.1333333333333333
2018-10-29,thedailybeast crashed indonesia monday ending safest period flying brand,IBM,0.0
2018-10-29,business gains stronger foothold open source industry expertise deal says whitehurst,IBM,0.1666666666666666
2018-10-29,streetwearvice adidas grey camo available purchase free shipping options spng,IBM,0.0
2018-10-29,someday ferrari maybe someday hope someone mercedes hits,IBM,0.1363636363636363
2018-10-29,ibmsecurity entrustdatacard help shield highly regulated industries storm thre,IBM,0.16
2018-10-29,york sues mobil saying deceived climate change lxubldxluy,IBM,0.5
2018-10-29,jumps cloud mega merger,IBM,0.0
2018-10-29,know someone doing exciting work products analytics time nomiate them,IBM,0.3
2018-10-29,someday ferrari maybe someday hope someone mercedes hits,IBM,0.0
2018-10-29,please help find stolen hours white series,IBM,0.0
2018-10-29,lift pakistan proudly announces partner event grab passes register yourself,IBM,0.8
2018-10-29,software developer description what doing verizon connect guide connected world dnxsldpjzv,IBM,0.0
2018-10-29,alabama mcdonald gunman killed armed injured shootout,IBM,0.5
2018-10-29,alabama mcdonald gunman killed armed injured shootout thank pistol carrying father,IBM,0.0
2018-10-29,acquire redhat world leading provider open source technology becoming hybrid cloud provider,IBM,0.0
2018-10-29,monkchips culture surprise people strongly shared values these folks,IBM,0.2
2018-10-29,mideast saudi extends gain after earnings banks weigh dhabi reuters mideast middleeast news,IBM,0.0
2018-10-29,forget watson acquisition thing saves techcrunch,IBM,0.0
2018-10-29,mcdonald weekend white little girl called ugly black asian friend well,IBM,0.0
2018-10-29,juhiibm acquire completely changing cloud landscape becoming world hybrid cloud provider,IBM,0.1833333333333332
2018-10-29,actually does prolific contributors open source planet doing,IBM,0.0
2018-10-29,cash debt taking bigger leap into hybrid cloud dijfjxieqj,IBM,0.0
2018-10-29,sugardaddyserious minded babies only first babies retweet cash only,IBM,0.0
2018-10-29,rwlord best blockchain developer,IBM,1.0
2018-10-29,sportscenter stop kareem hunt kcvsden bosqbqnuuo,IBM,-0.3125
2018-10-29,trump sanctions iran tested thirsty china india reuters,IBM,0.1875
2018-10-29,acquire open source software company billion largest tech deal,IBM,0.0
2018-10-29,grandfather retired esso time capital world kkcabcmcxm,IBM,0.0
2018-10-29,turn whole squad bosses kickin adidas,IBM,-0.2
2018-10-29,acquired what started making laptops,IBM,0.0
2018-10-29,buys open source software company billion,IBM,0.0
2018-10-29,baby ready ebygzhrewh,IBM,-0.15
2018-10-30,buys open source software company billion njrfinipqb thehackersnews,IBM,0.0
2018-10-30,dbongino already tuned mainstream media haven watched years,IBM,-0.3
2018-10-30,yoona jung hyundai duty free making video,IBM,-0.05
2018-10-30,reuterstech jumps cloud mega merger,IBM,0.0
2018-10-30,thank wonderful support callforcode,IBM,1.0
2018-10-30,thesocialcmo lego team powered interactive watsoncommerce ibmcommerce artificialintelligence,IBM,0.0
2018-10-30,land rover safari ebay land rovers,IBM,0.0
2018-10-30,hailstatefb introducing adidas primeknit statesman uniform inspired mississippi national guard globemaster,IBM,0.0
2018-10-30,memory analytics outlook players corporation pearltree,IBM,0.25
2018-10-30,update group names citi exec britain group holdings named former bank technology iiawvyuhao,IBM,0.0
2018-10-30,ibdinvestors jump buys keeps rising eateries wing txrh,IBM,0.25
2018-10-30,acquire oneplus launch video cnet,IBM,0.0
2018-10-30,mint chocolate cream amazing cream flavor ready lasang chocolate colgate,IBM,0.0
2018-10-30,watch deleted entire episode official website find these segments youtube either,IBM,0.0
2018-10-30,thehackersnews windows allowed apps access files computer without consent,IBM,0.0
2018-10-30,cash debt taking bigger leap into hybrid cloud fundraising bcombinator,IBM,0.0
2018-10-30,adidasalerts retail adidas adidas essentials stripes pants retail shipped code octsale cart,IBM,0.0
2018-10-30,politvidchannel breaking reuters reported saudi arabia arms deal trump create defense,IBM,0.25
2018-10-30,customers watch acquisition closely,IBM,0.0
2018-10-30,brady fedex ground players nominees,IBM,0.0
2018-10-30,info blackpink adidas korea fansigning event date november location hyundai department store,IBM,0.0
2018-10-30,ebay mirror data communications media,IBM,0.1363636363636363
2018-10-30,adidas mark lullaby,IBM,0.0681818181818181
2017-01-31,sony smes whatsapp business news brief tuesday january fnkpzfsdpm,IBM,0.0
2017-01-31,bosch foxconn building blockchain tech internet things startup,IBM,0.5
2017-01-31,uncharted thief sony playstation vgydwwdacf,IBM,0.0
2017-01-31,reports revenue full cloud revenue reaches flipora tech,IBM,-0.1555555555555556
2017-01-31,knfilters took delivery filter honda feel starting modifyin,IBM,0.0
2017-01-31,stolencarrsa owner audi missing since heading towards middleburg handr,IBM,0.3452380952380952
2017-01-31,senschumer tighten loopholes waiver prgm ensure passports faked stop terrorists want exploit,IBM,0.0
2017-01-31,lambda lambda lambda serverless integrates openwhisk,IBM,0.0
2017-01-31,stvnews shell sells north assets rival deal,IBM,0.625
2017-01-31,steve bannon making sure white house paper trail says source,IBM,0.125
2017-01-31,really stoked toyota supra please these renderings come true,IBM,0.25
