Date,Tweet,Ticker,Score
2017-01-31,bdutt democrats introduced bill bill introduced minimum than doubled,IBM,0.3181818181818182
2017-01-31,gypsy showdown episode theflash tonight,IBM,0.0
2017-01-31,positivelypower road early warwick lovely jane jeffries hamiltonrentals soon jane,IBM,0.1
2017-01-31,senschumer tighten loopholes waiver prgm ensure passports faked stop terrorists want exploit,IBM,0.5
2017-01-31,dragon inquisition sony playstation,IBM,0.4
2017-02-01,qkode unveils plan hire trump meeting,IBM,0.0
2017-02-01,southern copper reports surge profit lima reuters southern copper forex traiding akkwlzheja,IBM,0.0
2017-02-28,reliance build largest services platform eedwaozgta,IBM,0.0
2017-02-28,independent makes than cars britain until,IBM,0.875
2017-02-28,ajenglish yong samsung chief charged bribery embezzlement linked massive south korean scandal,IBM,0.875
2017-02-28,pedoqpop according nasa moon miles away earth samsung corby picks problem,IBM,0.0
2017-02-28,moving beer ship road saves says heineken imagine what happen ships gree,IBM,0.0
2017-02-28,israeli chief qaeda bases turkey provide easy jihadist access europe destination,IBM,0.0
2017-02-28,sony check product review analysis tspbyzeajh,IBM,-0.3333333333333333
2017-02-28,teapainusa feller senatorburr charge senate committee investigatin trumprussia step,IBM,0.0
2017-02-28,khaleejtimes samsung unveil galaxy march,IBM,0.0
2017-02-28,watching kidnapping freddy heineken,IBM,0.0
2017-02-28,thehill presssec admit raid gathering people lives stake child seal afults,IBM,0.0
2017-02-28,chrisodonnellpt news chris late late show james corden tonight february,IBM,0.0
2017-02-28,first drug dealer giggles gets stabbed,IBM,0.0
2017-02-28,xbox rock band wired bundle guitar drums game,IBM,0.0
2017-02-28,historicalpics hard drive fphbzqopcn,IBM,-0.2916666666666667
2017-02-28,having trouble myself sure samsung virgin prob wifi working everything though,IBM,0.0
2017-02-28,marble side table paua shell handmade inlay floral marquetry gifts,IBM,0.0
2017-02-28,hockeyandbeers chevronrock wagon true wagon,IBM,0.0
2017-03-01,gets patent office email patent office years,IBM,0.0
2017-03-01,tedlieu really think head exploding reuters intelligence lying them,IBM,0.1898989898989898
2017-03-01,brain lesions cause fatal pedestrian accident paul minnesota wcco healthnews,IBM,0.0
2017-03-01,jumps through portal lands pouring rain feet away gypsy theflash,IBM,0.0
2017-03-01,barbies kool wacky skating dream special editions nrfb,IBM,0.0
2017-03-01,what fork doing produce sign petition change,IBM,0.18
2017-03-31,vodafonein vodafonein delay response legal notice file defamation suit against vodafone,IBM,0.0
2017-03-31,ssfcrabbitohs panthers pepper bulldogs broncos manly allianz tigers,IBM,0.0
2017-03-31,ratchet clank sony playstation,IBM,0.0
2017-03-31,cryptocoinsnews develops blockchain platform fight carbon emissions china hpuanejwjx,IBM,0.0
2017-03-31,ibmblockchain watch blockchain network effect real trusted business mwieck wolfond securekey,IBM,0.2
2017-03-31,marchmadnesstv years shining moment made debut original version started incredi,IBM,0.0
2017-03-31,jbcgiveaway preparations underway allianz parque paulo brazil justin bieber purposetourstadiums,IBM,0.0
2017-03-31,bought audi couldn diet vanilla igloo holder sara,IBM,0.0
2017-03-31,andybittervt link works time hokies west virginia slated prime time sunday sept fedex field,IBM,0.0
2017-03-31,compuware blogged mainframers rejoice compuware agree linkedin ibmz,IBM,0.0
2017-03-31,samsung made revenues billion than federal government india,IBM,0.0
2017-03-31,reviewer descried ghost shell beautiful movie seen blatantly raci,IBM,0.1704545454545454
2017-03-31,sure received about these shop ebay seems empty,IBM,0.5
2017-03-31,cbsnews investigators probing whether trump campaign reps role russian cyberattacks news learn,IBM,0.0
2017-03-31,mkbhd samsung designs beautiful phone metal glass edgeless display samsung case,IBM,0.0
2017-04-28,exclusive trump says major major conflict north korea possible seeks diplomacy reuters,IBM,1.0
2017-04-28,dead xbox,IBM,0.4
2017-04-28,japan sharp narrower loss cuts paying tokyo reuters sharp corp hialbovwph,IBM,0.0681818181818181
2017-04-28,acdhlgqmst deals videogames consoles deal ebay bargain golden compass sony playstation,IBM,0.0
2017-04-28,photographer berenice abbott woman wiring early computer documenting science series,IBM,0.1
2017-04-28,consortium loses another member chase departs bitcoin crypto,IBM,0.0
2017-04-28,todays best selling desktop computers minix cherry trail fanless mini desktop computers,IBM,0.0
2017-04-28,executive lessons learned battle vbhjzusuth,IBM,0.0
2017-04-28,ezekielfiguero girl american apparel tennis skirt call babygirl choke kitten daddy cigarettes adidas knee high,IBM,0.0
2017-04-28,domeniconpr quotes trump reuters intvw work thought easier miss life,IBM,0.0
2017-04-28,loved previous life trump told reuters work thought yjeiifbsoz davidgregory,IBM,0.0
2017-04-28,flipkart name chandra book leaving change world,IBM,0.0
2017-04-28,mcdonald make uber announcement drivers families announce boycott,IBM,0.0
2017-04-28,father says marriage exalted ceremony dead policeman reuters,IBM,0.0
2017-04-28,sometimes change rules shamla naidoo global ciso hmgcisony,IBM,0.0
2017-04-28,darrenrovell breaking armour adidas passing lonzo ball after lavar insisted them licensing baller brand,IBM,0.25
2017-04-28,toyota recalls tacoma pickups leaks roadshow,IBM,-0.1
2017-04-28,bleacherreport hold back after armour adidas wouldn sign lonzo ball,IBM,0.4333333333333333
2017-04-28,deaf sues lawyer translating million correctly settlement yestodeaf,IBM,0.0
2017-04-29,senior system administrator charlotte jobs charlotte description jack henry spgjleotce,IBM,0.0
2017-04-29,broken samsung galaxy black,IBM,0.0
2017-04-29,btuflyboutique women black grey honeycomb skinny jeans size ebay,IBM,0.0
2017-04-29,adjustable nylon strap belt leather ends electric acoustic guitar bass ebay,IBM,0.0
2017-05-31,independent donald trump unpredictability drag economy behind europe says blackrock boss lplebpnrqm,IBM,0.0
2017-05-31,vintage granny square afghan crochet heavy warm full size queen ebay grannysquare afghan,IBM,0.0
2017-05-31,battlefield hardline sony playstation,IBM,0.0
2017-05-31,shitbsbplyrssay text coach saying,IBM,0.0
2017-05-31,introducing ready storage reinforcing commitment business partners delivering ibmstorage,IBM,0.2
2017-05-31,noopurdavis listening krebsonsec cybersecurity summit breaches stem supplier vendor,IBM,0.0
2017-05-31,pres samsung edge aggravating button edge edge,IBM,0.25
2017-05-31,china ramps exports volvo buick cadillac mbwdckxniv america china largest,IBM,-0.0583333333333333
2017-05-31,iphone case vofolen impact resistant protective shell iphone wallet cover shockproof rubber bumper case,IBM,0.0
2017-05-31,aging autism eliminating barriers technology forbes,IBM,0.0
2017-06-01,series beloved project original series currently,IBM,0.0
2017-06-01,integrate threat intelligence improve cyber security,IBM,0.0
2017-06-01,watson mostly bullshit,IBM,0.5
2017-06-01,chadpergram cmte aide says subpoenas unmasking come nunes acting separately russia probe consent,IBM,0.0
2017-06-01,robingaming floor plans sony definitely something,IBM,0.0
2017-06-01,june bloodbath comeback line,IBM,0.5416666666666667
2017-06-01,involved support please tesco every little helps,IBM,0.0
2017-06-30,thetrendlive samsung shop jumiakenya nikombelenajumia deals tonight,IBM,0.0
2017-06-30,clothrooms sexy shell bikini discount code trend,IBM,0.0
2017-06-30,repadamschiff house requested tapes documents memorandum comey didn comply answer,IBM,-0.4
2017-06-30,click link accept website bank transfers arranged,IBM,0.0
2017-06-30,valet thing goin guess what come service drop,IBM,0.0
2017-06-30,maddiemoonpie vintage gray enamel rhinestone flower figural brooch ebay ionuxfjbyi,IBM,0.0
2017-06-30,genuine print cartridge magenta laserjet,IBM,0.0
2017-06-30,spectatorindex world largest submarine fleet received submarines soviet union,IBM,-0.05
2017-06-30,watson another step direction,IBM,0.2857142857142857
2017-06-30,halo guardians xbox ends sold hdjlatsunf,IBM,0.1363636363636363
2017-06-30,seanhannity hillary russia collusion uranium obama investigate russia august flynn unmask leaked muel,IBM,0.0
2017-06-30,alex ratner grade excel canadian championship world finals,IBM,0.0
2017-06-30,atdavidhoffman enough stupidity realdonaldtrump msnbc times real news fake news coming,IBM,0.0
2017-06-30,gonna start work healthy mcdonald sleep,IBM,0.0681818181818181
2017-06-30,ogbenidipo salary dignified than yahoo yahoo makes millions,IBM,0.0
2017-07-01,industrials weigh helps restrain losses ezaygdptwo,IBM,0.0
2017-07-31,watson shows machine learning transforming cancer care,IBM,0.0
2017-07-31,thebetterindia india youngest woman captain gave wings childhood dream,IBM,0.0
2017-07-31,belugasolar chase source renewable energy develop portfolio,IBM,0.0
2017-07-31,ibmmobile petsathome teamed launch sales assist mobilefirst ipad,IBM,0.0
2017-07-31,redundancies silver lining widespread cloud adoption kamlsbkoqx forbes entrepreneur,IBM,0.3
2017-07-31,kubernan named diamond sponsor cloudexpo smartcities digitaltransformation cloud,IBM,0.0
2017-07-31,retail adidas ultra boost shipped retail white black,IBM,0.0
2017-07-31,aptare black cool grey womens retro ebay qiwxtwcblj cghktyxkpg,IBM,0.0
2017-07-31,history part empire strikes,IBM,0.0
2017-08-01,valaafshar proceeds were spacex solar city borrow,IBM,0.0
2017-08-31,hiring technical writer proddev xmsmnwpvlz indianapolis jobs,IBM,0.0
2017-08-31,ibmwatson using cognitive capabilities watson learn recognize critical victorious moments tennis match,IBM,0.0
2017-08-31,salesforce deepen partnership integrations salesforce joining forces dtfdlyhszr,IBM,0.0
2017-08-31,nilsdelter snezhkoslx retweet enter samsung galaxy international giveaway knboysxnwe,IBM,0.0
2017-08-31,takes data protection level meters underground lefdal mine datacenter norway,IBM,0.0
2017-08-31,datawarehousing consultant modelling datastage location milton keynes jobs hiring,IBM,0.1363636363636363
2017-08-31,book bookr salesforce deepen partnership integrations bookr,IBM,0.1363636363636363
2017-08-31,guardian ryanair boss doing brexit deal drinking sake,IBM,0.0
2017-08-31,sammsly curatedbymike forced mcdonald throat okay asked weeks,IBM,0.0
2017-08-31,what xenapp essentials trending apps azure marketplace vmworld pdujkwhixt,IBM,0.0
2017-08-31,salesforce advance partnership joint solutions,IBM,0.0
2017-08-31,takes data protection level meters underground lefdal mine datacenter norway,IBM,0.1363636363636363
2017-08-31,baytown phillips chemical reported released than contaminants into,IBM,0.0
2017-08-31,think world maybe computers thomas watson chairman,IBM,0.0
2017-08-31,watch newest spectrum advertising,IBM,0.5
2017-08-31,thehill selling trump hats quarter what trump online store,IBM,0.0
2017-08-31,kaptionthis ultimate driving machine okada roastabrand,IBM,0.0
2017-09-01,sony voice assistant sure does know around speaker,IBM,0.0
2017-09-01,thehill undercuts trump sale selling knockoffs quarter,IBM,0.0
2017-09-01,sheaserrano time fuck hurricane harvey donation wanna join introducingliston gmail,IBM,0.0
2017-09-29,samsung powerbot robot vacuum free shipping,IBM,0.0
2017-09-29,ictpnews ictp peter shor charles bennett watson research center davi,IBM,-0.1
2017-09-29,employees india than does home nation report ndtv news india trending,IBM,0.5
2017-09-29,india jumps rank best country expats hsbc cxbafpvaqo,IBM,0.0
2017-09-29,thenflchick thing though nantz partner pushed aside simms rsqadrkmbg,IBM,0.0
2017-09-29,yoannarsenal people laughing lacazette shopping tesco express find broke people shopping gucci funnier,IBM,0.0
2017-09-29,varietydeals promotion need promotion selfie music video soundcloud youtube business,IBM,0.0
2017-09-29,ryanair cabin crew scamming millionaire team mccrudden dalmac judy byrne crewlink winning recruitment,IBM,0.0
2017-09-29,yoannarsenal people laughing lacazette shopping tesco express find broke people shopping gucci funnier,IBM,0.5
2017-09-29,currently raised melon please sign donate only fill,IBM,0.25
2017-09-29,justlesspay fubotv premier warranty days soccer,IBM,0.0
2017-09-29,watson health cambridge,IBM,0.0
2017-09-29,nhlnetwork wants sweet cardinals stlouisblues jersey retweet chance call yours thanks sending,IBM,0.0
2017-09-30,rogershelps yeah note before blew settled sony,IBM,0.5
2017-10-31,samsung electronics unveils fresh slate executives struggles leadership crisis,IBM,0.0
2017-10-31,heart human blood boiling brain xyxezttyhv,IBM,0.0
2017-10-31,everything offer event watsonmarketing miss early bird registration,IBM,0.0
2017-10-31,discover socomec seminars covering switchgear energy efficiency energy storage book,IBM,0.0
2017-10-31,reuters news talks merge wireless carriers sprint mobile hits another roadblock,IBM,0.0
2017-10-31,business develops weather dashboard drivers fleets msnerevhep trucking technews technology weather traffic,IBM,0.0
2017-10-31,ihatenisha person picks mcdonald french rafidah,IBM,0.0
2017-10-31,given risk everyday good remind everyone take data responsibility seriously,IBM,0.25
2017-10-31,thesolesupplier adidas originals multicolor drops nowhere pxxsxmyzjp,IBM,0.0
2017-10-31,thank sherylunderwood marvinsapp yolandaadams jason aldean network truly make,IBM,0.0
2017-10-31,sniptoday samsung expected earn billion iphone sales than galaxy,IBM,0.0
2017-10-31,twthereddragon loot crate crowd want blood suddenly quiet sony does,IBM,0.4
2017-10-31,entered giveaway chance colorjoy compatible cartridges colorjoy giveaway,IBM,0.0
2017-10-31,yourfavvbaddie accept cash western union transfer mean what good prcinasrbn,IBM,1.0
2017-10-31,senatorburr tmrw markwarner lead senate open session social media companies,IBM,0.0
2017-10-31,joshdcaplan news dead multiple injuries manhattan truck incident according nypd source intentional,IBM,-0.0517676767676767
2017-10-31,news obtains photo sayfullo saipov suspect terror attack,IBM,0.0
2017-10-31,flashbackbaby reuters gets suggests north launching launch preemptivel tsmcxwelwx,IBM,0.0
2017-11-01,struggle analytics tealeaf customer experience cloud watsonmarketin,IBM,0.0
2017-11-01,happy halloween indeed size fanta orange mcdonald,IBM,0.0
2017-11-01,bitwitkyle pimpmypc gaming evga samsung mmbrawunkn,IBM,0.5
2017-11-01,scottpresler radical islamic terrorist infiltrated diversity program lottery came murder extreme vetti,IBM,0.0
2017-11-01,fave moment trick treater telling husband work cool,IBM,0.0
2017-11-01,isis mocked stephen miller stating lottery program thats manhattan,IBM,0.0
2017-11-01,christopher bailey burberry chief creative officer leaving business oqoaluuszi,IBM,0.0
2017-11-01,yourfavvbaddie accept cash western union transfer mean what good prcinasrbn,IBM,0.0
2017-11-01,motogp monza agostini hailwood were neck neck final race until hailwood honda failed cruised,IBM,0.0
2017-11-30,please download examdump storwize technical solutions mvqubsxwnd,IBM,0.0
2017-11-30,hacker hire pleads guilty yahoo breach,IBM,0.3181818181818182
2017-11-30,coca cola plan turn gains proposed cuts,IBM,0.25
2017-11-30,save bestbuy samsung galaxy qualified activation verizon,IBM,0.0
2017-11-30,adidas instant boost collection sold minutes sneakers kicks sneakernews,IBM,0.5
2017-11-30,bluemix cloud offers services designed data ready secure core ibmcloud,IBM,0.1
2017-11-30,house ranking member adam schiff reporters asked attorney general specifically potus,IBM,-0.125
2017-11-30,arrunpareek north america integration roadshows oracledevs oracleintegrate,IBM,-0.5
2017-12-01,natgeo image found imprinted lobster claw reminding ocean filled,IBM,0.0
2017-12-01,latelateshow voters spoken watch play flinch perform tonight btsxjamescorden,IBM,-0.1
2017-12-01,news conference news legal correspondent paula reid repeatedly spokesperson,IBM,0.0
2017-12-29,latelateshow voters spoken watch play flinch perform tonight btsxjamescorden,IBM,0.0
2017-12-29,worldwide gift card giveaway winners gift cards deposit winner choice value,IBM,0.1
2017-12-29,ejsrvrmiog audi dope nope ejsrvrmiog,IBM,0.1
2017-12-29,making biggest moves premarket bhzjtsqyon,IBM,0.5
2017-12-29,iumushimushi sony site update,IBM,0.1363636363636363
2017-12-29,declined payden rygel boosted stake million,IBM,0.0
2017-12-29,opened asos delivery space weeks realised amount nice clothes make feel,IBM,0.1
2017-12-29,nhlcanes tonight friday hockey pres enter mcdonald gift card sure keep,IBM,0.0
2017-12-29,news almalki playing stove caused deadly york fire officials york reuters,IBM,0.1
2017-12-30,krassenstein boom reuters reported russian tankers supplied fuel north korea least separate times recent,IBM,0.1363636363636363
2017-12-30,dirty money change good,IBM,0.0
2018-07-11,bristowcolin elise delbecq hans petter dalen analytics data analytics london read,IBM,0.25
2018-07-11,techjournalist pegs mega breach average breach hits wjoushyofu,IBM,-0.15
2018-07-11,does every canadian know making cash hand fist stuttering failing fabulousl,IBM,0.0
2018-07-11,lands million deal australian government contract australian government,IBM,0.0
2018-07-12,launch world fastest supercomputer techcrunch,IBM,0.0
2018-07-13,ganeumann tech companies become engineers designers separated customer facing employees companies becom,IBM,0.0
2018-07-13,techknowledgeit study average data breach globally mega breaches reco,IBM,-0.075
2018-07-13,zoginstor nvme accelerated embraced multi cloud enabled flashsystem redefines storage thanks,IBM,0.2
2018-07-13,stop ibmresearch booth hello director watson david,IBM,0.0
2018-07-13,stellarlumens fairx mobius sdex stellarx stellarterm stellarport interstellar exchange fchain smartlands,IBM,0.0
2018-07-15,debater lawyer atticus finch clarence darrow debater what does company envision sgvaxnujdk,IBM,0.0
2018-07-15,valaafshar companies older than croatia nokia ericsson nintendo motorola sams,IBM,0.1666666666666666
2018-07-15,alerteye companies older than croatia nokia ericsson nintendo motorola samsun,IBM,0.1666666666666666
2018-07-15,examdump download system storage technical solutions please,IBM,0.0
2018-07-15,developerworks oscon tensorflow july opportunity hands tensorflow,IBM,0.0
2018-07-15,twistopherrobin aesthetics circuitry diagram logic chip corresponding microchip computer generated plot paper,IBM,0.0
2018-07-15,assessment websphere solution design examdump download please,IBM,0.0
2018-07-16,please download examdump enterprise storage technical support,IBM,0.0
2018-07-16,cognos analytics author examdump download please,IBM,0.0
2018-07-16,ibmmea pursuit greatness wimbledon uses cloud constantly innovate provide fans players unique experien,IBM,0.1875
2018-07-17,kiffmeister partnering stronghold anchor which rails stellar blockchain,IBM,0.25
2018-07-17,celeritylimited ponemon institute reveal findings artificial intelligence cybersecurity study agvqjappew,IBM,-0.3
2018-07-17,though familiar details article doesn make look good really trying,IBM,0.00625
2018-07-17,helping launch stable cryptocurrency insured fdic marketing,IBM,0.0
2018-07-17,blockchainbook blockchainrevolution launches free blockchain program students india,IBM,0.4
2018-07-17,cointelegraph backs project dollar pegged stablecoin uses stellar network begins testing,IBM,0.1931818181818181
2018-07-17,what smartcontracts blockchain blockchain blog,IBM,0.0
2018-07-17,stellar preparing launch venture backed stronghold cryptocurrency,IBM,0.25
2018-07-17,qradar incident forensics qradar siem allow remote attacker bypass,IBM,-0.1
2018-07-17,partners stronghold digital stable coin,IBM,0.0681818181818181
2018-07-17,bitcoinmagazine stronghold collaborate launch fdic insured stablecoin stellar cryptocurrencyne,IBM,0.25
2018-07-17,building first universal quantum computers business science,IBM,0.125
2018-07-17,fortunemagazine working crypto dollar stablecoin,IBM,0.0
2018-07-17,domainmondo earnings live webcast july technology,IBM,0.1363636363636363
2018-07-17,backs dollar pegged stablecoin runs stellar network,IBM,0.1931818181818181
2018-07-18,cointelegraph backs project dollar pegged stablecoin uses stellar network begins testing,IBM,0.1931818181818181
2018-07-19,gets boost businesses tops estimates,IBM,0.1363636363636363
2018-07-19,lockheed martin join council work automation technology,IBM,0.0
2018-07-19,making biggest moves premarket qcom ebay,IBM,0.5
2018-07-19,making biggest moves premarket qcom ebay,IBM,0.5
2018-07-19,thinkpad windows installed rare criwdukqwi ebay,IBM,0.0
2018-07-19,jimcramer hyperledger blockchain easy modular distributed framework future cloud,IBM,0.3083333333333333
2018-07-19,patent trial groupon casts shaking tech companies,IBM,-0.1402777777777777
2018-07-20,historyinmoment console,IBM,0.0
2018-07-21,power systems scale technical sales skills examdump download please,IBM,0.0
2018-07-21,historylvrsclub hard drive,IBM,-0.2916666666666667
2018-07-21,cointelegraph andreessen horowitz peter thiel list stable coins keeps growing,IBM,0.0
2018-07-21,ibmstorage accelerate business execution increase reduce costs flashsystem learn,IBM,0.1363636363636363
2018-07-21,confirms adoption stellar rise affect coin,IBM,0.25
2018-07-21,know story behind ring trustchain built using blockchain helping ensure diamonds,IBM,-0.4
2018-07-21,zoginstor announces flashsystem than nvme beats pure storage latency,IBM,0.5
2018-07-21,service cloud transforming customer experience power salesforce partnership work,IBM,0.0
2018-07-22,confirms adoption stellar rise affect coin,IBM,0.25
2018-07-22,give credit really becoming industry front runner tech role model blockchai,IBM,0.0
2018-07-22,magnus collective considered first artificial intelligence analysts think fact dlltgpjojo,IBM,-0.175
2018-07-22,ibmwatson icymi introducing fellows class these brilliant individuals contributed achievements breakthroug,IBM,0.0
2018-07-22,charlesmilander mediaocean announce blockchain consortium tackle what wrong tech yuahwmekxr,IBM,-0.5
2018-07-22,nostalnerd foone lazygamereviews force little tiny screen,IBM,-0.09375
2018-07-22,rallyqt making noise since coinbase exploring says list tokens backed stablecoin project,IBM,-0.1
2018-07-23,rallyqt making noise since coinbase exploring says list tokens backed stablecoin project,IBM,-0.1
2018-07-23,stpiindia thinks blockchains help reduce carbon emissions,IBM,0.0
2018-07-23,greatwestcloud come learn about features capabilities integrated analytics system sneak peeks upcoming features,IBM,0.1363636363636363
2018-07-24,mobilematt bayerus spot search nazis bill gates statements certain conferences,IBM,0.0
2018-07-24,recognition commitment support lgbt listed hired inclusive organisa,IBM,0.5
2018-07-24,analyzed characters books shortlisted booker story suneeratweets occupations,IBM,0.0
2018-07-24,tested cleaned best offer trgihmmiab,IBM,1.0
2018-07-24,lands watson contracts spain italy netherlands,IBM,0.0
2018-07-24,server storage iomemory used offers,IBM,0.1
2018-07-24,apache patch critical cloud vulnerability,IBM,0.0
2018-07-24,bitcoin excitement crypto exchange officially launches stablecoin,IBM,0.0
2018-07-25,reservation bandh message clear india cannot built companies general motors,IBM,0.075
2018-07-25,ibmbenelux lands watson contracts spain italy netherlands,IBM,0.0
2018-07-25,close partnership presale live bonus tokens,IBM,0.2
2018-07-25,calvinhp story hired someone europython birmingham years,IBM,0.0
2018-07-25,embedded billion transistors built workloads meet processors,IBM,0.0
2018-07-25,evelinedeb hybrid data management platform allows leverage available data matter type source structure,IBM,0.4
2018-07-25,integration solution development hhaeyepgvo examdump download please,IBM,0.0
2018-07-25,ibmstorage spectrum storage suite allows customers flexibility manage external storage solutions provides,IBM,0.0
2018-07-25,rebeccadrobbins product piece doctor jupiter hospital florida told executives according docum,IBM,0.0
2018-07-25,watsoniot center munich germany home garage brings design thinking cloud blockchain capabili,IBM,-0.1
2018-07-25,software developer software developer corporation research triangle park architecture design,IBM,0.6
2018-07-25,polleyg nebev based openwhisk cloud functions something,IBM,0.0
2018-07-25,ibmsecurity watson unified endpoint management manage endpoints everything between,IBM,0.0
2018-07-25,dead talk replacing doctors hype babylon little substance,IBM,-0.2
2018-07-26,valdiskrebs watson reportedly recommended cancer treatments were unsafe incorrect documents state instead,IBM,0.0
2018-07-26,ibmwatson learn exponentially become disruptor instead disrupted ginni rometty wednesdaywisdo,IBM,0.0
2018-07-26,deals keep coming vcjbrgjxgf,IBM,0.0
2018-07-26,katecrawford whoa watson recommending unsafe incorrect cancer treatments according internal document,IBM,0.0
2018-07-26,quion dutch third party provider mortgages consumer credit used cognos analytics steer,IBM,0.0
2018-07-26,rishikedia trying resolve complex problems looking help starting inception implementation code patterns,IBM,-0.15
2018-07-26,only great company these various women lists attest father great,IBM,0.3472727272727273
2018-07-26,installed accuracy first,IBM,0.25
2018-07-26,shed valuation than entire what wall street analysts euwwrlgtzh,IBM,0.0
2018-07-26,mountain view principle scientist baidu tech lead manager jdczaxexwu,IBM,0.0
2018-07-27,please download examdump programming enterprise,IBM,0.0
2018-07-27,spectrum protect implementation examdump download please,IBM,0.0
2018-07-27,product piece doctor jupiter hospital florida told executives according,IBM,0.0
2018-07-28,developing lotus domino applications advanced xpage design examdump download please,IBM,0.4
2018-07-28,wins million groupon internet patent fight wins million groupon internet,IBM,0.3
2018-07-28,examdump download smartcloud control desk asset management implementation please,IBM,0.0
