Date,Tweet,Ticker,Score
2020-04-09,investorideas ideas aieye episode nyse services selected prysmian infrastructure acceleration inte,IBM,0.0767090544104576
2020-04-09,investorideas episode nyse services selected prysmian infrastructure acceleration nasdaqgs,IBM,0.0398813337087631
2020-04-09,elliottforecast long term opportunity horizon elliottwave,IBM,0.8494217395782471
2020-04-09,showing swings peak another complete swings reach extreme area time peak elliottwave,IBM,-1.0890065431594849
2020-04-09,long term opportunity horizon elliottwave,IBM,0.935149908065796
2020-04-11,first informative pivot points close pivot point download free tradingview stockstowatch,IBM,0.8718687295913696
2020-04-13,target analysts sanford bernstein dquohbsjxb,IBM,-0.9845521450042723
2020-04-13,close reaching extreme area peak elliottwave,IBM,-1.0878229141235352
2020-04-13,long term opportunity horizon youtube watch video about possible long term opportunity subscribe youtube channel access latest youtube videos elliottwave,IBM,0.8539268970489502
2020-04-13,release earnings monday,IBM,-0.0017370581626892
2020-04-14,lowered akpbjwdaei,IBM,-1.0171787738800049
2020-04-14,first informative pivot points close pivot point download free tradingview stockstowatch,IBM,0.8490899801254272
2020-04-14,long term opportunity horizon youtube watch video subscribe youtube channel access latest youtube vidoes free elliottwave indices,IBM,0.8747419118881226
2020-04-14,long term opportunity horizon elliottwave,IBM,0.935149908065796
2020-04-15,firing white workers busy hiring cheap slaves india doing reverse colonialism,IBM,0.3026345074176788
2020-04-15,first informative pivot points close pivot point download free tradingview stockstowatch,IBM,0.8578169345855713
2020-04-15,stifel nicolaus cuts target,IBM,-0.8498871326446533
2020-04-15,multiple dividend years dividend future dividend aristocrat focus cloud good,IBM,0.8121227025985718
2020-04-15,lowered,IBM,-1.0115433931350708
2020-04-16,long term opportunity horizon elliottwave indices another seen blue good opportunity long term,IBM,0.9712845087051392
2020-04-16,dropped nearly themotleyfool,IBM,-0.9944506883621216
2020-04-17,looks wants make another complete sequence great opportunity long term reaching extreme areas peaks blue elliottwave indices,IBM,0.972802758216858
2020-04-17,capital lowers target,IBM,-0.517892599105835
2020-04-18,expected earnings,IBM,0.5757957696914673
2020-04-19,currently earnings least rometty destroyer long,IBM,0.5257335901260376
2020-04-19,tradesmartstock possible start push towards channel breakout possi,IBM,0.9562861919403076
2020-04-19,americanbanking given consensus recommendation hold brokerages,IBM,0.0349176973104476
2020-04-19,given consensus recommendation hold brokerages,IBM,0.0541050471365451
2020-04-19,earnings preview redhat revenue growth lagged years,IBM,-0.254951000213623
2020-04-19,options flow grid update optionstrading ibmcloud ibmsecurity technology services cloudcomputing cognitivecomputing blockchain stockmarket stockstowatch stockstotrade stocktrading,IBM,0.7717148065567017
2020-04-19,reports earnings check unusual options activities earnings history options money flow grid score chart ratings financial numbers stockmarket stockstowatch ibmcloud technology ycctcszzud,IBM,-0.8554184436798096
2020-04-20,revenue drops quarter rometty earnings,IBM,-1.060543656349182
2020-04-20,drivingtheday djia nasdaq composite crash earnings live webcast,IBM,-1.00840961933136
2020-04-20,beats estimate sales miss estimate withdraws guidance earnings earningsreports earningsseason stockmarket stockstowatch stockstotrade stocktrading ycctcszzud,IBM,0.3915226459503174
2020-04-20,tradesmartstock weekend close breakout wallstreet options nyse nasdaq stockmarket,IBM,0.9474049806594848
2020-04-21,target analysts wedbush,IBM,-0.9912914037704468
2020-04-21,given target morgan stanley,IBM,0.2001449316740036
2020-04-21,looking broke above lookin round bottom tradeit,IBM,-1.0433871746063232
2020-04-21,given target credit suisse group analysts,IBM,0.3118615746498108
2020-04-21,target lowered group,IBM,-1.0018713474273682
2020-04-21,moving armrreport whiteboard looking good entry stockmarket,IBM,0.9749019145965576
2020-04-21,dividend risky challenges ahead finance,IBM,-0.9752331972122192
2020-04-21,rating reiterated bank america,IBM,0.3843864798545837
2020-04-21,issues earnings results,IBM,0.084740936756134
2020-04-21,international business machines corp mixed results decelerating revenue growth cloud cognitive equity,IBM,-0.4507504105567932
2020-04-22,jmllubber cnbc scottwapnercnbc doing buybacks leader cycle money,IBM,0.6966304779052734
2020-04-22,options flow grid update optionstrading stockmarket stockstowatch stockstotrade stocktrading finance,IBM,0.913710117340088
2020-04-22,ready covid world business economy,IBM,0.6383408308029175
2020-04-22,coronavirus pandemic impacts themotleyfool,IBM,-0.1559643149375915
2020-04-22,coronavirus pandemic impacts themotleyfool read cloud,IBM,0.0046480186283588
2020-04-22,coronavirus pandemic impacts themotleyfool read cloud cloudcomputing computers computing datascience future intranet,IBM,-0.0036085620522499
2020-04-22,long term opportunity horizon reach extreme area another elliottwave,IBM,-1.0204812288284302
2020-04-22,askslim drops mixed earnings withdrawal forecasts analysts remain cautious news software slump,IBM,-1.0785530805587769
2020-04-23,results were better worse than seemed surface themotleyfool,IBM,0.0457044020295143
2020-04-23,options flow grid update optionstrading stockmarket stockstowatch stockstotrade stocktrading finance,IBM,0.9022427797317504
2020-04-23,earnings estimate issued wedbush,IBM,0.0696319192647934
2020-04-23,analysts recent ratings changes,IBM,0.146037757396698
2020-04-23,seekingalpha safe dividend turmoil economy finance,IBM,0.947097659111023
2020-04-23,safe dividend turmoil economy finance,IBM,0.9478589296340942
2020-04-24,coronavirus pandemic impacts themotleyfool read cloud cloudcomputing computers computing datascience future intranet,IBM,-0.0042288452386856
2020-04-26,looks swings lower peak another make swings take extreme area peak offer good long term opportunity elliottwave indices,IBM,0.8828626871109009
2020-04-27,options flow grid update optionstrading stockmarket stockstowatch stockstotrade stocktrading finance,IBM,0.9112138748168944
2020-04-27,liking puts around,IBM,0.4971835315227508
2020-04-27,does continue being gift keeps giving thinking overpriced worthy taking peek,IBM,0.3766475319862366
2020-04-28,stand corrected raised dividend consecutive date away enough sell load cheaper,IBM,-0.9590805768966676
2020-04-28,thahbigbadwolf waiting dividend waiting course gift keep giving,IBM,-0.794158935546875
2020-04-28,waiting dividend waiting course gift keep giving loaded puts check specifically debt equity operating cash flow name couple,IBM,-0.6089096069335938
2020-04-29,increases dividend gjgesxxeey,IBM,0.8936797380447388
2020-04-29,becomes dividend aristocrat increasing dividend consecutive themotleyfool,IBM,0.81493079662323
2020-05-03,stockmarket internationalbusinessmachines reported looking into results previous quarter sales fell billions dropped,IBM,-0.871035099029541
2020-05-04,lotto calls calls,IBM,-0.1090783327817916
2020-05-05,feel free fill lower after hours play stockmarket,IBM,0.5049777030944824
2020-05-05,about time tell round stockmarket,IBM,-0.5383526086807251
2020-05-05,stockmarket gffqjoggvc fuxaszpwpt,IBM,0.5345371961593628
2020-05-05,good mornings stockmarket,IBM,0.9643975496292114
2020-05-05,dividend hence lotto call options stockmarket xuqolezbni,IBM,0.1566163897514343
2020-05-06,rated luckily already profited nicely prior less than ideal decision making stockmarket,IBM,0.8170756101608276
2020-05-06,dammit gift keeps giving stockmarket,IBM,-0.3500047624111175
2020-05-07,investorideas ideas aieye episode nyse collaborating samsung imda singapore industry,IBM,-0.0235685445368289
2020-05-07,time lower filled sold gold stockmarket,IBM,-0.9089082479476928
2020-05-07,investorideas episode nyse collaborating samsung imda singapore industry trial,IBM,-0.0101533196866512
2020-05-08,investorideas episode nyse collaborating samsung imda singapore industry trial,IBM,-0.0082884170114994
2020-05-08,investorideas ideas aieye episode nyse collaborating samsung imda singapore industry,IBM,-0.0190906077623367
2020-05-09,elliottforecast long term opportunity horizon instrument providi,IBM,0.7140847444534302
2020-05-28,overlooking roth themotleyfool,IBM,-0.7480218410491943
2020-05-29,poor technical analysis score score breakdown categories candle score neutral moving average score weak momentum score weak stockmarket,IBM,-1.0516366958618164
2020-05-30,poor technical analysis score score breakdown categories candle score neutral moving average score weak momentum score weak stockmarket,IBM,-1.0533462762832642
2020-06-01,good technical analysis score score breakdown categories candle score neutral moving average score excellent momentum score excellent stockmarket,IBM,0.9610333442687988
2020-06-01,options maxpain chart open interest chart update optionstrading optionsflow stockmarket,IBM,0.3841461539268493
2020-06-02,excellent technical analysis score score breakdown categories candle score excellent moving average score good momentum score good stockmarket,IBM,0.9609345197677612
2020-06-02,excellent technical analysis score score breakdown categories candle score excellent moving average score good momentum score good stockmarket wowqnupbik,IBM,0.9609345197677612
2020-06-05,excellent technical analysis score score breakdown categories candle score good moving average score excellent momentum score excellent stockmarket,IBM,0.9611340761184692
2020-06-05,elliottforecast instrument gather ceiling move about pullbac,IBM,-0.1931652426719665
2020-06-08,receives average rating hold analysts gdzbgkllfm,IBM,-0.0182996913790702
2020-06-09,neutral fundamental analysis score score check various indicators value score chart roic gross margin ebitda stockmarket,IBM,0.4278200566768646
2020-06-11,elliottforecast instrument holding indices mentioning members article explaining,IBM,0.1163806915283203
2020-06-15,neutral technical analysis score score breakdown categories candle score excellent moving average score poor momentum score good stockmarket,IBM,0.8657947778701782
2020-06-15,huge variation international business machines,IBM,0.6596102714538574
2020-06-16,huge variation international business machines,IBM,0.6886719465255737
2020-06-16,huge variation international business machines,IBM,0.6868265867233276
2020-06-16,huge variation international business machines,IBM,0.6675515174865723
2020-06-16,huge variation international business machines,IBM,0.6878228187561035
2020-06-16,huge variation international business machines,IBM,0.7005826234817505
2020-06-16,huge variation international business machines,IBM,0.6947728395462036
2020-06-16,huge variation international business machines,IBM,0.6768158674240112
2020-06-16,huge variation international business machines,IBM,0.6872073411941528
2020-06-16,huge variation international business machines,IBM,0.7201632261276245
2020-06-17,neutral technical analysis score score breakdown categories candle score neutral moving average score poor momentum score good stockmarket,IBM,-0.1465550363063812
2020-06-20,starting look heavy hold mini pattern building look bounce trend line value play interested shorting breaks below channel stay patient,IBM,0.7490416765213013
2020-06-21,iliketotweettou debt analysts haven updated earnings estimates days negative business signals,IBM,-1.023876667022705
2020-06-22,seekingalpha underwhelming turnaround persists gets worse oeeykqelgz stockmarket,IBM,-1.0719448328018188
2020-06-22,underwhelming turnaround persists gets worse oeeykqelgz stockmarket,IBM,-1.0622395277023315
2020-06-22,askslim level members updated levels idea updated analysis,IBM,0.1250220686197281
2020-06-22,askslim level members updated levels idea updated analysis chart grid archive page slimulator chart updated,IBM,0.6737041473388672
2020-06-23,options maxpain chart open interest chart update optionstrading optionsflow optionstrade optiontrading stockmarket invest,IBM,0.4766495823860168
2020-06-25,options flow grid update optionstrading optionsflow stockmarket informationtechnology technology,IBM,0.7094910144805908
2020-06-25,options flow grid update optionstrading optionsflow stockmarket informationtechnology technology mtyswzfjue,IBM,0.7328329086303711
2020-06-25,company profile fundamental technical analysis score update score score stockmarket invest,IBM,0.0509841926395893
2020-06-25,options flow grid update optionstrading optionsflow stockmarket informationtechnology technology dvrmsgkdhw,IBM,-0.1601621806621551
2020-06-25,options maxpain chart open interest chart update optionstrading optionsflow optionstrade optiontrading stockmarket invest,IBM,0.383989006280899
2020-06-25,chart update value areas support bounce drops options charts stockstotrade fintwit,IBM,0.7854588031768799
2020-06-26,options flow grid update optionstrading optionsflow stockmarket informationtechnology technology iwzsymrtya qkulloctfy,IBM,0.8866313695907593
2020-06-27,poor technical analysis score score breakdown categories candle score neutral moving average score poor momentum score neutral stockmarket,IBM,-1.045695424079895
2020-06-29,click link view chart seeing retesting pattern either reject break lower into support zones yellow break back into pattern continuation higher options fintwit,IBM,-0.9879783391952516
2020-06-29,mitickwatcher international business machines poor technical analysis score score breakdown categories candl,IBM,-1.053144097328186
2020-06-29,international business machines poor technical analysis score score breakdown categories candle score neutral moving average score poor momentum score poor stockmarket,IBM,-1.0368586778640747
2020-06-29,international business machines poor technical analysis score score breakdown categories candle score neutral moving average score poor momentum score poor stockmarket,IBM,-1.0368586778640747
2020-06-30,international business machines poor technical analysis score score breakdown categories candle score neutral moving average score weak momentum score weak stockmarket vcvegnzbke,IBM,-1.036526083946228
2020-06-30,detected noticeable fall zeitgeist international business machines corporation hpqtjakzqk visit dataswarm information nyse dataswarm,IBM,-1.0113425254821775
2020-07-03,options power options maxpain chart open interest chart update optionstrading optionsflow stockmarket,IBM,0.3532110750675201
2020-07-04,elliottforecast long term opportunity horizon instrument sayin,IBM,0.7547187805175781
2020-07-06,options maxpain chart open interest chart update optionstrading optionsflow optionstrade optiontrading stockmarket invest,IBM,0.4766495823860168
2020-07-06,neutral technical analysis score score breakdown categories candle score excellent moving average score weak momentum score neutral stockmarket,IBM,0.7766076326370239
2020-07-07,multiple dividend years dividend future dividend aristocrat focus cloud good,IBM,0.8466993570327759
2020-07-07,neutral fundamental analysis score score check various indicators value score chart roic gross margin ebitda stockmarket,IBM,0.3718534409999847
2020-07-07,options flow grid update optionstrading optionsflow stockmarket informationtechnology technology,IBM,0.1307692527770996
2020-07-07,weak technical analysis score score breakdown categories candle score neutral moving average score weak momentum score neutral stockmarket,IBM,-1.048810601234436
2020-07-08,options maxpain chart open interest chart update optionstrading optionsflow optionstrade optiontrading stockmarket invest,IBM,0.383989006280899
2020-07-08,options flow grid update optionstrading optionsflow stockmarket informationtechnology technology ddbyiifulw,IBM,0.2604193687438965
2020-07-10,international business machines poor technical analysis score score breakdown categories candle score poor moving average score poor momentum score poor stockmarket,IBM,-1.035330891609192
2020-07-14,options flow grid update optionstrading optionsflow stockmarket informationtechnology technology,IBM,0.7352088689804077
2020-07-15,neutral fundamental analysis score score check various indicators value score chart roic gross margin ebitda stockmarket elnmbsdkwi,IBM,0.2662898600101471
2020-07-15,neutral fundamental analysis score score check various indicators value score chart roic gross margin ebitda stockmarket,IBM,0.3718534409999847
2017-01-31,want look morals care about stirring hello,IBM,0.0
2017-02-28,syrian militias support fight plan phase reuters,IBM,0.0
2017-02-28,sony welcome comfort zone first episode skottmusic performs single wolf totally,IBM,0.0
2017-03-31,cptharmless ryanair cptharmless sorry hear legally claim compensation,IBM,1.0
2017-03-31,samsungmobileus tmobile finish ordering sexy beautiful midnightblack thank sammy bfehuuempt,IBM,0.0
2017-04-28,what president trump thinks about first days office reuters,IBM,0.0
2017-04-29,versatility starts tiguan almost nothing bounds,IBM,0.0
2017-05-31,reuters philippines says islamists keep long fight prisoners looted guns,IBM,0.0
2017-06-30,libertymaga jamesokeefeiii newday realdonaldtrump kellyannepolls never watch jeff zucker,IBM,0.0
2017-07-01,bouska every retweet gets donate glaad help reach retweets,IBM,0.0
2017-07-31,half gallons szechuansauce stuck retweet respond bring them present before,IBM,0.0
2017-07-31,reuters watch venezuelan president maduro leader dictator white house,IBM,0.75
2017-08-31,queen victoria watermarked scans ebay,IBM,0.0
2017-08-31,reuters reality trump risk sinks tokyo tries keep ties tight,IBM,0.0
2017-08-31,fxpress roundtable hosted idcap driving data business growth jakar,IBM,0.0
2017-09-01,versastack cloudcenter means deploy application anywhere learn webcast,IBM,0.0
2017-09-29,portlanddesign easyjet launching wifi autumn expect competitors suit easymoney traveltech,IBM,0.2
2017-09-29,samsung leading race smartphones shipment samsungmobile leaks ylfqarjupj,IBM,0.0
2017-09-29,thank leadership community corporate philanthropy giving zwrxhmhghu,IBM,0.0
2017-09-29,help humans satya nadella tells technology discussion about book hitrefresh,IBM,0.0
2017-09-29,check dram poison charlotte armstrong crest prize winning vintage ebay,IBM,0.0
2017-09-30,killing skype business online topped collaboration news facebook zoho news okwqepohza,IBM,0.0
2017-10-31,reuters sacked catalan leader puigdemont says accepts snap election seeking asylum bpfxtmesuf,IBM,0.0
2017-10-31,kudos expanding paidleave policy parents offering equal lengths leave,IBM,0.0454545454545454
2017-10-31,starwars explore real life robotic limbs helping people episode scienceandstarwars,IBM,-0.1
2017-11-01,check sale retail emporio armani underwear stripe boxer brief emporioarmani ebay,IBM,0.0
2017-11-30,james holiday wish came true secondary school kenya wishesdelivered,IBM,0.0
2017-11-30,good continuing invest platform photos androi,IBM,0.0
2017-11-30,fantastic hear expedia drove business success analytics awscloud tableau empowerement self,IBM,0.2
2017-11-30,check volkswagen type lost series diecast model ohfsnmrscb ebay,IBM,0.0
2017-11-30,arinbhowmick proud designers giving back social good design ibmdesign,IBM,0.3833333333333333
2017-12-01,december learn soti samsung knox raising mobility management register,IBM,0.0
2017-12-01,polymer commemorative australian dollars money free postage ebay,IBM,0.0
2017-12-29,short term disaster doesn make middle class permanent ikwurxpvnj,IBM,0.0
2017-12-29,tesco credit well done tesco team immensely efficient dealing,IBM,0.5
2018-10-01,globalsemi sumit gupta sumitgup machine learning deep learning machine learning driving creation,IBM,0.0
2018-10-01,people often what does what conanobrien thinks,IBM,0.0
2018-10-01,ibmwatson tomfriedman nytimes ginni rometty says jobs augmented read,IBM,0.0
2018-10-18,first joined ibmcloud team arrived clothes back motorcycle runs thunderdome,IBM,0.125
2018-10-18,antgrasso epiphany collaboration hosting open banking event join succeed open banking october,IBM,0.0
2018-10-19,ibmpowersystems exciting news data scientists nvidia collaborations advance open source acceleration,IBM,0.375
2018-10-20,callforcode congratulations internal callforcode finalist mergency control room continue pushing technology,IBM,0.0
2018-10-21,binance room consensys hyperledger bancor unicef speaking october,IBM,0.0
2018-10-21,lights camera stacks asked delivered never before seen footage inside ibmcloud data center,IBM,0.0
2018-10-21,cloud helps airlines create easier check improve time departures avoid turbulence smart work,IBM,0.0
2018-10-22,kennedydee stopthetraffik westernunion barclaysuk asklloydsbank inspiring news wonderful,IBM,0.75
2018-10-22,change jobs industries professions ginni rometty perspectives managing unprecedented,IBM,0.6
2018-10-22,congratulate chro diane gherson named hrexecmag executive learn diane helping drive innovati,IBM,0.0
2018-10-22,charlottegreant focus focus value create yousef hashimi palacios txcapi,IBM,0.0
2018-10-23,stop booth ground floor ibminfluencer sibos ibmfintech ibmfintech ibmblockchai,IBM,0.0
2018-10-23,department computer science engineering university organizing seminar internet,IBM,0.0
2018-10-23,gotgreatcertified congratulations great place work certified kudos,IBM,1.0
2018-10-23,icymi introduced first kind capabilities ibmcloud,IBM,0.5
2018-10-24,successful projects continued interest adoption industries proving blockchain,IBM,0.375
2018-10-24,icymi introduced first kind capabilities ibmcloud,IBM,0.5
2018-10-24,demonstrating loopback cloudnativejs development methods horse race game,IBM,-0.4
2018-10-24,meet force command cyber tactical operations center industry first security operations center wheels find,IBM,0.0166666666666666
2018-10-24,sarbjeetjohal session tmanspeaks pxikgewnig,IBM,0.0
2018-10-25,rwlord thanks chelseaclinton inspiring work cgiu honor callforcode team help,IBM,0.4125
2018-10-27,atlascorps awesome honored partner teachforamerica thank team members program,IBM,1.0
2018-10-28,inside brain infographic strategy innovation disruption marketing leadership tamar,IBM,0.0
2018-10-28,what cyber threathunting insiderthreat cyberthreat dataprotection databreach ransomware malware cybe,IBM,0.0
2018-10-28,acquire redhat world leading provider open source technology becoming hybrid cloud provider,IBM,0.225
2018-10-29,thecube know chris wright kernelcdub redhat redhat,IBM,0.0
2018-10-29,colleagues neighbor lets build great things together collaboration,IBM,0.4681818181818182
2018-10-29,ubujay redhat suddenly devs devops specialists security consultansts sres individual contrubutors turned pessimistic,IBM,0.0
2018-10-29,acquire redhat world leading provider open source technology becoming hybrid cloud provider,IBM,0.225
2018-10-29,bobehayes forget ibmwatson redhat acquisition thing saves,IBM,0.0
2018-10-29,sure forced interesting move purchase redhat what,IBM,0.0589285714285714
2018-10-29,thecube know ashesh badani cloud openshift asheshbadani redhat redhat,IBM,0.0
2018-10-29,prof yaron wolfsthal head ccoe huge cybersecurity talent pool israel army cooperation,IBM,0.4000000000000001
2018-10-29,trump sons hunt these beautiful animals heartless what kill rhino elepha,IBM,0.85
2018-10-29,infrastructure moving managed services cloud real inertia space,IBM,0.0
2018-10-29,iamdvr redhat jwhitehurst easily develop entirely linux dotnet,IBM,0.2166666666666666
2018-10-29,jckgld redhat about linux about having competitive stance against dell vmware especially hybridcl,IBM,0.0
2018-10-29,mariofusco redhat oracles ibms blue companies food employees former employee,IBM,0.0
2018-10-30,bryanlunduke interesting after announcement redhat being purchased shot through roof,IBM,0.0
2018-10-30,redhat acquisition maintain strong legacy opensource innovation scale broad portfoli,IBM,0.1239583333333333
2018-10-30,acquire redhat world leading provider open source technology becoming hybrid cloud provider,IBM,0.225
2018-10-30,requestnetwork attending consensys hyperledger bancor unicef speak,IBM,0.5
2018-10-30,fintanr excellent analysis redhat deal clients subscription required gartner invest analyst insight,IBM,1.0
2018-10-30,someone know lives neworleans works hosting open,IBM,0.0
2018-10-30,karlexceed redhat considering giant deal consider deal,IBM,-0.05
2018-09-01,smart work layoff americans hire foreigners,IBM,0.2142857142857142
2018-09-01,farmers satellite imagery weather data watson help monitor soil moisture levels smart work,IBM,0.0
2018-09-02,ibmwatson intelligently distributes renewable energy network batteries helping balance grid qavnapdlwq,IBM,0.8
2018-09-10,justmeans jencrozier long focused leveraging talent technology social good discuss,IBM,0.0
2018-09-11,wingsplatform terrific news igtcrypto congrats partnership,IBM,0.0
2018-09-11,same technology means watson help engineers identify what defect train track sounds acoustic signatu,IBM,0.0
2018-09-02,ogilvy title bench client office clientwork adoftheday,IBM,0.0
2018-09-04,ibmsports data points across usopen integrates data flowing court create,IBM,0.0
2018-09-04,blockshipping know maerskline media attention blockchain collaboration,IBM,0.0
2018-09-04,salmonella coli listeria food recalls using blockchain,IBM,0.0
2018-09-05,ibmwatson nytimes ginni rometty quoted stating jobs augmented read,IBM,0.0
2018-09-05,siderabc great realities together sidera change rules game blockchain part incubation,IBM,0.8
2018-09-05,nytimes ginni rometty quoted stating jobs augmented,IBM,0.0
2018-09-06,ibmwatson nytimes ginni rometty quoted stating jobs augmented read,IBM,0.0
2018-09-06,boulder thanks ibmwatson ibmcloud being leader using technologies cloud,IBM,0.35
2018-09-06,stakes learning nothing company whose punchcard technology helped nazis search census data ethnicit,IBM,0.0
