Date,Tweet,Ticker,Score
2018-10-29,shomaristone shooting suspect gregory bush tried enter black church before killing police victims vickie,KR,-0.1666666666666666
2018-10-29,need help yall best phone service tmobile verizon metro,KR,0.1111111111111111
2018-10-29,mention article msnbc alabama mcdonald gunman killed armed injured,KR,-0.0119047619047619
2018-10-29,please help find stolen hours white series,KR,-0.3333333333333333
2018-10-29,mitchellcocaine shut conservatives make competitor getongab makes competitor,KR,0.8
2018-10-29,analyticsexo attention count only billboard charts korean charts target count korean char,KR,0.1
2018-10-29,xbox looking brighter future custom radiation king samsung qled custom xbox,KR,-0.0119047619047619
2018-10-29,mkraju mitch sides those send bombs shoot shoot synagogue only come,KR,0.0
2018-10-29,xbox looking brighter future custom radiation king samsung qled custom xbox,KR,0.2
2018-10-29,davidfrum mailbomb followed attacks synagogue shooting followed jeers globalists shooting,KR,0.5
2018-10-29,clevertitletk perpetrators murders mail bombs tree life massacre which happened,KR,0.0
2018-10-29,love back verizon family send discuss,KR,-0.0119047619047619
2018-10-29,reminder bought redhat lots conern open community culture fedora redhat cento,KR,-0.8
2018-10-29,nigmanoname benshapiro specific events serial bomber synagogue shooting shooting,KR,0.0
2018-10-29,baby ready ebygzhrewh,KR,-0.8
2018-10-29,foxbusiness after pittsburgh synagogue shooting banned godaddy medium suspended platforms deirdrebolt,KR,-0.8
2018-10-29,baby ready ebygzhrewh,KR,0.5
2018-10-29,balqissidiqia confirmed crashed lion passenger plane lost contact ground control,KR,-0.8
2018-10-30,before funeral friends maurice stallard victims shooting gathered,KR,0.0
2018-10-30,politikmasfina people shooting elderly women synagogue children school people send,KR,0.0
2018-10-30,mikeshinoda shinodacat throw shinodacat viewing party house pizza,KR,-0.8
2018-10-30,orrchris long keep grisly tally forget addition tree life shooting shootin,KR,-0.05
2018-10-30,mkbhd macbook back retina display slimmer bezels couple colors,KR,0.0
2018-10-30,louisville community came together mourn shooting victim maurice stallard porte,KR,-0.075
2018-10-30,shannonrwatts breaking wake mass shooting pittsburgh synagogue fedex ending program offers discounts,KR,-0.0318181818181818
2018-10-30,apos shooting being called hate crime critics,KR,-0.8
2018-10-30,zeddary white supremacist attack assassination attempts against presidents dozen,KR,0.0
2018-10-30,usatoday shooting black louisville hasn widely denounced hate crime people askin,KR,-0.3555555555555556
2018-10-30,shooting black louisville hasn widely denounced hate crime people,KR,-0.3555555555555556
2018-10-30,shop adidas originals yung sneakerbaas code needed tqarqjsnve,KR,-0.45
2018-10-30,amid calls hate crime charges killings prosecutors complicated,KR,-0.65
2018-10-31,free friday download november free friday chobani flip hint flavor greek yogurt owjqxdadrz,KR,0.2666666666666666
2017-01-31,retail hourly associate central division peru,KR,0.0
2017-01-31,owner food less ralphs hire nationwide orange county register,KR,-0.1666666666666666
2017-01-31,what does diversity look corp america hear ceos rodney mcmullen,KR,0.0
2017-01-31,president donald trump staff proposing eliminate national endowment arts federal,KR,0.0
2017-01-31,breaking roughly state department officials sign dissent memo critical trump immigration order reuters citing,KR,0.0
2017-01-31,mikepencevp reuters poll shows americans support trump immigration order while only disag,KR,0.0
2017-02-01,dcbigjohn finally catching news israeli worried moving embassy jerusalem idea,KR,0.0
2017-02-28,verizon taps cenx based optical network service assurance,KR,0.0
2017-02-28,shilobitch lmaooo make sure think twice time buying zebra meat thanks dvrdpsrqbc,KR,0.2333333333333333
2017-02-28,well kacie sure shit seen endangered zebra jackalope meat,KR,0.15
2017-03-31,kauspland know economy really little gouging maybe,KR,-0.2499999999999999
2017-03-31,blackrock believes pound,KR,-0.4
2017-03-31,halliejackson senate committee receptive flynn immunity request sources tell kasie kendilania,KR,0.0
2017-03-31,horacetwil totally respect privacy though helped kill protecting,KR,0.2875
2017-03-31,couple years maybe samsung galaxy early which always,KR,0.0909090909090909
2017-04-01,vintage style abalone shell silver overlay pendant jewelry,KR,0.0
2017-04-01,reneehooray stopped young about minute flowers gift card want good,KR,0.2666666666666666
2017-04-01,mcspocky dropped trump russia bombshell explains everything trumprussia resist,KR,0.0
2017-04-28,leadingnfl sports gave browns grade taking jabrill peppers what grade give pick,KR,0.0
2017-04-28,desmondvalenzi want thank wraps brought meaning life keep good work,KR,0.325
2017-04-28,bleacherreport hold back after armour adidas wouldn sign lonzo ball,KR,0.0
2017-05-31,fluidseven giveaway fluidseven fluidmods icrazzymods dnrcrewnetwork retweetdnr hyperrts,KR,-0.4
2017-05-31,technology changing grocery store shopping experience zwzuktlctr,KR,0.0
2017-05-31,israelifreedom unmasking revelation house panel issues subpoenas agencies cites obama officials,KR,0.0
2017-05-31,complete cloud architect training helps pass comptia mcse,KR,0.1555555555555556
2017-05-31,charged having pounds marijuana riverside chicago,KR,0.0
2017-06-30,pregnant woman runs suspected purse thief north carolina taken hospital jail,KR,0.0
2017-06-30,advertavenue sony xperia smartphone simply competition prize giveaway jviy,KR,0.0
2017-07-01,ajarwolf kids gift pokemon grass bulbasaur plush doll figure collectible ebay,KR,0.0
2017-07-31,simplysolly brighton relegated everyone confident,KR,-0.0166666666666666
2017-07-31,oficialfazeclan giving everyone fazeup,KR,0.1363636363636363
2017-07-31,entered giveaway chance samsung galaxy edge waterproof case meritc meritcase giveaway,KR,-0.1277777777777778
2017-07-31,customers please carts back scatter them everywhere someone,KR,0.0
2017-07-31,black friday sale thingsthatlastedlongerthanthemooch,KR,-0.1277777777777778
2017-07-31,combat messaging machine democrats msnbc espn,KR,-0.1277777777777778
2017-07-31,tmtrickk giveaway enter tmtrickk friend extra chance,KR,0.0
2017-07-31,peeps seen ebay harvard sorry directory erroneously scaramucci dead,KR,-0.1277777777777778
2017-08-01,wearing pajamas buying cream congratulations caught middle crisis,KR,0.0
2017-08-31,davisjcook nigerian genuinely easiest process through fast friendly efficient,KR,0.0
2017-08-31,contributes million harvey houston disaster fund behind texas,KR,0.0
2017-08-31,cortana open alexa first kind collaboration,KR,0.0
2017-09-01,mentioned printing nice copy saving recommend premium presentation paper double sided matte,KR,0.0
2017-09-01,concept crystal mixer because clear lots looks common drinks,KR,0.0
2017-09-01,fatkiddeals steal office works code checkout,KR,0.0
2017-09-01,thehill becomes first major tech company urging trump keep protections dreamers,KR,0.0
2017-09-29,free trident ralphs fred meyer papa cents,KR,0.4
2017-09-29,juventusfcen allianz stadium time pitch fifafriday easportsfifa,KR,0.875
2017-09-29,trump puerto rico response island surrounded water water ocean water,KR,0.4000000000000001
2017-09-30,gateway touchscreen webcam allinone deals,KR,1.0
2017-10-31,what deal save mega sale full inclusion list heart,KR,0.5
2017-10-31,record profit higher global spending reuters buicjkywes,KR,0.0
2017-10-31,latest houston click apply meat seafood produce hourly associate labor hiring,KR,0.5
2017-11-01,scottpresler radical islamic terrorist infiltrated diversity program lottery came murder extreme vetti,KR,0.1
2017-11-30,lobster found logo tattoo fuels fears ocean litter anyway guess,KR,0.0583333333333333
2017-11-30,clusterstock sales slump says sees strong holiday season,KR,0.4333333333333333
2017-11-30,queue live adidas adidas yeezy boost,KR,0.0
2017-12-29,opened asos delivery space weeks realised amount nice clothes make feel,KR,0.0
2017-12-29,evankirstel unveils drone capable landing aircraft carrier navy competition heats drones,KR,0.0
2017-12-29,nissan altima take look,KR,0.0
2017-12-29,belugasolar earth project democratize access climate change data cleantechnica belugasolar,KR,0.0
2017-12-29,nistikconcours winner screen notif chez nistikconcou,KR,0.0
2017-12-30,agowa customers checked bill lately believe being charged service protection plan,KR,0.0
2018-07-11,siezure parking drive doctor,KR,0.0
2018-07-11,lucky britney spears came before made myself look fool,KR,0.3333333333333333
2018-07-11,msannettemc grocery store found food lion know baking,KR,0.0
2018-07-13,pbalakrishnarao piloting autonomous food delivery homes iiot tech news automation futureofwork innovati,KR,0.0
2018-07-13,aprilfrvr selling sunflower bouquets remember only takes make,KR,0.0
2018-07-13,livefeedlville cardinal stadium field cardinal stadium field proving point,KR,0.0
2018-07-13,cincinnatizoo love show batman smart adorable house cheetah encounter,KR,0.4464285714285714
2018-07-14,aprilfrvr selling sunflower bouquets remember only takes make,KR,0.0
2018-07-14,krogercripples blatantly allows customers hurt stores,KR,-0.5
2018-07-14,thecjpearson realdonaldtrump wear suit probably walked,KR,0.2857142857142857
2018-07-15,grocery central ohio rivals gaining ground,KR,0.0
2018-07-15,chesterthrash krogercripples blatantly allows customers hurt stores renders feyozraplu,KR,-0.5
2018-07-15,free samples western grillers signature rufe snow keller come,KR,0.2
2018-07-15,aprilfrvr selling sunflower bouquets remember only takes make,KR,0.0
2018-07-15,secslowsmoked loudest stadiums round field vanderbilt stadium kentuckywildcats anchordown,KR,-0.15
2018-07-15,amylaceyrva swellicecream krogercripples blatantly allows customers hurt stores,KR,-0.5
2018-07-15,hiring click apply peak time teller clarksville fridays saturdays sundays holiday,KR,0.0
2018-07-16,secslowsmoked loudest stadiums round field vanderbilt stadium kentuckywildcats anchordown,KR,-0.15
2018-07-16,hanlynseb manager stopped while carrying asked store,KR,0.0
2018-07-17,aprilfrvr selling sunflower bouquets remember only takes make,KR,0.0
2018-07-17,khou krogercripples blatantly allows customers hurt stores renders them while,KR,-0.5
2018-07-17,sure everyone lives avon indiana area halo crea,KR,0.1287878787878787
2018-07-17,buys home chef maker meal kits article photo david phillip file buying home,KR,0.0
2018-07-17,superbaratisimo shoppers save torany syrups sauces load electronic coupon valid until,KR,0.0
2018-07-18,livefeedlville cardinal stadium field cardinal stadium field proving point,KR,0.0
2018-07-18,secslowsmoked loudest stadiums round field vanderbilt stadium kentuckywildcats anchordown,KR,-0.15
2018-07-18,aprilfrvr selling sunflower bouquets remember only takes make,KR,0.0
2018-07-19,aprilfrvr selling sunflower bouquets remember only takes make,KR,0.0
2018-07-19,secslowsmoked loudest stadiums round neyland stadium field vols wildcats,KR,-0.15
2018-07-20,secslowsmoked loudest stadiums round neyland stadium field vols wildcats,KR,-0.15
2018-07-20,aprilfrvr selling sunflower bouquets remember only takes make,KR,0.0
2018-07-21,secslowsmoked loudest stadiums semifinal round field donald reynolds wildcats razorbacks,KR,-0.15
2018-07-22,secslowsmoked loudest stadiums round neyland stadium field vols wildcats,KR,-0.15
2018-07-22,palouse capital management raised stake water island capital upped dunkin,KR,0.0
2018-07-22,listening juvenile after trip eating chips drinking orange juice carto,KR,-0.25
2018-07-25,mrlila come half consumer grocer products cincinnati,KR,-0.1666666666666666
2018-07-25,celticvixxen krogercripples blatantly allows customers slip fall stores renders,KR,-0.5
2018-07-25,nice countries leaders milte rahoge public liye kuch modi,KR,0.025
2018-07-26,krogernews donated million meals food funds help hunger communities zerohungerzerowaste,KR,0.0
2018-07-26,football lady looking daughter yelled georgia promptly respond,KR,0.0
2018-07-26,happened daleville literally exact same shit safe,KR,0.0166666666666666
2018-07-27,covergirl deal beauty event items krogerdeals krogerbeautyevent deannasdeals,KR,0.390625
2018-07-28,years jason leffler raceway park clermont,KR,0.0
2018-07-29,shopping deals ralphs safeway lucky albertsons jewel shaws publix schnucks frys vons pavilions,KR,0.3333333333333333
2018-07-30,wndu looking start eating healthy help customers make better choices called optup,KR,0.5
2018-07-30,card lying around purchase,KR,1.0
2018-07-31,columbuscrewsc krogercripples horrible record customer safety,KR,-1.0
2018-07-31,wraps salads sold recalled parasite concern iewaeqyppj,KR,-0.125
2018-08-01,cbsnews wraps salads sold recalled parasite concern iewaeqyppj,KR,-0.125
2018-08-01,wcpo salad wrap products sold walgreens recalled cyclospora concerns,KR,0.0
2018-08-01,elliemail pastipaparliamentarians victorian state michael image dated march ipaexposed,KR,0.0
2018-08-01,health alert issued than dozen salad wrap products available walgreens concerns,KR,0.45
2018-08-01,recall alert salads wraps sold walgreens contaminated parasite,KR,0.0
2018-08-01,lucky delray love shopping great alternative hogg coddling publix buys delray beach shopping,KR,0.4791666666666666
2018-08-01,salads wraps walgreen contaminated fgbdhorduk,KR,0.0
2018-08-01,alert issued salads wraps walgreens parasite concern,KR,-0.125
2018-08-01,parasite alert issued salads sold walgreens thedailybeast,KR,0.0
2018-08-01,necn nationwide public health alert wrap products sold walgreens effect cyqcndqr,KR,0.0
2018-08-01,salads wraps walgreen contaminated intestinal parasite,KR,0.0
2018-08-01,klgandhoda health alert issued salads wraps parasite,KR,0.0
2018-08-01,health alert issued salads wraps walgreens concerns about possible parasite contamina,KR,-0.0625
2018-08-01,another another processed food recall salads wraps walgreen contamina,KR,0.0
2018-08-01,recallalert wraps salads sold walgreens recalled possible parasite contamination,KR,0.0
2018-08-01,salads wraps sold walgreens recalled parasite concerns,KR,-0.125
2018-08-01,eartheats food safety warnings time wraps packaged salads retailers include,KR,0.5
2018-08-01,recall alert salads sold walgreens being recalled because tainted cyclos,KR,0.0
2018-08-01,breathe easy publix coming florida,KR,0.4333333333333333
2018-08-01,multiramblings alert issued salads wraps walgreens parasite concern,KR,-0.125
2018-08-01,foxla public health alert wraps salads affected parasite,KR,0.0
2018-08-01,foxbusiness jackhough,KR,0.0
2018-08-01,health alert issued salads wraps walgreens parasite concern,KR,-0.125
2018-08-01,salads wraps walgreens contaminated parasite,KR,0.0
2018-08-01,health alert issued salads wraps walgreens parasite concern does,KR,-0.125
2018-08-01,irritatedwoman thank goodness fasting icky health alert issued salads wraps,KR,0.2857142857142857
2018-08-01,warning issued walgreens salads wraps possible parasite contamination,KR,0.0
2018-08-01,buzzfeednews warning issued walgreens salads wraps possible parasite contamination,KR,0.0
2018-08-01,business briefs public health social media vvormdfkgj,KR,0.0166666666666666
2018-08-01,webmd consumer warning popular salad wrap products sold stores including walgreens contaminat,KR,0.6
2018-08-01,warning issued walgreens salads wraps possible parasite contamination dykgcydquu,KR,0.0
2018-08-01,alert issued salads wraps walgreens parasite concern,KR,-0.125
2018-08-01,states department agriculture stores include walgreen conta,KR,0.0
2018-08-01,grocer launches delivery service,KR,0.1363636363636363
2018-08-02,health alert issued salads wraps walgreens concerns about possible parasite contamina,KR,-0.0625
2018-08-02,goshenschools presented check band performance thank,KR,0.0
2018-08-02,smartinezwpsd recall public health alert salad wrap products sold walgreens recall,KR,0.0
2018-08-02,warning issued walgreens salads wraps possible parasite contamination,KR,0.0
2018-08-02,njdotcom salads wraps sold walgreens contain intestinal parasites,KR,0.0
2018-08-02,cbsnews wraps salads sold recalled parasite concern,KR,-0.125
2018-08-02,card transactions stores longer loyal customer,KR,0.3333333333333333
2018-08-02,recall salads wraps sold various grocery chains contaminated parasite njyeqzvqgb,KR,0.0
2018-08-02,redtraccoon wake county piggly wiggly obsolete closed stores area surpri yxtzcwcdxi,KR,-0.1
2018-08-02,bcdreyer royal throne kings sceptered aisle blessed plot earth realm,KR,0.0
2018-08-02,vaughtsviews time cast those votes perform opening game concert field thatepps,KR,-0.4
2018-08-02,real time feedback calling riverwalk south charleston,KR,0.0
2018-08-02,cards virtually every time visit,KR,0.0
2018-08-03,madison county says lawsuit responsible lost tooth hwptbqmggd,KR,0.2
2018-08-03,labtestsonline alert issued salads wraps walgreens cygcnzkmkq food illness,KR,0.0
2018-08-03,jenheraldleader enjoyed hosting state championships campus barnhart khsaa football championships field,KR,0.5
2018-08-03,justforall sprouts whole foods,KR,0.2
2018-08-04,pinkninjablogg bang buck kind gift card check happy card plus enter,KR,0.4621212121212121
2018-08-04,slept hours watch everything,KR,0.0
2018-08-04,ralph ralph,KR,0.0
2018-08-05,jwstaton krogercripples love hear about wonderful cripples woman,KR,0.75
2018-08-05,receipt return couldn store credit beautifulchild,KR,0.0
2018-08-05,reds thursday volunteers participated reds cincinnati community makeover prospe,KR,0.1363636363636363
2018-08-05,cbsnews wraps salads sold recalled parasite concern,KR,-0.125
2018-08-05,grayotaylor continues rolling thunder push into digital retail preserving analog being serious about digital,KR,-0.1111111111111111
2018-08-06,stop evan because thought coming earlier never showed gypmifrgdr,KR,0.0
2018-08-06,beccajlower special birthday which starts midnight yuengling cans winning,KR,0.3571428571428571
2018-08-06,sitting outside waiting money center open people sitting cars,KR,0.1
2018-08-06,giving blue ridge area food bank years wnicobrmcd,KR,0.0
2018-08-07,gayrotismo bareback ricky shields ryan full video download fcrvtnpgpn,KR,0.0
2018-08-07,security officer shoots shoplifter foot vehicle,KR,0.0
2018-08-07,these pumpkins soooo cute pricey cute halloween halloweendecor rfiftezyrg,KR,0.5
2018-08-07,yelling into phone while facetiming middle please stop,KR,0.0
2018-08-08,herbal essences shampoo conditioner mega sale save krogermegasale,KR,0.0
2018-08-08,officer reportedly uses taser accused shoplifting officer,KR,0.0
2018-08-08,pharmacy technician stores fort worth xoaxdfmnef fort worth,KR,0.3
2018-08-08,icymi hiring michigan hundreds,KR,0.0
2018-08-08,entire store degrees,KR,0.0
2018-08-08,wsbtv taser used girl accused shoplifting police oezwadzqjc,KR,0.0
2018-08-08,dominatereality suspected stealing food tased obeying command parent mother merely,KR,0.1
2018-08-10,video hens beaten suffering dying supplier help peta,KR,0.0
2018-08-10,home walking around hands deep sweats rubbing,KR,0.0
2018-08-10,video hens beaten suffering dying supplier help peta,KR,0.0
2018-08-11,gayrotismo bareback ricky shields ryan full video download,KR,0.0
2018-08-11,video hens beaten suffering dying supplier help peta,KR,0.0
2018-08-11,sandrasumnall thousands hens gassed slammed into trucks beaten supplier,KR,0.0
2018-08-12,hmmmm possibly better deals target better customer service understand totally,KR,0.0
2018-08-14,yeah baby gonna treat taking limo,KR,0.0
2018-08-14,vegansikh thousands hens gassed slammed into trucks beaten supp youtube,KR,0.0
2018-08-14,ashleighwmusic video hens beaten suffering dying supplier help peta,KR,0.0
2018-08-14,pennwealth penn after hours makes move into china tapestry jumps kate spade sales takes,KR,0.0
2018-08-15,tictoc grocery chain overseas first time china specific tech giant alibaba helping,KR,0.125
2018-08-15,michigan pees deli section store police istock,KR,0.0
2018-08-15,michigan pees deli section store police ircxkuvtnu foxnews,KR,0.0
2018-08-16,nuro deploying self driving cars grocery delivery arizona ftwpdbiliq udeiyswowh,KR,0.0
2018-08-16,easy deal kraft shredded cheese mega sale save krogermegasale deannasdeals,KR,0.5416666666666667
2018-08-16,movetheworldus while excited about breakthrough pigs work chickens check,KR,0.2875
2018-08-16,best deals august,KR,1.0
2018-08-16,madison,KR,0.0
2018-08-17,reasons shop cookie cake bagel bites want pizza,KR,0.0
2018-08-17,teabdpodcast personal professional despiser grocery bags appreciated shade thrown,KR,0.1
2018-08-17,fbisdcommunity krogercripples earth allowed hurt people recourse,KR,0.0
2018-08-17,partnering robotics company driverless delivery pilot robotics,KR,0.0
2018-08-19,shopping deals ralphs safeway lucky albertsons jewel shaws publix schnucks frys vons pavilions,KR,0.3333333333333333
2018-08-19,bareback ricky shields ryan full video download,KR,0.0
2018-08-19,mikewillmadeit exactly used grass work brandsmart sold beats being broke never,KR,0.25
2018-08-19,employee crushing gave employee discount because though curved nice,KR,0.5
2018-08-20,mikewillmadeit exactly used grass work brandsmart sold beats being broke never,KR,0.25
2018-08-21,gayrotismo bareback ricky shields ryan full video download bkujdyfsxp,KR,0.0
2018-08-21,mikewillmadeit exactly used grass work brandsmart sold beats being broke never,KR,0.25
2018-08-21,what steal ground beef stopped arrested processed,KR,0.0
2018-08-21,movetheworldus largest grocery chain committed phasing cruel gestation crates supply chain,KR,-1.0
2018-08-22,chronichoosier gonna believe shit page coffee table book chronic hoosier,KR,-0.2
2018-08-22,andre block beautiful human loved since years kind,KR,0.2833333333333333
2018-08-22,fred meyer pair,KR,0.975
2018-08-23,kill plastic bags transition reusable bags,KR,0.0
2018-08-23,wcnc plastic bags transition reusable bags customers grocery chain stores including matthews,KR,0.0
2018-08-23,committogreen ditch plastic bags largest grocer says customers asking less packaging waste,KR,0.0444444444444444
2018-08-23,plastic bags vhgciafpca,KR,0.0
2018-08-23,neilflochmd hurt bullied wife recourse protesting,KR,0.0
2018-08-23,phase plastic bags stores,KR,0.0
2018-08-23,phase plastic bags stores associated press,KR,0.0
2018-08-23,interesting wralsarah phase plastic bags stores including harris teeter,KR,0.5
2018-08-23,pressure working announcement phasing plastic bags comes after,KR,0.0
2018-08-23,plastic bags says longer supply plastic shopping bags,KR,0.0
2018-08-23,phase plastic bags stores,KR,0.0
2018-08-23,ukfootball place field caturday need sept getup,KR,0.0
2018-08-24,says plans stop distributing single bags completely across chains includes major chai,KR,0.1
2018-08-24,ditching plastic bags company says news bstjiqwlcx want promote yiljjjgxmt,KR,0.0
2018-08-25,grocery shopping while give coupon everything bought discovered,KR,0.0
2018-08-25,gayrotismo bareback ricky shields ryan full video download,KR,0.0
2018-08-25,australia stuffed unelected michael liberal victorian state preisdent news telling elected,KR,0.0
2018-08-25,nowthisnews america biggest grocery store chain phasing plastic bags,KR,0.0
2018-08-25,told friends watch hairy looking boys because damn,KR,0.1
2018-08-26,,KR,0.0
2018-08-26,local kinda doing same thing curious,KR,0.0
2018-08-27,udhcmh already miss lots times think concept really good idea,KR,0.2174242424242424
2018-08-28,krogercripples hail heartless company ruined wife lives,KR,0.0
2018-08-28,ascottera online request state information what recog,KR,0.0
2018-08-28,okay what chall want buying,KR,0.5
2018-08-29,ramen gyros cajun food among offerings field fall xtnegjxytd,KR,0.1363636363636363
2018-08-29,khou krogercripples hail heartless company ruined wife lives well,KR,0.0
2018-08-30,albericie michael abcpm french pair frankly time time need ministers,KR,0.0
2018-08-30,richardlfarmer politics victorian liberal president michael talking about women during leadership spill,KR,0.0
2018-08-30,aroundindy thursday august music petty symphony prairie conner,KR,0.0
2018-08-30,entire years working undergrad never show work mood spirit really,KR,-0.3499999999999999
2018-08-30,expanding instacart same grocery delivery program additional stores including myrtle,KR,0.0
2018-08-30,drjenewalker shop make donation salt light evangelistic association incorporated enroll,KR,0.4
2018-08-31,albericie michael abcpm french pair frankly time time need ministers,KR,0.0
2018-09-01,jennifer garner newport seemed notice,KR,0.0
2018-09-01,know support granger elementary shopping family,KR,0.3
2018-09-01,remember pawankalyan garu time kushi movie atlast hbdjanasenanipa,KR,0.0
2018-09-02,brainouty electron home paris same time until,KR,0.0
2018-09-10,aware about though confirm about android pezani kachiphapha samsung bruh,KR,0.0
2018-09-10,moonves stay adviser years security donate metoo,KR,0.0
2018-09-10,gogiinc samsung review perfect premium smartphone payment gogiinc,KR,0.0
2018-09-10,ebay deals laptop sony xperia verizon wifi water mkfeqttoaq,KR,0.0
2018-09-10,reutersuk reporting reuters downhill years glaring error,KR,0.0
2018-09-10,vitocoalts random tarjeta spotify premium fornite unmigrated full acces seguir vito,KR,-0.2291666666666666
2018-09-10,wgnnews burberry longer destroy items sell repair donate recycle them instead,KR,-0.5
2018-09-10,need water andrews road irmo water truck coming store management,KR,0.0
2018-09-10,playing saying playing game honda deal,KR,-0.0625
2018-09-11,etechnovators krogercripples coming anniversary celebrate wife after,KR,0.0
2018-09-11,adobe supercharges photoshop content aware fill options fewer fails techcrunch,KR,0.0
2018-09-02,divinitybraid cord nature theme handfasting cord handfasting wedding tree life ebay divintiybraidbyasvwedding,KR,0.9
2018-09-02,streetwearfiend adidas bred drops read,KR,0.0
2018-09-02,ingrahamangle laid older americans sought import foreign workers breitbartnews,KR,-0.2
