Date,Tweet,Ticker,Score
2020-04-11,equity,KR,0.017250970005989
2020-04-11,first informative pivot points close pivot point download free tradingview stockstowatch,KR,0.8437293767929077
2020-04-13,seekingalpha fair value basket fpldnrmrzr business,KR,0.8962116241455078
2020-04-13,fair value basket fpldnrmrzr business,KR,0.8888040781021118
2020-04-15,coverage initiated analysts citigroup bqopqighyz,KR,0.0784559100866317
2020-04-15,workers front line working help people food essentials,KR,0.7462007999420166
2020-04-15,wants half million employees designated first responders masks gloves themotleyfool,KR,0.3305020928382873
2020-04-16,first informative pivot points close pivot point download free tradingview stockstowatch,KR,0.874590277671814
2020-04-17,target raised chase sfmlttoyci,KR,0.9003225564956665
2020-04-17,seekingalpha raise print money huge upside,KR,0.9819689989089966
2020-04-17,raise print money huge upside,KR,0.9657310247421264
2020-04-17,receives average recommendation hold analysts,KR,-0.0239079371094703
2020-04-18,tbgwghklmv equity,KR,0.017250970005989
2020-04-21,sees significant decline short interest,KR,-1.0411388874053955
2020-04-22,earnings oppenheimer forecasts,KR,0.3488812744617462
2020-04-23,earnings estimate issued oppenheimer,KR,0.0467044822871685
2020-04-23,research analysts ratings changes,KR,0.044918343424797
2020-04-23,zacks analysts expect earnings,KR,0.3799442052841186
2020-04-24,billion sales expected quarter,KR,0.3570168912410736
2020-04-26,sergdjb chart taking advantage situation trying break multi resistance volume coming riding,KR,0.9725383520126344
2020-04-28,unit widens free covid testing themotleyfool,KR,0.5351381301879883
2020-04-28,short interest increases,KR,0.9532431364059448
2020-04-29,raised,KR,0.91558039188385
2020-06-03,options maxpain chart open interest chart update optionstrading optionsflow stockmarket bneylhruem,KR,0.4446021318435669
2020-06-04,neutral fundamental analysis score score check various indicators value score chart roic gross margin ebitda stockmarket,KR,0.6163042783737183
2020-06-07,expected quarter,KR,0.1478525996208191
2020-06-08,sergdjb thing consolidating nicely watching close swing breaking area support below,KR,0.85309898853302
2020-06-09,brokerages anticipate announce sales billion,KR,0.1271877139806747
2020-06-11,saved butt optionstrading,KR,1.011987328529358
2020-06-11,raised,KR,0.91904878616333
2020-06-11,actually looks bullish massive long term base looks relative,KR,0.9751383066177368
2020-06-14,options power options maxpain chart open interest chart update optionstrading optionsflow optionstrade optiontrading stockmarket invest,KR,0.5727497339248657
2020-06-14,long expected jump earnings fiscal poolsapp finance fintwit,KR,0.8934183120727539
2020-06-14,reports earnings thursday earnings insights unusual options activity earnings history score advanced chart financial numbers stockmarket optionstrading optiontrading ycctcszzud erzgzklieb,KR,0.984408974647522
2020-06-15,raised group,KR,0.90525221824646
2020-06-16,poor technical analysis score score breakdown categories candle score poor moving average score weak momentum score weak stockmarket,KR,-1.0586230754852295
2020-06-16,dividend growth finance,KR,0.8583667278289795
2020-06-16,forecasted earnings,KR,0.4108650982379913
2020-06-17,unusualoa date time ticker strike spot contracts premium,KR,0.0561900585889816
2020-06-17,large volume call options,KR,0.9690321683883668
2020-06-17,jefferies financial group weighs earnings,KR,0.0197091586887836
2020-06-18,suits starting come around believe took them full realize beating earnings good thing ddtg money greentrain,KR,0.96833336353302
2020-06-18,kdkfund because guidance given guidance being noguidance,KR,0.1224071681499481
2020-06-18,because guidance given guidance being noguidance,KR,-0.2608749568462372
2020-06-18,earnings results beats expectations,KR,0.1856782883405685
2020-06-18,beats estimate sales beat estimate earnings stockmarket invest ycctcszzud,KR,0.8756568431854248
2020-06-18,purchase large volume options,KR,0.9151651859283448
2020-06-18,premarket expects outlook beats estimates profit sales,KR,0.6685965061187744
2020-06-18,scheduled announce earnings results thursday june before open consensus estimate consensus revenue estimate earnings stockmarket,KR,0.7666406631469727
2020-06-19,analysts recent ratings updates,KR,0.2238751649856567
2020-06-19,target increased analysts deutsche bank,KR,0.9327467679977416
2020-06-19,earnings oppenheimer forecasts,KR,0.3304310142993927
2020-06-19,detected noticeable rise zeitgeist visit dataswarm information nyse dataswarm,KR,0.9946954250335692
2020-06-19,company profile fundamental analysis score update score stockmarket eqvmrzpcxp,KR,0.0468249656260013
2020-06-19,options flow grid update optionstrading optionsflow optiontrading stockmarket,KR,-0.9052731990814208
2020-06-20,normal options volume common volume after finishing common,KR,0.6884464025497437
2020-06-22,estimates boosted jefferies financial group,KR,0.8452883958816528
2020-06-22,estimates increased analyst,KR,0.8889874219894409
2020-06-24,paid bills,KR,0.6697843074798584
2020-06-24,paid bills,KR,0.6718380451202393
2020-06-25,rodney mcmullen sells,KR,-0.71272873878479
2020-06-25,rodney mcmullen hosts meeting transcript stockmarket,KR,0.0039125047624111
2020-06-25,announces double digit dividend boost themotleyfool,KR,0.9530543088912964
2020-06-25,americanbanking announces dividend,KR,0.1647030562162399
2020-06-25,announces dividend,KR,0.1681531965732574
2020-06-25,morgan stanley increases target,KR,0.848015308380127
2020-06-25,earnings forecast issued northcoast research,KR,0.0709706395864486
2020-06-26,company raised dividend cuts,KR,0.7334928512573242
2020-06-27,stockmarket thekrogerco reported,KR,0.066757246851921
2020-06-29,covid crisis provide long term tailwinds,KR,-0.0099552124738693
2020-06-30,excellent fundamental analysis score score check various indicators value score chart roic gross margin ebitda stockmarket,KR,0.9792596101760864
2020-06-30,good fundamental analysis score score check various indicators value score chart roic gross margin ebitda stockmarket,KR,0.972069501876831
2020-07-02,increasing position dividend payer significant discount high great potential upside,KR,0.9599014520645142
2020-07-08,mttstrading watchlist target hopefully people profited,KR,0.9564605951309204
2020-07-09,excellent fundamental analysis score score check various indicators value score chart roic gross margin ebitda stockmarket,KR,0.9789721965789796
2020-07-11,optionsmaxpain options flow grid update optionstrading optionsflow optiontrading stoc,KR,0.8951787948608398
2020-07-11,options flow grid update optionstrading optionsflow optiontrading stockmarket,KR,0.6319866180419922
2020-07-14,dividends value growth,KR,0.7448519468307495
2020-07-14,good technical analysis score score breakdown categories candle score neutral moving average score excellent momentum score good stockmarket nyekbewqzv,KR,0.963521122932434
2017-01-31,check eurotek rise scissor lift phase power mobile included eurotek ebay,KR,0.0
2017-01-31,dear please vote cancel seattle contract wellsfargo startwithseattle nodapl,KR,0.0
2017-01-31,diary anxiety girl stranger started convo midway through shook hand realized talking hands,KR,0.0
2017-03-01,self check repair least schedule extra cashiers time wasted standing line,KR,0.5
2017-03-31,check pennywise clown stephen king inspired amigurumi crochet stuffed doll ebay,KR,-0.0357142857142857
2017-03-31,velveteenfemme asos probably only came sale nice know what mean,KR,0.0
2017-04-28,reuters trump wants renegotiate terminate horrible deal south korea wants billion thaad,KR,-0.8
2017-04-28,little pony beach towel bath towel terry cotton ebay,KR,0.6
2017-06-01,reuters trump administration approves tougher vetting including social media checks,KR,0.0
2017-06-01,labelldebi mykingsoopers label avatar need,KR,0.0
2017-07-31,adidas signs bigballerbrand never adidas product rest life,KR,0.0
2017-08-31,ryanair blimey communication bringing back memories come home screamin uahxnxihuh,KR,0.0
2018-10-18,store rincon gotten time clicklist gave expired nutpods,KR,-0.6999999999999998
2018-10-20,union committee recommend worker strike intelligencerwv unionstrong unionlabor workersrights,KR,0.0
2018-10-22,chase dropping serious knowledge krogerchocolatemilk,KR,-0.3333333333333333
2018-10-24,downwritemental crazy thought require firearms milk bread,KR,-0.6
2018-10-24,jesus reassess policy allowing open carry firearms stores,KR,0.0
2018-10-25,live locally something happens area daughter,KR,0.0681818181818181
2018-10-28,michaelskolnik pattyarquette realdonaldtrump cannot wait longer president congress,KR,0.0
2018-10-30,talbertswan realdonaldtrump sorry attention deserves kdgzekzzmy,KR,-0.3125
2018-10-30,americanbakers special address chair erin sharp group vice president manufacturing fakvbjfttk,KR,0.1160714285714285
2018-10-30,dozens common breakfast cereals contain trace amounts roundup monsanto cancer causing weedkiller stop sell,KR,-0.3
2018-09-11,etechnovators krogercripples coming anniversary celebrate wife after,KR,0.0
2018-09-02,milk apples eggs american grocery store chain planning pilot project nuro,KR,0.0
2018-09-03,nascaronnbc austin gotten back since first,KR,0.125
2018-09-03,buzzfeednews lack proper grocery stores wholefoods safeway need expand into poor neighborhoods which avoid,KR,0.0
2018-09-03,triplepundit krogercripples wife pain orqdxxmzyz,KR,0.0
2018-09-07,called back different manager phone claimed call disconnected time,KR,0.0
2018-09-11,alexiswlwt wlwt oprah freestorefb oprah hope able visit fiona while cincinnati bunziddzct,KR,0.625
2018-09-11,stores listed below closing until notice north kings highway myrtle beach,KR,0.0
2018-09-13,partnered feedingamerica support local food banks cashier round hunger regist,KR,0.0
2018-09-13,meals families better families meals home each increase healthy food,KR,0.5625
2018-09-13,pasta dish plus peas veggies mushrooms broccoli,KR,0.0
2018-09-13,krogercripples about quarter million hits hashtag talked,KR,0.0
2018-09-15,krogercripples approaching hits hashtag read story about what horr,KR,0.0
2018-09-15,thank associates store portsmouth jumped into action helping those affected hurricaneflorenc,KR,0.1
2018-09-15,dleachjr reviewed options offerings scam great things scan slow enough,KR,0.0
2018-09-18,thatpatti while keeps favorites brand roasted tomato,KR,0.0
2018-10-01,jdshelburne ukfootball didn know kinda famous,KR,0.5
2018-09-23,called bring cheerios clicklist camaro road tires fuel,KR,0.0
2018-09-26,spinnershells them bathroom liners poop pickup take them daughter,KR,0.0
2018-09-28,quit resetting stores find come hyvee come wichita,KR,0.5
2018-10-01,look toyota prius another tfltph pjgkfybfvq,KR,0.0
2018-10-01,arsesix hats flintshirecc bernieattridge great work cycle path passing toyota linking wirral,KR,0.375
2018-10-01,operating conditions package delayed delivery rescheduled meanwhile,KR,0.0
2018-10-01,tescohullextra latest results tesco bags help community initiative humber foundation trust,KR,0.0
2018-10-01,ebay jeep wrangler sport salvage repairable wholesale sport salvage repairable whol,KR,0.0
2018-10-18,jumiakenya answer huawei flash what catch shop using card what time date first treas,KR,0.0
2018-10-18,cold swim never cold appreciate nature while driving hyundai,KR,0.0
2018-10-18,toyota camry fully upgraded specs clean fabric seats cylinder engine touch,KR,0.0
2018-10-18,shell shocker linksys velop system sengled element starter wemo mini smart plug,KR,0.0
2018-10-18,ectokid marvel razorline comics clive barker foil cover ebay comicbooks culcvoqfbl,KR,0.0
2018-10-18,caitlinwixted waitress kaitlin bennett know carry,KR,0.0
2018-10-18,momagicdragon jeoncrocs what does mean maintain sortin,KR,0.0
2018-10-18,aoasuni oauvsunilag babes after seeing toyota camry qcvjoidpgw,KR,0.0
2018-10-18,sentence founder paul allen shared simple rule lifelong happiness,KR,0.0
2018-10-18,vodafone sakhi event wearing styled bornalitalukdar understated love,KR,0.0
2018-10-21,racist white refused elderly black woman ryanair flight called ugly black bast,KR,-0.1333333333333333
2018-10-21,ryanair says tolerate flight racial abuse after tolerating,KR,0.48828125
2018-10-21,cobbnewsnow second time metro atlanta drivers pumped contaminated fuel into vehicles separate,KR,0.0
2018-10-21,espn bears were close nevschi,KR,0.0
2018-10-22,tillamookcheese trying local heath ohio luck chocolate,KR,0.0
2018-10-22,tour theater,KR,0.0
2018-10-22,putting specialist phurrion keeping watchful yechun yuan ranked golfer china hsbc championship,KR,0.0
2018-10-22,network security engineer remote support rochester marine engineering jobs,KR,0.0
2018-10-23,recall hits millions pounds food harris teeter eleven,KR,0.5
2018-10-23,vintage fitzandfloyd ornament paper mache japan christmas soldier ebay,KR,0.0
2018-10-23,usatoday recall hits millions pounds food harris teeter eleven,KR,0.5
2018-10-23,does save thing tummyache,KR,0.0
2018-10-23,jdrumuk benny snell never elton john warming field playing bennie,KR,0.0
2018-10-24,leaving damn good didnt respond heard bitch,KR,0.7
2018-10-24,girl asos expert never knew thing existed whatttttt,KR,0.0
2018-10-24,alboenews breaking emergency crews responding amid reports multiple shooting victims store louisville kentucky read,KR,0.0
2018-10-24,developing multiple victims reported shooting grocery store jeffersontown kentucky massive police respo,KR,0.0
2018-10-24,yesterdays tornado near imagine people pretend doing cleanup vlozearjji,KR,0.0
2018-10-24,every kotex product purchased store online ubykotex donating products someone,KR,0.05
2018-10-24,breaking picture jtown scene shooting multiple victims reported stay,KR,0.0
2018-10-24,alboenews breaking police searching away chaos shooting store kentucky read,KR,0.0
2018-10-24,cnnbrk multiple people shot jeffersontown kentucky local media says suspect custody,KR,0.0
2018-10-24,breaking multiple people shot inside grocery store outskirts louisville kentucky police,KR,0.0
2018-10-24,joshdcaplan developing multiple people shot inside grocery store outskirts louisville kentucky police,KR,0.0
2018-10-24,police respond multiple shot kentucky bfvkasgutc,KR,0.0
2018-10-24,reports record results cloud surface gaming grow tech marketing,KR,0.0
2018-10-24,nicky begging tara banned every service access,KR,0.0
2018-10-24,multiple people shot inside grocery store outskirts louisville kentucky police associated press,KR,0.0
2018-10-24,alboenews breaking multiple people shot store louisville kentucky read,KR,0.25
2018-10-24,multiple people shot kentucky crap,KR,-0.4
2018-10-24,breaking jeffersontown multiple people shot inside grocery store outskirts louisville kentuck,KR,0.0
2018-10-24,alboenews breaking employees person came into louisville kentucky store opened fire hitting multiple people,KR,0.0
2018-10-24,multiple people shot supermarket jeffersontown kentucky witnesses describe terrifying scene,KR,-0.5
2018-10-24,breaking police people killed shooting grocery store outskirts louisville kentucky,KR,-0.2
2018-10-24,breaking police people killed shooting grocery store outskirts louisville kentucky,KR,-0.2
2018-10-24,breaking multiple people shot inside grocery store outskirts louisville kentucky police,KR,-0.2
2018-10-24,newsthissecond breaking multiple people shot inside grocery store outskirts louisville kentucky police,KR,0.0
2018-10-24,mspoweruser releases xbox preview alpha build mouse support search improvements bppsjfqgom,KR,0.0
2018-10-24,update police dead custody shooting kentucky,KR,-0.2
2018-10-24,cnnbrk people were shot killed store jeffersontown kentucky police chief says,KR,-0.2
2018-10-24,cbsnews gold digging pretends stray hamburgers mcdonald owner says,KR,0.0
2018-10-24,antique english kings pattern sterling silver forks thistle crest ebay,KR,0.0
2018-10-24,jswatz scoop york suing mobil accusing fossil fuel giant defrauding downplaying risk climate,KR,0.0
2018-10-24,breaking police people killed shooting grocery store outskirts louisville kentucky,KR,-0.475
2018-10-24,shooting kentucky florida texas says hold beer,KR,0.0
2018-10-24,police dead custody shooting kentucky,KR,-0.2
2018-10-24,kaivanshroff multiple victims shooting kentucky armed bystander tried shoot attacker missed good guys guns,KR,0.0
2018-10-24,want sugar daddy only bank credit card debts allowance plus gifts,KR,-0.1
2018-10-24,multiple people shot inside grocery store near louisville kentucky,KR,0.05
2018-10-24,jphoornstra degrees chase utley taking without socks pants rolled knees,KR,0.0
2018-10-24,shannonrwatts witness father drew confronted suspect parking suspect shoot,KR,0.0
2018-10-24,ahmerzdfs lesean mccoy doesn score baring injuries give away doesn yards,KR,-0.1
2018-10-24,allanbrocka shooter bystander whites kill whites,KR,0.0
2018-10-24,mcdonald employee cream machines broke,KR,0.0
2018-10-24,cimotrade lling carp these money interest accept ofeers,KR,-0.1
2018-10-25,aldi food lion main places second,KR,0.0
2018-10-25,breaking multiple people shot inside grocery store outskirts louisville kentucky police,KR,0.0
2018-10-25,flylifestylehq adidas yeezy utility black available purchase free shipping options rvpmxt,KR,-0.1
2018-10-25,breaking police people killed shooting grocery store outskirts louisville kentucky,KR,-0.2
2018-10-25,hours white supremacist walked into store jeffersontown kentucky opened fire injured seve,KR,-0.1
2018-10-25,thedailybeast shooting people yourselves shoot back continue,KR,0.125
2018-10-25,ebay canvas sneakers classic lace fashion casual shoes colors size,KR,0.0
2018-10-25,developing multiple victims reported shooting grocery store jeffersontown kentucky massive police respo,KR,0.0
2018-10-25,bombshell obama white house ignored saudi crown prince after revealing osama laden iran,KR,0.0
2018-10-25,crewcrew jared kushner took official meeting citigroup before family kushner companies,KR,-0.1
2018-10-25,cbsphilly gold digging pretends stray hamburgers mcdonald owner says,KR,0.1681818181818181
2018-10-25,samsung drops sharply bringing earnings ratio about means take,KR,0.0
2018-10-25,while home unknown people honda civic number tried intercept make frightened stoppe,KR,-0.2
2018-10-25,sapinmemory hana best machinelearning data platform fast training validation scoring amongst features,KR,0.0
2018-10-25,minor service package kshs xfrxbfqgaa,KR,-0.2
2018-10-25,people were shot killed store jeffersontown kentucky police chief,KR,-0.2
2018-10-25,cbsnews gold digging pretends stray hamburgers mcdonald owner says,KR,0.0
2018-10-25,hours white supremacist walked into store jeffersontown kentucky opened fire injured seve,KR,-0.2
2018-10-25,newyorkstateag fraud alleged suit reached highest levels management including former chairman,KR,0.0
2018-10-25,blinkdomina antis blackpink gonna concert only songs mics always rfdehvvpcj,KR,-0.2
2018-10-25,gwillowwilson jontsuei know what part city live aurora hunter boots ejijlcypzs,KR,-0.1833333333333332
2018-10-25,china flash disk factory shell material plastic capacity interface cusigleusbflashdrives,KR,-0.2
2018-10-25,shot killed kentucky continue using tuozmlklhl need update brow,KR,0.0
2018-10-25,adidas originals winter jacket blackpink lvqtolilwr,KR,0.0
2018-10-25,breaking well regulated militia opens fire inside louisville kentucky cheap thoughts useless,KR,0.0
2018-10-25,guys world burning take minutes monday watch happytogether,KR,0.0
2018-10-25,steph curry buries triples route warriors victory arena dubnation,KR,-0.1833333333333332
2018-10-25,lalicethailand adidas originals winter jacket blackpink blackpink jisoo jennie lisa,KR,-0.1833333333333332
2018-10-25,crewcrew jared kushner took official meeting citigroup before family kushner companies,KR,0.0
2018-10-27,nytimes gunman killed people kentucky tried enter predominantly black church minutes before attack,KR,-0.1833333333333332
2018-10-27,drchriscaldwell heard white newscasters shooting understandable wron,KR,0.0
2018-10-27,ebay odyssey works putter steel,KR,0.0
2018-10-27,emfarl word sensitive thing move something half inch pictures move pages inserte,KR,-0.1833333333333332
2018-10-27,breaking multiple people shot inside grocery store outskirts louisville kentucky police,KR,0.0
2018-10-27,talbertswan vickie jones woman recently retired hospital murdered supermarket jeffe,KR,0.0
2018-10-27,amjoy greg bush killer attempted gain access predominately black church before,KR,-0.1666666666666666
2018-10-27,zeddary white supremacist attack assassination attempts against presidents dozen,KR,0.0
2018-10-27,tariqnasheed vickie jones black victim murdered white supremacist gregory alan bush store,KR,-0.0604166666666666
2018-10-27,emfarl word sensitive thing move something half inch pictures move pages inserte,KR,-0.0916666666666666
2018-10-27,marmel heels failing shoot black church shot elderly black people instead,KR,-0.1666666666666666
2018-10-27,zeddary white supremacist attack assassination attempts against presidents dozen,KR,-0.2
2018-10-27,wanted make special cashier steps paint disabled woman nails salon refuses,KR,-0.1833333333333332
2018-10-27,already voted pmsf aviva community fund votes unsure,KR,-0.0916666666666666
2018-10-27,knowyourobama realdonaldtrump gunman killed jeffersontown tried enter predominantly black chur,KR,-0.1833333333333332
2018-10-27,rudepundit shooting victims kentucky were black shooting victims pittsburgh were jewish bomb target,KR,-0.0833333333333333
2018-10-27,amandataub poem mind days especially wake shooting pittsburgh used,KR,0.0
2018-10-27,patterico sends bombs because hates trump critics another shoots people because hates blacks another,KR,0.0
2018-10-27,tryedandtrue bombs sent people realdonaldtrump attacked people killed store because color skin,KR,-0.2
2018-10-27,lcrboston first partisan mail bombing campaign black people killed store jeffersontown white,KR,0.25
2018-10-27,kevvwill hindsight making sling available platform probably ptetty clear message about bein cable,KR,-0.1638888888888889
2018-10-27,hopeanimalsnc update alum tucker family tucker name bennie beepbeep doggy siste,KR,0.0
2018-10-27,white shot store louisville killing black people injuring,KR,-0.0833333333333333
2018-10-27,apparently enough adidas eligible hype access through company creators club,KR,-0.0916666666666666
2018-10-27,white tried attack black church murdered innocent black people,KR,0.0416666666666666
2018-10-27,kennethcdavis somewhat overlooked shooting suspect tried enter black church before killing nyti,KR,-0.0833333333333333
2018-10-27,wing terror attacks alone shooting kentucky multiple,KR,0.0
2018-10-27,deal expires inventory ebay listings being funko product,KR,-0.0555555555555555
2018-10-27,navy blue toyota landcruser acting suspicious kilchreest area,KR,-0.0916666666666666
2018-10-27,toure pittsburgh synagogue attack kentucky attack pipe bombs multiple acts terror,KR,0.0
2018-10-27,cioutism giving away these rules checking everything cioutism retweet,KR,-0.1666666666666666
2018-10-27,andrew torba fuck,KR,0.0
2018-10-27,carsthatnevermadeitetc what difference years makes contrasting pics audi audi,KR,-0.1
2018-10-28,rudepundit shooting victims kentucky were black shooting victims pittsburgh were jewish bomb target,KR,-0.0833333333333333
2018-10-28,broderickgreer maurice stallard vickie jones were killed kentucky shooting,KR,-0.2
2018-10-28,nytimes gunman killed people kentucky tried enter predominantly black church minutes before attack,KR,-0.1833333333333332
2018-10-28,gidglick heart breaks victims tree life synagogue pittsburgh louisville hate boiling,KR,0.0
2018-10-28,crewcrew wilbur ross holding meetings wife appears stake company,KR,-0.1222222222222222
2018-10-28,zeddary white supremacist attack assassination attempts against presidents dozen,KR,0.0
2018-10-28,toure pittsburgh synagogue attack kentucky attack pipe bombs multiple acts terror,KR,0.0
2018-10-28,savetheplanetxo terrorism america white male wasn caravan sent those bombs shot people store,KR,0.0
2018-10-28,paulkrugman forget attempted mass killing african americans shooter tried,KR,0.0
2018-10-28,zeddary white supremacist attack assassination attempts against presidents dozen,KR,-0.0916666666666666
2018-10-28,patterico sends bombs because hates trump critics another shoots people because hates blacks another,KR,0.0
2018-10-28,dwebbkhn everyone reporting pittsburgh please note domestic terror attacks recent days,KR,0.0
2018-10-28,bakermayfield making little magic happen browns,KR,-0.1222222222222222
2018-10-28,avivauksupport trick treat want aviva branded power bank give away avivauksup,KR,0.0
2018-10-28,sportscenter stop kareem hunt kcvsden bosqbqnuuo,KR,0.0
2018-10-28,theoriginaltwug violence pittsburgh magabomber shooter symptoms stochastic terrorism presi,KR,0.0
2018-10-28,paxclara instead damage start ammount default lose,KR,0.0
2018-10-28,baby ready ebygzhrewh,KR,0.0
2018-10-29,msnbc synagogue shooting comes same mail bomber race based attack,KR,0.0
2018-10-29,myanmar reuters journalists serving sentence exposing massacre country military,KR,0.0
2018-10-29,dwebbkhn everyone reporting pittsburgh please note domestic terror attacks recent days,KR,0.0
2018-10-29,getongab jack murdered innocent people grocery louisville local media wdrbnews reports,KR,0.25
2018-10-29,nissan sept japan output falls global,KR,0.0
2018-10-29,indonesia lion plane onboard crashes into officials news,KR,0.6
2018-10-29,dontbrexitfixit dear toyota honda vauxhall nissan workers assembled fitted door handle,KR,0.0
2018-10-29,supporting high street barnes great british high street awards sponsored good luck,KR,0.0
2018-10-29,colmorrisdavis murder african americans kentucky bombs mailed leaders massacred pittsburgh synagogu,KR,0.0
2018-10-29,killed black people tried enter predominantly black church minutes earlier police,KR,-0.1333333333333333
