Date,Tweet,Ticker,Score
2018-08-17,directhex mcdonald guess clustering find store categories classification each,MCD,0.0
2018-08-17,mcdonald london glamorous makeover help markvandelli richardvines,MCD,0.0
2018-08-17,investigation continues into mcdonald salads sickened hundreds including people,MCD,0.0
2018-08-17,mcdonald recife pernambuco,MCD,0.0
2018-08-18,jokerofankh crazy teach children mcdonald song show nice illustrated picture books about farm animals classi,MCD,0.0333333333333333
2018-08-18,never mcdonald daughter happy meals boyfriend,MCD,0.8
2018-08-18,mcdonald mcthai bangkok,MCD,0.0
2018-08-18,stcom married mcdonald australia wedding package complete course mcmeal cake,MCD,0.3833333333333333
2018-08-18,mcdonald never experienced before fast food eatery london upscale kensington neighborhood gets transfor,MCD,-0.1
2018-08-18,gfriendph what meet lightstick merchandises mcdonald theatre august onwards internation,MCD,0.0
2018-08-18,thetylt trump mcdonald order consists macs calories filet fish calories chocolate malted,MCD,0.0
2018-08-18,outbreak intestinal illness linked eating salads mcdonald widening than after vkguwcrdft,MCD,0.0
2018-08-18,texas mexicana mcdonald mexicana pixel,MCD,0.0
2018-08-18,nope need people work mcdonald,MCD,0.0
2018-08-18,mcdonald employee excuse water,MCD,-0.05
2018-08-18,mcdonald employee excuse water,MCD,-0.05
2018-08-19,mcdonald customers notice encounter between black teen pull phones record,MCD,-0.0833333333333333
2018-08-19,texas mexicana mcdonald mexicana pixel,MCD,0.0
2018-08-19,ikamranshahid keralafloodrelief collection point bangalore south main stage behind mcdonald nearest land,MCD,-0.0777777777777777
2018-08-19,never uncommon driver scarfing mcdonald while driving knees,MCD,-0.4
2018-08-19,jxmmi worked todd star olive garden factories mcdonald couldn empty pockets,MCD,-0.05
2018-08-20,forbes mcdonald spending remake fast food image yzvnappbds,MCD,0.0
2018-08-20,jxmmi worked todd star olive garden factories mcdonald couldn empty pockets,MCD,-0.05
2018-08-20,shindags during hurt mcdonald mchurt,MCD,0.0
2018-08-20,salads sold mcdonald sicken,MCD,0.0
2018-08-20,mcdonald crew member south dublin ireland,MCD,0.0
2018-08-20,texas mexicana mcdonald mexicana pixel,MCD,0.0
2018-08-20,dairocketto mcdonald window haha what what happens ranma gets pregnant changes back into rumiko,MCD,0.1777777777777777
2018-08-20,mcdonald,MCD,0.0
2018-08-20,burger king mcdonald,MCD,0.0
2018-08-20,animehiphop nothing normal mcdonald qakubqwfpq,MCD,0.15
2018-08-20,people mcdonald make than starting bitching make enough want,MCD,0.25
2018-08-20,hate speech think about logically unhappy service mcdonald chall,MCD,-0.2875
2018-08-21,animehiphop nothing normal mcdonald qakubqwfpq,MCD,0.15
2018-08-21,burger king mcdonald,MCD,0.0
2018-08-21,extra ranch sauce mcdonald employee dsqjqcaiou,MCD,0.0
2018-08-21,work mcdonald mcdonald work,MCD,0.0
2018-08-21,jxmmi worked todd star olive garden factories mcdonald couldn empty pockets,MCD,-0.05
2018-08-21,dairocketto mcdonald window haha what what happens ranma gets pregnant changes back into rumiko,MCD,0.1777777777777777
2018-08-21,mmvas iheartradiommvas ffnewkriswu kriswu picture mcdonald,MCD,0.1363636363636363
2018-08-21,texas mexicana mcdonald mexicana pixel,MCD,0.0
2018-08-21,moneysavingexp love maccies time time ultimate mcdonald hack fries,MCD,0.1666666666666666
2018-08-21,mcdonald breakfast killer both literally figuratively,MCD,0.0
2018-08-21,williamschaos absolutely remember taking mcdonald woolwich opened first mcdo,MCD,0.2625
2018-08-21,checked mcdonald dammit,MCD,0.0
2018-08-21,shindags during hurt mcdonald mchurt,MCD,0.0
2018-08-21,wooliewoolz someone grew family friends collected mcdonald monopoly pieces obsessively story,MCD,0.0
2018-08-21,releasing info norm mcdonald upcoming talk show which released smart,MCD,0.2142857142857142
2018-08-21,nmlinguaphile nomikikonst companies mcdonald survive wage,MCD,0.0
2018-08-21,spend dollars mcdonald easy oreo mcflurrys mcdonald employe,MCD,0.0
2018-08-22,mcdonald eats meal after half hour hands cramp fred sanford,MCD,-0.1041666666666666
2018-08-22,septicdevotee course mcdonald mcloughlin famous jacksepticeye funniest home videos star only ronald,MCD,0.25
2018-08-22,animehiphop nothing normal mcdonald qakubqwfpq,MCD,0.15
2018-08-22,neither mcdonald burger king best fast food nothing better than chicken fried,MCD,1.0
2018-08-22,markmayerson read books screenwriting storytelling brian mcdonald invisible among best,MCD,0.0
2018-08-22,homeless hired mcdonald after police officer helped shave beard interview movingu,MCD,0.0
2018-08-22,burger king mcdonald,MCD,0.0
2018-08-22,shindags during hurt mcdonald mchurt,MCD,0.0
2018-08-22,uberfacts caesar salad mcdonald calories salt than double,MCD,0.1666666666666666
2018-08-22,capscapsforsale saturday agenda filled iconic oldest establishments oldest operating mcdonald downey,MCD,0.45
2018-08-22,roadscholarz latest step reliance long history bullying back least scuttling hamish mcdonald biography,MCD,0.0375
2018-08-22,interview mcdonald thailand hester chew proclaimed pleasure results,MCD,0.0
2018-08-22,mcdonald berck nord,MCD,0.0
2018-08-22,emmy keri russell them mcdonald,MCD,0.0
2018-08-22,mcdonald mishref asimah,MCD,0.0
2018-08-22,mcdonaldscorp mcdonald franchisees remove barriers employment million young people globally giving,MCD,0.05
2018-08-22,mcdonald whopper sherwin williams dutch,MCD,0.0
2018-08-23,carltonautism donald trump mcdonald melania northern italy plays barron,MCD,0.1
2018-08-23,animehiphop nothing normal mcdonald qakubqwfpq,MCD,0.15
2018-08-23,mcdonald pontian johor smyejpsphv,MCD,0.0
2018-08-23,albertchesterjr found beautiful flower mcdonald drive thru griffith indiana,MCD,0.85
2018-08-23,countdown braincell mcdonald,MCD,0.0
2018-08-23,yeah denver airport someone bought mcdonald business food allowan,MCD,0.0
2018-08-23,jxmmi worked todd star olive garden factories mcdonald couldn empty pockets,MCD,-0.05
2018-08-23,robgotobed told mcdonald tell them birthday,MCD,0.0
2018-08-23,missamyvarle mcdonald homelesspolice friend florida says hello check,MCD,0.0
2018-08-23,respond email mcdonald donotreply address area supervisor contacte,MCD,0.0
2018-08-23,jvywrxght guess never jane finch mcdonald runs sweet sour sauce,MCD,0.0999999999999999
2018-08-23,scalzi mcdonald hater checking,MCD,0.0
2018-08-23,humaneleagueuk mcdonald security were lovin delivered giant unhappy meal signatures asking chang,MCD,-0.3
2018-08-24,animehiphop nothing normal mcdonald qakubqwfpq,MCD,0.15
2018-08-24,remember mcdonald environment looks little styrofoam,MCD,0.0
2018-08-24,mcdonald bagged spot sweet featuring maine mendoza sweet,MCD,0.35
2018-08-24,comfortablysmug mcdonald nothing about cream machine working,MCD,0.0
2018-08-24,kyleplantemoji drive thru speaker welcome mcdonald what vague sobbing speaker sigh,MCD,1.0
2018-08-24,wendys mcdonald talking shit,MCD,-0.25
2018-08-24,friend text salads mcdonald ohio making sick trying think haven rtvtqcrxmw,MCD,-0.7142857142857143
2018-08-24,wait promised mcdonald didn,MCD,0.0
2018-08-24,nunyaaaaaaaaa cute taking keep saying mcdonald,MCD,0.5
2018-08-24,calls kids meals mcdonald doing happy hour yeah thinking definitely mine,MCD,0.3
2018-08-25,beautifulcelebz mcdonald subway,MCD,0.0
2018-08-25,animehiphop nothing normal mcdonald qakubqwfpq,MCD,0.15
2018-08-25,people carry ketchup them people carry maple syrup them carry whole fucking mcdonald,MCD,0.0
2018-08-25,humaneleagueuk mcdonald security were lovin delivered giant unhappy meal signatures asking chang,MCD,-0.3
2018-08-25,concludes class chicago trendy mcdonald tripe heart file piece,MCD,0.6
2018-08-25,normsrespecter notice mcdonald mascot clown joker makes think pretty fucked,MCD,-0.175
2018-08-25,bullshit work mcdonald church laws lack male parenting,MCD,0.0
2018-08-26,chapman flip mcdonald american dunk contest,MCD,0.0
2018-08-26,historytolearn mcdonald toys,MCD,0.0
2018-08-26,pondhockeypro mcdonald sauce make mcdonald home dont think,MCD,0.3
2018-08-26,wendys dollar cone mcdonald instead,MCD,0.0
2018-08-26,mcdonaldshawaii hawaii mcdonald hurricane pricing kailua mcdonald gouging,MCD,0.0
2018-08-26,mcdonald iconic happy meal evolving since introduced nearly years options changed,MCD,0.4666666666666667
2018-08-26,animehiphop nothing normal mcdonald qakubqwfpq,MCD,0.15
2018-08-26,mcdonald,MCD,0.0
2018-08-27,historytolearn mcdonald toys,MCD,0.0
2018-08-27,moment decided life worth living fast food worker mcdonald,MCD,0.025
2018-08-27,porto foodies architecture beautiful mcdonald world crystal chandeliers,MCD,0.675
2018-08-27,cerromerussell woman horny joke suck mcdonald milkshake pull dude horny joke horny,MCD,0.065079365079365
2018-08-27,chuckwoolery worked mcdonald sucked asshole what point people sick,MCD,0.0
2018-08-27,sharestv released first episode parents mcdonald money saottwthcx,MCD,0.325
2018-08-27,mcdonald,MCD,0.0
2018-08-27,burger king mcdonald,MCD,0.0
2018-08-28,trump dies only place flag half staff mcdonald,MCD,0.2111111111111111
2018-08-28,didn mean people come across mcdonald halal what confusing,MCD,-0.30625
2018-08-28,pkmnmasterholly welcome japan mcdonald centers sponsored gyms raid lobbies packed trainers,MCD,0.8
2018-08-28,animehiphop nothing normal mcdonald qakubqwfpq,MCD,0.15
2018-08-28,teprometolr mcdonald luansantana luansantanatv luanetes,MCD,0.0
2018-08-28,soda mcdonald burger king actually tastes different todayshow,MCD,0.0
2018-08-29,trump dies only place flag half staff mcdonald,MCD,0.2111111111111111
2018-08-29,pumpkin spice hype legitimately surprised mcdonald never made pumpkin spice milksha,MCD,0.1
2018-08-29,yonkouprod shonen jump issue piece mcdonald free burger purchasing jump using ticket included,MCD,0.0
2018-08-29,maywardofficial flyers august mcdonald store avail whatever maywardformcdo newest endorsement,MCD,0.0
2018-08-29,immediate positions closer weidman mcdonald location offer great great benefits,MCD,0.0
2018-08-29,stabbyclown realdonaldtrump according dribble everything rigged exception news mcdonald,MCD,0.0
2018-08-29,piece mcdonald allez mcdonald burger king,MCD,0.0
2018-08-29,anime interest collaboration gives shonen jump readers free mcdonald hamburger digital manga shueisha shonen jump maga,MCD,0.2
2018-08-29,mcdonald,MCD,0.0
2018-08-30,thiccerbeef pick side mcdonald wendy cahowcwgvw,MCD,0.0
2018-08-30,maywardofficial flyers august mcdonald store avail whatever maywardformcdo newest endorsement,MCD,0.0
2018-08-30,yonkouprod shonen jump issue piece mcdonald free burger purchasing jump using ticket included,MCD,0.0
2018-08-30,sihyun mcdonald face kimsihyun sihyun yuehua,MCD,0.1363636363636363
2018-08-30,told boys were good salon mcdonald happy meals never leave,MCD,0.75
2018-08-30,existentialcoms time fifteen years dude front mcdonald ordered medium rare sometim,MCD,0.15
2018-08-30,monkey escapes flees mcdonald news,MCD,-0.05
2018-08-31,emandeleon actors maymayentrata edwardbarber mcdonald makeup emandeleonmakeup hairstyling jaymarlahaylahay,MCD,0.0
2018-08-31,maywardofficial time play cool mcdonald evangelista makati store what pick maywardva,MCD,0.546875
2018-09-01,retweet chance winning adidas team entry closes,MCD,0.0
2018-09-01,ebay deal discount blue bloods complete eighth season brand,MCD,0.0
2018-09-01,emandeleon actors maymayentrata edwardbarber mcdonald makeup emandeleonmakeup hairstyling jaymarlahaylahay,MCD,0.0
2018-09-01,mcdonald mateo august ready mcdosanmateo mcfreeze coming soon,MCD,0.1681818181818181
2018-09-01,mega laptop special samsung galaxy note stuff india september issue dyson,MCD,0.2
2018-09-01,jantaste mcdonald comeste,MCD,0.0
2018-09-01,saturdaymorningcartoons world greatest superfriends adventures mightymouse lxrrdwhadc,MCD,0.0
2018-09-01,live japan first sponsored locations mcdonald trend,MCD,0.0
2018-09-01,weregeek thing ebay ohhhhh about forever,MCD,0.8
2018-09-01,millsbw saturdaymorningcartoons spiderwoman popeye hour adventures flashgordon,MCD,-1.0
2018-09-01,digital empire armageddon various artists discs ebay,MCD,-0.0166666666666666
2018-09-01,friend told ryanair changed luggage politics confused than before,MCD,0.0
2018-09-02,drivers photographs,MCD,0.25
2018-09-02,queenklttykat silent tributes best tributes keep them coming losers fearlesscollins gmail cash goddess,MCD,0.25
2018-09-10,solving mystery mcdonald famous jingle lovin felizlunes vonvon,MCD,0.5
2018-09-10,original slogan comes alive translated into chinese brings ancestors back grave,MCD,-0.4
2018-09-10,people were shot mcdonald people were shot people were shot,MCD,0.0
2018-09-10,check email member board directors wrote kathygriffin begging trump mercy,MCD,-0.5
2018-09-10,officialjoelf mcdonald testing international menu south florida mcspicy chicken hong kong grand mcextreme,MCD,-0.0333333333333333
2018-09-10,what looks inside massive pretoria factory which produces luxury suvs hour bisouthafrica,MCD,0.15
2018-09-10,toyotasa ultimate prize ultimate hero ultimate freedom ultimate toyota fortuner,MCD,0.15
2018-09-10,food companies whole foods nestle losing ceos,MCD,0.15
2018-09-10,propriator support small business custom made coquina shell band genuine blue suede leather fouambgenj,MCD,0.15
2018-09-10,cointelegraph report citigroup offer crypto based product institutional,MCD,0.0
2018-09-10,alexweprin providing moonves office services security services years resignation,MCD,0.0
2018-09-10,citigroup custodian held cryptocurrency sources claim,MCD,0.2458333333333333
2018-09-10,christhedj uber driver picking supermarket took mcdonald watched through drive thru,MCD,0.0
2018-09-10,toyota highlander take look,MCD,0.0
2018-09-10,mendesnotices finished first worked adobe after effect long manon,MCD,0.0
2018-09-10,original manchester chelsea samsung mobile liverpool carlsberg arsenal those were,MCD,0.0
2018-09-10,card declined mcdonald cheeseburger called bank front everyone held queue mins,MCD,0.0
2018-09-10,black color original cartridges cartridges deskjet envy,MCD,0.0
2018-09-10,junkyardblonde vintage otagiri shell pitcher coastal home decor black pottery pitcher gold gilt shell nautical decor,MCD,0.0
2018-09-10,julie chen wife departed takes time talk,MCD,0.0
2018-09-10,stiff competition stellar bitcoin cryptocurrency cryptonews,MCD,0.0
2018-09-10,ebay unitek sata adapter cable external hard drive,MCD,0.0
2018-09-10,fiame skin tight white shirt super skinny ripped jeans adidas ultra boost girls club gonna,MCD,0.0
2018-09-10,indiadominique overheard mommy after taking little fuckers anywhere,MCD,0.0
2018-09-10,ruminmycoffee want only extra entries notifications show proof,MCD,0.0
2018-09-10,technology software never ages remote software upgrade software upgrades install ynolggqwtm,MCD,-0.4
2018-09-10,judywoodruff women inside news reluctant speak investigators says ronanfarrow state probe into,MCD,0.0
2018-09-11,uberdick mcdonald angus beef quarter pounder think shit,MCD,0.0242694805194805
2018-09-11,bittrscrptreadr ncis sized ratings live streamed what offices everyone reacts,MCD,0.0
2018-09-11,months overlooked warning signs moonves metoo moment infighting hampered ability rumors,MCD,0.0
2018-09-11,reuters julie chen wife departed takes time talk,MCD,0.0
2018-09-11,chloe wear adidas ootd everywhere tour broke,MCD,0.0
2018-09-11,loomered sticks label calling investigative journalist laura loomer protester diminish impact,MCD,0.5083333333333333
2018-09-11,pixelatedboat hijack northwest states extort ransom before escaping parachute,MCD,0.0
2018-09-11,jmattpugh grocery water aisle florence pack perrier anyone wants hurricaneflorence florence,MCD,0.0
2018-09-11,people carry ketchup them people carry maple syrup them carry whole fucking mcdonald,MCD,0.0
2018-09-11,entered through exit iamspartacus,MCD,0.15
2018-09-11,limgwvil retweet coca cola mgwv,MCD,0.0
2018-09-02,want improve sales strategies guarantee profit ebay ecommerce sales marshacollier,MCD,0.0
2018-09-02,fancy winning samsung galaxy note simply reply answer question below sunday chance,MCD,0.0
2018-09-02,based website builder converts hand drawn sketches html reddit,MCD,0.0
2018-09-02,mcdonald mccafe batu caves selangor,MCD,0.0
2018-09-02,santander location milton keynes make decisions matter while protecting customers grea,MCD,0.0
2018-09-02,animehiphop nothing normal mcdonald qakubqwfpq,MCD,0.15
2018-09-02,budweiser heineken effect,MCD,0.0
2018-09-02,sneakertweetshq butter adidas yeezy boost rumored restock read,MCD,0.25
2018-09-02,noone mcdonald think happy meal only place take,MCD,1.0
2018-09-02,want learn about trumprussia check list investigators community investigative,MCD,0.0
2018-09-02,enter chance millennium origin during gamer days originpcfamily intelgamerdays,MCD,0.0
2018-09-02,commonly overheard california mcdonald vegan anus boneless anus everyone asking friend,MCD,-0.3
2018-09-02,brennentaylor mcdonald mukbang homeless skid listen mans words incredible,MCD,0.0
2018-09-03,soleindividual closer look breathe walk adidas read,MCD,0.0
2018-09-03,adage watch newest schick squarespace mcdonald,MCD,0.5
2018-09-03,seattletimes billionaire seahawks owner founder paul allen donated group aiming keep republicans,MCD,0.8
2018-09-03,reuters reporters investigating rohingya muslim killings sentenced years jail violating myanmar,MCD,0.0
2018-09-03,machinegunkelly eminem submachine find mcdonald stan,MCD,0.0
2018-09-03,mcdonald,MCD,0.0
2018-09-03,partner fund management healthcare stake aviva lowered american,MCD,0.4533333333333334
2018-09-03,girl baby tebogopinkygirl duma ngwana leaving,MCD,0.2071428571428572
2018-09-03,everyone knows mcdonald fake need franchise already before kills mickey,MCD,-0.5
2018-09-03,theatlantic mcdonald given every workers raise money spent buybacks annie lowre,MCD,-0.1
2018-09-03,jesse james steelers fine roll vance mcdonald injury absence same noted,MCD,0.2020833333333333
2018-09-04,echowhatson these products urgently recalled lidl tesco asda sainsbury safety fears,MCD,0.0
2018-09-04,jackson pulling jype white audi gshsjs audis yugyeom black audi,MCD,0.0
2018-09-04,thaneofmordor hello notice list sorry forgot ebay list first interest those dvds,MCD,-0.0499999999999999
2018-09-04,need link current mixer done,MCD,0.0
2018-09-04,wants human records,MCD,0.0
2018-09-04,position lecturer arabic language colgate university middle eastern studies,MCD,0.0
2018-09-04,sierrasystems showcasing dynamics azure machine learning help transform business regis,MCD,0.4
2018-09-04,mcdonald bathrooms dominate august headlines digsignagetoday,MCD,0.0
2018-09-04,lucky suite products work together address these outage causing problem,MCD,-0.2
2018-09-04,lovin thought poster prank hoodwinks mcdonald,MCD,0.0
2018-09-04,khou friends wanted representation pearland mcdonald creative htownrush,MCD,0.5
2018-09-04,friends hung poster themselves mcdonald noticed weeks,MCD,0.0
2018-09-04,tpvtrevor upcoming conservative protests dustbin history starbuck,MCD,0.8
2018-09-04,luvgodncountry cbsnews fake news half story what wrong trying start civil,MCD,0.0
2018-09-04,friends prank mcdonald poster unnoticed days,MCD,-0.2
2018-09-04,update early enough watch redsox take field front happy,MCD,0.0
2018-09-04,ebay cyberpower smart sinewave system outlets,MCD,0.0
2018-09-04,tpvtrevor upcoming conservative protests dustbin history starbuck,MCD,0.0
2018-09-04,merajurr vodafone never,MCD,0.0
2018-09-05,usalovegod mueller accept trump written answers russia probe questions york times article reuters,MCD,0.1363636363636363
2018-09-05,mabuhay mcdonald friends prank mcdonald poster unnoticed days vdzlepmibv,MCD,-0.2
2018-09-05,sxdoc annvandersteel steele truth former officers tell about suppression distortion information real reporters,MCD,0.8
2018-09-05,altsxanax giveaway full access unmigrated capas optifine tarjetas metodo,MCD,0.0
2018-09-05,days long poster hanging local mcdonald noticed blank wall mcdonald,MCD,-0.025
2018-09-05,tpvtrevor upcoming conservative protests dustbin history starbuck,MCD,0.0
2018-09-05,serenjiminah fastest kpop group fastest kpop group fastest kpop,MCD,0.0
2018-09-05,piece phone case samsung friend love,MCD,-0.5
2018-09-05,hello guys chance absolutely free gift card,MCD,0.0
2018-09-05,thanking obama killing laden into mcdonald thanking ronald mcdonald hamburger,MCD,0.0
2018-09-05,maddieeeemoon someone watch adidas ultra boosts whole wardrobe,MCD,-0.7142857142857143
2018-09-05,sensanders walton family wealthiest family country worth nearly billion meanwhile pays,MCD,0.0
2018-09-05,zero nissan rogue back camera bluetooth owner carfax,MCD,0.0
2018-09-05,oldhondacivic mcdonald delivery sees please write cute note time order,MCD,0.0
2018-09-05,retailwire wants make home town tech spot innovation retail,MCD,0.0
2018-09-05,joshbloch true hope production make same rule production,MCD,0.0
2018-09-05,mcdonald loving,MCD,0.2857142857142857
2018-09-05,sensanders mcdonald find money spend billion buybacks find money workers,MCD,0.0
2018-09-05,playstation years worth games catalog along stuff beyond nostalgia literally,MCD,1.0
2018-09-06,found dope life hack mcdonald fast food chain water workers,MCD,0.0
2018-09-06,selling honda civic great commute info,MCD,0.0
2018-09-06,hedenkamphusky come join mcdonald sunbow happy mcteachers,MCD,0.0
2018-09-06,thanking obama killing laden into mcdonald thanking ronald mcdonald hamburger,MCD,0.0
2018-09-06,sensanders mcdonald find money spend billion buybacks find money workers,MCD,0.0
2018-09-06,nice ride nasa shorter need mcdonald nasasls,MCD,0.6
2018-09-06,examdump download sales expert please,MCD,0.0
2018-09-06,osascruz samsung nigeria luck someone think,MCD,0.0
2018-09-06,atlas transportation command flight heading west,MCD,0.6000000000000001
2018-09-06,cnnphilippines filipinos hung poster mcdonald texas make point about representation weeks,MCD,0.0
2018-09-06,actbrigitte make national security abundantly simple chain migration diversity lottery implement merit,MCD,0.0
2018-09-06,laquan mcdonald family wants peace matter outcome trial officer killed,MCD,0.0
2018-09-06,laptop computer turion camera work ebay kgdknqtgfi,MCD,-0.2
2018-09-06,solelinks women adidas falcon multicolor selling tgwo,MCD,0.7000000000000001
2018-09-06,thetrailerbot video sony pictures entertainment mackenzie comedian skills gong show,MCD,0.3125
2018-09-06,espn tiger woods championship live espn cvfnnuvpyx,MCD,0.0
2018-09-06,jamesstevenson insomniacgames wish bought collector edition least ebay,MCD,0.0
2018-09-06,universeice galaxy does adopt major change design samsung completely defeated huawei damage,MCD,0.2722222222222222
2018-09-06,patblanchfield remember worked closely nazis develop punch card census technology literally instrume,MCD,0.2722222222222222
2018-09-06,ashposton donna harvey suits ross rachel friends mike rachel suits cassie cole monkeys hermione,MCD,0.2722222222222222
2018-09-06,didollaa adidas jersey crackhead,MCD,0.0
2018-09-06,perfimperfct samsung galaxy protip battery works bestbuy,MCD,0.2722222222222222
2018-09-06,mppregent officers being asked commanders resp attack answer possibly isis,MCD,0.0
2018-09-06,seeing burt reynolds hanging sportscasters local channel rare treat about xhlpaltzib,MCD,0.06
2018-09-07,book mcdonald vienna useless irish garbage obama insurance stupid,MCD,-0.1333333333333333
2018-09-07,blue jackets extend officials reuters bluejacketsnhl,MCD,0.0
2018-09-07,mcdonald worker syndrome celebrates years years bringing smiles customers,MCD,-0.1555555555555556
2018-09-07,stomainateacup colitistoostomy shell wise young worry about daughter though flown nest,MCD,0.0
2018-09-07,omespino writeup love story closed informative stored yahoo mail short story about,MCD,0.2722222222222222
2018-09-07,calories mcdonald burger king burger,MCD,0.5
2018-09-07,sensanders mcdonald find money spend billion buybacks find money workers,MCD,0.0
2018-09-07,vodafone strategy team need beat give idea vodafone,MCD,0.6
2018-09-07,iphone first strongbow dark fruits noise cancelling headphones mcdonald double cheeseburger,MCD,0.0333333333333333
2018-09-07,reported shooting investigation mcdonald hampton,MCD,0.0
2018-09-07,russdiemon free event pullin nissan roswell high school parking standing,MCD,0.0
2018-09-07,audisouthafrica confident companion business leisure audi register interest,MCD,0.0
2018-09-07,messiquote adidas greatest matter what retweet show support team messi,MCD,0.0
2018-09-08,mrbcyber face china together envoy brussels tells reuters,MCD,0.0
2018-09-08,retronewsnow debut shazam starring michael gray jackson bostwick premiered years september,MCD,0.3181818181818182
2018-09-08,general however cold mcdonald fries delightful,MCD,0.05
2018-09-08,mcdonald maccoin anniversary marked unique currency,MCD,0.1583333333333333
2018-09-08,added video youtube playlist sweden stockholm arlanda terminal take easyjet berlin,MCD,0.5
2018-09-08,breaking cory booker poised reveal mcdonald secret sauce recipe anonymous sources,MCD,-0.4
2018-09-08,naijaflyingdr gave warren buffet started company worth omaha worlds,MCD,0.0
2018-09-08,reuters reported ordered thousands idps return unsafe region borno state because pending elect,MCD,0.0
2018-09-08,mcdonald ketchup craving,MCD,0.1363636363636363
2018-09-08,nickswardson fast food cravings only couple things mcdonald sausage cheese mcmuffin nbissdreya,MCD,0.1
2018-09-08,korndiddy keith attempts cook gourmet meal using only mcdonald happy meal ingredients dumpanada,MCD,0.4
2018-09-09,rxhun youngflymouthog mcdonald,MCD,0.2857142857142857
2018-09-09,jonostrower rolled first static test airframe late friday cover darkness,MCD,0.0
2018-09-09,days easy happy days cheers happy hour spend,MCD,-0.1499999999999999
2018-09-09,check plush stuffed animal plush alien life form hawaiian shirt tags ebay,MCD,0.0
2018-09-11,pyrefliesx statement thinks only releasing songs makes sense ajrijwrq,MCD,0.0
2018-09-11,stephaniebe complaining minimum wage cashier meaning after,MCD,-1.0
