Date,Tweet,Ticker,Score
2020-07-02,mobil currently highest dividend yield dividend aristocrats,XOM,1.001606583595276
2020-07-02,company profile fundamental analysis score update score stockmarket invest,XOM,0.0434412471950054
2020-07-03,honda civic,XOM,0.0881517305970192
2020-07-03,both civic owner,XOM,-0.040300790220499
2020-07-03,honda civic,XOM,0.0587699636816978
2020-07-03,robinivski sbalatan similar company every quarter send check supporting them trolling elon,XOM,0.7292150259017944
2020-07-03,mobil options maxpain chart open interest chart update optionstrading optionsflow optionstrade optiontrading stockmarket invest qhcdllrzfx whqnyciufs,XOM,0.5046553611755371
2020-07-03,correcto mick,XOM,0.8921825885772705
2020-07-03,mobil analysis july good opportunity,XOM,0.614559531211853
2020-07-03,qcontrarian good second straight loss guidance suggesting potential loss natural,XOM,-1.0358930826187134
2020-07-03,good second straight loss guidance suggesting potential loss natural unit took debt expected around gotta oott investments,XOM,-0.9916043281555176
2020-07-03,need good news headlines changing world surpassing expectations while deep losses less value leaveitintheground start drivingonsunshine,XOM,0.5096758604049683
2020-07-03,matters read take major naturalgas industry headlines around world democrats biden oott ongt brazil germany energytransition,XOM,-0.0365184135735034
2020-07-03,exxonmobil flags earnings wall street calls asset write downs full story oott ongt,XOM,-0.5264556407928467
2020-07-03,everyone direct deposit helps,XOM,0.8144502639770508
2020-07-03,mobil receives consensus rating hold analysts,XOM,-0.0073582753539085
2020-07-03,mobil given average recommendation hold brokerages oqezdxgtrx,XOM,-0.0346630327403545
2020-07-03,mobil receives consensus rating hold analysts mnsjoljmjd,XOM,-0.0073582753539085
2020-07-03,mobil expected sales billion,XOM,0.0750891044735908
2020-07-03,exxonmobil renews collaboration princeton energy center advance emission research energy solutions uhgafkcyda,XOM,0.1913962960243225
2020-07-03,timing forecast view sell bearish search timing forecast upper lower cttmbzrrpr wjipjjofpv,XOM,-1.057964324951172
2020-07-04,adamsinger hmeisler place stuck financing dividend through bond purchases dividend flat what worry,XOM,0.6379150152206421
2020-07-04,highschool taking elective course about learned about different exchanges paper traded program watch became intrigued teacher told invested decades checks,XOM,0.8937563896179199
2020-07-04,despite coronavirus balance sheet remains rock solid themotleyfool,XOM,0.9293313026428224
2020-07-04,love levels back paid straight years,XOM,0.9802312850952148
2020-07-04,despite coronavirus balance sheet remains rock solid themotleyfool,XOM,0.9293313026428224
2020-07-04,zacks brokerages expect mobil announce earnings,XOM,-0.8704837560653687
2020-07-04,zacks brokerages expect mobil announce earnings vfnbfetwoq,XOM,-0.8704837560653687
2020-07-04,mobil hold rating reaffirmed cowen,XOM,0.0199370123445987
2020-07-04,mobil rating reiterated cowen vbsvmmrmla,XOM,0.1660525649785995
2020-07-04,mobil rating reiterated cowen,XOM,0.1660525649785995
2020-07-05,mobil start outperforming,XOM,-0.7411576509475708
2020-07-05,mobil need portfolio,XOM,0.6024922132492065
2020-07-05,dvdnddiplomats example raise debt divie,XOM,0.2898751497268677
2020-07-05,downtrend drop because broke higher bollinger band june view odds indicators exxonmobil stockmarket technicalanalysis money daytrading news,XOM,-1.072337985038757
2020-07-05,mobil corp dividend impairment charges,XOM,-0.007553644478321
2020-07-05,consensus estimates mobil increased july newswires,XOM,0.8177764415740967
2020-07-05,mobil corp dividend impairment charges,XOM,-0.0164475962519645
2020-07-05,covid breakdown offering buying opportunity,XOM,0.9834470748901368
2020-07-05,already long adding current position reinvest dividends every unless unexpected expenses turn dividends cash things back reinvesting only done twice years,XOM,0.9681274890899658
2020-07-05,viscosityredux which brings issued earnings consideration within gently push earnin,XOM,0.6960002183914185
2020-07-05,seekingalpha mobil corp dividend impairment charges business,XOM,-0.0843940898776054
2020-07-05,mobil corp dividend impairment charges business economy,XOM,-0.0010641664266586
2020-07-05,debt exit putting debt assuming impairments without impairments expect highest debt ratio century debt acqd crossed threshold,XOM,0.8136310577392578
2020-07-05,warns refining losses results,XOM,-0.9676917791366576
2020-07-05,mobil earns hold rating cowen,XOM,0.2313235998153686
2020-07-05,richtechexec mean historically speaking head part cycle reluctantly,XOM,-0.7605334520339966
2020-07-06,forgot throw local exxonmobil station within feet makings portfolio companies know valuable because them everyday know only finds value them,XOM,0.89271080493927
2020-07-06,energy general correcting cycle march favoured downside find equal extremes before bounce occur holding march,XOM,0.7023712396621704
2020-07-06,optimus closed sold loss mobil corp corp stats,XOM,-1.029542326927185
2020-07-06,zacks brokerages expect mobil,XOM,-0.4531855881214142
2020-07-06,refuses write downs assets giants wrote assets give accurate valuation,XOM,0.3919531106948852
2020-07-06,billion sales expected mobil quarter,XOM,0.2157281041145324
2020-07-06,goldman analyst says sell mobil target large debt builds expensive valuation relative majors challenged free cash flow generation dividend coverage oott update efxcvwhyus,XOM,-0.7790690660476685
2020-07-06,mobil corporation support lower trendline ascending channel upgrades cwigzlxwzx,XOM,0.9383931159973145
2020-07-06,hour view midday update presented members efwyqfzobf elliottwave ftbkogqcbb,XOM,0.0193042680621147
2020-07-06,elliott wave view forecasting decline lower elliottwave,XOM,-1.0341211557388306
2020-07-06,bounces falls below high weakness towards target area lower before bounce take place elliottwave,XOM,-1.0678184032440186
2020-07-06,elliott wave view mobil pulling back elliottwave,XOM,0.0230946317315101
2020-07-06,hour view midday update showing reaction lower taking place blue area elliottwave,XOM,-1.010602593421936
2020-07-06,hour view update bounce managed reach blue area rejected expected elliottwave,XOM,-1.0441153049468994
2020-07-06,hour view weekend update ended waves peak made wave bounce elliottwave,XOM,0.4348121881484985
2020-07-06,ended waves cycle march peak made waves decline hour view update elliottwave,XOM,-1.0910528898239136
2020-07-06,mobil call volume above normal directionally bullish,XOM,0.8783444166183472
2020-07-06,stop loss,XOM,-1.0601285696029663
2020-07-06,mobil call volume above normal directionally bullish,XOM,0.8898981809616089
2020-07-06,optimus maximus shorted opened mobil corp corp chance loss hold stats,XOM,0.8542051315307617
2020-07-06,analysts mobil target,XOM,0.0526372268795967
2020-07-06,mobil receives consensus target brokerages,XOM,0.0752540230751037
2020-07-06,looking great,XOM,0.958762526512146
2020-07-06,seekingalpha watching looking wrong metric economy,XOM,-1.0698121786117554
2020-07-06,watching looking wrong metric economy stockmarket,XOM,-1.060262680053711
2020-07-06,downtrend decline result having broken higher bollinger band june view odds indicators exxonmobil stockmarket technicalanalysis money daytrading news imyeafzgwg,XOM,-1.0753153562545776
2020-07-06,cont downtrend intraweek combo chart,XOM,-1.0797125101089478
2020-07-06,javyandrade love think losing call credit card company probably waive adjust strategy moving forward glad mistake admit better,XOM,0.6393706798553467
2020-07-06,arrogant resists asset writedowns despite energy weakness,XOM,-1.033027172088623
2020-07-07,xozxro looking really appealing hope these words because think,XOM,0.9829185009002686
2020-07-07,swaggystocks bearish sentiment puts strike premium paid,XOM,0.1999121010303497
2020-07-07,looking really appealing hope these words because think,XOM,0.9849853515625
2020-07-07,falls option straddle implying move days,XOM,-0.800972580909729
2020-07-07,july,XOM,0.5122919082641602
2020-07-07,picked lowering average,XOM,-0.8098940849304199
2020-07-07,kylerhasson libertyrpf jerrycap kylerhasson hear below book value,XOM,-1.0095375776290894
2020-07-07,kylerhasson libertyrpf jerrycap best,XOM,0.9680871963500975
2020-07-07,bearish sentiment puts strike premium paid,XOM,0.9348219633102416
2020-07-07,hour view midday update presented members efwyqfzobf elliottwave,XOM,0.0193042680621147
2020-07-07,elliott wave view forecasting decline lower elliottwave,XOM,-1.0341211557388306
2020-07-07,bounces falls below high weakness towards target area lower before bounce take place elliottwave,XOM,-1.0685755014419556
2020-07-07,elliott wave view mobil pulling back elliottwave,XOM,0.0230946317315101
2020-07-07,hour view midday update showing reaction lower taking place blue area elliottwave,XOM,-1.010602593421936
2020-07-07,hour view update bounce managed reach blue area rejected expected elliottwave,XOM,-1.0441153049468994
2020-07-07,hour view weekend update ended waves peak made wave bounce elliottwave,XOM,0.4348121881484985
2020-07-07,ended waves cycle march peak made waves decline hour view update elliottwave,XOM,-1.0910528898239136
2020-07-07,seekingalpha mobil sell rallies economy,XOM,-0.928360104560852
2020-07-07,mobil sell rallies economy,XOM,-0.9504401683807372
2020-07-07,optimus maximus closed covered previously shorted profit mobil corp corp stats,XOM,0.7901986837387085
2020-07-07,moved below moving average june view odds indicators exxonmobil stockmarket technicalanalysis money daytrading news,XOM,-1.0162461996078491
2020-07-07,great episode thinking about while dude respect work navy something,XOM,0.9949209690093994
2020-07-07,exxonmobil bidaskscore lowered stronglysold nbofrwxhge,XOM,-0.9235539436340332
2020-07-08,directional bias mobil report click details zfbjwhimaa,XOM,-0.2814651727676391
2020-07-08,mobil report click sell,XOM,0.2153952419757843
2020-07-08,instrument area only recommend buying area reached elliottwave,XOM,0.980144739151001
2020-07-08,mindwbw basiljh speaks calls cents,XOM,0.0613748058676719
2020-07-08,mindwbw basiljh speaks news coming,XOM,0.0423232018947601
2020-07-08,commented mobil sell rallies,XOM,-0.6582822799682617
2020-07-08,cheddarflow calls opened premium,XOM,0.9320785999298096
2020-07-08,adding watch list,XOM,0.6284126043319702
2020-07-08,added list,XOM,0.3703152239322662
2020-07-08,buckquivas likely eddy given wouldn announce name probably head fake actually,XOM,-1.0669095516204834
2020-07-08,holding july puts setup guessing myself,XOM,-0.6464182138442993
2020-07-08,calls opened premium,XOM,0.968025803565979
2020-07-08,hour view midday update presented members efwyqfzobf elliottwave,XOM,0.0333166047930717
2020-07-08,hour view midday update presented members efwyqfzobf elliottwave,XOM,0.0193042680621147
2020-07-08,elliott wave view forecasting decline lower elliottwave,XOM,-1.0341211557388306
2020-07-08,elliott wave view mobil pulling back elliottwave,XOM,0.0230946317315101
2020-07-08,hour view midday update showing reaction lower taking place blue area elliottwave,XOM,-1.010602593421936
2020-07-08,hour view update bounce managed reach blue area rejected expected elliottwave,XOM,-1.0441153049468994
2020-07-08,hour view weekend update ended waves peak made wave bounce elliottwave,XOM,0.4348121881484985
2020-07-08,ended waves cycle march peak made waves decline hour view update elliottwave,XOM,-1.0910528898239136
2020-07-08,stats fall stockmarket stockstowatch nyse nasdaq dividendinvesting dividends optionstrading options pennystocks finance energy,XOM,-0.923015594482422
2020-07-08,bullish sentiment calls strike premium paid,XOM,0.9023401737213136
2020-07-08,closed loss,XOM,-1.06481671333313
2020-07-08,opposed inaccessible wealth govt says access without severe penalty nice pool etrade buying selling brings,XOM,0.9803181886672974
2020-07-08,cont downtrend intraweek combo chart,XOM,-1.0797125101089478
2020-07-08,downtrend decline result having broken higher bollinger band june view odds indicators exxonmobil stockmarket technicalanalysis money daytrading news geqpwvxxjr,XOM,-1.0753153562545776
2020-07-08,detected noticeable fall zeitgeist mobil corporation visit dataswarm information nyse dataswarm,XOM,-0.985409140586853
2020-07-08,timing forecast view sell bearish search timing forecast upper lower,XOM,-1.057795166969299
2020-07-08,puts alerted peak after alert progress,XOM,0.8801686763763428
2020-07-08,puts alerted peak after alert progress gukpnfedfs,XOM,0.8824416399002075
2020-07-08,peak profit expired option alerts sivxvtjadp zcidriwdwk,XOM,0.699190616607666
2020-07-08,months option alerts peaked above after were triggered algo sivxvtjadp,XOM,0.9227344989776612
2020-07-08,view historical options performance sivxvtjadp,XOM,0.1098226979374885
2020-07-09,guys were pumping changed position already,XOM,0.1231188401579856
2020-07-09,settled support rwfrksfhty,XOM,0.7616102695465088
2020-07-09,latest hour chart members showing proposed path lower taking place elliottwave,XOM,-1.020873785018921
2020-07-09,hour chart members showing proposed path lower elliottwave,XOM,-1.0207065343856812
2020-07-09,sideways since indices breaking range finally reaching blue buying area minimum waves bounce happening bvokluzugc,XOM,0.8549121618270874
2020-07-09,arapen application trademark filed mobil corporation arapen,XOM,0.0231618173420429
2020-07-09,upfinacom,XOM,-0.031235247850418
2020-07-09,come only promises statusquojoe keeps ultras company only responsibility shouldn days paying taxes joebiden suuuure believe joebiden schoolsreopening,XOM,-0.3268203437328338
2020-07-09,bearish sentiment puts strike premium paid,XOM,0.9276958703994752
2020-07-09,options flow grid update optionstrading mobil optionsflow stockmarket energy oilandgas oilprices oilprice,XOM,0.2107540220022201
2020-07-09,stops triggered earlier,XOM,-1.0613776445388794
2020-07-09,interest volume diff purchase,XOM,0.316673070192337
2020-07-09,recent technical alerts doji bullish plus alerts,XOM,0.3342610001564026
2020-07-09,hour view update presented members efwyqfzobf elliottwave,XOM,-0.0008323676884174
2020-07-09,hour view midday update presented members efwyqfzobf elliottwave,XOM,0.0193042680621147
2020-07-09,elliott wave view forecasting decline lower elliottwave,XOM,-1.0341211557388306
2020-07-09,bounces falls below high weakness towards target area lower before bounce take place elliottwave,XOM,-1.0672236680984497
2020-07-09,elliott wave view mobil pulling back elliottwave,XOM,0.0230946317315101
2020-07-09,hour view midday update showing reaction lower taking place blue area elliottwave,XOM,-1.010602593421936
2020-07-09,hour view update bounce managed reach blue area rejected expected elliottwave,XOM,-1.0441153049468994
2020-07-09,hour view weekend update ended waves peak made wave bounce elliottwave,XOM,0.4348121881484985
2020-07-09,ended waves cycle march peak made waves decline hour view update elliottwave,XOM,-1.0910528898239136
2020-07-09,making stockmarket oilandgas,XOM,-0.5940930843353271
2020-07-09,zone,XOM,0.9737592935562134
2020-07-09,delta expiration maxpain options oglmdjmlye,XOM,-0.0252184718847274
2020-07-09,commented mobil sell rallies,XOM,-0.6582822799682617
2020-07-09,incarceratedbob,XOM,-0.8505351543426514
2020-07-09,bullish,XOM,0.950265407562256
2020-07-09,orionstafa closed below support move continues looking august puts first target,XOM,-1.0760056972503662
2020-07-09,closed below support move continues looking august puts first target stop loss,XOM,-1.088142156600952
2020-07-09,moved below moving average june view odds indicators uhcpzwkhir exxonmobil stockmarket technicalanalysis money daytrading news,XOM,-1.0162461996078491
2020-07-09,bought,XOM,0.9460525512695312
2020-07-10,lynaldencontact gold outperformed including reinvested dividends since buffett wrote rather,XOM,0.7580273151397705
2020-07-10,mobil resumes drilling guyana bloomberg,XOM,-0.865747332572937
2020-07-10,lynaldencontact look back beginning growth rate peaked gold outperformed,XOM,0.7201062440872192
2020-07-10,throwback comment trough cycle real advantages project costs coming resulting lower capacity additions available catch cycle upswing,XOM,0.985066294670105
2020-07-10,june only closed position best same worse less than gain best because closed profitable closed time before entering worse because escape around profits,XOM,0.5611193180084229
2020-07-10,article biden wins presidency likely raise corporate rates around dividend aristocrats already high payout ratios,XOM,0.9718443155288696
2020-07-10,huge variation mobil corporation common,XOM,-0.9784797430038452
2020-07-10,look back beginning growth rate peaked gold outperformed nearly,XOM,0.8233945369720459
2020-07-10,gold outperformed including reinvested dividends since buffett wrote rather gold february great timing call because gold flush positive sentiment time years later gold ahead sfsdsvxmkb,XOM,0.9604804515838624
2020-07-10,huge variation mobil corporation common,XOM,-0.9784797430038452
2020-07-10,cadeinvests people look back didn upside appreciation waiting plus dividend current values,XOM,0.9751912355422974
2020-07-10,bought calls each contract breakeven make revenue every dollar above profit every dollar above,XOM,0.9703741073608398
2020-07-10,hour view midday update presented members efwyqfzobf elliottwave,XOM,0.0193042680621147
2020-07-10,elliott wave view forecasting decline lower elliottwave,XOM,-1.0341211557388306
2020-07-10,elliott wave view mobil pulling back elliottwave,XOM,0.0230946317315101
2020-07-10,hour view midday update showing reaction lower taking place blue area elliottwave,XOM,-1.010602593421936
2020-07-10,hour view update bounce managed reach blue area rejected expected elliottwave,XOM,-1.0441153049468994
2020-07-10,hour view weekend update ended waves peak made wave bounce elliottwave udfkyfdtlo,XOM,0.4348121881484985
2020-07-10,ended waves cycle march peak made waves decline hour view update elliottwave,XOM,-1.0910528898239136
2020-07-10,added leap calls,XOM,0.763505220413208
2020-07-10,justtradin haven traded since march close learned patient hide soon,XOM,0.8499256372451782
2020-07-10,stironingshirts partial sale after buying upper sold after couldn reach adding back couple weeks regain mojo,XOM,0.8720928430557251
2020-07-10,elliottforecast averaging,XOM,-1.0767942667007446
2020-07-10,downtrend sliding consecutive days july view odds indicators mzuqennpqs exxonmobil stockmarket technicalanalysis money daytrading news,XOM,-1.0750306844711304
2020-07-10,,XOM,-0.1027899831533432
2020-07-10,crazy crazy crazy wave extended since wave poop move,XOM,-1.102387547492981
2020-07-10,settled support rwfrksfhty,XOM,0.723802924156189
2020-07-10,falls option straddle expiring implies move,XOM,-0.8735812902450562
2020-07-10,crazy crazy crazy wave extended since wave poop move wave,XOM,-1.1035151481628418
2020-07-10,timing forecast view neutral bearish search timing forecast upper lower,XOM,-1.0613776445388794
2020-07-11,looks strong dividend payer mobil corp dividend impairment charges nyse fmyvtglhgr,XOM,0.9417060613632202
2020-07-11,trobertbenjamin december large bullish positioning inflation stagflation,XOM,0.9681137800216676
2020-07-11,december large bullish positioning inflation stagflation,XOM,0.9757046699523926
2020-07-11,mistercommodity chigrl speaking which,XOM,-0.4651505649089813
2020-07-11,uptrend ascend result having broken lower bollinger band july view odds indicators exxonmobil stockmarket technicalanalysis money daytrading news,XOM,0.856315016746521
2020-07-11,irbezek lynaldencontact easily reinvesting dividend gives massive against gold gold best feature,XOM,0.987746238708496
2020-07-11,lynaldencontact both poor investments gold overvalued back encountered prolonged stretch,XOM,-1.0646250247955322
2020-07-11,spike started road starts,XOM,0.9515818357467652
2020-07-12,negative sentiment social media mobil days learn,XOM,-1.0681321620941162
2020-07-12,hour view midday update presented members elliottwave,XOM,0.0193042680621147
2020-07-12,elliott wave view forecasting decline lower sllntbpdqr elliottwave,XOM,-1.0341211557388306
2020-07-12,elliott wave view mobil pulling back elliottwave,XOM,0.0230946317315101
2020-07-12,hour view midday update showing reaction lower taking place blue area elliottwave,XOM,-1.010602593421936
2020-07-12,hour view update bounce managed reach blue area rejected expected elliottwave lfshwzkmkk,XOM,-1.0441153049468994
2020-07-12,calls alerted peak after alert progress,XOM,0.8957732915878296
2020-07-12,peak profit expired option alerts sivxvtjadp,XOM,0.4421834945678711
2020-07-12,months option alerts peaked above after were triggered algo sivxvtjadp tvpkcsqnlk,XOM,0.9227344989776612
2020-07-12,view historical options performance sivxvtjadp,XOM,0.1098226979374885
2020-07-12,,XOM,-0.1181090921163559
2020-07-12,yielding ebitda pretty ridiculous take into consideration credit,XOM,-1.0491565465927124
2020-07-12,yielding ebitda pretty ridiculous take into consideration credit rating,XOM,-1.0768671035766602
2020-07-12,uptrend ascend result having broken lower bollinger band july view odds indicators exxonmobil stockmarket technicalanalysis money daytrading news,XOM,0.856315016746521
2020-07-12,bsmithtrades looks strong dividend payer mobil corp dividend impairment charges nyse,XOM,0.9538710117340088
2020-07-12,commented mobil sell rallies,XOM,-0.6582822799682617
2020-07-13,clean break support trend heading towards,XOM,0.9414001703262328
2020-07-13,mobil lowered,XOM,-0.94191312789917
2020-07-13,announce building electric truck move private island,XOM,-0.1891674697399139
2020-07-13,short puts strike premium paid,XOM,0.943738341331482
2020-07-13,recent technical alerts stochastic signal,XOM,0.92981219291687
2020-07-13,hour view update presented members efwyqfzobf elliottwave,XOM,-0.0007046535611152
2020-07-13,themoneypursuit moneysavvymind great idea same thing stable company come back eventually themoneypursuit,XOM,0.9737764596939088
2020-07-13,moneysavvymind bought dividends,XOM,0.9582853317260742
2020-07-13,bounces falls below high push lower towards target area before bounce take place elliottwave,XOM,-1.0588794946670532
2020-07-13,elliott wave view forecasting decline lower elliottwave,XOM,-1.0341211557388306
2020-07-13,elliott wave view mobil pulling back elliottwave,XOM,0.0230946317315101
2020-07-13,hour view midday update showing reaction lower taking place blue area elliottwave,XOM,-1.010602593421936
2020-07-13,hour view update bounce managed reach blue area rejected expected elliottwave,XOM,-1.0441153049468994
2020-07-13,hour view weekend update ended waves peak made wave bounce elliottwave,XOM,0.4348121881484985
2020-07-13,ended waves cycle march peak made waves decline hour view update elliottwave,XOM,-1.0910528898239136
2020-07-13,interest volume diff purchase,XOM,0.0446908324956893
2020-07-13,short puts strike premium paid,XOM,0.9341442584991456
2020-07-13,pullback downtrend intraweek combo chart,XOM,-1.0630935430526731
2020-07-13,coronavirus pandemic shows what mobil future look after november great dividend,XOM,0.983102560043335
2020-07-13,coronavirus pandemic shows what mobil future look after november economy,XOM,0.0239418894052505
2020-07-13,psar chart,XOM,0.1133578568696975
2020-07-13,orthereaboot good question favor sectors yields least temporarily instance obviously yields number regional banks range sure what,XOM,0.9568006992340088
2020-07-13,good declining lows sell highs looking head towards,XOM,0.9841262102127076
2020-07-13,uptrend ascend result having broken lower bollinger band july view odds indicators exxonmobil stockmarket technicalanalysis money daytrading news,XOM,0.856315016746521
2020-07-13,vigilant capital management position mobil,XOM,0.08322374522686
2020-07-13,brianferoldi invested exactly years automatically reinvested dividends sitting lost ground inflation hard pass,XOM,-0.9822394847869872
2020-07-13,mrdpaq brianferoldi long anything tank,XOM,0.3760810196399688
2020-07-13,brianferoldi though rank checklist financials moat potential customers,XOM,0.8038172721862793
2020-07-13,brianferoldi reference fact moats aren enough evidenced musk something effect,XOM,-0.494069904088974
2020-07-13,brianferoldi shame about held years finally sold free capital good loved dividends,XOM,0.9516487121582032
2020-07-13,brianferoldi long anything tank,XOM,0.4692864120006561
2020-07-13,timing forecast view sell bearish search timing forecast upper lower,XOM,-1.059552550315857
2020-07-13,though rank checklist financials moat potential customers revenue mgmt culture gauntlet disruption loser total score awful picture,XOM,-0.7105560302734375
2020-07-14,calls august expiration average contracts,XOM,-0.0147444084286689
2020-07-14,ogdylankelly spike started road starts,XOM,0.9706350564956664
2020-07-14,little little,XOM,-0.3176081478595733
2020-07-14,what think weeks months,XOM,-0.1049196347594261
2020-07-14,rising volume appearances since close days later worst best days later worst best days later worst best,XOM,-0.2433566898107528
2020-07-14,engulfing appearances since close days later worst best days later worst best days later worst best,XOM,-0.8227705955505371
2020-07-14,heard cube development plan permian game changer gocubeyourube,XOM,-0.0443363822996616
2020-07-14,musicandwork yeah laggards high flyers acting heavy willing grab think inflation pike,XOM,-0.8915410041809082
2020-07-14,volatility chart monday into opec meeting best charts,XOM,0.9767873287200928
2020-07-14,interest volume diff underlying,XOM,0.3851817548274994
2020-07-14,lots buys,XOM,0.9706016778945924
2020-07-14,options flow grid update optionstrading mobil optionsflow stockmarket energy oilandgas oilprices oilprice,XOM,0.726271390914917
2020-07-14,buys calls,XOM,0.7049942016601562
2020-07-14,stop sold alert discord,XOM,-1.0023754835128784
