Date,Tweet,Ticker,Score
2020-06-04,bear puts strike premium,XOM,0.9601662158966064
2020-06-04,exxonmobil delayed mozambique project come official,XOM,-0.825687050819397
2020-06-04,optimus maximus shorted opened mobil corp corp chance loss hold stats,XOM,0.8719910383224487
2020-06-04,mobil looking done great cutting costs tough environment looking solid long term play things back normal supported great dividend risk course dividend gets,XOM,0.9808018207550048
2020-06-04,another awesome another great huge wins keep momentum,XOM,0.9723224639892578
2020-06-04,themoneypursuit,XOM,0.844071626663208
2020-06-04,clean break plenty volume momentum upside higher,XOM,0.9844136238098145
2020-06-04,enters uptrend momentum indicator exceeded level view odds indicators exxonmobil stockmarket technicalanalysis money daytrading news,XOM,0.9005511999130249
2020-06-04,deenkamaljr wait another relatively speaking recover,XOM,0.6785304546356201
2020-06-04,deenkamaljr wait another relatively speaking recovered,XOM,0.7219971418380737
2020-06-04,seekingalpha mobil unfriendly management business,XOM,-0.4277128577232361
2020-06-04,best entry point smaller position txfarebkoh,XOM,-0.776124119758606
2020-06-04,mobil unfriendly management business,XOM,-0.3346147835254669
2020-06-05,brief educational video covers open position moving averages kept,XOM,0.2763333320617676
2020-06-05,,XOM,0.7316977977752686
2020-06-05,mobil settled upper resistance lurking,XOM,0.2391917556524276
2020-06-05,mobil settled upper resistance lurking,XOM,0.1950540691614151
2020-06-05,brief educational video covers open position moving averages kept currently,XOM,0.90931499004364
2020-06-05,carterbworth same thought room,XOM,0.0525073632597923
2020-06-05,options maxpain chart free options tzrjipipfz,XOM,0.1545801162719726
2020-06-05,options chart free hgyhiwulnm,XOM,0.210766315460205
2020-06-05,took rest money,XOM,0.8152254819869995
2020-06-05,above volume pattern appearances since performance close days later worst best days later worst best days later worst best,XOM,-0.2358631044626236
2020-06-05,major breakout pattern appearances since performance close days later worst best days later worst best days later worst best,XOM,-0.753277063369751
2020-06-05,minor breakout pattern appearances since performance close days later worst best days later worst best days later worst best,XOM,-0.7534036636352539
2020-06-05,soars gaining within single high volume sentiment bullish,XOM,0.967126965522766
2020-06-05,hackermanace keeps popping missed wasn trendspider doing reviews constantly pointing,XOM,-0.707839846611023
2020-06-05,cont uptrend intraweek combo chart,XOM,0.942351222038269
2020-06-05,bullish,XOM,0.9565486907958984
2020-06-05,incarceratedbob keep holding later summer,XOM,0.8901174068450928
2020-06-05,keep holding later summer,XOM,0.8826315402984619
2020-06-05,justinpulitzer having nice recovery short term close channel high longer term think prefer buying dips,XOM,0.9728730916976928
2020-06-05,incarceratedbob thanks hold,XOM,0.2965095937252044
2020-06-05,kaioken dirt,XOM,0.0399493053555488
2020-06-05,recent technical alerts upper bollinger band walk plus alerts,XOM,0.3371926844120025
2020-06-05,passivefool reminds bought cash proxy were bunch analyst reports buying meant deep value using stuff cash little income,XOM,0.9454615116119384
2020-06-05,whoa check,XOM,0.042976975440979
2020-06-05,good upside,XOM,0.9593901634216307
2020-06-05,having nice recovery short term close channel high longer term think prefer buying dips than chasing highs,XOM,0.9746462106704712
2020-06-05,keeps popping missed wasn trendspider doing reviews constantly pointing important chart setups which used confluence strategy eventually understand incorporate profitable,XOM,0.9360285997390748
2020-06-05,calls,XOM,0.0800125375390052
2020-06-05,calls sold half position hold free contracts months come,XOM,0.867925763130188
2020-06-05,lifetime during covid talking investments known oldmoney years patriarch matriarch family picking restaurant people sickwealth,XOM,0.9714133739471436
2020-06-05,bought dividend march sitting didn think fast unfortunately missed boat southwest airlines lose,XOM,-0.4153712689876556
2020-06-05,mobil,XOM,0.7341845035552979
2020-06-05,finally close loeykguxnz,XOM,0.1472235023975372
2020-06-05,related seeing action mext calls,XOM,0.6745442152023315
2020-06-05,sold,XOM,-1.017287015914917
2020-06-05,treating good,XOM,0.9518420696258544
2020-06-05,call worth time,XOM,0.933630347251892
2020-06-05,stop close sweet return money stockmarket options stockmarkets optionstrading,XOM,0.9431413412094116
2020-06-05,optimus maximus closed covered previously shorted loss mobil corp corp stats,XOM,-1.0681451559066772
2020-06-05,alert mobil corporation alert type percent change value dividend visit custom alerts,XOM,0.7899724245071411
2020-06-05,elliottforecast elliott wave view strength mobil elliottwave,XOM,0.8891948461532593
2020-06-05,watch technical video explaining structure taking place aornntwjjx elliottwave,XOM,-0.0383316911756992
2020-06-05,elliott wave view strength mobil elliottwave,XOM,0.9171253442764282
2020-06-05,resumed rally higher managed break above april peak opening bullish sequence march elliottwave,XOM,0.9566303491592408
2020-06-05,waves pullback into equal legs area buyers were waiting waves bounce take place least elliottwave,XOM,0.8288010358810425
2020-06-05,chart bghcdjquxd looking resume rally higher elliottwave,XOM,0.950757622718811
2020-06-05,chart june upside mobil elliottwave,XOM,0.9671918153762816
2020-06-05,enters uptrend momentum indicator exceeded level view odds indicators exxonmobil stockmarket technicalanalysis money daytrading news,XOM,0.9005511999130249
2020-06-05,elliott wave view strength mobil elliottwave zfufxmoqxo,XOM,0.9153637886047364
2020-06-05,latest chart strength mobil elliottwave qvburstgln,XOM,0.9320257902145386
2020-06-05,chart strength mobil elliottwave,XOM,0.9537795782089232
2020-06-05,nice breakout works holding pivot days look high long keeps holding believe coming weeks,XOM,0.9782878160476683
2020-06-05,fills galore higher target,XOM,0.9572291374206544
2020-06-05,shorts since because held above green line flipped long instead,XOM,0.811859130859375
2020-06-05,timing forecast view neutral bullish search timing forecast upper lower band,XOM,0.8501201868057251
2020-06-05,chart forex elliottwave fxsignals forexsignals pips tradingsignals,XOM,0.0632679015398025
2020-06-05,chart forex elliottwave fxsignals forexsignals pips tradingsignals woaoprluzw,XOM,0.0632679015398025
2020-06-05,chart forex elliottwave fxsignals forexsignals pips tradingsignals,XOM,0.0738041475415229
2020-06-05,mikedompierre mobil above resistance surging higher room oott oilandgas,XOM,0.8811434507369995
2020-06-05,mobil above resistance surging higher room oott oilandgas,XOM,0.799963116645813
2020-06-05,trendspider march fill already filled hasn watch tonight video,XOM,0.116887554526329
2020-06-05,march fill already filled hasn watch tonight video,XOM,0.1218621581792831
2020-06-06,coworker showing commonly bought dividend always reminds fund retirement good friend bought because afford time,XOM,0.9621678590774536
2020-06-06,idea think,XOM,0.2914570271968841
2020-06-06,exxonmobil bidaskscore increased sold,XOM,-0.5492279529571533
2020-06-06,javyandrade true issue debt divies,XOM,-0.0577031038701534
2020-06-06,javyandrade true issue debt divies,XOM,-0.050701942294836
2020-06-06,idea think,XOM,0.445632666349411
2020-06-06,approaching supply sell setup close above first time almost back,XOM,-1.0380852222442627
2020-06-06,duck looking wonder think break bollinger band spells doom obviously charting appreciate feedback,XOM,0.9395636320114136
2020-06-06,approaching supply sell setup close above first time almost back test confirm support bulls hold conviction please below caution bulls,XOM,-0.1329991966485977
2020-06-06,technical alerts upper bollinger band walk expansion breakout pocket pivot,XOM,0.1374112516641616
2020-06-06,enters uptrend because momentum indicator exceeded level view odds indicators exxonmobil stockmarket technicalanalysis money daytrading news,XOM,0.8954344987869263
2020-06-06,mobil world largest company recently world biggest companies biggest years,XOM,0.2669218182563782
2020-06-06,supermugatu alternatively send write everything,XOM,-0.2038239985704422
2020-06-06,options maxpain chart free options,XOM,0.1545801162719726
2020-06-06,makes outsized move option straddle implying move days,XOM,0.1581283509731292
2020-06-06,opec meeting,XOM,-0.0381511449813842
2020-06-06,chigrl clients finally happy,XOM,0.9630541801452636
2020-06-07,timing forecast view neutral bullish search timing forecast upper lower vdbhcgmepy mcjambfpbg,XOM,0.9007120132446289
2020-06-07,gqgeraldotrades support resistance opec extending cuts another energy indust,XOM,-0.2352139204740524
2020-06-07,watching trigger,XOM,0.2559142112731933
2020-06-07,investingwbrady what favorite long term,XOM,0.3424325883388519
2020-06-07,incarceratedbob plenty room invest chill,XOM,0.7242484092712402
2020-06-07,incarceratedbob plenty room invest chill,XOM,0.8105450868606567
2020-06-07,libertyrpf yourmtlbroker them were pretty good businesses start point moving businesses think opening yourself survivorship bias made mark leonard buying well,XOM,0.9518086910247804
2020-06-07,incarceratedbob holding through summer,XOM,0.3669173121452331
2020-06-07,plenty room invest chill,XOM,0.6818447113037109
2020-06-07,holding through summer,XOM,0.2385317534208297
2020-06-07,incarceratedbob,XOM,0.0259121842682361
2020-06-07,dividend payout june biggest positions around coming free mostly through rothira fill tank enjoy beautiful weekend sundaythoughts retireearly oldmoney,XOM,0.9869387149810792
2020-06-07,realmattmoney first dividend looking forward payout,XOM,0.9754359722137452
2020-06-07,optionsmike thoughts,XOM,-0.060902327299118
2020-06-07,chart chance thanks,XOM,0.3585249483585357
2020-06-07,jimcramer energy sector looks alive kicking,XOM,0.8583986759185791
2020-06-07,friday midday chart presented members shows extension higher elliottwave,XOM,0.9601483345031738
2020-06-07,chart june upside mobil elliottwave,XOM,0.9671918153762816
2020-06-07,productive jumping straight into strong territory nice pullback ideal enter against trend looking long because looks support strong these lvls,XOM,0.9750179052352904
2020-06-07,pain maturity maxpain options fecejwygif,XOM,0.0329960361123085
2020-06-07,enters uptrend because momentum indicator exceeded level view odds indicators exxonmobil stockmarket technicalanalysis money daytrading news,XOM,0.8954344987869263
2020-06-07,midday chart members shows extension higher elliottwave uvwtucodyn,XOM,0.964847445487976
2020-06-07,mobil higher,XOM,0.8794194459915161
2020-06-07,chart june upside mobil elliottwave,XOM,0.9671918153762816
2020-06-07,realmattmoney checked dividend payment supposed come payment,XOM,0.1890364289283752
2020-06-07,checked dividend payment supposed come payment expecting reinvestment dividends,XOM,0.8980633020401001
2020-06-07,reversemtgfl about rode unfortunately didn pick anymore because built huge position roth instead,XOM,-1.066490888595581
2020-06-08,view historical options performance sivxvtjadp,XOM,0.1098226979374885
2020-06-08,watch video explaining current structure taking place lkrosvhtif elliottwave crudeoil,XOM,-0.0339817740023136
2020-06-08,chart elliott wave view strength mobil elliottwave,XOM,0.9562429189682008
2020-06-08,found buyers blue area rallied highs elliottwave yvghqkkfuq,XOM,0.8383493423461914
2020-06-08,chart calling upside elliottwave,XOM,0.968834400177002
2020-06-08,major breakout pattern appearances since performance close days later worst best days later worst best days later worst best,XOM,-0.7542866468429565
2020-06-08,minor breakout pattern appearances since performance close days later worst best days later worst best days later worst best,XOM,-0.7489176988601685
2020-06-08,energy join rally stocknewsdotcom,XOM,0.9121663570404052
2020-06-08,theefinanceguy good questions know thinking does stay profitable well south,XOM,0.9865020513534546
2020-06-08,already joined surge read picks time,XOM,0.9664245843887328
2020-06-08,added list,XOM,0.7751997709274292
2020-06-08,cyclical industry argue heck downturn since peaked definitely massive balance sheet worried about growing debt load think,XOM,-1.0796270370483398
2020-06-08,behavioralmacro beginning since bottom,XOM,-0.9081974029541016
2020-06-08,bought,XOM,0.9636185169219972
2020-06-08,update eeuu research crudeoil,XOM,-0.0604658648371696
2020-06-08,investingwbrady long adding positions great company long time come,XOM,0.966500759124756
2020-06-08,update energy firms prepare resume gulf mexico output after storm passes,XOM,-0.1809048056602478
2020-06-08,mention,XOM,0.0585337728261947
2020-06-08,lotta calls,XOM,0.4175987541675567
2020-06-08,made pretty well calls looking play lovingthismarket,XOM,0.9605847597122192
2020-06-08,action usually makes sense lower crude,XOM,-1.0203598737716677
2020-06-08,extra pocket livelifetrading,XOM,0.7301130294799805
2020-06-08,sold calls holding couple months good enough time refuel cash bazooka,XOM,0.8134006261825562
2020-06-08,bull calls strike premium,XOM,0.9566948413848876
2020-06-08,call,XOM,0.0151472762227058
2020-06-08,better feeling than waking freshly printed calls,XOM,0.9250065088272096
2020-06-08,lower cant find sorry later saudis risk gains traction rather dips,XOM,-1.0126317739486694
2020-06-08,exit position,XOM,-0.4549272060394287
2020-06-08,strong hold puts overnight until change current trend,XOM,0.201851025223732
2020-06-08,investingwbrady increasing less dividend reinvestment,XOM,-0.727432370185852
2020-06-08,incoming,XOM,0.2716646194458008
2020-06-08,turbo swing alert update entry sell gain stop targets full analysis website cglfotwqsj,XOM,0.7311770915985107
2020-06-08,livesquawk exxonmobil refineries louisiana keep running through storm rtrs oott,XOM,-0.5375592708587646
2020-06-08,exxonmobil refineries louisiana keep running through storm rtrs oott,XOM,-0.6513164043426514
2020-06-08,watch video friday explaining bullish structure taking place elliottwave,XOM,0.9632827043533324
2020-06-08,elliott wave view strength mobil elliottwave,XOM,0.9117830991744996
2020-06-08,chart bghcdjquxd looking bounce higher blue area elliottwave lfkjdyxrev,XOM,0.7236237525939941
2020-06-08,mobil receives average rating hold analysts vikkxnvxco,XOM,-0.0250153690576553
2020-06-08,mobil receives average rating hold brokerages,XOM,-0.0125489197671413
2020-06-08,least room towards moving roughly level,XOM,-0.1687835305929184
2020-06-08,latest hour chart weekend update presented clients elliottwave,XOM,0.3311693370342254
2020-06-08,elliott wave view strength mobil elliottwave srxfpsmyzk,XOM,0.9157603979110718
2020-06-08,chart june upside mobil elliottwave,XOM,0.9671918153762816
2020-06-08,enters uptrend because momentum indicator exceeded level view odds indicators exxonmobil stockmarket technicalanalysis money daytrading news,XOM,0.8954344987869263
2020-06-08,chart june upside mobil elliottwave fyomdjdpda,XOM,0.9671918153762816
2020-06-08,elliottforecast june midday chart members shows extension higher elliottwave,XOM,0.9617692232131958
2020-06-08,best places join live updates chart analysis chat everything needs give,XOM,0.9911435842514038
2020-06-08,orionstafa looking calls retest back break levels,XOM,-1.01143217086792
2020-06-08,detected noticeable rise zeitgeist mobil corporation visit dataswarm information nyse dataswarm,XOM,0.9972690343856812
2020-06-08,june midday chart members shows extension higher elliottwave,XOM,0.9653664827346802
2020-06-08,looking calls retest back break levels,XOM,-0.8167139291763306
2020-06-08,chart june upside mobil elliottwave,XOM,0.9671918153762816
2020-06-08,tomgartner staying rehab jobs using bond,XOM,0.4437102973461151
2020-06-09,expected mobil quarter,XOM,-0.6325523853302002
2020-06-09,expected mobil quarter,XOM,-0.7686542272567749
2020-06-09,dividend yield upside seems brainer stable company does well recessionary times,XOM,0.9578046798706056
2020-06-09,swaggystocks bearish sentiment puts strike premium paid,XOM,0.6916321516036987
2020-06-09,bearish sentiment puts strike premium paid,XOM,0.9222143888473512
2020-06-09,forgot,XOM,-0.5763362646102905
2020-06-09,mobil rating lowered hold standpoint research,XOM,-0.9214873313903807
2020-06-09,downgrades standpoint research cuts hold,XOM,-1.0336865186691284
2020-06-09,mobil rating lowered standpoint research,XOM,-0.9954754114151
2020-06-09,stable dividend yield money environment,XOM,0.9541490077972412
2020-06-09,standpoint research cuts hold,XOM,-1.0302478075027466
2020-06-09,bearish sentiment puts strike premium paid,XOM,0.797082781791687
2020-06-09,short term correction swings reached equal legs area bounce taking place elliottwave,XOM,0.8796654939651489
2020-06-09,watch technical video explaining view elliottwave,XOM,0.0082468353211879
2020-06-09,elliott wave view strength mobil elliottwave,XOM,0.9117830991744996
2020-06-09,chart looking rally take place blie area elliottwave,XOM,0.7656736373901367
2020-06-09,livesquawk morgan raises target exxonmobil,XOM,0.5412801504135132
2020-06-09,target rise stopped,XOM,-0.9279838800430298
2020-06-09,actually really hate,XOM,-1.0557345151901243
2020-06-09,,XOM,0.0428341478109359
2020-06-09,recent technical alerts stochastic sell signal plus alerts,XOM,-0.4588892757892608
2020-06-09,fundstrat oils,XOM,0.0928230583667755
2020-06-09,analystwire exxonmobil raised securities,XOM,0.7817014455795288
2020-06-09,exxonmobil raised securities,XOM,0.7976962327957153
2020-06-09,chart june upside mobil elliottwave,XOM,0.9671918153762816
2020-06-09,morgan raises target exxonmobil,XOM,0.6281822919845581
2020-06-09,enters uptrend because momentum indicator exceeded level view odds indicators exxonmobil stockmarket technicalanalysis money daytrading news,XOM,0.8954344987869263
2020-06-09,seekingalpha mobil expect them someone,XOM,-0.0840954333543777
2020-06-09,mobil expect them someone,XOM,-0.0887655690312385
2020-06-09,best places join live updates chart analysis chat everything needs give,XOM,0.9919092655181884
2020-06-09,puts alerted peak after alert progress,XOM,0.8843749761581421
2020-06-09,peak profit expired option alerts sivxvtjadp,XOM,0.5526939630508423
2020-06-09,months option alerts peaked above after were triggered algo sivxvtjadp,XOM,0.919321060180664
2020-06-10,mobil options maxpain chart open interest chart update optionstrading optionsflow stockmarket,XOM,0.2932304441928863
2020-06-10,makes outsized move option straddle implying move days,XOM,-0.2014504373073578
2020-06-10,settled note recent teal,XOM,0.7488070726394653
2020-06-10,mobil option order flow sentiment bullish,XOM,0.9199002981185912
2020-06-10,wallstreettape love looks dump looking long,XOM,0.9544069766998292
2020-06-10,settled note recent teal,XOM,0.5766241550445557
2020-06-10,wallstreettape love looks dump looking long into fill,XOM,0.9739898443222046
2020-06-10,fundstrat positive,XOM,0.5494102239608765
2020-06-10,mobil,XOM,-0.7715194225311279
2020-06-10,took profits bought sold held longer than grabbed profits after hold consider buying dips stockmarket,XOM,0.9440973997116088
2020-06-10,manual exit closing position opened gain,XOM,0.9279590845108032
2020-06-10,long looking close days,XOM,0.0431011468172073
2020-06-10,expiration maxpain high open interest high call open interest,XOM,0.9301141500473022
2020-06-10,manual exit closing position opened gain,XOM,0.9206621646881104
2020-06-10,eyeing risk reacts hurry instate,XOM,-1.0271226167678833
2020-06-10,head,XOM,0.4182940721511841
2020-06-10,directional bias mobil report click details,XOM,-0.2814651727676391
2020-06-10,mobil report emigdygfba click sell,XOM,0.2153952419757843
2020-06-10,calls loaded boat these each amazing entry least double money before leave room note waiting sell well before september,XOM,0.9726800918579102
2020-06-10,bouncing shorts careful,XOM,-1.0536519289016724
2020-06-10,good technical analysis score score breakdown categories candle score neutral moving average score excellent momentum score excellent stockmarket,XOM,0.9607614278793336
2020-06-10,alert mobil corporation alert type percent change value dividend visit custom alerts,XOM,-0.3077163994312286
2020-06-10,shale news speculation long,XOM,-0.9962557554244996
2020-06-10,goin wrong buddy,XOM,-1.037644863128662
2020-06-10,long looking close days,XOM,0.0690951347351074
2020-06-10,optimus maximus shorted opened mobil corp corp chance loss hold stats,XOM,0.8559751510620117
2020-06-10,looks look shroted,XOM,0.6939105987548828
2020-06-10,chase reaffirms hold rating mobil,XOM,0.0249544344842433
2020-06-10,edcowsar production intelligence lean oilfield ospreydata offshore landrig rigcount eagleford,XOM,0.0766775906085968
2020-06-10,mobil lowered hold standpoint research,XOM,-0.8084686994552612
2020-06-10,production intelligence lean oilfield ospreydata offshore landrig rigcount eagleford marcellus utica,XOM,0.0128753371536731
2020-06-10,doji supply zone after perfected sell setup completed help timing these setups although broke yesterdays close above them demand zone high probability,XOM,0.9506720304489136
2020-06-10,mobil lowered hold standpoint research,XOM,-0.8084686994552612
2020-06-10,standpoint research lowers mobil hold,XOM,-0.02865631878376
2020-06-10,mobil lowered hold standpoint research,XOM,-0.8084686994552612
2020-06-10,echelontrader broke bullish bear flag resting fibbo curling good support,XOM,0.9720033407211304
2020-06-10,mobil given hold rating chase,XOM,0.0944837927818298
2020-06-10,mobil given hold rating chase,XOM,0.0944837927818298
2020-06-10,mobil given hold rating chase,XOM,0.0944837927818298
2020-06-10,enters uptrend momentum indicator exceeded level view odds indicators exxonmobil stockmarket technicalanalysis money daytrading news,XOM,0.9005511999130249
2020-06-10,broke bullish bear flag resting fibbo curling good support stop losses,XOM,0.9802865982055664
2020-06-10,iraq fields black gold thousands lose livelihoods,XOM,-0.8799014091491699
2020-06-10,mobil rating reaffirmed chase,XOM,0.2042950987815857
2020-06-10,mobil rating reaffirmed chase qwvpbhjkwm,XOM,0.2042950987815857
2020-06-10,,XOM,-0.126676321029663
2020-06-10,dividend june mobil pays cash dividend common record pjivwzbmug,XOM,0.2966501116752624
2020-06-11,dimartinobooth frugalprofblog garykaltbaum,XOM,0.1485845446586609
2020-06-11,received dividend early,XOM,0.520832896232605
2020-06-11,slow beaumont refinery expansion bloomberg sxqbvymdzv,XOM,-0.7588160037994385
2020-06-11,slows gulf refinery expansion after slump fuel demand,XOM,-0.7314919233322144
2020-06-11,chigrl prepares launch sale british north assets after months delays sources redboxwire,XOM,-0.1978516578674316
2020-06-11,seekingalpha mobil tread carefully business economy,XOM,0.1251816153526306
2020-06-11,settled nearing rising trend break offer seem probable,XOM,0.7741955518722534
2020-06-11,mobil tread carefully business economy,XOM,0.136746659874916
2020-06-11,incarceratedbob incarceratedbob thoughts sell change opinion hold through summer,XOM,0.0188832692801952
2020-06-11,mobil files form,XOM,-0.0876866951584816
2020-06-11,testing former breakout area lows lost look towards demand zones,XOM,-1.0512841939926147
2020-06-11,what guys thinking about setup,XOM,-0.1001407951116561
2020-06-11,lower higher volume pattern appearances since performance close days later worst best days later worst best days later worst best,XOM,-0.6926727294921875
2020-06-11,received another dividend,XOM,0.7881242036819458
2020-06-11,pain maturity maxpain options fecejwygif,XOM,0.0846948623657226
2020-06-11,falls largest options open interest,XOM,-0.1274436116218567
2020-06-11,bearish sentiment puts strike premium paid,XOM,0.8715683221817017
2020-06-11,call options expiring bought,XOM,0.9445463418960572
2020-06-11,tradeui mobil option alert calls earnings before open,XOM,0.1275622248649597
2020-06-11,back thinking about,XOM,0.2364350408315658
2020-06-11,revive sale north assets reuters coronavirus,XOM,0.1678846776485443
2020-06-11,livesquawk prepares launch sale british north assets after months delays rtrs sources expected raise,XOM,-0.1666788905858993
2020-06-11,first preparing sale british north assets reportedly held talks potential buyers oott northsea traderscom staunovo kilduffreport,XOM,0.2072509378194809
2020-06-11,exclusive revive north sale after months delays sources nasrallashadia reuters oott oilandgas,XOM,-0.7660819292068481
2020-06-11,prepares launch sale british north assets after months delays sources redboxwire,XOM,-0.3662128150463104
2020-06-11,papua guinea amends laws affecting mining,XOM,-0.1359452307224273
2020-06-11,deitaone burp after lunch,XOM,-0.0355194881558418
2020-06-11,prepares launch sale british north assets after months delays sources held talks potential buyers recent weeks sources north assets expected raise sources,XOM,0.0645108520984649
2020-06-11,prepares launch sale british north assets after months delays rtrs sources expected raise,XOM,-0.0108907632529735
2020-06-11,received another dividend,XOM,0.827175498008728
2020-06-11,stop risky alert discord,XOM,-1.065991997718811
2020-06-11,below,XOM,0.8545485734939575
2020-06-11,delta expiration maxpain options,XOM,-0.0252275466918945
2020-06-11,thebreadmakerr thought almost bust wake almost gain nice thank,XOM,0.9863686561584472
2020-06-11,optimus maximus closed covered previously shorted profit mobil corp corp stats,XOM,0.8134952783584595
2020-06-11,alert mobil corporation alert type percent change value dividend visit custom alerts,XOM,-0.317009687423706
2020-06-11,booked partial gains holding rest position energy,XOM,0.9719576835632324
2020-06-11,only profit taking dividends,XOM,0.955073356628418
2020-06-11,woke dividends,XOM,0.8245670795440674
2020-06-11,,XOM,0.0143596939742565
