Date,Tweet,Ticker,Score
2020-04-21,guys wanna hear joke almost june contract bucks barrel bucks,XOM,0.1737520098686218
2020-04-21,view presented hour update members april otboesihdl anticipates reacting lower blue area elliottwave commodities tradingsignals oilprice yatqpmmckl,XOM,-1.0086876153945925
2020-04-21,oilstocktrader crude think picked minuses cheaper than producing plus cheap feedstock chemicals destruction competitors thats side mate stopped thinking logic about since about,XOM,0.9521266222000122
2020-04-21,,XOM,0.4516415894031524
2020-04-21,green,XOM,0.2575935423374176
2020-04-21,mweh icecream business,XOM,-0.1186983212828636
2020-04-21,sinking fast,XOM,-0.8845174312591553
2020-04-21,sinking fast,XOM,-0.7790791988372803
2020-04-21,dividendgrowth think mobil dividend,XOM,-0.8562130928039551
2020-04-21,loaded short stop,XOM,-1.0880613327026367
2020-04-21,fighting hold vwap expecting continue sell offf couple days maybe weeks,XOM,-1.090206503868103
2020-04-21,rampcapitalllc flat,XOM,0.729702353477478
2020-04-21,renegadestyle absolute agreement thevinhvuong regards long game suggest adding weareox,XOM,0.6269544363021851
2020-04-21,cking easy,XOM,0.6145172119140625
2020-04-21,holding because expected supply destruction,XOM,-0.92645001411438
2020-04-21,freshjiva feeling regards given recent events,XOM,-0.017721714451909
2020-04-21,fucking holding expect dump months understand likely entire dollar destruction holds dumps safe including,XOM,-0.9609297513961792
2020-04-21,chamath massive difference between defending back defending buybacks taking total amount buybacks comparing similarly daft care took total amount dividends paid comped,XOM,0.5402380228042603
2020-04-21,trump needs bpcl gain supplychain,XOM,0.9683283567428588
2020-04-21,seanbrodrick cnbc madmoneyoncnbc jimcramer chart fossil fuel party,XOM,-0.0569972358644008
2020-04-21,dougkass soon,XOM,0.5618413686752319
2020-04-21,great short,XOM,0.9754297733306884
2020-04-21,tested held away energy really improving relative terms setup weakens,XOM,0.6435894966125488
2020-04-21,buying oils stks call crazy refuse green tape,XOM,0.1532139778137207
2020-04-21,mind boggling,XOM,-0.709865927696228
2020-04-21,something accumulating well expecting sharp decline,XOM,-1.0884422063827517
2020-04-21,imagine short positions pissed doing weird thing ksksnjrgbx,XOM,-1.0989134311676023
2020-04-21,green,XOM,0.7218619585037231
2020-04-21,freezerohedge guess start pricing administration within,XOM,0.0179588571190834
2020-04-21,green,XOM,0.1936581432819366
2020-04-21,heck green maybe good sell high,XOM,0.8195668458938599
2020-04-21,love crude worthless,XOM,0.94490647315979
2020-04-21,lotto call,XOM,0.0117362365126609
2020-04-21,finish sentence wrong answers only mobile corporation news,XOM,-0.5341640710830688
2020-04-21,took long position dividend makes worth hold while eventually comes back,XOM,0.9582138061523438
2020-04-21,dividendgrowth years,XOM,0.2286414206027984
2020-04-21,wstpacglenn says divie good luck west total cash total cash total debt,XOM,0.9661470651626588
2020-04-21,wondering about risks volatility,XOM,-0.9857590198516846
2020-04-21,holding nice,XOM,0.9367414712905884
2020-04-21,mobil countdown dividend,XOM,-0.6716033220291138
2020-04-21,think mobil dividend,XOM,-0.7573132514953613
2020-04-21,jonnajarian holding well drop above dividend play,XOM,-0.8022997379302979
2020-04-21,long,XOM,0.8066540956497192
2020-04-21,algeria says signed boost partnership great dividend,XOM,0.974564790725708
2020-04-21,lmao slipped fuck hopefully keep sliding need,XOM,-0.5757529735565186
2020-04-21,alert mobil corporation alert type percent change value dividend visit custom alerts,XOM,-0.3508320152759552
2020-04-21,fucked mobil green,XOM,-0.9349114894866944
2020-04-21,working schmuck make bought planning future retirement glad rooting against retirement success ocassionalcortex,XOM,0.9830487966537476
2020-04-21,openoutcrier bought eyeing,XOM,0.9715181589126588
2020-04-21,mobil countdown dividend stockmarket,XOM,-0.975922703742981
2020-04-21,looking taking short below consider puts instead watch,XOM,-1.0632082223892212
2020-04-21,great bounces back convinced,XOM,0.9748976230621338
2020-04-21,volatilitywiz find interesting saudis buying european equity stakes reported wonder nibbling decade lows,XOM,0.9396448135375975
2020-04-21,bruh using efficiency received note thank tduaztbnbw,XOM,0.9362694025039672
2020-04-21,mobil closed carnage feels strange lower oilcrash exxonmobil,XOM,-1.073481559753418
2020-04-21,oilstocktrader reason canadian names closely only really watch majors,XOM,-0.1371769905090332
2020-04-21,uptrend indicator exits oversold zone view odds indicators exxonmobil stockmarket technicalanalysis money daytrading news,XOM,0.8779526948928833
2020-04-21,ryedafinanceguy divyprincipal scary divy know long term considered look,XOM,-1.0910474061965942
2020-04-21,helljanarentsen wstpacglenn west tough what around infrastructure,XOM,-1.0737687349319458
2020-04-21,everything trump touches dies therickwilson acosta jimcramer realdonaldtrump minerals geology rocks seismicimaging drilling oilandgas opec oott crudeoil crude usoil oilandgasindustry oilfield petroleumengineer nasdaq nyse,XOM,-0.3231537044048309
2020-04-21,everything trump touches dies therickwilson acosta jimcramer realdonaldtrump minerals geology rocks seismicimaging drilling oilandgas opec oott crudeoil crude usoil oilandgasindustry oilfield petroleumengineer nasdaq nyse yfdgcjahbf,XOM,-0.3231537044048309
2020-04-21,everything trump touches dies therickwilson acosta jimcramer realdonaldtrump minerals geology rocks seismicimaging drilling oilandgas opec oott crudeoil crude usoil oilandgasindustry oilfield petroleumengineer nasdaq nyse,XOM,-0.3231537044048309
2020-04-21,divyprincipal scary divy know long term considered looking into clean energy plays,XOM,-0.7992269992828369
2020-04-21,wstpacglenn west tough what around infrastructure knowledge,XOM,-1.0675569772720337
2020-04-21,austen wait mean works king ntlxydqzky,XOM,-0.1209116652607917
2020-04-21,says divie good luck west total cash total cash total debt,XOM,0.9474858045578004
2020-04-21,patrickceresna guyana good stand solidarity energy,XOM,0.9631572961807252
2020-04-21,akmgreatesthits goddamn interning,XOM,0.0048825591802597
2020-04-21,chrisnelder close time,XOM,-1.000670313835144
2020-04-21,ryangrim negative disconnect between reality disorienting,XOM,-1.0969934463500977
2020-04-21,anasalhajji,XOM,0.685405969619751
2020-04-21,stocktwits trending alert recent interest mobil ibqgjnfkvp,XOM,0.738490104675293
2020-04-21,says dividend crowd keeping saying income depend finally something good coming holding them bonds oott,XOM,0.9569751024246216
2020-04-21,bought,XOM,0.9369620084762572
2020-04-22,robertmacminn nice snipe,XOM,0.9699227809906006
2020-04-22,view presented hour update members april otboesihdl anticipates reacting lower blue area elliottwave commodities tradingsignals oilprice,XOM,-1.0086876153945925
2020-04-22,peak profit expired option alerts sivxvtjadp,XOM,0.4904253780841827
2020-04-22,months option alerts peaked above after were triggered algo sivxvtjadp ktpbtzhwgb,XOM,0.9188801050186156
2020-04-22,view historical options performance sivxvtjadp,XOM,0.1098226979374885
2020-04-22,options maxpain chart free options,XOM,0.1545801162719726
2020-04-22,brokerages mobil target,XOM,0.055181361734867
2020-04-22,mobil receives average target analysts,XOM,0.0443364791572093
2020-04-22,begins construction china ethylene project,XOM,0.0193702355027198
2020-04-22,thedividendguy wait what does think raise declaration position damn tempting,XOM,0.7661434412002563
2020-04-22,options chart free hgyhiwulnm nsphvxhaym,XOM,0.210766315460205
2020-04-22,thelimerickking exxonmobil realize nearly every single thedemocrats member congress portfolio favorite course,XOM,0.7810451984405518
2020-04-22,mobil doubling negative iercywcmij great dividend,XOM,0.9596561193466188
2020-04-22,begins construction china ethylene project great dividend,XOM,0.981139063835144
2020-04-22,mobil earnings piper sandler forecasts,XOM,0.349530428647995
2020-04-22,vendbienjon mindwbw notabubble stockcats doozytrader think bottom range total collapse,XOM,-1.0883524417877195
2020-04-22,owns bunch inherited mother grandfather worked years bought retirement dividend payments doesn sell wish divested fossil fuels years,XOM,0.2941314578056335
2020-04-22,mindwbw notabubble vendbienjon stockcats doozytrader remember always moves after everyone gives long time keep lower lower entries buffett,XOM,-1.0791093111038208
2020-04-22,theoretical,XOM,-0.685948371887207
2020-04-22,danhandex ginamartinadams theterminal looks case take average meas,XOM,-0.0800312906503677
2020-04-22,bank america increases mobil target,XOM,0.5250416994094849
2020-04-22,mobil earnings piper sandler forecasts,XOM,0.2716667354106903
2020-04-22,breakdown,XOM,-0.5769915580749512
2020-04-22,bank america increases mobil target,XOM,0.5250416994094849
2020-04-22,mobil given target bank america ffddeaahrs,XOM,0.1421336084604263
2020-04-22,bank america increases mobil target,XOM,0.5250416994094849
2020-04-22,begins construction china ethylene project,XOM,0.0193702355027198
2020-04-22,danhandex ginamartinadams theterminal looks case take average measured first each only lower book reserves written completely chart based pricing story same,XOM,-0.5518572330474854
2020-04-22,mobil earnings piper sandler forecasts qwxpfrkljy,XOM,0.2716667354106903
2020-04-22,hftalert good long term play smaller shale producers pennies dollar them bankrupt shale producers debt highly leveraged,XOM,0.9656943082809448
2020-04-22,begins construction china ethylene project,XOM,0.0153714120388031
2020-04-22,those calls discuss grizzle live youtube stonks rockets nails anot,XOM,0.2728908061981201
2020-04-22,estimates mobil reduced jefferies financial group,XOM,-0.9769349098205566
2020-04-22,puts working rest splat,XOM,0.8469637632369995
2020-04-22,estimates mobil decreased jefferies financial group,XOM,-0.7768537998199463
2020-04-22,estimates mobil reduced jefferies financial group,XOM,-0.8042982816696167
2020-04-22,estimates mobil reduced jefferies financial group,XOM,-0.8042982816696167
2020-04-22,those calls discuss grizzle live youtube stonks rockets nails another hqfibhsvpt,XOM,0.3067598938941955
2020-04-22,begins construction china ethylene project,XOM,0.0193702355027198
2020-04-22,seekingalpha mobil doubling negative,XOM,-1.0760189294815063
2020-04-22,mobil doubling negative,XOM,-1.065473198890686
2020-04-22,marketcurrents begins construction china ethylene project raedkpfezs,XOM,-0.0106868147850036
2020-04-22,begins construction china ethylene project raedkpfezs,XOM,0.0193702355027198
2020-04-22,mobil doubling negative,XOM,-1.0737402439117432
2020-04-22,loaded puts since open dead bounce,XOM,-0.9382604360580444
2020-04-22,mobil countdown dividend,XOM,-0.6716033220291138
2020-04-22,wave,XOM,0.2160188406705856
2020-04-22,exxonmobil wednesday started construction solely funded chemical complex south china huizhou city total around billion complex includes ethylene cracker design production million tons vifemudpzq,XOM,0.3156149089336395
2020-04-22,person opinion dividends,XOM,0.3182925283908844
2020-04-22,headlines filled news collapse remain stable perhaps,XOM,-0.3322505354881286
2020-04-22,willrayvalentin,XOM,0.1323222815990448
2020-04-22,commented mobil countdown dividend,XOM,-0.7615102529525757
2020-04-22,selling puts long,XOM,-1.065166473388672
2020-04-22,steveracftw dividend alongside value,XOM,0.9414339065551758
2020-04-22,amdtrades thanks usually companies considering short,XOM,-0.9588046073913574
2020-04-22,greenmonsterah worst probably worse long term hold energy,XOM,-1.086055874824524
2020-04-22,amdtrades watching into earnings keen action develops held during,XOM,0.6749125719070435
2020-04-22,watching into earnings keen action develops held during debacle sell dividends need though position about make large move,XOM,-1.089940905570984
2020-04-22,axiusholdings fzucchi think covers dividend,XOM,-0.0795325934886932
2020-04-22,fzucchi think covers dividend,XOM,-0.0838499590754509
2020-04-22,believe held days,XOM,-0.5076725482940674
2020-04-22,wait single digits,XOM,1.0003793239593506
2020-04-22,dapper dividends quick discussion buys buying dividendinvesting dividends podcasting applepodcasts dapper stockmarket mobil medtronic lockdown podcasts,XOM,0.9760112762451172
2020-04-22,toddhagopian juliusagusta shit fedporn odds dividend before them,XOM,-1.0046933889389038
2020-04-22,toddhagopian juliusagusta wants know which think dividends,XOM,-1.0404671430587769
2020-04-22,toddhagopian juliusagusta wants know which think dividends,XOM,-1.0454376935958862
2020-04-22,honestly suspend start buying these distressed major totally,XOM,-0.7644331455230713
2020-04-22,well crude stay time mentioned previously between dollars between june futures contract drops than crude continues unprecedented sell txgruohoqm,XOM,0.9286413192749025
2020-04-23,coronavirus rescue,XOM,0.7655106782913208
2020-04-23,coronavirus rescue bullish,XOM,0.9680558443069458
2020-04-23,coronavirus rescue cbsicarssw,XOM,0.715591549873352
2020-04-23,coronavirus rescue,XOM,0.9025254249572754
2020-04-23,options maxpain chart free options,XOM,0.1545801162719726
2020-04-23,were hedge funds about mobil corporation,XOM,0.282561331987381
2020-04-23,larger caps showing similar patterns nearly defined watching same rising wedge second couple months broke downside,XOM,-0.0935479775071144
2020-04-23,jpgirth,XOM,0.9678946733474731
2020-04-23,,XOM,0.1686024963855743
2020-04-23,,XOM,0.3882695734500885
2020-04-23,headed towards wave,XOM,0.1448053419589996
2020-04-23,joshuapiskula tell bought holding them months advice received,XOM,0.9577739238739014
2020-04-23,earnings estimate mobil issued piper sandler,XOM,0.046637587249279
2020-04-23,putorcallhenryx really love give nasty bleed preferably fall tomor,XOM,-0.9151535034179688
2020-04-23,farrisbaba hurt being puts bought earlier,XOM,0.8504574298858643
2020-04-23,earnings estimate mobil issued piper sandler,XOM,0.0204601138830184
2020-04-23,someone help know about industry companies cratered,XOM,-0.6090666055679321
2020-04-23,boom treating folks real nice leap calls since grizzle bullish paywalls,XOM,0.9811561107635498
2020-04-23,inching time mama happy,XOM,0.9644017219543456
2020-04-23,inching time mama happy,XOM,0.9671859741210938
2020-04-23,deltaninety nice played along thanks birthday gift,XOM,0.9884406328201294
2020-04-23,bought calls,XOM,0.934799075126648
2020-04-23,makes outsized move option straddle expiring implies move,XOM,0.0601151250302791
2020-04-23,long,XOM,0.0687832683324813
2020-04-23,downtrend stochastic indicator peaks leaves overbought zone view odds indicators exxonmobil stockmarket technicalanalysis money daytrading news,XOM,-1.053154468536377
2020-04-23,mobil qgihiihrqz,XOM,0.718877911567688
2020-04-23,company profile fundamental technical analysis score update score score stockmarket,XOM,0.0445182919502258
2020-04-23,sunrisetrader looking good,XOM,0.9446196556091307
2020-04-23,mindwbw lucky,XOM,0.9428011178970336
2020-04-23,airpocket cnbc cnbcfastmoney,XOM,-0.0059829875826835
2020-04-23,alert mobil corporation alert type percent change value dividend visit custom alerts,XOM,0.7832387685775757
2020-04-23,great them selective cnbc cnbcfastmoney,XOM,0.9929583072662354
2020-04-23,what energy sector brianoverby looks selling cash secured episode optionsplaybookradio download preferred podcast provider listen,XOM,-1.0468095541000366
2020-04-23,great breakout long,XOM,0.9861664772033693
2020-04-23,nice played along thanks birthday gift,XOM,0.98865807056427
2020-04-23,bipolar change recently gkmfeoxzlb,XOM,0.6854398250579834
2020-04-23,mobil gains lead point climb,XOM,0.8601667881011963
2020-04-23,watch move higher,XOM,0.9780614376068116
2020-04-23,looks good move higher,XOM,0.9522011280059814
2020-04-23,exxonmobil billion gain billion marketcap represents billion integrated companies industry jinhgdysed stocktips stockmarket,XOM,0.9998908042907716
2020-04-23,makes laugh these people realize owned world ones govt needs deal sort these seats filled precisely these companies good luck untangling oott opec yoqrekwfeu,XOM,0.9911168813705444
2020-04-23,whatever,XOM,0.091570571064949
2020-04-23,mobil doubling negative pzjdxazrsn,XOM,-1.065473198890686
2020-04-23,estimates mobil reduced jefferies financial group,XOM,-0.980278730392456
2020-04-23,monster,XOM,-0.0821143016219139
2020-04-23,cuts dividend screaming,XOM,-1.0528604984283447
2020-04-23,mobil corporation good long term ratio,XOM,0.9650493860244752
2020-04-23,estimates mobil decreased jefferies financial group kdepbztzty,XOM,-0.7841335535049438
2020-04-23,earnings forecast mobil issued piper sandler,XOM,0.0342376753687858
2020-04-23,earnings forecast mobil issued piper sandler,XOM,0.0342376753687858
2020-04-23,implied volatility expiration maxpain options zzmjxivwrz,XOM,-1.0694235563278198
2020-04-23,reason love largest producer integrated,XOM,0.95694100856781
2020-04-23,reason love largest producer integrated than gasoline,XOM,0.9508694410324096
2020-04-23,marcodacostafx gonna bullish bearish,XOM,-0.5127789974212646
2020-04-23,jimcramer,XOM,-0.0822508335113525
2020-04-23,rorotrader robertmacminn what think hits before,XOM,-0.0495152845978736
2020-04-23,marcodacostafx gonna bullish bearish,XOM,-0.5584337711334229
2020-04-23,rorotrader robertmacminn what think hits before,XOM,-0.0192022509872913
2020-04-24,weronlyhumn missjulialee girlisgut mylakelady supremeslaya ydvrawopuogtucp lastlaughaemial brokeroca realboduke immortalallow dirkhelp funnyinnitgurl crazyivanka butdidyouseeit kingkongslaya danceformelames tslacksmarin slumington mkshake jack,XOM,0.5318503379821777
2020-04-24,mobil settled made black candle around bodes bearish monday earnings,XOM,-1.0760345458984375
2020-04-24,puts mobil option alert puts sweep near earnings before open sweeps,XOM,0.4507146775722503
2020-04-24,every since recent crude crashes dividend reduction notices cross,XOM,-0.0441547483205795
2020-04-24,options maxpain chart free options leaqgjcrwk,XOM,0.1545801162719726
2020-04-24,began position negative continued slowly didn fall fall timestamp,XOM,-1.0937974452972412
2020-04-24,anasalhajji part position based ability pick quality assets weak players picks properties auction them allies private enterprise,XOM,-1.0554436445236206
2020-04-24,position short strangle sold sold call,XOM,-1.019501566886902
2020-04-24,richytee chart everyone after juicy divi safer lower beta play,XOM,-0.1584427803754806
2020-04-24,chart everyone after juicy divi safer lower beta play seen baggers space buying vhuvjbytvd,XOM,0.8304827213287354
2020-04-24,never thought drill drill,XOM,-0.5456557273864746
2020-04-24,lets continue legging doesnt stop tradertvlive show stops nasdaq nyse daytrading stockmarket finance money pennystocks livetrading stockstowatch,XOM,0.9847959280014038
2020-04-24,plans make about million bottles hand sanitizer,XOM,0.0421970225870609
2020-04-24,chigrl redboxwire friend owned them,XOM,0.9572134017944336
2020-04-24,lotto,XOM,0.0367324016988277
2020-04-24,adjusting petchem plant pump isopropyl alcohol knew hand sanitizer came clean without dirty,XOM,-0.3508559465408325
2020-04-24,shifting louisiana operations make hand sanitizer response covid pandemic targeting gallons sanitizer enough fill nearly million ounce bottles donate,XOM,-0.0093797519803047
2020-04-24,modifies louisiana facilities make hand sanitizer afqunzklhl great dividend,XOM,0.9815353155136108
2020-04-24,need tank,XOM,0.0848725140094757
2020-04-24,modifies louisiana facilities make hand sanitizer,XOM,-0.023187331855297
2020-04-24,earnings forecast mobil issued jefferies financial group,XOM,0.0368036888539791
2020-04-24,earnings forecast mobil issued jefferies financial group,XOM,0.0368036888539791
2020-04-24,alert mobil corporation alert type percent change value dividend visit custom alerts,XOM,0.7756770849227905
2020-04-24,back keep buying,XOM,0.9667669534683228
2020-04-24,exxonmobil modifies facilities produce medical grade sanitizer covid response,XOM,-0.0017228424549102
2020-04-24,divyprincipal relate basis started buying trying convince wife years finally convinced weeks before virus stop hearing about,XOM,0.9456896781921388
2020-04-24,caetuscap exxonmobil modifies facilities produce sanitizer exxonmobil targeting production gallons sanitizer,XOM,-0.1327676028013229
2020-04-24,timing everything freely admit holding along however nudged better half start position march gonna scary compounding years,XOM,0.4199472069740295
2020-04-24,modifies facilities produce medical grade sanitizer covid response exxonmobil coronavirus coronaviruspandemic coronavirusoutbreak,XOM,0.0595057681202888
2020-04-24,exxonmobil modifies facilities produce medical grade sanitizer covid response,XOM,0.0603242143988609
2020-04-24,exxonmobil modifies facilities produce medical grade sanitizer covid response,XOM,-0.0084291212260723
2020-04-24,exxonmobil modifies facilities produce sanitizer exxonmobil targeting production gallons sanitizer worth barrel,XOM,0.9032223224639891
2020-04-24,directional bias mobil report click details,XOM,-0.2814651727676391
2020-04-24,mobil report click sell,XOM,0.2153952419757843
2020-04-24,downtrend stochastic indicator leaves overbought zone view odds indicators exxonmobil stockmarket technicalanalysis money daytrading news,XOM,-1.06194269657135
2020-04-24,earnings forecast mobil issued piper sandler tyfwklcqjx,XOM,0.0306589901447296
2020-04-24,earnings forecast mobil issued piper sandler,XOM,0.0306589901447296
2020-04-24,mobil forecasted earnings,XOM,0.3519223630428314
2020-04-24,piper sandler comments mobil earnings,XOM,0.021418023854494
2020-04-24,piper sandler comments mobil earnings,XOM,0.021418023854494
2020-04-24,research analysts offer predictions mobil earnings,XOM,0.0282562635838985
2020-04-24,research analysts offer predictions mobil earnings,XOM,0.0282562635838985
2020-04-24,mobil announce earnings friday,XOM,0.0414698980748653
2020-04-24,mobil announce earnings friday oiaxunpvbn,XOM,0.0344709232449531
2020-04-24,mobil announce earnings friday,XOM,0.0344709232449531
2020-04-24,mobil announce earnings friday,XOM,0.0344709232449531
2020-04-24,mobil announce earnings friday,XOM,0.0514437556266784
2020-04-24,sparticuszorro long catching action albeit lower beta,XOM,-0.8102024793624878
2020-04-24,timmerfidelity exxonmobil wednesday started construction solely funded chemical complex south china huizhou city total around billion which includes ethylene cracker design production million tons,XOM,0.3276952505111694
2020-04-24,wallstcynic donny buddy bullshit those swing production assets shale better serve everyone hamms world strong player portfolio long,XOM,0.8709133863449097
2020-04-24,option order flow sentiment bullish,XOM,0.9207532405853271
2020-04-25,latest president questions holding briefings health emergencymanagement householdchemicalsmanufacturing,XOM,0.2598441243171692
2020-04-25,latest president questions holding briefings health emergencymanagement householdchemicalsmanufacturing hklxbrfqbq,XOM,0.2203864902257919
2020-04-25,imszvdehqr latest potbelly sandwich shop returning money health diseaseoutbreaks publichealth,XOM,0.4224036335945129
2020-04-25,latest potbelly sandwich shop returning money health diseaseoutbreaks publichealth,XOM,0.4212731719017029
2020-04-25,iybcbgtjlo latest navy says virus cases aboard destroyer rising health infectiousdiseases diseasesandconditions,XOM,0.2959843575954437
2020-04-25,latest navy says virus cases aboard destroyer rising health infectiousdiseases diseasesandconditions,XOM,0.335843026638031
2020-04-25,resistance bullish target back test failed channel line,XOM,-0.5326056480407715
2020-04-25,latest fauci urges careful science virus drugs health infectiousdiseases diseasesandconditions,XOM,-0.93965744972229
2020-04-25,latest fauci urges careful science virus drugs health infectiousdiseases diseasesandconditions,XOM,-0.7626552581787109
2020-04-25,latest surgeon says evaluation changes needed health oilandgas energy,XOM,0.1757553815841674
2020-04-25,latest surgeon says evaluation changes needed health oilandgas energy,XOM,0.1556852459907531
2020-04-25,resistance bullish target back test failed channel line bottom kelt around ignore itself focus massive assets years look macd lowest life,XOM,-1.0238045454025269
2020-04-25,after years rockefeller family exiting business news,XOM,-0.0794883742928505
2020-04-25,xkqbfnoqib latest spain poised ease home confinement health walking exercise,XOM,0.2796359956264496
2020-04-25,latest spain poised ease home confinement health walking exercise,XOM,0.2532742917537689
2020-04-25,lewieleroux peakeftbro streetbomber wyllem ryansitton dude wish lobbyist know anyone suck,XOM,-0.0300622768700122
2020-04-25,latest turkey death toll virus reaches health romancatholicism christianity,XOM,0.18726746737957
2020-04-25,latest turkey death toll virus reaches health romancatholicism christianity,XOM,0.1363950967788696
2020-04-25,adamsinger long dinosaurs,XOM,0.2744538784027099
2020-04-25,divcultivator core holdings,XOM,0.0411810912191867
2020-04-25,report earnings expected move,XOM,0.4783810079097748
2020-04-25,exotic full tank subaru bvnxakktwk,XOM,0.8770214319229126
2020-04-25,wanna hear good news,XOM,0.9534920454025269
2020-04-25,brandonvanzee earnings,XOM,0.3428203165531158
2020-04-25,seekingalpha mobil dividend safe company,XOM,-0.252072662115097
2020-04-25,mobil dividend safe company,XOM,-0.1947330236434936
2020-04-25,mobil dividend safe company,XOM,-0.1057218238711357
2020-04-25,uptrend indicator exits oversold zone view odds indicators exxonmobil stockmarket technicalanalysis money daytrading news bqgkszebhu,XOM,0.8779526948928833
2020-04-25,research analysts expectations mobil earnings,XOM,0.0248471423983573
