Created_at,Tweet_Words,Score
2020-06-08 08:36:14+00:00,given average recommendation brokerages,-0.0101148225367069
2020-06-08 08:36:09+00:00,given average recommendation brokerages,-0.046432476490736
2020-06-08 08:25:20+00:00,telus receives average rating analysts,0.7922934293746948
2020-06-08 08:21:16+00:00,telus receives average rating analysts,0.8831033706665039
2020-06-08 05:18:19+00:00,flow states overline arxiv physics,-0.9411247968673706
2020-06-08 05:11:09+00:00,peaked triggered algo,0.9100663661956788
2020-06-08 05:07:07+00:00,view historical performance,0.0946619436144828
2020-06-08 01:43:59+00:00,bomb ge paid lead biggest scam human history place lost saw seeds takeover billy goat gates halfbrother ogre oros paid enough ogre,-0.0151067711412906
2020-06-08 00:46:19+00:00,acknowledged govt misappropriating daca parents properties mentioned abaddon tune,-0.4535647332668304
2020-06-08 00:43:58+00:00,hbo max thesis felt way content tech usability comparing,0.3192780315876007
2020-06-08 00:30:56+00:00,jorrit kruthoff onkar parrikar flow states overline,-0.7090928554534912
2020-06-09 23:58:38+00:00,dem run states swamp spent fix poverty sangabriel steve magie conway fayetteville pinebluff,-0.1466247141361236
2020-06-09 23:38:25+00:00,webcast talk jeff mcelfresh bank america merrill lynch telecom media conference,0.0165741369128227
2020-06-09 23:31:57+00:00,fundamental analysis score fa score various fa value score roe roa roic gross margin ebitda etc,0.9736745357513428
2020-06-09 22:18:37+00:00,btw wrote newsletter territory topic covered well scenario hbo max avod ambitions conversation reflects hbomax,0.9107000827789308
2020-06-09 20:33:16+00:00,analysis earlier let,0.0498689524829387
2020-06-09 19:56:36+00:00,aug action late,0.901486873626709
2020-06-09 19:34:36+00:00,swinging exp,0.1961110532283783
2020-06-09 19:23:02+00:00,federal shortfall sitting half endowment figure,-0.8053642511367798
2020-06-09 19:21:50+00:00,commented failed opportunity,-1.054741621017456
2020-06-09 18:53:42+00:00,well im sub always gtc orders forward meeting sooner later,0.8591213226318359
2020-06-09 17:52:16+00:00,propaganda disseminated guilty responsible boycottatt divest esg impactinvesting,-0.9895753860473632
2020-06-09 17:44:05+00:00,terror inciting pogrom speech delhipogrom delhigenocide antimuslimpogrominindia,-1.0005756616592407
2020-06-09 17:24:01+00:00,webcast talk jeff mcelfresh bank america merrill lynch telecom media conference,0.0130585804581642
2020-06-09 17:11:08+00:00,underrated aristocrats town,0.784214973449707
2020-06-09 16:16:11+00:00,move div payout,0.9717042446136476
2020-06-09 16:00:16+00:00,fav dividend,0.9531358480453492
2020-06-09 15:59:06+00:00,,0.0082347393035888
2020-06-09 15:46:13+00:00,expiring contract,-0.0827013701200485
2020-06-09 15:08:37+00:00,analysis please let dividends stockstowatch dividendinvesting,0.1440044641494751
2020-06-09 13:49:24+00:00,webcast talk jeff mcelfresh bank america merrill lynch telecom media conference,0.0165741369128227
2020-06-09 13:38:53+00:00,,0.2301579117774963
2020-06-09 13:19:57+00:00,answer complex problems writing trillion deficit easy money inexperience parade pretenders clue serious economic crisis caused mismanagement pandemic stopspending,-0.8375982046127319
2020-06-09 12:15:33+00:00,every dad near ifeel urge thr,-0.0134871900081634
2020-06-09 11:55:47+00:00,mr watson spoken almost alexander graham bell analysis,0.0651545822620391
2020-06-09 08:37:11+00:00,moved moving average view odds money news,0.9061819314956664
2020-06-09 07:00:23+00:00,pe funds deployed crisis ended yielding median annualised retum assets management swollen amassed dry powder deploy deals,0.8420974016189575
2020-06-09 06:43:03+00:00,peter genuinely sorry applying pine gap sign contract controlling managing securing security safety technological asi im owed aus,-1.0084410905838013
2020-06-09 06:03:46+00:00,bought saw lot waited case,0.9609040021896362
2020-06-09 04:39:04+00:00,wow ramble english squeeze given ex div tmr pull thoughts,0.3126311600208282
2020-06-09 04:36:58+00:00,sir theoretically tmr ex div date drop given mkt run thoughts scorching near believe well marks wk around,0.9472581148147584
2020-06-09 00:34:53+00:00,understand question pandemic printing fiscal impact forecast bad forecaster track record largely forecasts adjust verbatim,-0.0191159695386886
2020-06-09 00:18:00+00:00,bullish twenty long pennant formation rsi macd mean breaks usd somewhere oct leave experience nyse priceprediction priceaction,0.944409728050232
2020-06-10 23:47:54+00:00,thank bhouxszc mac,0.3336590826511383
2020-06-10 23:44:51+00:00,jul atm implied volatility straddle implies move earnings jul bmo,-0.9430010318756104
2020-06-10 23:36:48+00:00,lawmakers propose isolationist socialist aid semiconductor industry enough compete global field fine,0.956870436668396
2020-06-10 22:39:56+00:00,need hiding nope nope nope lee tuthill takin streets oh lord takin streets takin streets takin build wall gain ruth motorway,0.5086197853088379
2020-06-10 22:13:45+00:00,yes robust cash cows bit slow grower,0.3312659859657287
2020-06-10 22:12:20+00:00,webcast talk john stephens credit communications conference,0.0087933540344238
2020-06-10 22:09:49+00:00,fight whether gon na cut dividend verified iq,-0.8887512683868408
2020-06-10 21:53:11+00:00,break failed program pro,-1.073763728141785
2020-06-10 21:41:03+00:00,stay blessed yu hunnitz,0.9813251495361328
2020-06-10 21:36:42+00:00,stay blessed yu hunnitz,0.979700207710266
2020-06-10 20:39:11+00:00,solid dividend found,0.9564131498336792
2020-06-10 20:23:52+00:00,alotta red pick additional,-0.6441421508789062
2020-06-10 19:14:38+00:00,tired walking circle earn pussie real girl cty klods believe life build earn stuff give earn pussie,-0.0924719721078872
2020-06-10 19:07:52+00:00,telco monopoly consolidated revenues billion course block spam texts sent hotmail email address manually head ftc report instead executives forced law competition address,-0.1120711416006088
2020-06-10 18:50:11+00:00,bearish sentiment aug premium paid,0.870281457901001
2020-06-10 18:21:44+00:00,proof nation softer guess wind glad home,0.8092845678329468
2020-06-10 18:15:31+00:00,steer clear telus corp,0.1366750001907348
2020-06-10 18:09:39+00:00,unusual activity jun money expiring,-1.0746153593063354
2020-06-10 17:09:52+00:00,mean blm antifa lunatics meanwhile exodus long term viewers financial news huge wonder owner aware franchise destruction,-1.0765349864959717
2020-06-10 16:31:13+00:00,depends nearer accumulation phase distribution phase nearer latter lean,0.3340598344802856
2020-06-10 16:21:42+00:00,rue bought mendoza line reason,0.806853175163269
2020-06-10 16:19:14+00:00,small dividend growth rate downfall larger positions,-0.9835352897644044
2020-06-10 16:14:06+00:00,goddamit,-0.0024456232786178
2020-06-10 16:11:17+00:00,dividend aristocrat positioned beat decade,0.9225445985794068
2020-06-10 16:02:00+00:00,,0.4525380432605743
2020-06-10 15:41:35+00:00,rough internet,-1.0550471544265747
2020-06-10 15:24:03+00:00,forgot argument acquiring directtv falls category,-0.1881433129310608
2020-06-10 15:23:26+00:00,dividend yield fair,0.958748459815979
2020-06-10 15:05:10+00:00,expecting future hbo max,0.9516743421554564
2020-06-10 14:43:54+00:00,coronavirus states reopening meaning home disappear,0.9836488962173462
2020-06-10 14:14:07+00:00,blazingly fast internet speeds western canada faster telus purefibre gigabit internet,0.4407240450382232
2020-06-10 13:45:59+00:00,dividend aristocrat positioned beat decade,0.9225445985794068
2020-06-10 13:41:52+00:00,webcast talk john stephens credit communications conference,0.0087933540344238
2020-06-10 13:26:59+00:00,dividend aristocrat positioned beat decade,0.965004563331604
2020-06-10 13:20:23+00:00,late internetofthings stockstowatch qanons,0.9467837810516356
2020-06-10 13:04:59+00:00,yes donald amazing done government freemoney always believed socialising loses thought gop party,0.9237759113311768
2020-06-10 10:41:26+00:00,money esp faux shyt railroad heist fake bill hear minne big factory fire makin mannequins queens stirrin trouble thecrest hercorona removed member global,-0.930424690246582
2020-06-10 10:03:49+00:00,wind temporarily removed hbo max wake george floyd protests,-0.0419701226055622
2020-06-10 09:31:03+00:00,directional bias report click details,-0.7685412168502808
2020-06-10 09:24:28+00:00,report click,0.2375848293304443
2020-06-10 09:01:55+00:00,uptrend moving average divergence macd crosses signal line view odds money news,0.9515771865844728
2020-06-10 08:14:48+00:00,hbo max total failure,-1.0486053228378296
2020-06-10 06:10:24+00:00,analysis please let dividends sto,0.1040203496813774
2020-06-10 05:14:24+00:00,review recently covered,0.9405364990234376
2020-06-10 04:46:28+00:00,boycott defund cnn hbo,-0.8523808717727661
2020-06-10 01:49:37+00:00,bought cent wayyy otm comment wsb bed believe anyway,0.8288706541061401
2020-06-10 01:07:35+00:00,programs promoted freasury pandemic missed part moral hazard excluded pandemic surprise joke registration statements specific risk factor,-0.9258019924163818
2020-06-10 00:30:44+00:00,declines jun straddle implying move,-1.0751324892044067
2020-06-10 00:13:41+00:00,rn literally rolling commercial personal enough cash flow continue paying extraordinarily dividend,0.984005570411682
2020-06-10 00:10:00+00:00,isp seemed pick given necessary become past overall chose rollout seems pretty serious,0.9338870048522948
2020-06-10 00:03:37+00:00,promote cheap af,0.9894640445709229
2020-06-11 23:43:55+00:00,recent favour downside place,-1.006560444831848
2020-06-11 23:18:26+00:00,rationale believe remains current dividends financialindependence dividend aristocrat positioned beat decade,0.964271068572998
2020-06-11 22:44:03+00:00,jul atm implied volatility straddle implies move earnings jul bmo,-0.9415230751037598
2020-06-11 22:28:15+00:00,outsized move jun straddle expiring implies move,-0.5827153921127319
2020-06-11 21:06:36+00:00,implied volatility expiration,-1.0730328559875488
2020-06-11 21:06:33+00:00,implied volatility expiration,-1.0730328559875488
2020-06-11 20:54:44+00:00,personally awesome covered positions unfortunately early eg waited thought pick cant wait schizophrenic decides direction,0.9636709690093994
2020-06-11 20:08:39+00:00,closes near,-0.0577234923839569
2020-06-11 19:47:07+00:00,aged well metals,-1.025767803192139
2020-06-11 19:42:35+00:00,cleaners wrong drowning debt buyin,-0.7386069297790527
2020-06-11 19:40:54+00:00,webcast talk andre fuetsch wells fargo forum,0.0030629187822341
2020-06-11 19:34:43+00:00,oi range expiration putcallratio,0.9750267267227172
2020-06-11 18:25:52+00:00,tenet buzz important opening weekend sales,0.7231687307357788
2020-06-11 17:49:02+00:00,aggressive elevated risk triggered jun est,-1.0395866632461548
2020-06-11 17:35:38+00:00,around brainer,0.935598850250244
2020-06-11 17:25:12+00:00,police building surveillance networks private security cameras cities social security bottomless bucket bailing money part insecurity ignorance division surveillance alphas ignoring decisions,-0.0833499580621719
2020-06-11 17:24:52+00:00,tenet word mouth important opening weekend ticket sales coronavirus,0.6336265802383423
2020-06-11 17:22:12+00:00,government praise hospitals end bag expect government ownership universities keep closing online increases big sinkhole,0.940253496170044
2020-06-11 17:14:13+00:00,div play almost situations dividend safe company executives biz need living downside debt ratio thru reduce value,0.9588114023208618
2020-06-11 17:13:28+00:00,yes none directly besides etfs index funds,0.2584413588047027
2020-06-11 17:11:38+00:00,depth personally huge fan lack dividend growth yield soon outpaced lower yield higher growth opportunities,0.9663678407669068
2020-06-11 17:09:16+00:00,pays dividend dividend basket dd,0.9769631624221802
2020-06-11 16:27:05+00:00,type percent change value hit dividend visit custom,-0.1909973621368408
2020-06-11 16:26:00+00:00,came previous every glitch matrix opportunity loading lower tbh,-0.8615281581878662
2020-06-11 16:10:52+00:00,open fucking country give lives fascist democrats afraid criminal power cartel voted permanently retire private islands,-0.7410043478012085
2020-06-11 15:36:40+00:00,completely shutter dc universe move entire catalog,-0.2250376641750335
2020-06-11 14:02:08+00:00,ramp,0.0257347151637077
2020-06-11 13:57:59+00:00,ihx deserves union representation readytogo lifeatatt,0.5082746744155884
2020-06-11 13:48:21+00:00,webcast talk andre fuetsch wells fargo forum,0.0065971799194812
2020-06-11 12:07:14+00:00,beating large dividend payers long,-0.968009114265442
2020-06-11 11:58:09+00:00,cv deaths,-0.9104888439178468
2020-06-11 11:28:08+00:00,ik man modi ji id,0.4130791127681732
2020-06-11 11:22:29+00:00,downtrend sliding consecutive view odds money news,-1.0736215114593506
2020-06-11 11:07:22+00:00,reopening,0.4598428308963775
2020-06-13 23:42:18+00:00,definitely bargain,0.6969804763793945
2020-06-13 22:05:56+00:00,thank,0.9686887264251708
2020-06-13 21:22:56+00:00,full story sweden lundin petroleum crimes humanity sudan wikipedia hard believe norway wealth fund heavily lundin petroleum type record europe us australia canada uk germany,-0.98373281955719
2020-06-13 21:15:12+00:00,dividend aristocrat intrinsic value analysis dividends highyield aristocrat ch,0.2492171674966812
2020-06-13 21:01:08+00:00,outraged norway wealth fund blacklisted sweden lundin,-0.9640159606933594
2020-06-13 20:38:18+00:00,outraged norway wealth fund blacklisted sweden lundin petroleum end war crimes crimes humanity sudan canada trudeau,-0.8594652414321899
2020-06-13 20:18:02+00:00,bargain imo,0.6999515295028687
2020-06-13 19:58:10+00:00,story sweden committed crimes humanity sudan wikipedia norway wealth fund continues lundin petroleum nordic hypocrisy viking brutality canada cdnpoli social justice warriors,-0.9727381467819214
2020-06-13 19:50:51+00:00,wow waste money louis cardnials chicago cub,-0.9440003633499146
2020-06-13 19:06:56+00:00,let continue dividend performance list change change date sector performance,0.7075234651565552
2020-06-13 18:46:15+00:00,dividend aristocrat intrinsic value analysis dividends highyield aristocrat champion cashflow communications dividend aaamportfolios,0.7300155162811279
2020-06-13 18:45:42+00:00,clearly sustainable mnuchin assures us stimulus need save companies bankrupt stimulus yield curve control fed funding treasury deficit dollar damned,-0.8488799333572388
2020-06-13 18:04:51+00:00,need hbo brand pile garbage content service hbo missed compete value giving away hbogoplusmaxnow wireless subscribers standalone player streaming space,-0.84501051902771
2020-06-13 15:49:14+00:00,always gains loses,0.0676103010773658
2020-06-13 14:55:17+00:00,difference mind cash flow real estate dividend blue chips oil pipeline companies pay dividends,0.0821874067187309
2020-06-13 14:46:21+00:00,added,0.7474490404129028
2020-06-13 14:21:30+00:00,clowns continue idea branding continue mean service stay niche matter big company set hire smart chance buried inside death zone debt trap withers,0.9511420726776124
2020-06-13 13:55:14+00:00,warner brothers announced delaying movies christopher nolan film tenet delayed premiering wonder woman sequel delayed premiering,-0.488962858915329
2020-06-13 13:51:53+00:00,stagflation appears anomaly blip rather general rule inflation problem qe pumped created runaway inflation bc unemployment weapon,-1.063397765159607
2020-06-13 13:14:59+00:00,,-0.991544246673584
2020-06-13 13:12:22+00:00,,-0.991544246673584
2020-06-13 13:11:14+00:00,,-0.991544246673584
2020-06-13 12:57:51+00:00,upcoming event bank america merrill lynch telecom media conference expiring cover event implied move,0.2563970685005188
2020-06-13 12:57:18+00:00,continuing logic spain pay coutries forced spanish language th,-0.150710642337799
2020-06-13 12:53:46+00:00,continuing logic spain pay coutries forced spanish language ottoman turkey forced nations became mmf forced comintern world taxpayer scam,-0.2072252631187439
2020-06-13 12:45:27+00:00,assessing debt dividend safety end,0.3613984584808349
2020-06-13 12:21:40+00:00,,-0.0049122609198093
2020-06-13 08:42:08+00:00,technical dma resistance dma macd bearish signal line cross,-1.0563077926635742
2020-06-13 06:25:48+00:00,ny hat nutty,0.1431112736463546
2020-06-13 03:50:54+00:00,scared coz harley fucking quinn,-1.0426993370056152
2020-06-13 02:31:29+00:00,someone asked opps,-1.0540143251419067
2020-06-13 02:26:18+00:00,wonder woman sequel latest postponed,0.3503102958202362
2020-06-13 00:12:54+00:00,seeking sale warner unit,0.1128423064947128
2020-06-14 23:20:35+00:00,situation nobody difference hoard cash wont spend possibly rightly store wont cash need survial crme eggs irrelevant,-0.5739221572875977
2020-06-14 19:05:40+00:00,thoughts potential sale wb bi,0.4780218601226806
2020-06-14 19:05:26+00:00,trigger warning warning dream running away fake friends literally ribs sense felt true,-0.1854347288608551
2020-06-14 19:05:24+00:00,slower,-1.0468264818191528
2020-06-14 17:49:57+00:00,super cheap historical standards stockstobuy fintwit,0.9964224100112916
2020-06-14 15:32:03+00:00,everyone care mental health speak help fight alone ripsushantsinghrajput,-0.0393321514129638
2020-06-14 14:51:12+00:00,,-0.0223771184682846
2020-06-14 14:16:59+00:00,comedians philosophers disguise remember comedian wrote entire script joker dave chapelle,-0.0110016949474811
2020-06-14 14:00:54+00:00,underwater helped decision agree executing well wished kept increasing streak let quarter paying debt taken merge,0.9488513469696044
2020-06-14 13:42:01+00:00,grove,0.0213174484670162
2020-06-14 12:52:07+00:00,grove,0.049444131553173
2020-06-14 12:36:09+00:00,agree find hbo content amoung radom junk fired hbomax,-0.600319504737854
2020-06-14 12:17:35+00:00,reason religion termed terror,-1.0516918897628784
2020-06-14 12:16:59+00:00,reason religion termed terror,-1.0516918897628784
2020-06-14 12:15:01+00:00,reason religion termed terror,-1.0247457027435305
2020-06-14 12:14:41+00:00,reason religion termed terror,-1.0516918897628784
2020-06-14 10:48:12+00:00,thoughts potential sale wb bi,0.7212475538253784
2020-06-14 09:42:37+00:00,mulls billion sale division report,0.1408814340829849
2020-06-14 05:44:32+00:00,glitch matrix reaching pre coronavirus blowing mind,-1.0126336812973022
2020-06-14 02:25:51+00:00,,0.8611835241317749
2020-06-14 02:01:45+00:00,stay blessed yu hunnitz,0.9906917810440063
2020-06-14 01:45:49+00:00,wish happy birthday pandu manideep bl,0.9921749830245972
2020-06-14 00:31:39+00:00,seeking alpha comments section gold mine funny reactions blackstone bankrupt dc comics,0.8016639947891235
2020-06-15 23:26:34+00:00,implied volatility expiration,-1.0729376077651978
2020-06-15 22:11:01+00:00,way badly kid eye fork understand,-0.5707874298095703
2020-06-15 20:47:04+00:00,downtrend moving average divergence macd crosses signal line view odds money news,-1.0717941522598269
2020-06-15 20:24:52+00:00,jun play,0.5223703384399414
2020-06-15 20:18:47+00:00,though lot debt,0.9575260877609252
2020-06-15 20:06:05+00:00,forever favorite dividend,0.9769246578216552
2020-06-15 19:56:14+00:00,forever favorite dividend,0.9884172677993774
2020-06-15 19:49:10+00:00,processing adding,0.9620215892791748
2020-06-15 19:44:20+00:00,wb bn deal money news,-0.4957506954669952
2020-06-15 19:41:34+00:00,wb gamesi bn deal money news,-0.484265923500061
2020-06-15 19:15:55+00:00,least guarantee strictly pumping well dividend company collects data,0.9453920125961304
2020-06-15 18:55:32+00:00,full disclosure multiple truly dgaf away happier definitely heavier positive side let fucking though,0.9737197160720824
2020-06-15 18:53:11+00:00,simplify messy branding though perhaps done rolling flipside least spurred dozens explanatory articles journalism thanks,0.8966931104660034
2020-06-15 18:51:36+00:00,lfg let drop low possible load way yearly trends end help fellow stonks,0.96338951587677
2020-06-15 18:11:32+00:00,date ticker exp spot contracts premium,0.0835154578089714
2020-06-15 18:02:40+00:00,,0.0946687161922454
2020-06-15 17:51:41+00:00,thoughts yay nay,-0.0978504866361618
2020-06-15 17:28:59+00:00,loading boat,0.1290902346372604
2020-06-15 16:46:03+00:00,hbo gonewiththewind wind shoots bestseller pulled hbo max,0.0477893762290477
2020-06-15 16:01:49+00:00,nobody,0.9698110818862916
2020-06-15 16:00:51+00:00,loading boat,0.1485280692577362
2020-06-15 14:54:24+00:00,gin sa grove,0.0077904351055622
2020-06-15 14:46:19+00:00,gin sa grove,0.0571307614445686
2020-06-15 13:43:08+00:00,dividend yield,-0.1645572185516357
2020-06-15 13:40:21+00:00,optimus maximus et opened corp chance avg avg loss avg id stats,0.873571515083313
2020-06-15 13:38:02+00:00,aggressive elevated risk triggered jun est,-1.0365370512008667
2020-06-15 13:35:02+00:00,experience affordable samsung galaxy across,0.4001683592796325
2020-06-15 13:25:34+00:00,terrible ehe baby tw miserablexe moist bed alike renna,-1.04452645778656
2020-06-15 13:16:30+00:00,experience affordable samsung galaxy across,0.4409010708332062
2020-06-15 13:07:41+00:00,jun straddle implies move jun bank america merrill lynch telecom media conference,0.0249605476856231
2020-06-15 08:52:29+00:00,tenet word mouth important opening weekend ticket sales,0.6548681259155273
2020-06-15 08:00:42+00:00,whopping huge million dollar orders consistently bearish flow long term carefully att stockstowatch,-1.0708333253860474
2020-06-15 05:15:29+00:00,learned possible add variables vue plugin directive positional parameter find reference sooner find interesting examples,0.8197159767150879
2020-06-15 03:35:08+00:00,hayes money ai block city mine stamped,0.3570081293582916
2020-06-15 01:45:59+00:00,retired risky reliable yield subscription economy paying debt faster feds interest recent crappy ceo retiring end luck,0.9519182443618774
2020-06-15 01:45:59+00:00,retired risk reliable dividend subscription model economy able pay debt faster thanks fed interest rate recent,0.9665942192077636
2020-06-16 23:51:49+00:00,little carole journalism amount innuendo cool give example citizen responded carole superhuman talking doubt,0.5780012607574463
2020-06-16 23:51:24+00:00,jun forecast view bearish search forecast upper lower,-1.0552462339401243
2020-06-16 23:44:06+00:00,nky,0.6899635791778564
2020-06-16 23:15:08+00:00,cutting thousands jobs beginning,-0.6196490526199341
2020-06-16 22:48:17+00:00,cutting jobs shutting stores union representing company workers,-0.6793822050094604
2020-06-16 22:14:59+00:00,laying thousands workers shutting least stores,-0.7092816829681396
2020-06-16 22:13:12+00:00,ponos industries offers purchase million att,0.7213277816772461
2020-06-16 22:09:33+00:00,urges stockholders reject ponos industries offer,-0.7911819219589233
2020-06-16 22:00:52+00:00,couple atms,0.9827051162719728
2020-06-16 21:56:31+00:00,neutral technical analysis score ta score categories score neutral moving average score poor score,-0.1889658868312835
2020-06-16 21:30:00+00:00,urges stockholders reject ponos industries offer,-0.8490573167800903
2020-06-16 21:24:56+00:00,recommends stockholders reject offer ponos industries llc,-0.6738086938858032
2020-06-16 21:13:35+00:00,recommends stockholders reject offer ponos industries,-0.8650966882705688
2020-06-16 21:08:25+00:00,urges stockholders reject ponos industries offer,-0.8908913135528564
2020-06-16 20:47:11+00:00,files form events,-0.121016040444374
2020-06-16 20:12:19+00:00,becomes clear channels sense model bundles becomes whether starz needs buyer probably buyer financials,0.9382071495056152
2020-06-16 20:04:10+00:00,vulnerable population beyond piece shit pay nj senior property tax chopping block father pay almost scum,-0.960318088531494
2020-06-16 19:59:39+00:00,,-0.9039435386657716
2020-06-16 19:55:21+00:00,news drop,-1.0824415683746338
2020-06-16 19:52:46+00:00,closing stores covid showed need eliminating technician clerical jobs wonder,-0.516563892364502
2020-06-16 19:50:33+00:00,update plans cut thousands jobs close stores company tells union,-0.5075949430465698
2020-06-16 19:41:36+00:00,feels waiting reach target patiencepatiencepatience stockstowatch internetofthings,0.3703701794147491
2020-06-16 19:40:26+00:00,intends cut technician clerical jobs cwa union,-0.5507200956344604
2020-06-16 19:39:29+00:00,plans cut thousands jobs close stores union sound,-0.6549572944641113
2020-06-16 19:36:36+00:00,idk broke bois imma keep convince stockstowatch,0.8955724239349365
2020-06-16 19:35:49+00:00,cwa union planning cut technician clerical jobs,-0.5764436721801758
2020-06-16 19:30:00+00:00,intends cut technician clerical jobs cwa union,-0.5880801677703857
2020-06-16 19:13:31+00:00,news bullish,0.9462544918060304
2020-06-16 19:12:29+00:00,plans cut thousands jobs close stores union sound experiencing,-0.7256879806518555
2020-06-16 19:09:25+00:00,cwa union planning cut technician clerical jobs,-0.6081334352493286
2020-06-16 19:08:32+00:00,update plans cut thousands jobs close stores union,-0.4227361381053924
2020-06-16 18:56:07+00:00,evaluate available spectrum mcelfresh question,0.4341705739498138
2020-06-16 18:55:25+00:00,intends cut technician clerical jobs cwa union,-0.5499498844146729
2020-06-16 18:54:37+00:00,cut jobs cheddarlive,-0.9338382482528688
2020-06-16 18:49:32+00:00,plans cut jobs union,-0.5248805284500122
2020-06-16 18:48:07+00:00,cut jobs cheddarlive,-0.973129153251648
2020-06-16 18:43:06+00:00,ceo little longer least cnn owner wrote letter urging federal state local governments promote equal racial justice story,0.1032247841358184
2020-06-16 18:13:01+00:00,commented negatives unit,-1.0415972471237185
2020-06-16 18:06:26+00:00,downtrend moving average divergence macd turned negative view odds money news,-1.082397222518921
2020-06-16 17:37:43+00:00,negatives unit finance,-1.064061999320984
