Created_at,Tweet_Words,Score
2020-04-09 22:49:58+00:00,ready house searching amazing house friend saved kid travilah elementary school guess cell towers feet away school crime pray,0.4477379024028778
2020-04-09 22:31:16+00:00,sh show please dufus done magarally happen tuned thanks,-0.1409597992897033
2020-04-09 22:08:57+00:00,koolaid drinkers trump rest us forget due trump incompetence genocidal indifference lives lost dollars spent save economy wear hazmat suit necessary vote,0.0177148878574371
2020-04-09 21:38:28+00:00,collecting paycheck hiding home keeps spending let em stay home useless bureaucrats,-0.3317030966281891
2020-04-09 19:58:36+00:00,implied volatility expiration,-1.0714343786239624
2020-04-09 19:56:37+00:00,easy correlate cellular data pandemics dense populous areas thus confirmation exists however weird hypothetical situation believe randall let data telecom,-1.0610049962997437
2020-04-09 18:48:30+00:00,stop blaming congress fed safety able children family local state chronic problem solve push fed govt debt lacks leadership budget,-0.5784969329833984
2020-04-09 18:18:33+00:00,fed pumping yr decade sign inflation sense numbers show little inflation figure,-0.1343019306659698
2020-04-09 18:11:51+00:00,paid quick profit held little willl dip,0.8737598657608032
2020-04-09 18:05:45+00:00,slept happen tonight wtf need detailed review data plan open feds dumped life economy,-1.0666989088058472
2020-04-09 17:34:23+00:00,expects robust wireless capex growth,0.9223742485046388
2020-04-09 17:17:43+00:00,curious happens facets finance rely bond yield possible fed loans money move need move guess infinity dividend,0.4738455414772033
2020-04-09 17:17:17+00:00,carolina wealth advisors llc acquires,0.3293366134166717
2020-04-09 17:12:41+00:00,throw green deal,0.908313512802124
2020-04-09 17:11:43+00:00,dollars long term,0.9660394191741944
2020-04-09 17:10:48+00:00,,-0.7162322998046875
2020-04-09 17:10:30+00:00,ct entertainment bpt nyc mike notice,-0.07577645778656
2020-04-09 16:40:24+00:00,mr thing,0.2286342978477478
2020-04-09 15:51:21+00:00,face secular pressures subscription hard kill dtv ran ground worst substantial fcf personally away,-1.0773911476135254
2020-04-09 15:21:29+00:00,lately seems normal rational fed helicopter drops aka prints dollars lower int rates prop economy mkts unemployed crisis took yr real bottom though seems accellerated,-0.8573373556137085
2020-04-09 14:16:13+00:00,bullish details matter idea fed generating bank reserves absorb losses needs clarification,0.3878209888935089
2020-04-09 14:15:57+00:00,congress basically awol pass bailouts thursdaythoughts half congress die covid old,-0.6281446218490601
2020-04-09 13:29:55+00:00,commented stay home box office,0.2113302797079086
2020-04-09 12:32:02+00:00,target cut,-1.0324450731277466
2020-04-09 12:27:55+00:00,ban fr relate,-0.2780955135822296
2020-04-09 11:31:09+00:00,uptrend moving average divergence macd crosses signal line view odds money news,0.9515771865844728
2020-04-09 07:06:32+00:00,prairieview partners llc,-0.679923415184021
2020-04-09 06:57:45+00:00,eps estimates telus cut analyst,-0.8466991186141968
2020-04-09 06:22:45+00:00,eps estimates telus cut analyst,-0.8466991186141968
2020-04-09 02:31:36+00:00,,0.222910389304161
2020-04-09 01:32:54+00:00,allow away manipulation news create fakenews deception integrity customers glad,-0.7536400556564331
2020-04-09 00:21:46+00:00,somebody needs adult conversation cramer tell asshole face entitlements deducted paychecks us actually living root cause trump debt,-0.9192371368408204
2020-04-10 22:21:10+00:00,oh skills multiple languages worlds highest gdp capita terrible geography km berlin paris possibly cyber online digital economy europe already sorry bro talking havent clue peace,-0.8568357229232788
2020-04-10 21:12:56+00:00,mike ct entertainment bpt nyc notice,-0.0697390288114547
2020-04-10 21:12:01+00:00,corporate execs need dial comp dial force capitalist blind folks behind ss medicare corporate tax cuts corona add,-0.9818891286849976
2020-04-10 21:00:33+00:00,firstnet square miles expanded coverage includes portable coverage public safety agencies police fire departments alone us million devices,0.1168108955025672
2020-04-10 20:26:40+00:00,implied volatility expiration,-1.0720466375350952
2020-04-10 19:36:43+00:00,collision collision collision obama administration repeatedly sought cut ppe stockpile deficits dems blame,-0.6285563707351685
2020-04-10 19:21:47+00:00,mf nahhhh open ofc gon find track live,-0.0828113332390785
2020-04-10 18:53:41+00:00,run potus election america serious need president represents mainst outsources jobs indians doubles national debt fed providing welfare wallstreet trump maga,-0.0987930223345756
2020-04-10 17:23:53+00:00,fuck way democrats implemented term decided give health insurance cartel instead neverbiden endtheoligarchy burnitdown,-0.5245151519775391
2020-04-10 17:11:06+00:00,case,0.1709345579147339
2020-04-10 17:05:38+00:00,guessing disinfect anything trump name add rescue package,0.008048228919506
2020-04-10 17:03:46+00:00,add fuel fire us monetarily sovereign never run creates forced bankruptcy bills congress passes congress streets,0.4347721338272095
2020-04-10 16:57:05+00:00,guessing disinfect anything trump name add rescue package,-0.0327437184751033
2020-04-10 16:31:36+00:00,guessing disinfect anything trump name add rescue package,0.2081836760044098
2020-04-10 15:26:35+00:00,usg imposed shut economy freedoms find infuriating usg forced americans lose income single federal employee lost single dime congress listen ppl dump economy,-1.0339008569717407
2020-04-10 15:20:40+00:00,small biz suffer measly suffer trump grift ig fed treas artificially propping owners debt whole avg folks hedge fund pe,-1.06429922580719
2020-04-10 15:03:42+00:00,mr speaker please lend voice smallbiz spite literally receiv,-0.0710640698671341
2020-04-10 14:15:36+00:00,,0.675438642501831
2020-04-10 14:13:51+00:00,,0.784806489944458
2020-04-10 14:13:42+00:00,mr speaker please lend voice smallbiz spite literally receiving eidlhoax,-0.1617360115051269
2020-04-10 14:06:12+00:00,collision collision collision obama administration repeatedly sought cut ppe stockpile deficits dems blame budget squeeze america,-0.8294696807861328
2020-04-10 14:02:28+00:00,usa depression recession debt point return question relax guidelines orders start opening consumer spending,-0.6591888666152954
2020-04-10 13:23:07+00:00,extract mutations max occurs aa nuc btw changed covid ok gisaid concerned science paper quality lives,0.690915584564209
2020-04-10 12:33:02+00:00,wondering sentiment ratio,-0.0273666679859161
2020-04-10 11:31:10+00:00,extend higher towards area sellers waiting appear wave reaction lower least,-0.2296967357397079
2020-04-10 11:30:56+00:00,bounces expected fail swings move lower towards target area,-1.086644172668457
2020-04-10 11:30:49+00:00,lower managed break low opened bearish sequence peak favoring downside,-1.0826438665390017
2020-04-10 11:30:38+00:00,hour update presented members extend lower,-1.0142215490341189
2020-04-10 10:34:59+00:00,enters uptrend exceeded level view odds ht,0.910198211669922
2020-04-10 10:27:55+00:00,enters uptrend exceeded level view odds money news,0.9085429906845092
2020-04-10 07:40:24+00:00,telus earnings national bank financial forecasts,0.3420558273792267
2020-04-10 07:37:39+00:00,telus earnings national bank financial forecasts,0.3420558273792267
2020-04-10 07:01:44+00:00,android authority ign confirmed wb lego star wars code ship included razor crest set included dlc promotion androidauth androidauthority tech,0.1153416484594345
2020-04-10 04:19:34+00:00,question little tinfoilhatish hear us suing china chances purposefully overreacted rona show easy couple losses necessary,-1.0248234272003174
2020-04-10 03:29:13+00:00,commented stay home box office,0.2113302797079086
2020-04-10 03:21:20+00:00,throwing quarantined america bone giving needed entertainment home ratio unprecedented,0.9888138771057128
2020-04-10 02:43:35+00:00,cycle miss swing lower potential target towards etf update,-0.9848686456680298
2020-04-10 02:19:41+00:00,companies across spectrum reducing eliminating dividend need everybody opportunity without paying fact applaud prudent,0.9444431066513062
2020-04-10 02:13:56+00:00,meets estimates despite subscriber losses,-0.6242214441299438
2020-04-10 02:13:44+00:00,already big subscriber losses bigger quarter analyst ibd,-1.063393235206604
2020-04-10 02:12:33+00:00,fed idk wont catch fat bloated pos losing subs tons debt,0.8493735790252686
2020-04-10 02:08:50+00:00,,0.0222496092319488
2020-04-10 02:06:39+00:00,yield keeps bigger falls swear paying debt huge priority added billion debt,0.8373790979385376
2020-04-10 02:04:28+00:00,counting number yield broke give rest,-0.0862824395298957
2020-04-10 01:56:52+00:00,zacks analysts anticipate earnings,0.4354844987392425
2020-04-10 01:42:20+00:00,risk,-1.0311208963394165
2020-04-10 01:34:23+00:00,pure ewt waves waves corrective guessing wave cycle degree wave dow spx close enuf need stop,-1.0651189088821411
2020-04-10 01:27:22+00:00,weiping wang ce xu alternating euler sums euler tilde sums,0.0054437518119812
2020-04-10 00:34:20+00:00,sh show please dufus done magarally happen tuned thank,-0.1000536903738975
2020-04-11 22:47:04+00:00,beside tempertantrumtrump feeling foxnews please oann need rise senilegrandfatherinchief,0.2408618927001953
2020-04-11 20:06:01+00:00,providing service alone value least current valuation lowest true worth possibly undervalued actually worth around humble opinion,0.9337587356567384
2020-04-11 18:40:49+00:00,hom,-0.0469935350120067
2020-04-11 18:24:16+00:00,dumb imagine charge wireless services found chinese alien listening talk dumb pay billions dividends debt,-1.0682755708694458
2020-04-11 18:17:20+00:00,surplus soaked somewhere,0.5630980730056763
2020-04-11 17:04:12+00:00,peak profit expired,0.6938260793685913
2020-04-11 17:03:57+00:00,pt lowered,-1.0211342573165894
2020-04-11 17:00:10+00:00,apr,0.8436747789382935
2020-04-11 16:52:09+00:00,peaked triggered algo,0.9113759994506836
2020-04-11 16:48:07+00:00,view historical performance,0.0946619436144828
2020-04-11 15:44:31+00:00,yes idea government captured fire sector current crises case necessary adjustments need end neoliberal ideology enables fire sector,0.6727193593978882
2020-04-11 14:01:03+00:00,walkers bikers golfers thr trust clubs nca cmaa,0.3224941790103912
2020-04-11 09:51:43+00:00,wild guess upside printing presses warming quarantine stimulus,0.94436776638031
2020-04-11 09:36:22+00:00,enters uptrend exceeded level view odds money news,0.9064849615097046
2020-04-11 06:39:16+00:00,billion sales expected quarter,0.2398790717124939
2020-04-11 06:08:10+00:00,expected sales billion,0.1662816256284713
2020-04-11 06:07:52+00:00,expected sales billion,0.0899131000041961
2020-04-11 06:07:27+00:00,expected sales billion,0.0899131000041961
2020-04-11 04:38:00+00:00,spot mike china spent billions end infrastructure wasted money endless wars world spent show hit speed rail modern bridges airports piss poor govt computer,-0.9188156127929688
2020-04-11 04:05:25+00:00,models quality flaxions arxiv relevance darkmatter,0.9474904537200928
2020-04-11 03:13:47+00:00,gov congress passed bill gov monetarily sovereign never run creates never forced bankruptcy came gov gov funds us spend none,0.2475117743015289
2020-04-11 02:26:12+00:00,neighbor across lake within assuming safe efficacy vaccine dirtyfiat stimulus thrown around sky limit,0.9211403131484984
2020-04-12 23:32:58+00:00,ton,0.5269565582275391
2020-04-12 20:53:51+00:00,mike ct bpt nyc entertainment bugged entertainment creator fonder,-0.9110311269760132
2020-04-12 18:20:54+00:00,retweet receive trumpbux,0.0510515682399272
2020-04-12 17:57:47+00:00,hope leads promises create retain jobs footloose centers workers,0.4831434488296509
2020-04-12 15:54:55+00:00,intraday available viewing members,0.1908088773488998
2020-04-12 15:38:24+00:00,rally sellers area downside waves least etf update,-0.992010235786438
2020-04-12 15:37:24+00:00,cycle miss swing lower potential target towards etf update,-0.9848686456680298
2020-04-12 15:34:37+00:00,,-0.0859204530715942
2020-04-12 14:29:22+00:00,requires rules seen deregulation hawks lethal regulate everything sight types example little freedom move allow buybacks taxpayers several already,-0.8595200777053833
2020-04-12 13:26:43+00:00,guggenheim trims target,0.0380236133933067
2020-04-12 13:26:40+00:00,target cut,-1.0324450731277466
2020-04-12 12:37:30+00:00,updated analysis dividend aristocrat intrinsic value analysis dividends highyield aristocrat champion cashflow communications dividend aaamportfolios,0.3718030750751495
2020-04-12 11:08:29+00:00,earnings expected quarter,0.3642886281013489
2020-04-12 11:03:59+00:00,dems block funding help americans request billion aid iran sense bat demsarecorrupttotalitariantyrants voterepublican,-2.062320709228516e-05
2020-04-12 11:02:47+00:00,expected earnings,0.3868572413921356
2020-04-12 07:52:51+00:00,enters uptrend exceeded level view odds money news,0.9064849615097046
2020-04-12 04:19:17+00:00,ct entertainment bpt nyc mike bugged entertainment founder notice,-0.730565071105957
2020-04-12 02:25:26+00:00,bill maher cancelled whenever tells truth leftist fascists turn dared criticize communist china killing destroying economies,-0.9640063047409058
2020-04-12 02:11:01+00:00,wang xu alternating euler sums euler tilde sums,-0.0809063464403152
2020-04-13 23:51:12+00:00,mike ct bpt entertainment nyc safe god bless let pray virus away blood jesus,0.8725440502166748
2020-04-13 22:54:31+00:00,prediction lower dividend suspend entirely order give chance survi,-1.0604064464569092
2020-04-13 22:47:12+00:00,prediction lower dividend suspend entirely order give chance surviving inevitably happen cautiously aware mondaythoughts,-1.0432387590408323
2020-04-13 21:36:45+00:00,weak haters bluff piled national debt economically sink america care long happen already happened folks gdp un done,-1.0583657026290894
2020-04-13 21:27:34+00:00,bought directtv sense,0.4104399383068084
2020-04-13 21:20:40+00:00,credit economic depression scenario pressure ability pay dividend fully,-1.0295172929763794
2020-04-13 20:43:16+00:00,cs target,0.779936671257019
2020-04-13 20:37:51+00:00,dividend plus room rebound recovers,0.9574248790740968
2020-04-13 20:04:28+00:00,ave fo ill plan,-0.0591247715055942
2020-04-13 19:40:27+00:00,faces coronavirus wireless bunch question marks,0.8787147998809814
2020-04-13 19:02:59+00:00,ya moneyisntreal magic tree exists namely fed conjured moment notice ur psa fake let govt fool debt deficit none matters way control us guess us debt,-0.5717520713806152
2020-04-13 18:25:54+00:00,facts approx payout ratio yr average dividend growth,0.5435887575149536
2020-04-13 18:22:40+00:00,need talk bushe et et miss dealing bushe bushe friends false flag treason roads lead bushe et,-0.3530275821685791
2020-04-13 18:06:02+00:00,additional research dividend aristocrat currently paying debt,0.2055744975805282
2020-04-13 18:02:50+00:00,stimulus around financing big mortgage affected fnma etc delay inevitable govt release,-0.2223201096057891
2020-04-13 17:38:18+00:00,greetings alllll mike ct bpt entertainment nyc safe,0.9330034255981444
2020-04-13 17:26:42+00:00,facts approx payout ratio yr average dividend growth increases dividend straight note benefit launch hbo max streaming service data upgrade,0.9912585020065308
2020-04-13 17:13:15+00:00,add steveindex enjoy,0.9461249113082886
2020-04-13 17:07:52+00:00,gxd wxrld podcast begxns tonxght est xnstagram lxv wxll dxscussxng promotxng underground artxsts rappers producers vxsual artxsts tun podcast,0.2294515967369079
2020-04-13 17:01:33+00:00,directional bias report click details,-0.7685412168502808
2020-04-13 16:58:19+00:00,report click,0.2375848293304443
2020-04-13 16:42:59+00:00,show usps running deficits including pension prefunding mandate gop place,-0.1156249940395355
2020-04-13 16:27:18+00:00,nowhere long,0.9435374736785888
2020-04-13 16:27:09+00:00,bit riskier div growth beat inflation long focus paying debt cashflow grow well long well fire,0.3283179998397827
2020-04-13 16:14:16+00:00,cash flow statement management things paying debt thing rate dividend growth beat inflation capital gains long though,0.9469503164291382
2020-04-13 15:51:42+00:00,pacific wealth strategies purchases,0.1581375300884246
2020-04-13 15:25:56+00:00,starting position done full analysis though,0.3177118301391601
2020-04-13 15:24:13+00:00,additional research dividend aristocrat currently paying debt definitely let,0.9436244964599608
2020-04-13 15:20:14+00:00,target cut analysts credit,-1.0073381662368774
2020-04-13 15:19:20+00:00,target cut analysts credit,-1.0073381662368774
2020-04-13 15:18:59+00:00,target cut analysts credit,-1.0073381662368774
2020-04-13 15:00:51+00:00,dat mulu checkkk tho,0.8027034997940063
2020-04-13 14:50:31+00:00,watchlist dip fun,0.9776148796081544
2020-04-13 14:26:13+00:00,credit trims target,0.3106002509593963
2020-04-13 14:02:45+00:00,liberty apology nowplaying da blessing production radio listen download da bles,0.0285561382770538
2020-04-13 13:59:54+00:00,nurses physicians service firstnet network,0.8102763891220093
2020-04-13 13:57:02+00:00,trend reversal tradeideas room,0.6504586935043335
2020-04-13 13:32:06+00:00,heading bert dividend list shabby hair,0.6433776617050171
2020-04-13 13:08:56+00:00,credit maintains neutral lowers target,-0.6525989770889282
2020-04-13 13:06:02+00:00,explore fundamental pros cons,-0.2843285202980041
2020-04-13 13:05:05+00:00,recent technical crossed dma,0.7478611469268799
2020-04-13 12:30:58+00:00,dianna sorry mentioned allege prophet however accuse america things ar true covid virus contrived plan china heard alleged china owes,-0.2397587597370147
2020-04-13 12:26:37+00:00,cycle peak remain progress long peak leg lower place ending current bounce,-1.0272687673568726
2020-04-13 12:24:59+00:00,currently showing swings low target equal legs area place,0.804082989692688
2020-04-13 12:24:10+00:00,bounce higher potential double structure,0.9866108894348145
2020-04-13 12:23:19+00:00,end decline start waves bounce,-1.0201797485351562
2020-04-13 12:23:04+00:00,unique background greenfield type executive outside box,0.7607370615005493
2020-04-13 12:23:03+00:00,imagine jason kilar took job without degree comfort ability push boundaries break little glass icymi,0.9523700475692748
2020-04-13 11:43:13+00:00,undeterred coronavirus pandemic wavering promise roll wireless network,0.230249136686325
2020-04-13 11:25:19+00:00,lower managed break low opened bearish sequence peak favoring downside,-1.083936095237732
2020-04-13 11:24:41+00:00,hour update presented members extend lower,-1.0142215490341189
2020-04-13 10:46:54+00:00,liberty apology nowplaying da blessing production radio listen download da blessing production radio app app store dbpradio,0.0779094398021698
2020-04-13 10:10:09+00:00,informative app pivot points close pivot point download tradingview stockstowatch,0.8650386333465576
2020-04-13 09:57:16+00:00,target cut,-1.0324450731277466
2020-04-13 09:55:15+00:00,target cut,-1.0324450731277466
2020-04-13 09:54:02+00:00,target cut,-1.0324450731277466
2020-04-13 09:53:40+00:00,target cut,-1.0324450731277466
2020-04-13 08:59:09+00:00,enters uptrend exceeded level view odds money news,0.9064849615097046
2020-04-13 06:21:03+00:00,nurses physicians service firstnet network,0.8503766059875488
2020-04-13 04:19:59+00:00,nurses physicians service firstnet network,0.8503766059875488
2020-04-13 02:07:40+00:00,funny alot famous cuz knw porn frm ground mike entrepreneur,0.8040375709533691
2020-04-13 01:34:55+00:00,,0.08802430331707
2020-04-13 00:51:54+00:00,yung cal ft hefh spoil sponsored da reaction reaction spoil influence,0.0742852240800857
2020-04-14 22:20:20+00:00,mike ct entertainment bpt nyc stay safe greeting lll,0.9010268449783324
2020-04-14 22:15:17+00:00,zacks analysts anticipate sales billion,0.044069804251194
2020-04-14 22:14:56+00:00,expected sales billion,0.0907197892665863
2020-04-14 22:12:32+00:00,expected sales billion,0.0907197892665863
2020-04-14 21:57:23+00:00,big offer,0.9622180461883544
2020-04-14 20:39:42+00:00,bull thesis mvno immediately eventually dish tmus slowly building small cell network footprints besides mvno reliance footprint cable small cells currently ex altice,0.8522045612335205
2020-04-14 20:23:13+00:00,meridian purchases,0.0904293358325958
2020-04-14 20:06:00+00:00,tim corner dividend consideration,0.0691230222582817
2020-04-14 20:00:10+00:00,break close,0.9665483236312866
2020-04-14 19:59:44+00:00,goal books accumulate low lifetime forever savings minimal taxes need plan average average sp,0.9601999521255492
2020-04-14 19:39:57+00:00,gona keep hits dollars change,0.9865740537643432
2020-04-14 19:28:16+00:00,calculated dividend indefinitely pay phone bill thoughts lump sum purchases dollar averaging,0.3162837624549866
2020-04-14 19:12:45+00:00,telus rating increased outperform bmo capital,0.9468445777893066
2020-04-14 18:59:26+00:00,breakout ready needs,0.9415087699890136
2020-04-14 18:56:13+00:00,big offer,0.96370267868042
2020-04-14 18:51:18+00:00,chances,0.0557248368859291
2020-04-14 18:28:12+00:00,telus lifted outperform bmo capital,0.8863720893859863
2020-04-14 18:26:58+00:00,bmo capital upgrades telus outperform,-1.0378022193908691
2020-04-14 18:25:25+00:00,bmo capital upgrades telus outperform,-1.0378022193908691
2020-04-14 18:17:36+00:00,man,0.0653188824653625
2020-04-14 17:38:19+00:00,rd,0.1517669856548309
2020-04-14 17:26:47+00:00,thanks sa contributor wolf report fastgraphs article,0.3613877594470978
2020-04-14 16:55:24+00:00,management finally smart decisions economy,0.9481658935546876
2020-04-14 16:50:13+00:00,management finally smart decisions economy,0.927769660949707
2020-04-14 16:34:02+00:00,mike ct entertainment bpt nyc,-0.0190326683223247
2020-04-14 15:55:06+00:00,grabbed,0.4862721860408783
2020-04-14 15:03:39+00:00,pulled trigger,-0.1401109248399734
2020-04-14 15:00:19+00:00,mean world little bit help bills,0.8185371160507202
2020-04-14 14:53:02+00:00,executives reported pay truly excessive compensation came company eliminated workforce details compensation,-1.017109751701355
2020-04-14 14:50:16+00:00,heart believe birthright pottage orderly bread lines patient waiting dole arrive banks already received fills boundless despair everyone,-1.095749855041504
2020-04-14 14:47:25+00:00,thanks sa contributor wolf report fastgraphs article,0.2833640277385711
2020-04-14 14:36:42+00:00,models quality flaxions arxiv updated relevance darkmatter,0.9579055309295654
2020-04-14 14:05:46+00:00,seems pick little long term plans always long preferences divy,0.974740505218506
2020-04-14 14:03:54+00:00,jimmy keep dividend,0.1191334724426269
2020-04-14 13:35:51+00:00,lower managed break low opened bearish sequence peak favoring downside,-1.083936095237732
2020-04-14 13:35:38+00:00,hour update presented members extend lower,-1.0142215490341189
2020-04-14 13:19:24+00:00,telus reinforcing commitment albertans economy billion alberta,0.6917541027069092
2020-04-14 12:52:53+00:00,shame,-1.0072468519210815
2020-04-14 12:27:44+00:00,secured billion debt means dividend,0.1722037643194198
2020-04-14 10:44:35+00:00,analysis shit ugly,-1.062783122062683
2020-04-14 10:40:08+00:00,uptrend moving average divergence macd crosses signal line view odds money news,0.9515771865844728
2020-04-14 09:43:01+00:00,book value,0.6208127737045288
2020-04-14 08:51:00+00:00,target lowered credit,-1.007596135139465
2020-04-14 08:50:34+00:00,target lowered credit,-1.007596135139465
2020-04-14 08:48:02+00:00,target lowered credit,-1.007596135139465
2020-04-14 07:47:22+00:00,stocktwits trending recent interest,0.6953830718994141
2020-04-14 05:53:39+00:00,,0.5481833219528198
2020-04-14 05:13:27+00:00,date junius maltby youtube,-0.0134698897600173
2020-04-14 04:31:09+00:00,well done sir trimmed,0.971182942390442
2020-04-14 03:44:49+00:00,omg eternity agony waiting end sh show,-0.4078983664512634
2020-04-14 03:37:21+00:00,battery position company cell service reply wife told screen shot totally thanks jass cameos,0.6679178476333618
2020-04-14 03:17:49+00:00,liberty talk walk walk nowplaying da blessing production radio listen,0.0710043907165527
2020-04-14 02:23:53+00:00,rather shave head jk ask rf cker way fabulous,0.165021002292633
2020-04-14 02:09:58+00:00,subscribers contribution revenues,0.9738894701004028
2020-04-14 01:40:10+00:00,liberty talk walk walk nowplaying da blessing production radio listen download da blessing production radio app app store dbpradio,0.1045151352882385
2020-04-14 01:21:32+00:00,tell us resulted federal aid date spend clue care legislative vehicle carry anti american far agenda notmyspeaker,-0.1470770388841629
2020-04-14 00:41:54+00:00,growth rate dividend company general poor,-0.9930500984191896
2020-04-14 00:39:53+00:00,dividend plus room rebound recovers,0.9580501317977904
2020-04-14 00:22:05+00:00,wow needs fix problem,-0.7715946435928345
2020-04-15 22:51:12+00:00,expect pain economy,-1.033974289894104
2020-04-15 21:41:00+00:00,hoping drop rip move dawg,-0.8444249629974365
2020-04-15 21:31:01+00:00,iphone se entry level added spectrum bands firstnet band wcs band,0.1215304210782051
2020-04-15 21:02:34+00:00,warnermedia charter communications chtr announce distribution agreement hbo max,0.0485617630183696
2020-04-15 20:47:25+00:00,enormous vol ta news,0.8306530714035034
2020-04-15 20:44:42+00:00,bought,0.9606283903121948
2020-04-15 20:44:29+00:00,yes big fan wondering anyone news hbo let crank bitch,0.5341676473617554
2020-04-15 20:39:27+00:00,anyone shit normal,0.3565467596054077
2020-04-15 20:38:47+00:00,anyone slightest clue contracts side,0.401503324508667
