Created_at,Tweet_Words,Score
2020-04-24 01:30:25+00:00,ingrid beltita daniel beltita lie primitive ideals space,-0.095769815146923
2020-04-24 01:11:38+00:00,dude bitchass retail employees paying plus lease worthless luxury car blew mind reliable accord payment spreading money family,0.3708091378211975
2020-04-24 00:25:07+00:00,pt lowered cfra,-1.0419601202011108
2020-04-24 00:25:05+00:00,given target bank america,0.2976984977722168
2020-04-24 00:11:25+00:00,trump past presidents world order cun hope info helped clear questions pay nose us,0.2757820188999176
2020-04-25 22:14:47+00:00,meanwhile announced changes leadership randall stephenson retire ceo serve executive chairman board directors coo john stankey ceo effective,0.4208623468875885
2020-04-25 22:02:38+00:00,fed acted stabilized dollar toxic assets qe beyond classical economics claimed impending doom hyperinflation inflation anywhere qe,-1.050418257713318
2020-04-25 21:53:24+00:00,learnin,0.5716246366500854
2020-04-25 21:51:15+00:00,tryna bbed,-0.0268876925110816
2020-04-25 20:26:03+00:00,awesome scott,0.9284224510192872
2020-04-25 20:10:42+00:00,beltita beltita lie primitive ideals space,-0.631077766418457
2020-04-25 20:10:42+00:00,beltita beltita lie primitive ideals space,-0.1388927847146988
2020-04-25 19:19:29+00:00,adds bailout decades underwater state pension plans well change usa ussa socialized sadly path generational debt nearly tax burden unsustainable,-0.9427592754364014
2020-04-25 18:46:52+00:00,together package leadership changes need,0.086466446518898
2020-04-25 18:07:25+00:00,entry currently dividend hopefully growth,0.971333146095276
2020-04-25 17:48:45+00:00,together package leadership changes need ceo john stankey,0.081381618976593
2020-04-25 17:03:08+00:00,worst ceos seen documented,-1.089502453804016
2020-04-25 16:55:10+00:00,mir,-0.076306015253067
2020-04-25 16:50:24+00:00,icl und,-0.0468559861183166
2020-04-25 16:35:22+00:00,commented dividend despite virus hit,0.4811967611312866
2020-04-25 16:00:04+00:00,negative sentiment social media learn,-1.0770164728164673
2020-04-25 15:17:04+00:00,mr president never let however sent insult americans content held hostage homes without give riches sick,-0.7632187604904175
2020-04-25 14:53:16+00:00,ytd loss yoy rev entertainment warnermedia bsn turner ads gain ceo stephenson steps ceo outlook withdrawn,-0.8726720809936523
2020-04-25 14:46:24+00:00,max pain maturity,0.0186300501227378
2020-04-25 14:17:14+00:00,grabbed interesting pans lot headwinds,0.9578127861022948
2020-04-25 13:44:15+00:00,glad enjoyed article well key member dividend portfolio concerns position small long well thanks,0.9812780618667604
2020-04-25 12:18:24+00:00,director stephen luczo,0.0793440490961074
2020-04-25 12:17:28+00:00,director stephen luczo,0.0793440490961074
2020-04-25 12:16:53+00:00,director stephen luczo,0.0793440490961074
2020-04-25 12:16:49+00:00,director stephen luczo,0.0793440490961074
2020-04-25 11:37:03+00:00,releases earnings results misses expectations eps,-0.0239104554057121
2020-04-25 11:34:50+00:00,releases earnings results misses expectations eps,-0.0239104554057121
2020-04-25 08:44:12+00:00,uptrend moving average divergence macd crosses signal line view odds money news,0.9515771865844728
2020-04-25 07:28:22+00:00,android authority paramount pushed release dates mission impossible chris action film war dungeons dragons movie androidauth androidauthority tech,0.0676367357373237
2020-04-25 06:31:32+00:00,covered,0.1385515332221985
2020-04-25 06:05:29+00:00,ceo randall stephenson stepping company facing uncertain future,-0.7159637212753296
2020-04-25 05:57:01+00:00,begins coverage,0.0451906323432922
2020-04-25 05:56:06+00:00,begins coverage,0.0451906323432922
2020-04-25 04:46:15+00:00,deathstar aka runs deep state shadow networks careful att paranoiawilldestroyya,-0.7563188076019287
2020-04-25 04:38:49+00:00,announces preliminary results meeting,0.0765790790319442
2020-04-25 04:31:58+00:00,randall stephenson retire ceo serve executive chairman board board elects john stankey ceo board member,0.0508818104863166
2020-04-25 03:58:04+00:00,case shutting divvy seems pretty compelling way create equity value,0.9751917123794556
2020-04-25 03:08:00+00:00,outgoing tkr ceo randall stephenson telecom ceo ceos succession corporategovern,-0.0136102475225925
2020-04-25 03:07:15+00:00,outgoing tkr ceo randall stephenson telecom ceo ceos succession corporategovernance elliott,-0.0132734030485153
2020-04-25 02:24:45+00:00,,0.8925827741622925
2020-04-25 01:36:16+00:00,commented dividend despite virus hit,0.4811967611312866
2020-04-25 00:58:16+00:00,hard retweet considering dislike nailed ta keep real,-0.6095784902572632
2020-04-25 00:48:33+00:00,dividend despite virus hit,0.5856437683105469
2020-04-25 00:42:34+00:00,crazy creates opportunities,0.9022222757339478
2020-04-25 00:34:09+00:00,rating lowered dz bank,-0.9910112619400024
2020-04-25 00:29:29+00:00,dividend despite virus hit,0.6957813501358032
2020-04-25 00:23:50+00:00,choice economy reflation least,0.2278560101985931
2020-04-25 00:07:51+00:00,change leadership mean volatility long term grab,0.6734486818313599
2020-04-26 22:26:43+00:00,strategy,-0.1307665407657623
2020-04-26 21:33:23+00:00,disinformation program complete everything american public believes,-0.0292161665856838
2020-04-26 21:00:02+00:00,firstnet square miles expanded coverage includes portable coverage public safety agencies police fire departments alone us million devices,0.1168108955025672
2020-04-26 19:53:29+00:00,increase guess research goal,0.981642723083496
2020-04-26 17:50:13+00:00,problem antitrust imagine bookie related service largest customer,-0.8872720003128052
2020-04-26 17:31:22+00:00,disinformation program complete everything american public believes false william casey cia director operationmockingbird source,-0.7507919073104858
2020-04-26 17:30:26+00:00,disinformation program complete everything american public believes false william casey cia director operationmockingbird source,-0.6986020803451538
2020-04-26 17:09:28+00:00,ceo randall stephenson retire replaced warnermedia chief john stankey,-0.0029989033937454
2020-04-26 17:05:57+00:00,debt nonfinancial corporation world roughly billion consistent revenue streams healthy dividend experts consider company track future despite falling,0.9630624055862428
2020-04-26 17:03:54+00:00,longtime ceo randall stephenson stepped position modest earnings report company showed mixed results,-0.903688907623291
2020-04-26 16:04:03+00:00,yes beleive hbo max big deal long term agree,0.8328787088394165
2020-04-26 15:09:59+00:00,please fractional reserve banking publications actual federal reserve myth recent federal relief programs thin air war spending thin air cases meaning act congress,-0.0321215316653251
2020-04-26 15:00:03+00:00,past saw negative steady social media sentiment,-1.0723074674606323
2020-04-26 14:56:49+00:00,retirement strategy consider finance,0.5665024518966675
2020-04-26 14:26:02+00:00,ct entertainment bpt nyc mike,-0.0117683932185173
2020-04-26 14:03:04+00:00,heavier gon na change smidge worry mind whatever,-0.7796013355255127
2020-04-26 14:00:06+00:00,took hood bitches kmart playboy vogue magazine god told story jesus mary magdalene insaid washed feet aeropostale,0.039372120052576
2020-04-26 13:12:32+00:00,nomura cuts target,-0.918789267539978
2020-04-26 12:40:55+00:00,ytd loss yoy rev entertainment,-1.0637593269348145
2020-04-26 12:09:28+00:00,welcome example cr act brought dee compl ms media deception manipulate mind masses,0.1918142288923263
2020-04-26 11:33:32+00:00,duh without dividend,0.4395982325077057
2020-04-26 10:09:04+00:00,coverage initiated,0.0660524070262909
2020-04-26 10:07:37+00:00,coverage initiated,0.0660524070262909
2020-04-26 09:33:36+00:00,coverage initiated,0.0660524070262909
2020-04-26 09:31:36+00:00,coverage initiated,0.0660524070262909
2020-04-26 08:56:32+00:00,stephen luczo,0.2360619008541107
2020-04-26 08:56:30+00:00,insider director,0.7451121807098389
2020-04-26 08:53:56+00:00,stephen luczo,0.2360619008541107
2020-04-26 08:20:17+00:00,uptrend moving average divergence macd turned positive view odds money news,0.9583710432052612
2020-04-26 07:21:00+00:00,ceo randell stephenson step coo john stankey serve head,0.03885368257761
2020-04-26 07:01:47+00:00,dz bank downgrades,-1.050776481628418
2020-04-26 06:23:46+00:00,eps estimates reduced analyst,-0.7907146215438843
2020-04-26 06:23:39+00:00,analysts offer predictions earnings,0.036919355392456
2020-04-26 06:21:53+00:00,analysts offer predictions earnings,0.036919355392456
2020-04-26 05:52:03+00:00,earnings william blair forecasts,0.3079509735107422
2020-04-26 05:47:29+00:00,earnings william blair forecasts,0.3079509735107422
2020-04-26 05:47:17+00:00,earnings william blair forecasts,0.3079509735107422
2020-04-26 04:35:44+00:00,included hourly shows rising wedge formed area rising resistance extremely solid hourly descending triangle,0.9600093364715576
2020-04-26 02:55:30+00:00,understand dilemma govt grant bts exemption opening pandora box quantify musical achievements anyone bb thx bundles measure bring seen mediaplay yg sm,-0.1621682345867157
2020-04-26 00:47:53+00:00,strategic moves att,0.2068099975585937
2020-04-26 00:28:32+00:00,summary happened stimulus funds tod,0.0514730289578437
2020-04-26 00:24:48+00:00,dividends thing,0.9354780912399292
2020-04-26 00:22:08+00:00,action past stillunder couple dollars happy,0.8209913969039917
2020-04-27 23:02:17+00:00,insider filing sr exec vp gen counsel david ii mcatee,0.0468705147504806
2020-04-27 22:02:35+00:00,sec filing form,-0.043612752109766
2020-04-27 21:58:22+00:00,,0.0264455787837505
2020-04-27 21:57:37+00:00,,0.1147670224308967
2020-04-27 21:45:53+00:00,bank america trims target,0.0267533138394355
2020-04-27 21:43:21+00:00,bank america trims target,0.0267533138394355
2020-04-27 21:30:12+00:00,revstrat upside thestrat,0.9692331552505492
2020-04-27 21:24:46+00:00,cash leverage focus dividend,0.954822301864624
2020-04-27 21:24:20+00:00,cash leverage focus finance,0.6872036457061768
2020-04-27 21:12:55+00:00,cash leverage focus finance,0.6098275184631348
2020-04-27 20:44:48+00:00,opts consistency tapping longtime exec john stankey ceo separate chairman ceo role,0.1911969631910324
2020-04-27 20:43:43+00:00,opts consistency tapping longtime exec john stankey ceo separate chairman ceo role amid pressure,0.166718527674675
2020-04-27 20:37:34+00:00,bought small tranche dividend dividend yield,0.4307259619235992
2020-04-27 20:34:10+00:00,bear loaded bell dividend,0.956886887550354
2020-04-27 20:14:23+00:00,climbs straddle implying move,0.8713159561157227
2020-04-27 20:04:58+00:00,thanks sa contributor mark roussin fastgraphs article,0.2801299691200256
2020-04-27 19:32:15+00:00,happy managed,0.9750200510025024
2020-04-27 19:16:03+00:00,hahahaha rob boring hammer force playa playa thestrat,-0.0697418302297592
2020-04-27 19:12:42+00:00,bear loaded bell economy,0.1021542027592659
2020-04-27 18:59:41+00:00,dmi trigger conjunction vwap lucky moment,0.9837021827697754
2020-04-27 18:51:18+00:00,unless retiring stay low range drip accumulate bigly add cheap reach point low average collect tax income,0.9588587284088136
2020-04-27 18:49:29+00:00,mr,0.7438358068466187
2020-04-27 18:32:22+00:00,thanks anti rant heads demise appreciate sadly,-0.7927932739257812
2020-04-27 18:29:02+00:00,added,0.8290146589279175
2020-04-27 18:09:10+00:00,flow update optionsflow streaming,0.8975222110748291
2020-04-27 16:45:22+00:00,bought wait dip,0.9983015060424804
2020-04-27 16:31:26+00:00,picked,0.5919921398162842
2020-04-27 15:37:52+00:00,long peak remains place correction later,0.9690417051315308
2020-04-27 15:37:23+00:00,term bounce reach extreme area waves place,-1.0591624975204468
2020-04-27 15:03:46+00:00,appreciate let earn deb,0.989919900894165
2020-04-27 14:59:54+00:00,retirement strategy consider,0.5569080114364624
2020-04-27 14:35:02+00:00,juicy yield,0.9564565420150756
2020-04-27 14:33:34+00:00,shows boring ceo transitions needed,-0.8851091861724854
2020-04-27 14:12:06+00:00,appealing maintains safe dividend dividend,0.9504834413528442
2020-04-27 14:09:37+00:00,appealing maintains safe dividend,0.932486653327942
2020-04-27 14:03:28+00:00,appealing maintains safe dividend,0.9352511167526244
2020-04-27 13:29:21+00:00,portfolio,0.7962311506271362
2020-04-27 13:23:14+00:00,job,0.9097007513046264
2020-04-27 13:18:24+00:00,portfolio,0.8841792345046997
2020-04-27 13:15:11+00:00,newspapers coronavirus stimulus tv cashcasters ppp handouts nexstar sinclair promise black taxpayer benefactors cut directv distant network subs mo reprieve,0.2079574465751648
2020-04-27 13:03:46+00:00,commented dividend despite virus hit,0.4811967611312866
2020-04-27 12:39:05+00:00,covid deep state nationalized fed treasury provide aid easier catch child traffickers prevent ff ops flattening curve threat meant us able employ natl guard underground drug op rescue thousands,-0.282171219587326
2020-04-27 12:35:09+00:00,portfolio economy,0.8265016078948975
2020-04-27 10:47:50+00:00,uptrend moving average divergence macd turned positive view odds money news,0.9583710432052612
2020-04-27 09:18:32+00:00,att embedded expectations analysis usa currently corporate averages relative uniform earnings uniform levels equity,-0.8148483037948608
2020-04-27 09:18:07+00:00,stephen luczo,0.2360619008541107
2020-04-27 08:56:50+00:00,bit sad opportunistic political shill green energy crony capitalists flog toxic ecocidal wares,-1.0448139905929563
2020-04-27 08:06:28+00:00,keycorp equities analysts cut earnings estimates,-0.810705304145813
2020-04-27 07:34:09+00:00,earnings estimate issued keycorp,0.030937198549509
2020-04-27 07:33:48+00:00,earnings william blair forecasts,0.3997818231582641
2020-04-27 07:33:47+00:00,banks comments earnings,0.0548786185681819
2020-04-27 07:33:45+00:00,keycorp equities analysts cut earnings estimates,-0.9200756549835204
2020-04-27 07:04:25+00:00,banks comments earnings,0.0464422591030597
2020-04-27 07:03:32+00:00,banks comments earnings,0.0548786185681819
2020-04-27 07:03:31+00:00,earnings william blair forecasts,0.3997818231582641
2020-04-27 06:57:50+00:00,earnings william blair forecasts,0.3159463107585907
2020-04-27 06:23:39+00:00,pt lowered,-1.0229052305221558
2020-04-27 06:21:57+00:00,pt lowered,-1.0229052305221558
2020-04-27 06:21:42+00:00,given target cfra,0.2652512192726135
2020-04-27 06:20:48+00:00,pt lowered,-1.0229052305221558
2020-04-27 05:47:29+00:00,earnings forecasts,0.332842469215393
2020-04-27 05:46:51+00:00,earnings forecasts,0.332842469215393
2020-04-27 05:45:57+00:00,earnings forecasts,0.332842469215393
2020-04-27 05:45:34+00:00,earnings forecasts,0.4205933213233948
2020-04-27 05:43:34+00:00,earnings forecasts,0.332842469215393
2020-04-27 05:03:20+00:00,company meaning depth well dividend long term,0.9439970254898072
2020-04-27 04:26:54+00:00,treas sec mnuchin told fnc believes economy gon na bounce quickly summer states start reopen way economy gon na huge impact,0.968040943145752
2020-04-27 03:23:26+00:00,saw director purchase trust,0.9490982294082642
2020-04-27 01:50:53+00:00,remotework stockstowatch dtgi positioned,0.7278822660446167
2020-04-27 01:32:13+00:00,needs help,0.3915559351444244
2020-04-27 00:36:31+00:00,att learning hard way hollywood warner bros ceo steps allegations affair actress,-0.6113101243972778
2020-04-28 23:36:26+00:00,simple computer scientist axis ask,-0.0264035053551197
2020-04-28 23:31:08+00:00,measurement ckm matrix elements single quark channel production collisions sqrt tev arxiv physics,0.5192033052444458
2020-04-28 21:22:56+00:00,mike ct bpt nyc entertainment,-0.0131081975996494
2020-04-28 21:11:32+00:00,financials course dividend aristocrat solid company opinion bring hbo max fire,0.9860025644302368
2020-04-28 20:47:01+00:00,sec filing form,0.0164703726768493
2020-04-28 20:45:39+00:00,sec filing form,-0.0710971057415008
2020-04-28 20:40:50+00:00,dip weakness loaded paid never failed pop upsides,-0.8788166046142578
2020-04-28 20:27:03+00:00,deutsche bank cuts target consumers tighten dividend,0.9650431871414183
2020-04-28 20:24:59+00:00,dividend,0.9574532508850098
2020-04-28 20:22:45+00:00,permanent damage entertainment warner media destroy dividend dividend,0.9481868743896484
2020-04-28 20:00:48+00:00,permanent damage entertainment warner media destroy dividend,-0.9331743717193604
2020-04-28 19:51:50+00:00,wrong rebates receive programmers leagues provided customers,-1.0402954816818235
2020-04-28 18:23:41+00:00,commented,0.0524077117443084
2020-04-28 18:18:05+00:00,finance,0.0886125564575195
2020-04-28 18:00:34+00:00,newly named ceo john stankey received early wall street,0.6899940967559814
2020-04-28 17:04:09+00:00,halloo sen paul funny money man spend funny money consult aquabuddha us living bankrupting country repays funny money,0.7448447942733765
2020-04-28 16:48:25+00:00,,-0.0406219474971294
2020-04-28 16:39:34+00:00,stopped profit thank notice expand broadening formation anymore thestrat,0.918038249015808
2020-04-28 16:36:12+00:00,,-0.0711809992790222
2020-04-28 15:59:10+00:00,cash flow needs break room,0.9740434885025024
2020-04-28 14:56:08+00:00,mike ct bpt nyc entertainment safe stay inn bless us alll around wolrd,0.9458751678466796
2020-04-28 14:48:49+00:00,deutsche bank cuts target,-0.7787226438522339
2020-04-28 14:47:43+00:00,target cut,-1.033251404762268
2020-04-28 14:34:50+00:00,deutsche bank cuts target consumers tighten,-0.440043181180954
2020-04-28 14:30:22+00:00,closely largest single,0.137662649154663
2020-04-28 13:27:16+00:00,fuc lyk,-0.1997110545635223
2020-04-28 12:57:55+00:00,birthd blessed,0.5925559997558594
2020-04-28 12:46:01+00:00,peak profit expired,0.4290544986724853
2020-04-28 12:41:58+00:00,,0.790662407875061
2020-04-28 12:36:56+00:00,birthd blessed,0.4871024191379547
2020-04-28 12:33:57+00:00,peaked triggered algo,0.9082536697387696
2020-04-28 12:29:55+00:00,view historical performance,0.0946619436144828
2020-04-28 12:22:40+00:00,pt cut deutsche bank,-1.0498830080032349
2020-04-28 11:33:59+00:00,injections children happened past,0.0438048690557479
2020-04-28 11:21:41+00:00,telus expands hospital workers,0.917150378227234
2020-04-28 11:03:54+00:00,dz bank downgrades,-1.050776481628418
2020-04-28 11:02:53+00:00,dz bank downgrades,-1.050776481628418
2020-04-28 10:22:08+00:00,brokers issue forecasts earnings,-0.2837072312831878
2020-04-28 10:18:23+00:00,director geoffrey yang acquires,0.1115393415093422
2020-04-28 10:16:53+00:00,brokers issue forecasts earnings,-0.2837072312831878
2020-04-28 10:11:38+00:00,mike gooday blessing guys familia stay home safe ct entertainment bpt nyc,0.974624752998352
2020-04-28 08:45:17+00:00,uptrend recovers oversold zone view odds money news,0.9527933597564696
2020-04-28 07:41:13+00:00,earnings forecast issued banks,0.0752447247505188
2020-04-28 07:07:23+00:00,director geoffrey yang,0.2308745384216308
2020-04-28 06:49:22+00:00,media cannibals forced retreat hv country living hell full protection,-0.9026411771774292
2020-04-28 06:37:46+00:00,earnings estimate issued william blair,0.0247325897216796
2020-04-28 06:36:12+00:00,earnings forecast issued banks,0.0752447247505188
2020-04-28 06:33:28+00:00,expected earnings,0.2947407960891723
2020-04-28 05:57:59+00:00,forecasted earnings,0.2693564891815185
2020-04-28 05:56:26+00:00,weighs earnings,0.0329786278307437
2020-04-28 04:23:27+00:00,retesting dropping past,0.9404687881469728
2020-04-28 03:27:59+00:00,director acquires,0.3822247385978699
2020-04-28 03:26:32+00:00,singapore press ltd singapore press extended budget healthy pbsa bookings sph provided corporate update continual effects covid line enhanced disclosure estimated impact equity,0.9615267515182496
2020-04-28 02:02:56+00:00,commented dividend despite virus hit,0.4811967611312866
2020-04-28 01:48:23+00:00,cut dz bank,-0.9374343156814576
2020-04-28 01:48:00+00:00,cut dz bank,-0.9374343156814576
2020-04-28 01:36:28+00:00,interesting case study bad capital allocation becomes part culture capital allocation,0.8631694316864014
2020-04-28 01:28:13+00:00,classic,0.9447554349899292
2020-04-28 01:26:27+00:00,terrible capital allocation decisions,-1.0679352283477783
2020-04-28 00:01:17+00:00,insider filing director geoffrey yang,0.0539304539561271
2020-04-29 23:25:44+00:00,reits beaten pretty badly lots opportunities reits lot pay dividends wait quarter paid,0.9776582717895508
2020-04-29 23:09:52+00:00,lost admit losses reason,-1.0491327047348022
2020-04-29 22:14:43+00:00,republicans continue everything power lose election graham threaten cut future bailouts corporations gop care deny give struggling workers tax dollars recession,-0.7683099508285522
2020-04-29 22:04:55+00:00,brb gunna rename model,-0.0069972835481166
2020-04-29 21:10:12+00:00,telus expands hospital workers,0.9325571060180664
2020-04-29 20:52:14+00:00,trae tha truth slidin remix audio remix ft genasis need sum hot,0.0362845361232757
2020-04-29 19:52:37+00:00,idk funny devalue everyone hard earned money savings pensions etc bandits massive bailouts pitchforks torches imho least bitcoin,-1.0007036924362185
2020-04-29 19:36:09+00:00,retest close probably open,-1.0801986455917358
2020-04-29 19:16:07+00:00,long probably due hbo max,0.981887698173523
2020-04-29 18:29:16+00:00,nancy worth instead passing bills spend taxpayers pay empty payroll relief program,0.2257533818483352
2020-04-29 17:57:53+00:00,dividend always slow grower slow growth fine outsized yield low yield growth avoid low yield low growth solid value imo,0.7161202430725098
2020-04-29 17:26:06+00:00,standing ground covid dividend,0.2598187625408172
2020-04-29 17:19:32+00:00,bought personally ultimately mid doable mid,0.9677550792694092
2020-04-29 16:52:21+00:00,usually slow mover trigger dmi indcator quick tick move,0.9700479507446288
2020-04-29 16:49:41+00:00,starting move smoother waters resistance,0.7660701274871826
2020-04-29 16:37:10+00:00,hod,0.1820626109838485
2020-04-29 16:02:13+00:00,standing ground covid dividend dividend,0.9629839658737184
2020-04-29 15:49:28+00:00,whew almost gave closed profit patience skill learning,0.9179341793060304
2020-04-29 15:46:14+00:00,beautiful,0.9416764974594116
2020-04-29 15:34:44+00:00,grab,0.9332268238067628
2020-04-29 15:32:45+00:00,pick play familiar setup swing,0.932992458343506
2020-04-29 15:00:04+00:00,negative sentiment moderate activity social media,-1.0756229162216189
2020-04-29 14:51:56+00:00,mice comeback us,0.6751223802566528
2020-04-29 13:32:04+00:00,hellolikee broadcasting magic live,0.8631232976913452
2020-04-29 13:26:08+00:00,,0.1305411010980606
2020-04-29 13:15:10+00:00,standing ground covid dividend economy,0.4809279441833496
2020-04-29 13:03:37+00:00,break channel,-0.3159745037555694
2020-04-29 12:57:38+00:00,geoffrey yang acquires,0.1982349306344986
2020-04-29 12:54:58+00:00,director acquires,0.20650714635849
2020-04-29 12:42:33+00:00,wow dividend dividend longterm startingsmall,0.7239888906478882
2020-04-29 12:28:03+00:00,trae tha truth slidin remix audio remix ft genasis need sum hot ass rappers remix jawn fire,0.0775763094425201
2020-04-29 12:13:18+00:00,data universe ivolatility historical end eod data offers complete accurate source implied volatilities available leading firms,0.914608359336853
2020-04-29 09:53:00+00:00,announces coo john stankey boardofdirectors ceo corpgov,0.0246568322181701
2020-04-29 09:38:12+00:00,dividends indeed well covered cash flow dividend yield consistently moderately safe payout ratios fintwit dividendinvesting investingtips valueinvesting,0.9739176034927368
2020-04-29 09:26:01+00:00,mike ct nyc bpt entertainment gooday bless us,0.9360697269439696
2020-04-29 08:55:41+00:00,earnings estimate issued keycorp,0.0377615988254547
2020-04-29 08:37:27+00:00,uptrend peaks leaves oversold zone view odds money news,0.9323976039886476
2020-04-29 08:21:19+00:00,eps estimates decreased analyst,-0.8206273317337036
2020-04-29 07:22:18+00:00,guys,0.6428655385971069
2020-04-29 07:14:23+00:00,eps estimates decreased analyst,-0.8206273317337036
2020-04-29 07:14:00+00:00,banks comments earnings,0.0464422591030597
2020-04-29 06:24:14+00:00,weighs earnings,0.0329786278307437
2020-04-29 06:23:12+00:00,forecasted earn earnings,0.4598814249038696
2020-04-29 04:07:00+00:00,earnings difficult thesis,-1.0854485034942627
2020-04-29 02:12:11+00:00,earnings difficult thesis,-1.07670259475708
2020-04-29 01:38:38+00:00,adzl,0.0537280663847923
2020-04-29 01:27:13+00:00,deutsche bank cuts target,-0.9454219341278076
2020-04-29 00:56:25+00:00,printed deal covid find modern monetary theory hand everyone end poverty print enough money arrest global warming,0.6717084646224976
2020-04-29 00:37:47+00:00,max pain maturity,-0.1104882284998893
2020-04-29 00:24:24+00:00,chance notifications responses dmed iger ready shows saw message,-0.2299181520938873
2020-04-29 00:06:49+00:00,well currently commanding presumably fears regarding dividend fear payout well covered cash flow easy yield approaching dividends,0.9572397470474244
2020-05-03 22:10:14+00:00,max pain maturity,-0.1050592064857482
2020-05-03 21:18:38+00:00,zacks brokerages anticipate announce earnings,0.408629298210144
2020-05-03 15:20:33+00:00,directional bias report click details,-0.7685412168502808
2020-05-03 15:13:59+00:00,report click,0.2375848293304443
2020-05-03 13:09:25+00:00,hear passion frustration employee begin climb bunker clearly responses change stance strange former believer gtf need,-1.084549069404602
2020-05-03 12:34:10+00:00,resources together governments directing funny problem wars illuminati cabal destroying sanitation water pipes alone cause,-0.8560155630111694
2020-05-03 12:06:47+00:00,keep middle little dip dividend attractive,0.975743055343628
2020-05-03 09:46:49+00:00,valuengine downgrades,-0.8286771774291992
2020-05-03 09:45:11+00:00,valuengine downgrades,-0.8286771774291992
2020-05-03 09:37:14+00:00,position dividend excited though,0.9954334497451782
