Created_at,Tweet_Words,Score
2020-07-01 20:43:27+00:00,break rejection profit swing wish broke previous resistance buyers defend area breaks move,0.1866616457700729
2020-07-01 20:43:00+00:00,every paycheck,0.987064003944397
2020-07-01 20:40:53+00:00,solid saw add end,0.9664700031280518
2020-07-01 20:13:06+00:00,far anywhere pays around dividend,0.9330404996871948
2020-07-01 20:11:48+00:00,yeah hoped fool,0.6928495168685913
2020-07-01 20:03:15+00:00,liquidity help,0.5048128366470337
2020-07-01 20:02:38+00:00,,0.957390546798706
2020-07-01 20:00:37+00:00,snagged,0.469163179397583
2020-07-01 19:54:42+00:00,,0.9440492391586304
2020-07-01 19:54:38+00:00,target lowered morgan stanley overweight usd usd,-1.0001715421676636
2020-07-01 19:27:23+00:00,paid without wan na dividend,0.5712611675262451
2020-07-01 19:27:02+00:00,paid without wan na dividend,0.7554186582565308
2020-07-01 19:15:07+00:00,pa well college age guys streaming wasnt though,0.9126296043395996
2020-07-01 19:14:45+00:00,drops tiny bit,0.6511549949645996
2020-07-01 19:14:43+00:00,matt keep,0.9497995376586914
2020-07-01 18:53:18+00:00,bought,0.918887495994568
2020-07-01 17:37:34+00:00,flow update optionsflow streaming,0.1349928677082061
2020-07-01 17:33:33+00:00,dividend billions revenue covid yields research decision,0.6444869041442871
2020-07-01 17:24:46+00:00,debt probably metrics carefully track snippet fy slides presentation company paid interest expense fy focus company reduction clear add,0.5268561840057373
2020-07-01 17:14:14+00:00,yeah appears steps set company dtc success lot growing pains patience required suit,0.8897439241409302
2020-07-01 16:36:13+00:00,lamestreammedia protect,0.8202745914459229
2020-07-01 16:13:06+00:00,snagged dividend growth modest yield saf,0.9521328210830688
2020-07-01 16:00:52+00:00,volatility jay soloff help find ideas example earnings,-0.6608794927597046
2020-07-01 15:59:47+00:00,hour weekend update showing reaction lower place blue box area expected,-1.0111533403396606
2020-07-01 15:59:35+00:00,hour update update wave bounce towards blue box area sellers expected appear,-0.2760091722011566
2020-07-01 15:59:24+00:00,saw weekend update,0.0721880197525024
2020-07-01 15:52:54+00:00,currently dips dipping,0.5047358274459839
2020-07-01 15:52:12+00:00,kilar quote exemplifies challenge ahead well third cable satellite customers hbo max already paying hbo taken advantage offer,0.973235249519348
2020-07-01 15:51:41+00:00,tech,0.7570973634719849
2020-07-01 15:46:39+00:00,dividend mine dividend stockscreener,0.2040710598230362
2020-07-01 15:46:33+00:00,wrote thread power passive income dividend paying,0.9615074396133424
2020-07-01 15:46:14+00:00,,0.9370713233947754
2020-07-01 15:45:14+00:00,dividend eyes,-0.0016152262687683
2020-07-01 15:43:31+00:00,,0.9409092664718628
2020-07-01 15:42:50+00:00,point machine long dividends excess mo contributing job passive income increases income easier easier save,0.979473114013672
2020-07-01 15:42:47+00:00,passive income generate dividends essentially adding income total budget huge generating income dividend portfolio,0.9809843301773072
2020-07-01 15:42:43+00:00,morgan stanley trims target maintains overweight rating,-0.0035620182752609
2020-07-01 15:42:24+00:00,bought fractional drip,0.8514338731765747
2020-07-01 15:42:08+00:00,,0.928673505783081
2020-07-01 15:39:22+00:00,keep adding onto position,0.8619610071182251
2020-07-01 15:32:21+00:00,eyes,-0.4343825578689575
2020-07-01 15:30:22+00:00,vt wtf catching real fast lezz madrohas,-0.0949610769748687
2020-07-01 15:29:11+00:00,double money dividends,0.9746437072753906
2020-07-01 15:26:44+00:00,snagged dividend growth modest yield safe reducing debt levels well,0.9736043214797974
2020-07-01 15:26:21+00:00,heck happened randall,-0.7051225900650024
2020-07-01 15:20:31+00:00,find interesting every company carrier service plan personally,0.9821099042892456
2020-07-01 15:19:22+00:00,fire,0.2117397785186767
2020-07-01 15:15:28+00:00,already,-0.5882673263549805
2020-07-01 15:12:36+00:00,lockheed martin,-0.0072064846754074
2020-07-01 14:55:17+00:00,vt wtf catching real fast lezz madrohas,-0.071343332529068
2020-07-01 14:39:01+00:00,beautiful technical formation,0.9606270790100098
2020-07-01 14:37:57+00:00,dips drops gobbling,0.9549950361251832
2020-07-01 14:37:26+00:00,bullish mid jul,0.9744317531585692
2020-07-01 14:37:22+00:00,ponos llc scam stockstowatch scams wealth finance dividendinvesting dividend dividendincome nasdaq spy,-0.8358446359634399
2020-07-01 14:36:51+00:00,wrong bad actually broke recent thread,-0.9019758701324464
2020-07-01 14:16:03+00:00,aug cont,0.0270268060266971
2020-07-01 14:07:07+00:00,aug cont,0.008289698511362
2020-07-01 13:49:14+00:00,adfone mexico introduce unepuntos registered rewards platform prepaid mexico,-0.0136794932186603
2020-07-01 13:44:37+00:00,optimus maximus et opened corp chance avg avg loss avg id stats,0.8738452196121216
2020-07-01 13:43:05+00:00,cnbc interviewing ceo minutes mentioned broadband telephones,0.004720039665699
2020-07-01 13:31:02+00:00,yield relative safety,0.7960273027420044
2020-07-01 13:19:46+00:00,well reinvest dividends yes depend number things impact math growth eventually catch company depends goals income generation total returns,0.9725955724716188
2020-07-01 13:18:06+00:00,long term constant dividend drip,0.780049204826355
2020-07-01 13:16:05+00:00,nobody,-0.1003320515155792
2020-07-01 13:11:46+00:00,concerned executive chairman understand camera,-0.6235178709030151
2020-07-01 12:53:51+00:00,,-0.0498219318687915
2020-07-01 12:50:59+00:00,morgan stanley trims target,0.0096222460269927
2020-07-01 12:39:09+00:00,nayeon joke cant believe absolutely stupid insensitive,-0.8735908269882202
2020-07-01 12:34:34+00:00,cnbc interviewing ceo minutes mentioned broadband telephones,-0.010424043983221
2020-07-01 12:33:47+00:00,,-0.0355410948395729
2020-07-01 12:30:40+00:00,ask randall straight terrible management,-1.0714075565338137
2020-07-01 12:26:17+00:00,fabulous view verified achievement,0.8776916265487671
2020-07-01 11:51:31+00:00,bro paying dividend companies outside start briefcase,0.9696978330612184
2020-07-01 11:45:44+00:00,hours midnight piease dont forget tlx alright late hours cause,0.3605169355869293
2020-07-01 11:33:25+00:00,article author points management concern,0.984221339225769
2020-07-01 11:01:03+00:00,paying attention ad revenue shitter lot debt pay,-0.963958740234375
2020-07-01 09:35:23+00:00,downtrend rsi exits overbought zone view odds money news,-1.0641783475875854
2020-07-01 09:27:15+00:00,consider,-1.0022835731506348
2020-07-01 08:50:38+00:00,pokerone news tired paying rake play builder tournaments ggpoker,-0.3271426260471344
2020-07-01 08:36:42+00:00,pay rake learn avoid paying rake builder tournaments running every minutes ggpoker,-0.2875023484230041
2020-07-01 07:26:26+00:00,tired paying rake play builder tournaments ggpoker,-0.4447724819183349
2020-07-01 06:36:01+00:00,yield relative safety,0.7943220138549805
2020-07-01 04:25:50+00:00,labor extension southwest contract,0.0125632770359516
2020-07-01 03:48:43+00:00,story porn,-0.1021975874900817
2020-07-01 03:43:13+00:00,soon turn automatically places order cause party,0.1921348571777343
2020-07-01 03:22:07+00:00,ask sometimes answer simple coz dc expanded universe hbo max warners everything im wrong bet company worth,0.5730671882629395
2020-07-01 01:53:03+00:00,guarantee mil,0.632057785987854
2020-07-01 01:51:37+00:00,amazing literally income pair bowflex weights resell income produces dividend payments literally money,1.0022157430648804
2020-07-01 00:37:19+00:00,helpful governments building tools retrain spent fundamental skills jobs always needed,0.6040655374526978
2020-07-01 00:35:57+00:00,,0.1994551420211792
2020-07-01 00:00:25+00:00,cwa agree southwest wireline contract extension,0.2077291160821914
2020-07-02 23:54:30+00:00,audience appreciative nfl already canceled nfl ticket hear service holder switching canceling directtv,-0.9608596563339232
2020-07-02 23:43:31+00:00,added birthday gift forward boost,1.003376841545105
2020-07-02 23:20:37+00:00,caved bought increased yearly income passively,0.9208134412765504
2020-07-02 23:15:28+00:00,hmmm hill bc russia aware send cents naturally usa born usa key vault mercycard china owes us bs bout reconciled supposed educated,0.2364024817943573
2020-07-02 22:58:14+00:00,spots drawing winner receive picked chance extra money towards bad idea,1.007304072380066
2020-07-02 22:55:17+00:00,insider filing sr exec vp cfo john joseph stephens,0.0438506677746772
2020-07-02 22:35:22+00:00,insider filing director president ceo john stankey,0.0538249760866165
2020-07-02 22:29:28+00:00,terms dividends growth opportunity,0.9669240713119508
2020-07-02 22:15:40+00:00,pissed,-1.040937066078186
2020-07-02 22:14:02+00:00,yield relative safety,0.7960273027420044
2020-07-02 21:39:47+00:00,sweet,0.9451870918273926
2020-07-02 20:38:13+00:00,well well,0.9804137945175172
2020-07-02 20:27:03+00:00,nah opportunity wondering risk major looming pile picked close albeit earlier needed pseudo weekend uk,0.9400111436843872
2020-07-02 20:09:34+00:00,growing portfolio well picked,0.930937886238098
2020-07-02 19:49:01+00:00,money flow sale happening start,0.9841036796569824
2020-07-02 19:44:22+00:00,,-0.2702538967132568
2020-07-02 19:30:09+00:00,paying let without dividends reinvested,0.7549370527267456
2020-07-02 19:27:42+00:00,target lowered morgan stanley,-0.9964607954025269
2020-07-02 19:12:17+00:00,open interest update optionsflow uoa,0.5713311433792114
2020-07-02 18:45:20+00:00,tnt inside nba nba tnt return,0.0131191164255142
2020-07-02 18:35:06+00:00,oooooh shiz jewelry supply company order affiliate program known without,-0.0959636643528938
2020-07-02 18:34:39+00:00,okay guessing send guys message,0.8398317098617554
2020-07-02 18:22:18+00:00,bought leftover balance,0.9067047834396362
2020-07-02 18:19:36+00:00,bought leftover balance,0.9500819444656372
2020-07-02 18:16:10+00:00,implied volatility expiration,-1.0716711282730105
2020-07-02 18:15:56+00:00,luck sale average,0.9822170734405518
2020-07-02 18:11:21+00:00,yes mate bought need send message confirm processed,0.960636019706726
2020-07-02 17:59:14+00:00,shows potential reversal rsi started pointing upwards sma resistance ahead breaks run shall later pulls,0.8641012907028198
2020-07-02 17:55:19+00:00,luck sale average sale,0.9908647537231444
2020-07-02 17:50:54+00:00,someone tell sale,0.023027766495943
2020-07-02 16:23:50+00:00,fundamental analysis score fa score various fa value score roe roa roic gross margin ebitda etc,0.973164677619934
2020-07-02 16:15:20+00:00,set macd bullish,0.9651731252670288
2020-07-02 15:59:00+00:00,starlink disruptive keep latency,0.8918060064315796
2020-07-02 15:58:56+00:00,somewhere fairly undervalued imo pretty mega cap app upside,0.9637624025344848
2020-07-02 15:49:38+00:00,longer usual weekend reinvent wheel paid creative hit roadblock luck hope counting cash deciding,0.9704731702804564
2020-07-02 15:45:40+00:00,debt probably metrics carefully track snippet fy slides presentation,0.4719050526618957
2020-07-02 15:07:13+00:00,boring meant dividend forever move greatest value dividend ask warren buffet dividends majority paying young yield anyways,0.856899619102478
2020-07-02 15:04:45+00:00,,0.3858623206615448
2020-07-02 15:03:45+00:00,gon na,0.964404821395874
2020-07-02 14:20:17+00:00,relax everyone exactly growth safe payout relatively term point clearly defined purpose fit everyone needs,0.9654319286346436
2020-07-02 14:14:01+00:00,yield relative safety,0.7943220138549805
2020-07-02 13:55:31+00:00,reversaltoup tradeideas,0.0551734417676925
2020-07-02 12:00:57+00:00,starlink disruptive keep latency,0.4529427289962768
2020-07-02 09:48:11+00:00,moved moving average view odds,-1.0334595441818235
2020-07-02 09:47:52+00:00,moved moving average view odds money news,-1.017716884613037
2020-07-02 09:27:55+00:00,never moveds means keep yield,0.9637640714645386
2020-07-02 07:55:31+00:00,tired paying rake play builder tournaments ggpoker,-0.4447724819183349
2020-07-02 07:11:21+00:00,dips bucks,-1.060405135154724
2020-07-02 07:10:34+00:00,receive dividend,0.0584771893918514
2020-07-02 07:04:42+00:00,halloween,-0.1302146017551422
2020-07-02 06:25:28+00:00,yield relative safety,0.8312137126922607
2020-07-02 06:16:01+00:00,yield relative safety,0.7960273027420044
2020-07-02 05:22:55+00:00,dividend taxable hsa tax,-0.9226397275924684
2020-07-02 05:19:50+00:00,well lot brainer,0.1074284613132476
2020-07-02 05:09:08+00:00,hard need pick hoping,-1.031707525253296
2020-07-02 04:59:19+00:00,reasons consitently undervalued factoring possibility starlink satellites cell service obsolete,0.510573148727417
2020-07-02 04:12:25+00:00,never moveds means keep yield,0.9731966257095336
2020-07-02 04:01:06+00:00,,0.2637918591499328
2020-07-02 03:51:03+00:00,talk otherwise known thoughts company current wk hig,0.0251196101307868
2020-07-02 03:23:25+00:00,somewhere fairly undervalued imo pretty mega cap app upside pretty impartial,0.9684889316558838
2020-07-02 03:22:42+00:00,needs find way offer service lower point similar hulu ads place necessary hbo max worth adding statement friends south park readily available elsewhere,-0.341740220785141
2020-07-02 03:22:41+00:00,seem promising foreseeable future held contracts various cable providers hbo app offered addition service hbo app content hbo max hbo exists reason,0.0940289050340652
2020-07-02 03:22:41+00:00,somewhat confused messy platform hbo max front seem worth money charging ticket giants hulu offering wide variety content found online click button,-0.8639709949493408
2020-07-02 03:18:57+00:00,solution,0.9598015546798706
2020-07-02 03:14:41+00:00,wrong building dividend portfolio dividends futurewealth,0.6887698173522949
2020-07-02 02:34:22+00:00,,0.4438478052616119
2020-07-02 02:33:29+00:00,move whole quarter memo,-0.4261995851993561
2020-07-02 02:28:43+00:00,bho spend bailout bankers us mess bush obama trump outsider exposing shit finally guy actually us sad believe news truth,-0.0666542500257492
2020-07-02 02:21:28+00:00,fell accidentally guys experts personally list among forget ticker,-0.9300943613052368
2020-07-02 02:07:09+00:00,app lg smart tv sucks,-0.4679114520549774
2020-07-02 02:06:31+00:00,paid soon worry paychecks eye add dividend producer,0.9717915058135986
2020-07-02 02:01:26+00:00,yeah least undervalued fundamental standpoint long term need improve significantly,0.931099772453308
2020-07-02 01:57:35+00:00,seen lately acquired directv fan bring break luke,0.9812800884246826
2020-07-02 01:55:47+00:00,favorite cj struggling bounce levels big,0.4448408186435699
2020-07-02 01:41:52+00:00,sale,0.7852582931518555
2020-07-02 01:11:23+00:00,sale,0.618497371673584
2020-07-02 00:55:03+00:00,tired paying rake play builder tournaments ggpoker,-0.4447724819183349
2020-07-02 00:54:16+00:00,curious heard things,0.897024393081665
2020-07-02 00:41:22+00:00,grove st por soundcloud,-0.0635646358132362
2020-07-02 00:34:24+00:00,radar eyes sale thank,0.7223519086837769
2020-07-02 00:20:41+00:00,thread fire,0.9834572076797484
2020-07-02 00:19:28+00:00,,-1.0503332614898682
2020-07-02 00:18:40+00:00,company attractive dividend story long term believe names profitable eat sleep profit,0.971038579940796
2020-07-02 00:18:38+00:00,bright side center wireless continues grow company reported yoy revenue growth sector,0.9926416873931884
2020-07-02 00:18:37+00:00,thought positive acquisition flailing seems bad reported direct tv subscribers declined million loss million subscribers,-0.9075548648834229
2020-07-02 00:18:37+00:00,talk otherwise known thoughts company current wk wk low,-0.6209983825683594
2020-07-02 00:13:29+00:00,sooo possible sale keeping white board,0.6281499862670898
2020-07-02 00:11:38+00:00,sooo possible sale keeping white board,0.5020347833633423
2020-07-03 23:50:08+00:00,feel,0.7602430582046509
2020-07-03 23:33:33+00:00,totally achieve exception mkdir catch throwable fine,0.7725338935852051
2020-07-03 21:40:43+00:00,agree,0.746157169342041
2020-07-03 21:27:48+00:00,portfolio,0.966972827911377
2020-07-03 21:27:18+00:00,old reliable fire,0.7012453079223633
2020-07-03 20:19:44+00:00,washed car wife car saved mindset dividends automobile sponge,0.6220554113388062
2020-07-03 20:04:02+00:00,dividend yield pay phone internet cable need park voila utilities literally pay,0.856080174446106
2020-07-03 18:19:24+00:00,insider filing sr exec resources angela santone,0.042314875870943
2020-07-03 18:18:46+00:00,washed car wife car saved mindset dividends automobile sponge,0.6085083484649658
2020-07-03 18:03:07+00:00,loudspeaker captain explorer recent technical analysis graphs chartists track,0.1132478415966034
2020-07-03 17:39:21+00:00,guarantee confidential slide deck meeting finance hr agreed replacing computers turnover center employees miserable every meeting adjourned,-1.0784987211227417
2020-07-03 17:33:13+00:00,portfolio thanks dividend payment scheduled well,0.9064483642578124
2020-07-03 17:30:24+00:00,unique though illegal monopoly keeps pressure execs spend golfing senators every process imperfect fixes duct tape mine abandons employees chaos purpose strategy,-1.0342243909835815
2020-07-03 17:08:41+00:00,well drops half packets ms latency,-0.7019921541213989
2020-07-03 16:25:25+00:00,power open interest update optionsflow,0.4669371545314789
2020-07-03 15:59:23+00:00,insider filing ceo communications llc mcelfresh,0.0569774024188518
2020-07-03 15:44:01+00:00,kilar visionary patience vision experience headed,0.0400144308805465
2020-07-03 15:18:46+00:00,distribution quantity hard way blue approach least contact structures compute probability infected individuals,-1.0790318250656128
2020-07-03 15:13:02+00:00,yield relative safety,0.7960273027420044
2020-07-03 14:49:37+00:00,perfect example hire succeeded consistently across media companies digital george kliavkoff focus kilar balance fiduciary responsibilities skill set leans visionary clear,0.9721109867095948
2020-07-03 14:30:21+00:00,weaves stream platform light,0.2043321430683136
2020-07-03 13:52:09+00:00,apparently hbo max unlimited plan family hulu live tv hbo max,0.0764539837837219
2020-07-03 13:44:40+00:00,pl ,-0.1941395103931427
2020-07-03 13:44:20+00:00,pl ,-0.120186410844326
2020-07-03 13:30:59+00:00,surprising lives saved hatred exceed responsibility news outlet provide truth american cnn patent disgrace understand sits near lows,-0.9809403419494628
2020-07-03 13:06:01+00:00,never knew opportunities,0.8750123977661133
2020-07-03 11:06:19+00:00,downtrend rsi exits overbought zone view odds money news,-1.0641783475875854
2020-07-03 10:46:32+00:00,bro ok sales lololol complain hope excellent everyone talked thought material actually,0.9811400175094604
2020-07-03 10:01:18+00:00,insider filing sr exec vp gen counsel david ii mcatee,0.0468705147504806
2020-07-03 09:50:28+00:00,always ad hour,0.1096730232238769
2020-07-03 09:16:19+00:00,long term dividends gon na adding overtime well,0.9388670921325684
2020-07-03 08:34:25+00:00,receives average recommendation brokerages,-0.0629191324114799
2020-07-03 08:03:59+00:00,mike ct entertainment bpt nyc,-0.0070367380976676
2020-07-03 07:45:23+00:00,insider filing latam globalmktgofcr lori lee,0.0495929904282093
2020-07-03 07:09:01+00:00,yield relative safety,0.7943220138549805
2020-07-03 04:28:31+00:00,real hard coffee throw though lmao,-0.7278685569763184
2020-07-03 03:53:33+00:00,scare anyone,-0.953637719154358
2020-07-03 03:10:16+00:00,deleted ld cuz kept crashing downloaded loading entire hour keep man sparkles dizzy,-0.2322591841220855
2020-07-03 02:54:43+00:00,popular dividend boost expands,0.9825080633163452
2020-07-03 01:40:46+00:00,hope hit record sales weekend brother away seems everyone missing,0.9635497331619264
2020-07-03 01:21:17+00:00,insider filing exec chairman board randall stephenson,0.0500649958848953
2020-07-03 01:10:43+00:00,jul forecast view neutral bearish search forecast upper lower,-1.0517719984054563
2020-07-03 00:43:26+00:00,poor technical analysis score ta score categories score weak moving average score weak score poor,-1.0575785636901855
2020-07-04 23:46:53+00:00,wait catch red,-0.8989617824554443
2020-07-04 20:56:39+00:00,wrong wan na long feds bonds wan na wait earnings either,-0.6283555030822754
2020-07-04 20:38:17+00:00,wan na concert spite nevies snitched idk,-0.0848775655031204
2020-07-04 20:28:54+00:00,metric track performance segment essentially wireless services voice data subscr,-0.0196139961481094
2020-07-04 20:11:06+00:00,bought couple hit goal pay phone bill,0.997028350830078
2020-07-04 19:28:39+00:00,fucking wrecking crew hood pop tha nigga fight dick breath live thru shiii bottoms handle us break bottoms ai nooooo bragging rites us fuck,-0.7994403839111328
2020-07-04 19:20:02+00:00,yield relative safety,0.7943220138549805
2020-07-04 18:46:57+00:00,sending message qanon,-0.0587488822638988
2020-07-04 17:47:20+00:00,metric track performance segment essentially wireless services voice data subscribers importance division number subscribers connected devices driver usually focus postpaid subs,0.0570722669363021
2020-07-04 17:34:47+00:00,biggest american scams housing crisis everyone house healthcare scam corporate america money physicians money healthcare thousand healthcare administrators chuckschumer draintheswamp,0.1471608132123947
2020-07-04 17:20:13+00:00,sending message qanon,-0.0695747286081314
2020-07-04 17:10:59+00:00,grove,0.0685115233063697
2020-07-04 17:01:44+00:00,massive growth potential though growth dividend stable,0.9761606454849244
2020-07-04 16:29:44+00:00,reichministryofpublicenlightenmentandpropaganda trump drag america backward different,-0.1336118876934051
2020-07-04 16:29:36+00:00,reichministryofpublicenlightenmentandpropaganda trump drag america backward different source usa mtrushmore independenceday culturalheritage history,-0.2952094972133636
2020-07-04 16:15:47+00:00,reichministryofpublicenlightenmentandpropaganda trump drag america backward different source usa mtrushmore independanceday culturalheritage history,-0.3063291609287262
2020-07-04 13:01:40+00:00,trump speech cnn side tear george washington mt rushmore replace karl marx lot money china communists sympathizers underestimate america resolve,0.6475090980529785
2020-07-04 12:24:51+00:00,pay streaming service hbomax ok lied face company keep money enjoy sub mountrushmore cnn,0.9558398723602296
2020-07-04 12:21:46+00:00,cyber caf write orkut spent hrs finding girl,0.0109684243798255
2020-07-04 12:19:18+00:00,cyber caf write orkut spent hrs finding girl written name design fucking chutya,0.3463291525840759
2020-07-04 12:01:10+00:00,upcoming dividend date dividend amount dividend visit custom,0.0683409720659256
2020-07-04 11:55:51+00:00,lot data dots,0.0902679786086082
2020-07-04 11:34:18+00:00,target cut analysts morgan stanley,-1.0015993118286133
2020-07-04 10:23:43+00:00,morgan stanley trims target,0.0096222460269927
2020-07-04 09:13:02+00:00,yield relative safety,0.7960273027420044
2020-07-04 08:40:20+00:00,technical bearish doji bearish dma resistance shooting,-0.9615232944488524
2020-07-04 07:21:35+00:00,brothers,0.1888638436794281
2020-07-04 06:56:23+00:00,cool view company earnings ratio fcf ratio,0.8245335817337036
2020-07-04 06:00:06+00:00,anyone feel old,-0.0344773977994918
2020-07-04 02:47:27+00:00,insider filing sevp chief compliance officer david huntley,0.0393641293048858
2020-07-04 00:40:01+00:00,yield relative safety,0.7943220138549805
2020-07-05 23:57:22+00:00,feel moving forward owner add around dividend concerned cut dtv worse expected expect things hbo,-0.2296593487262725
2020-07-05 23:33:09+00:00,enough drip ex date close,0.6099038124084473
2020-07-05 23:28:10+00:00,missing,-0.6636937856674194
2020-07-05 23:26:20+00:00,move stay area level bounce,0.9670456647872924
2020-07-05 22:56:25+00:00,paid waiting open,0.9272626638412476
2020-07-05 22:48:22+00:00,always age old classic,0.9315401315689088
2020-07-05 22:34:59+00:00,whoop whoop,0.9654273986816406
2020-07-05 22:34:06+00:00,sitting cash eyes increase position,0.9722871780395508
2020-07-05 21:55:03+00:00,telling,-0.9757426977157592
2020-07-05 21:46:26+00:00,ex date money,0.9894373416900636
2020-07-05 21:26:12+00:00,classic,0.9639174938201904
2020-07-05 21:21:08+00:00,downtrend rsi exits overbought zone view odds,-1.0654724836349487
2020-07-05 21:21:00+00:00,downtrend rsi exits overbought zone view odds money news,-1.0641783475875854
2020-07-05 20:46:10+00:00,responsible thousands us troop death spent endless wars positive outcome us illegally releasing classified information public federal prison danger america,-0.3425745666027069
2020-07-05 20:13:48+00:00,rfr picture fu deaf dum blind kid tuttle point tuthill bystanders developers real estate drug landscaping sports insurance hospital oil mafia gang bang ok hop de roy fat eye warned,-0.3897877037525177
2020-07-05 20:03:38+00:00,building wealth near dividend let drip grow boost well transition,0.9688527584075928
2020-07-05 20:02:50+00:00,kst registered end let till,-0.0168035626411438
2020-07-05 18:39:50+00:00,gon na yeezys chris gems truth,0.9547384977340698
2020-07-05 18:21:53+00:00,target interesting play earnings,0.9706497192382812
2020-07-05 18:10:46+00:00,dropping money lose minds,-1.0755071640014648
2020-07-05 18:06:12+00:00,hoping dip soon adding wife,0.7591453790664673
2020-07-05 18:04:01+00:00,yield relative safety,0.7960273027420044
2020-07-05 17:03:24+00:00,reminder date gon na pick,0.4611557424068451
2020-07-05 16:48:40+00:00,someone talks dividends gon na literally teach dividends,1.0048222541809082
2020-07-05 16:38:55+00:00,percentage portfolio potential especially space hit hard,0.9685250520706176
2020-07-05 16:32:14+00:00,reminder date gon na pick,0.5072053670883179
2020-07-05 16:16:05+00:00,mir,-0.0374287329614162
2020-07-05 15:29:36+00:00,solid upside transitions,0.9638785123825072
